date,title,stock
2019-11-14,"UPDATE: Bank Of America On Cisco Also Notes Co's 'progress in the transition toward software/recurring revenues, and favor the ~3% dividend yield'",CSCO
2019-11-14,"UPDATE: Bank Of America Reiterates Buy On Cisco, Lowers Tgt To $56 As Firm Looks Though 'current weakness and reiterate our Buy, as we favor Cisco's strategy and execution, see strong growth in key product categories like Campus Switching and Security'",CSCO
2019-11-14,Shoppers Rise To The Occasion As Walmart Reports Another Impressive Quarter,CSCO
2019-11-14,"UPDATE: Nomura Maintains Neutral On Cisco, Lowers Target To $45 Notes Co. 'delivered solid results but disappointing guidance for the second quarter in a row'; 'We materially lower our sales estimates, though opex control limits our EPS revisions'",CSCO
2019-11-14,"UPDATE: UBS On Cisco Notes 'Going forward, the stock has both aspects of being a ""show-me story"" and what we view as a compelling risk-reward from today's levels if macro gets better'",CSCO
2019-11-14,"UPDATE: UBS Maintains Buy On Cisco, Lowers Target To $54 Notes 'The main theme of the earnings report was that macro headwinds got worse in the enterprise and commercial businesses (~80 of Cisco revenue)'",CSCO
2019-11-14,"KeyBanc Maintains Overweight on Cisco Systems, Lowers Price Target to $52",CSCO
2019-11-14,"UPDATE: KeyBanc On Cisco Also Notes 'While macro appears increasingly unsettled, core thesis drivers (9K, software) are trending in the right direction'",CSCO
2019-11-14,"UPDATE: KeyBanc Maintains Overweight On Cisco, Lowers Tgt To $52 Notes 'major headline was a broad-based weakening of demand (inclusive of Enterprise/Commercial) that led to a significant setback in guidance for F2Q20 at (5)-(3)% vs. consensus at +2.4%'",CSCO
2019-11-13,"Cisco Sees Q2 Adj. EPS $0.75-$0.77 vs $0.79 Estimate, Sales Down 3-5% Year Over Year",CSCO
2019-11-13,"Benzinga Pro's Top 5 Stocks To Watch For Wed., Nov. 13, 2019: CSCO, NVTR, TWOU, APDN, GOOS",CSCO
2019-11-13,"Cisco Systems Q1 Adj. EPS $0.84 Beats $0.81 Estimate, Sales $13.2B Beat $13.08B Estimate",CSCO
2019-11-13,12 Dow Stocks With At Least 2% Dividend Yields,CSCO
2019-11-13,Cisco shares are trading lower after the company issued Q2 EPS guidance below analyst estimates. The company also sees Q2 sales to be 3-5% lower year over year.,CSCO
2019-11-13,Cisco Shares Fall After Weak Guidance,CSCO
2019-11-13,Cisco Systems Q1 Earnings Outlook,CSCO
2019-11-13,"10 Stocks To Watch For November 13, 2019",CSCO
2019-11-13,"Earnings Scheduled For November 13, 2019",CSCO
2019-11-13,Cisco Falls Postmarket as Soft Guidance Offsets Earnings Beat,CSCO
2019-11-13,Top 5 Things to Know in the Market on Wednesday,CSCO
2019-11-13,Cisco s Bleak Guidance Pus These ETFs In Focus,CSCO
2019-11-13,Chart Of The Day  Cisco s Supply Demand Balance Suggests Weak Earnings Ahead,CSCO
2019-11-13,Cisco Systems  CSCO  Q1 Earnings And Revenues Beat Estimates,CSCO
2019-11-13,4 Stocks Moving In Wednesday's After-Hours Session,CSCO
2019-11-12,"Morgan Stanley Maintains Equal-Weight, $49 Target On Cisco Ahead Of Co's Q1 Earnings 11/13 Notes 'valuation currently reflects and sustains an in-line market multiple as overall growth normalizes even if there is potential small federal upside in FQ1'",CSCO
2019-11-12,Cisco Earnings Preview  Slowing Sales May Hurt  But Long Term Potential Is Intact,CSCO
2019-11-12,Day Ahead  Top 3 Things to Watch,CSCO
2019-11-11,"Benzinga's Top Upgrades, Downgrades For November 11, 2019",CSCO
2019-11-11,Does Cisco  CSCO  Look Like A Buy Ahead Of Q1 Earnings  ,CSCO
2019-11-11,"Piper Jaffray Downgrades Cisco Systems to Neutral, Lowers Price Target to $51",CSCO
2019-11-11,Ultra Clean  EnPro And Cisco Highlighted As Zacks Bull And Bear Of The Day,CSCO
2019-11-11,9 Technology Stocks Moving In Monday's Pre-Market Session,CSCO
2019-11-11,Acacia Communications Sees Cisco Deal Closing In H2'20,CSCO
2019-11-11,Acacia Communications Reports Regulatory Approval In Germany For Deal By Cisco,CSCO
2019-11-11,10 Biggest Price Target Changes For Monday,CSCO
2019-11-10,Computer Networking Industry Near Term Prospects Bleak,CSCO
2019-11-08,These New Dividend ETFs Have Some Strict Requirements And That's A Good Thing,CSCO
2019-11-06,Cisco Contact Center and TTEC Expand Their Strategic Partnership with New Enterprise Cloud Offering,CSCO
2019-11-05,"Credit Suisse Maintains Neutral on Cisco Systems, Lowers Price Target to $49",CSCO
2019-11-05,Cisco Systems  CSCO  Reports Next Week  Wall Street Expects Earnings Growth,CSCO
2019-11-01,17 Technology Stocks Moving In Friday's Pre-Market Session,CSCO
2019-11-01,Arista Hit Hard On Q4 Sales Warning: Is Facebook To Blame?,CSCO
2019-10-22,"Gogo Announces Partners For 5G Network And Onboard Systems: Cisco, Airspan And FIRST RF Corp",CSCO
2019-10-20,"Barron's Picks And Pans: Boeing, Comcast, Conoco, Emerson And More",CSCO
2019-10-17,10 Biggest Price Target Changes For Thursday,CSCO
2019-10-17,"KeyBanc Maintains Overweight on Cisco Systems, Lowers Price Target to $54",CSCO
2019-10-14,"Banks In Focus This Week As JPMorgan , Goldman Sachs, Others Report Tuesday",CSCO
2019-10-14,"Apple, Microsoft And Semiconductors: Technology Sector Earnings Ahead",CSCO
2019-10-12,"'Fast Money Halftime Report Traders' Weigh In On Datadog, Cleveland-Cliffs And More",CSCO
2019-10-11,Shares of several technology companies are trading higher after President Trump made positive remarks on the U.S.-China trade talks as traders grew more optimistic over the possibility of a limited trade deal. Trump is scheduled to meet with Chinese Vice Premier Liu He at the White House today.,CSCO
2019-10-11,Rally Hats On To Start The Day As Hopes Build For Progress In Trade Talks,CSCO
2019-10-10,5 Technology Stocks Moving In Thursday's Pre-Market Session,CSCO
2019-10-10,"Benzinga's Top Upgrades, Downgrades For October 10, 2019",CSCO
2019-10-10,"Goldman Sachs Downgrades Cisco Systems to Neutral, Lowers Price Target to $48",CSCO
2019-10-10,10 Biggest Price Target Changes For Thursday,CSCO
2019-10-10,Cisco Systems shares are trading lower after Goldman Sachs downgraded the stock from Buy to Neutral and lowered the price target from $56 to $48 per share.,CSCO
2019-10-09,"Cisco, UnitedHealth And More 'Fast Money' Picks For October 9",CSCO
2019-10-09,19 Technology Stocks Moving In Wednesday's Pre-Market Session,CSCO
2019-10-08,"'Fast Money Halftime Report' Traders Give Their View On Cisco, PayPal And More",CSCO
2019-10-08,'Fast Money Halftime Report' Picks For October 8,CSCO
2019-10-08,"PreMarket Prep Recap: Overnight Reversal, Technical Analysis For Dummies",CSCO
2019-10-08,"Shares of several technology companies are trading lower as optimism around the upcoming U.S.-China trade talks waned. A report says China is toning down its expectations of the meeting. The U.S. expanded its trade blacklist, and scheduled an increase in tariffs on $250 billion worth of Chinese goods from 25% to 30% on Oct. 15, which will go into effect if no progress is made.",CSCO
2019-10-02,Shares of several technology companies are trading lower amid continued fears of a recession following weak ADP jobs report. There is also uncertainty in the market over the upcoming U.S.-China meeting next week.,CSCO
2019-10-02,VirnetX Holding Reports US Court OF Appeals Has Denied Several Motions Stemming From Ongoing Legal Proceedings Between Co. Apple And Cisco,CSCO
2019-10-01,"Cisco shares are trading lower in sympathy with the overall market after the Institute for Supply Management said the U.S. manufacturing activity shrunk to its lowest level since June 2009, adding fears of an economic slowdown.",CSCO
2019-10-01,Cisco Falls 4 ,CSCO
2019-09-23,Winners And Losers From Nomura CIO Spending Survey,CSCO
2019-09-23,Cisco Partners With SingularityNET on Decentralized Artificial Intelligence,CSCO
2019-09-19,Cisco Systems  CSCO  Stock Moves  0 3   What You Should Know,CSCO
2019-09-19,Splunk  SPLK  Up 2 9  Since Last Earnings Report  Can It Continue ,CSCO
2019-09-18,Cisco Offered $7B+ for DataDog as Company Prepares IPO,CSCO
2019-09-17,"'Fast Money Halftime Report' Traders Share Their Thoughts On Cisco, Twitter And More",CSCO
2019-09-12,Cisco  CSCO  Up 8  Since Last Earnings Report  Can It Continue ,CSCO
2019-09-11,"Evercore ISI Group Initiates Coverage On Cisco Systems with Outperform Rating, Announces $60 Price Target",CSCO
2019-09-11,"Benzinga's Top Upgrades, Downgrades For September 11, 2019",CSCO
2019-08-29,Marvell forecasts revenue below estimates on Huawei ban  shares slide,CSCO
2019-08-28,Cisco Reports Exploit Of Vulnerability Could Be Used To Bypass Authentication On Cisco Routers Configured With Rest API Support For Cisco IOS XE Software,CSCO
2019-08-26,Shares of several large-cap companies are trading higher amid easing trade tensions. President Trump said China is ready to come back to the negotiating table.,CSCO
2019-08-26,"Cisco To Acquire CloudCherry, Terms Not Disclosed",CSCO
2019-08-25,Factors Likely To Influence Workday s  WDAY  Q2 Earnings,CSCO
2019-08-23,Shares of several large-cap companies are trading lower in sympathy with the overall market on escalated trade tensions after China announced it plans to impose a 5% to 10% tariff rate on $75 billion worth of U.S. goods.,CSCO
2019-08-22,Splunk s  SPLK  Q2 Earnings   Revenues Surpass Estimates,CSCO
2019-08-20,Beaten Down  Top Ranked Tech ETFs To Buy Now,CSCO
2019-08-19,Shares of several large-cap companies are trading higher on renewed optimism for a solution to the U.S.-China trade war.,CSCO
2019-08-18,The Zacks Analyst Blog Highlights  Cisco  Axalta Coating  Ennis  Integer And Pilgrim s Pride,CSCO
2019-08-17,"Bulls And Bears Of The Week: Apple, Cisco, Salesforce, Walmart And More",CSCO
2019-08-17,"Barron's Picks And Pans: American Eagle Outfitters, Chevron, Grocery Outlet And More",CSCO
2019-08-16,Cisco Outlook Takes Trade War Hit,CSCO
2019-08-16,Shares of several large-cap companies are trading higher with the broader market on renewed optimism surrounding US-China trade talks after Donald Trump announced earlier in the week that he would delay additional tariffs on Chinese goods until December.,CSCO
2019-08-16,75 Biggest Movers From Yesterday,CSCO
2019-08-15,28 Stocks Moving in Thursday's Pre-Market Session,CSCO
2019-08-15,"Benzinga Pro's Top 10 Most-Searched Tickers For Morning of Thursday., August 15, 2019",CSCO
2019-08-15,"A Look At Benzinga Pro's Most-Searched Tickers For August 15, 2019",CSCO
2019-08-15,UPDATE: Bank Of America On Cisco Systems Also Believes 'a forthcoming 5G cycle could reverse some of the current weakness',CSCO
2019-08-15,"UPDATE: Bank Of America Reiterates Buy On Cisco Systems, Reiterates $62 Target As Firm Notes 'we favor the strategy and Cisco's execution, and growth in key product categories like Campus Switching remains robust'",CSCO
2019-08-15,Cisco shares are trading lower after the company issued Q1 EPS guidance below analyst estimates.﻿,CSCO
2019-08-15,46 Stocks Moving In Thursday's Mid-Day Session,CSCO
2019-08-15,Cisco Earnings Marred By China Uncertainty That Softened Guidance,CSCO
2019-08-15,"UPDATE: Morgan Stanley Maintains Equal-Weight On Cisco, Lowers Target To $49 As Firm Notes Co's Q4 'echoed our recent checks and survey work; remain on sidelines until signs of recovery in SP spend or an uptick in pipeline'",CSCO
2019-08-15,Cisco Falls 8 ,CSCO
2019-08-15,"Raymond James Maintains Outperform on Cisco Systems, Raises Price Target to $59",CSCO
2019-08-15,"Morgan Stanley Maintains Equal-Weight on Cisco Systems, Lowers Price Target to $49",CSCO
2019-08-15,Cisco Systems  CSCO  Q4 Earnings   Revenues Beat Estimates,CSCO
2019-08-15,A Peek Into The Markets: US Stock Futures Tumble Ahead Of Economic Data,CSCO
2019-08-15,15 Technology Stocks Moving In Thursday's Pre-Market Session,CSCO
2019-08-15,"10 Stocks To Watch For August 15, 2019",CSCO
2019-08-14,Cisco shares are trading lower after the company issued Q1 EPS below analyst estimates.,CSCO
2019-08-14,4 Stocks Moving In Wednesday's After-Hours Session,CSCO
2019-08-14,"Cisco Systems Q4 EPS $0.83 Beats $0.82 Estimate, Sales $13.4B Beat $13.39B Estimate",CSCO
2019-08-14,Cisco Shares Fall On Lower Q1 Guidance,CSCO
2019-08-14,"Trading Bandwidth For Crypto: NOIA Brings New Tech, Cisco Partnership To Programmable Internet Space",CSCO
2019-08-14,Cisco Systems  CSCO  Surpasses Q4 Earnings And Revenue Estimates,CSCO
2019-08-14,Tariffs  China sales weigh on Cisco outlook  shares slide,CSCO
2019-08-14,Cisco Systems Q4 Earnings Outlook,CSCO
2019-08-14,"Cisco Sees Q1 Adj. EPS $0.80-$0.82 vs $0.83 Estimate, Sales Growth 0-2% Year Over Year",CSCO
2019-08-14,Cisco Earnings Beat in Q4  but Guidance Falls Short,CSCO
2019-08-14,Cisco shares trading lower with the broader stock market. The company will report Q4 earnings after the close today.,CSCO
2019-08-14,"Earnings Scheduled For August 14, 2019",CSCO
2019-08-14,"8 Stocks To Watch For August 14, 2019",CSCO
2019-08-14,Cisco Falls 4 ,CSCO
2019-08-13,Todd Gordon's Cisco Options Trade,CSCO
2019-08-13,Shares of several large-cap companies are trading higher in sympathy with the overall market after the U.S. announced it is excluding and delaying the additional 10% tariff on certain products.,CSCO
2019-08-12,Should You Buy Cisco Systems  CSCO  Ahead Of Earnings  ,CSCO
2019-08-12,Chart Of The Day  With Cisco Now A Buy  Why Are Technicals Signaling A Fall ,CSCO
2019-08-12,"Market Remains On Edge As Tensions Between U.S., China Continue",CSCO
2019-08-09,"Twists And Turns: This Week's Wild Ride Swings Through U.K., Italy, China",CSCO
2019-08-08,"Barclays Initiates Coverage On Cisco Systems with Equal-Weight Rating, Announces $52 Price Target",CSCO
2019-08-08,"Benzinga's Top Upgrades, Downgrades For August 8, 2019",CSCO
2019-08-06,Cisco Systems  CSCO  Earnings Expected To Grow  Should You Buy ,CSCO
2019-08-06,"Cisco Announces Intent to Acquire Voicea, Terms Not Disclosed",CSCO
2019-08-05,Shares of several large-cap companies are trading lower with the overall market on renewed US-China trade tensions. President Trump announced an additional 10% tariff on $300 billion worth of Chinese goods. China is manipulating its currency and announced they are not buying any agricultural products from the U.S.,CSCO
2019-08-05,Asure Software  ASUR  To Report Q2 Earnings  What s In Store ,CSCO
2019-08-05,Scientific Games  SGMS  Q2 Loss Widens Y Y  Revenues Flat,CSCO
2019-08-05,Cisco Falls 4 ,CSCO
2019-08-04,Factors To Consider Ahead Of Autohome s  ATHM  Q2 Earnings,CSCO
2019-08-04,What s In Store For Upland Software s  UPLD  Q2 Earnings ,CSCO
2019-08-04,Fortinet  FTNT  Catches Eye  Stock Jumps 8 9 ,CSCO
2019-08-02,Digital Turbine  APPS  To Post Q1 Earnings  What s In Store ,CSCO
2019-08-02,"Shares of several storage, semi and networking companies are trading lower in sympathy with Seagate Technology and NetApp after both companies issued Q1 guidance below analyst estimates.",CSCO
2019-08-02,Cisco Falls 4 ,CSCO
2019-08-01,J2 Global  JCOM  To Report Q2 Earnings  What s In Store ,CSCO
2019-08-01,MKS Instruments   MKSI  Q2 Earnings Beat  Revenues Miss,CSCO
2019-07-31,"Jim Cramer Gives His Opinion On Nvidia, Cisco And More",CSCO
2019-07-31,Cisco whistleblower gets first False Claims payout over cybersecurity,CSCO
2019-07-31,Why Cisco  CSCO  Is Poised To Beat Earnings Estimates Again,CSCO
2019-07-30,"Apple On Today's Menu, With Starring Roles From China Talks, Fed Meeting",CSCO
2019-07-30,"Nomura Maintains Neutral on Cisco Systems, Raises Price Target to $53",CSCO
2019-07-25,"Shares of several software companies are trading lower, potentially in sympathy F5 Networks, after the company reported mixed Q3 earnings and issued Q4 EPS guidance below analyst estimates.",CSCO
2019-07-24,6 Tech Stocks To Buy Pre Q2 Earnings On Trade Talk Prospects,CSCO
2019-07-19,Seeing Earlier Reports Indicating Cisco Is In Talks To Buy Cybersecurity Startup Signal Sciences,CSCO
2019-07-16,What Wall Street Analysts Think About Slack's Stock,CSCO
2019-07-10,China Could Be A Roadblock In Cisco s Acacia Acquisition,CSCO
2019-07-10,48 Biggest Movers From Yesterday,CSCO
2019-07-10,The $2.6B Cisco-Acacia Deal: 2 Analyst Takes On The Optics,CSCO
2019-07-09,Mid-Morning Market Update: Markets Open Lower; PepsiCo Tops Q2 Expectations,CSCO
2019-07-09,Cisco to buy Acacia Communications for  2 8 billion,CSCO
2019-07-09,Cisco Systems Option Alert: Jan 17 $62.5 Calls Sweep (4) near the Ask: 1203 @ $1.41 vs 5115 OI; Earnings 8/14 After Close [est] Ref=$56.62,CSCO
2019-07-09,30 Stocks Moving In Tuesday's Mid-Day Session,CSCO
2019-07-09,Cisco To Acquire Acacia In $2.6B Deal,CSCO
2019-07-09,Cisco To Acquire Acacia Communications For $70/Share In Cash,CSCO
2019-07-09,Mid-Day Market Update: Acacia Communications Surges Following Acquisition News; AquaVenture Shares Slide,CSCO
2019-07-09,Cisco  CSCO  To Buy Acacia To Boost Optical Based Networking,CSCO
2019-07-09,Mid-Afternoon Market Update: NASDAQ Rises 0.4%; Camber Energy Shares Spike Higher,CSCO
2019-07-09, ETFs In Focus On Cisco s Acacia Buyout Deal,CSCO
2019-07-01,Computer Networking Industry Prospects Not So Bright,CSCO
2019-06-26,Workday  WDAY  Up 0 7  Since Last Earnings Report  Can It Continue ,CSCO
2019-06-23,4 Thrivent Mutual Funds To Add To Your Portfolio,CSCO
2019-06-21,Ultra cyclist targets 24 hour record  with no toilet breaks,CSCO
2019-06-20,Hungary has no evidence of Huawei threat  plans rapid 5G rollout  minister,CSCO
2019-06-18,"Cisco, IBM Cloud Report Hybrid Cloud Partnership For Cisco Hyperflex, Hyperflex Edge",CSCO
2019-06-18,MLB roundup  Yanks  Tanaka shuts out Rays,CSCO
2019-06-14,Palo Alto Completes PureSec Buyout  Boosts Prisma Strategy,CSCO
2019-06-13,"As Oil Prices Jump, Energy Shares Help Fuel Market Rally",CSCO
2019-06-13,Why Is Cisco  CSCO  Up 0 4  Since Last Earnings Report ,CSCO
2019-06-13,"Jim Cramer Gives His Opinion On Cisco, Citizens Financial And More",CSCO
2019-06-12,"Benzinga's Top Upgrades, Downgrades For June 12, 2019",CSCO
2019-06-12,William Blair Downgrades Cisco Systems to Market Perform,CSCO
2019-06-12,Global Equities Hold On To 2019 Gains As Headwinds Build,CSCO
2019-06-12,A Peek Into The Markets: US Stock Futures Down; Inflation Data In Focus,CSCO
2019-06-11,5 Top Picks To Tap Momentum In Wireless Equipment Space,CSCO
2019-06-11,Here s Why Cisco Systems  CSCO  Is A Great Momentum Stock To Buy,CSCO
2019-06-10,"ZenSar Reports Global Partnership With NetApp, Cisco 'to deliver FlexPod® Managed Private Cloud Services'",CSCO
2019-06-06,A New Trade War ETF Arrives Right On Time,CSCO
2019-06-06,"Cisco To Purchase Sentryo, No Terms Disclosed",CSCO
2019-06-05,Report: China Will Issue 5G Business Licenses This Week,CSCO
2019-06-04,Shares of several technology companies are trading higher after China's Commerce Ministry stated they are open to dialogue to resolve trade tensions; Mexico trade concerns also eased after Mexican officials said it could find common ground with the US.,CSCO
2019-06-03,Can Science Applications  SAIC  Deliver A Beat In Q1 Earnings ,CSCO
2019-05-31,Shares of several technology companies are trading lower with the overall market following news President Trump will impose a 5% tariff on goods from Mexico.,CSCO
2019-05-29,Shares of several technology companies are trading lower with the overall US market as US-China trade tensions continue to concern investors.,CSCO
2019-05-28,"Firstwave Cloud Technology, Cisco Agree to Joint Investment in Tech Lab",CSCO
2019-05-23,"Shares of technology companies trading lower with the overall market, which has been relatively rangebound over the last 13 sessions. The technology sector is the second worst performing today.",CSCO
2019-05-20,"Ann Arbor-Based Fintech Startup Clinc Raises $52M, Aims For 2022 IPO",CSCO
2019-05-20,'Cisco Held Preliminary Acquisition Talks With Cloud Startup HashiCorp' -The Information,CSCO
2019-05-19,Barron's On: Investing For A Trade War,CSCO
2019-05-18,"Barron's Picks And Pans: Nordstrom, Pinterest, Take-Two Interactive And More",CSCO
2019-05-17,"A Look At Benzinga Pro's 10 Most-Searched Tickers For May 17, 2019",CSCO
2019-05-17,"China Accuses U.S. Of ""Bullying Behavior,"" Helping Pressure Market Sentiment",CSCO
2019-05-17,"Benzinga Pro's Top 10 Most-Searched Tickers For Morning of Fri., May 17, 2019",CSCO
2019-05-17,63 Biggest Movers From Yesterday,CSCO
2019-05-17,Cisco Pops On Earnings  Plenty More Upside,CSCO
2019-05-16,Cisco Rises 4 ,CSCO
2019-05-16,50 Stocks Moving In Thursday's Mid-Day Session,CSCO
2019-05-16,"A Look At Benzinga Pro's 10 Most-Searched Tickers For May 16, 2019",CSCO
2019-05-16,3 Cisco Analysts Continue To See Upside Potential After Narrow Q3 Beat,CSCO
2019-05-16,"Cisco, Walmart Earnings Brighten Market Sentiment Even As U.S. Targets Huawei",CSCO
2019-05-16,"Benzinga Pro's Top 10 Most-Searched Tickers For Morning of Thur., May 16, 2019",CSCO
2019-05-16,Cisco shares are trading higher after the company reported better-than-expected Q3 EPS and sales results; Cisco also issued Q4 EPS guidance inline with analyst estimates.,CSCO
2019-05-16,"Credit Suisse Maintains Neutral on Cisco Systems, Inc. - Common Stock, Raises Price Target to $52",CSCO
2019-05-16,30 Stocks Moving In Thursday's Pre-Market Session,CSCO
2019-05-16,A Peek Into The Markets: US Stock Futures Rise Ahead Of Walmart Earnings,CSCO
2019-05-16,"7 Stocks To Watch For May 16, 2019",CSCO
2019-05-16,"Morgan Stanley Maintains Equal-Weight on Cisco Systems, Inc. - Common Stock, Raises Price Target to $51",CSCO
2019-05-15,"Earnings Scheduled For May 15, 2019",CSCO
2019-05-15,6 Stocks Moving In Wednesday's After-Hours Session,CSCO
2019-05-15,Cisco Trades Higher After Q3 Earnings Beat,CSCO
2019-05-15,"Cisco Sees Q4 Adj. EPS $0.80-$0.82 vs $0.81 Estimate, Sales Growth 4.5%-6.5% Year Over Year",CSCO
2019-05-15,"Cisco Systems Q3 Adj. EPS $0.78 Beats $0.77 Estimate, Sales $12.958B Beat $12.89B Estimate",CSCO
2019-05-15,Mike Khouw Sees Unusual Options Activity In Cisco,CSCO
2019-05-15,"8 Stocks To Watch For May 15, 2019",CSCO
2019-05-15,Cisco Systems shares are trading higher after the company reported better-than-expected Q3 EPS and sales results; the company also issued Q4 EPS guidance inline with analyst estimates.,CSCO
2019-05-15,ETFs Set To Gain On Cisco s Robust Results,CSCO
2019-05-15,Cisco  CSCO  Beats In Q3  Raises Guidance,CSCO
2019-05-15,Cisco Systems  CSCO  Beats Q3 Earnings And Revenue Estimates,CSCO
2019-05-15,Cisco Systems Options Bulls Buzzing Before Earnings,CSCO
2019-05-15,Cisco Reports Profit  Revenue Just Ahead of Forecasts,CSCO
2019-05-13,"Shares of several technology companies are trading lower amid continued US-China trade concerns. Proposed tariffs between the two nations could raise input costs, while trade tensions could hurt tech companies with China exposure.",CSCO
2019-05-13,Cisco Falls 4 ,CSCO
2019-05-13,Trade War Heats Up As China Retaliates With Raised Tariffs Of Its Own,CSCO
2019-05-12,Is Cisco Systems  CSCO  Stock Outpacing Its Computer And Technology Peers This Year ,CSCO
2019-05-10,Tariff Troubles: Market Retreat Looks To Continue As U.S. Raises Levies On China Goods,CSCO
2019-05-10,"Jim Cramer Weighs In On Zebra Technologies, Exelixis And More",CSCO
2019-05-09,Shares of several technology stocks are trading lower on continued concern of China trade negotiations; China has become firmer in its stance and negotiations are set to continue next Thursday with expectations now being more uncertain.,CSCO
2019-05-09,Key Day Shapes Up For Trade Talks But Earnings Also In Focus As Disney Results Gleaned,CSCO
2019-05-07,Shares of several technology companies are trading lower on continued uncertainty surrounding the future of trade relations between the US and China.,CSCO
2019-05-01,"Jim Cramer Gives His Opinion On Cisco, Macy's, Vodafone And More",CSCO
2019-04-29,Cisco revamps its hardware for new Wi Fi technology,CSCO
2019-04-24,Britain to allow Huawei restricted access to 5G network,CSCO
2019-04-23,3 Thrivent Mutual Funds To Add Strength To Your Portfolio ,CSCO
2019-04-16,"Goldman Sachs Maintains Buy on Cisco Systems, Raises Price Target to $62; Removes From Americas Conviction List",CSCO
2019-04-11,A Look At The Dow And FANG Stocks In 2019,CSCO
2019-04-11,5G connected cows test milking parlor of the future,CSCO
2019-04-07,Are You Looking For A Top Momentum Pick  Why Cisco Systems  CSCO  Is A Great Choice,CSCO
2019-04-06, Free  Money  How Students Mine Cryptocurrency in Their Dorm Rooms,CSCO
2019-04-02,Cisco Systems  CSCO  Stock Moves 0 55   What You Should Know,CSCO
2019-03-28,IIoT Boosts Manufacturing Processes  4 Stocks Set To Benefit ,CSCO
2019-03-27,Xen1Thlabs Had Discovered The Zero-Day Vulnerability In Cisco Ip Phones (7800 And 8800 Series),CSCO
2019-03-27,Cisco Systems  CSCO  Stock Moves  0 19   What You Should Know,CSCO
2019-03-26,Cisco  Global Blockchain market will be worth  10 billion by 2021,CSCO
2019-03-24,Is Cisco Systems  CSCO  Outperforming Other Computer And Technology Stocks This Year ,CSCO
2019-03-21,"Jim Cramer Advises His Viewers On Cisco, Nokia, Splunk And More",CSCO
2019-03-18,Be Secure With 5 ETFs This Week That Packs A Global Punch  ,CSCO
2019-03-14,Why Is Cisco  CSCO  Up 9  Since Last Earnings Report ,CSCO
2019-03-05,Juniper Networks Buys Mist Systems For $405M: 2 Analyst Takes,CSCO
2019-03-01,Make A Good Thing Better,CSCO
2019-02-27,Explainer  Securing the 5G future   what s the issue ,CSCO
2019-02-27,Best Sector Of February And Its Top ETFs   Stocks,CSCO
2019-02-26,"Jim Cramer Weighs In On Foot Locker, Cisco And More",CSCO
2019-02-24,Infinera  INFN  Looks Good  Stock Adds 8 5  In Session,CSCO
2019-02-23,Barron's On: The New Cold War in Tech,CSCO
2019-02-18,"Bulls & Bears Of The Week: Cisco, Coca-Cola, IBM, Tesla And More",CSCO
2019-02-15,Near Term Outlook For Computer Networking Industry Looks Bright,CSCO
2019-02-14,Mid-Day Market Update: Invacare Surges Following Strong Q4 Results; Motif Bio Shares Slide,CSCO
2019-02-14,"Credit Suisse Earlier Reiterated Neutral on Cisco Systems, Raised Price Target to $47",CSCO
