date,title,stock
2020-06-10,"Benzinga's Top Upgrades, Downgrades For June 10, 2020",CSCO
2020-06-10,Cisco shares are trading lower after Baird downgraded the company's stock from Outperform to Neutral and announced a $48 price target.,CSCO
2020-06-10,"Baird Downgrades Cisco Systems to Neutral, Announces $48 Price Target",CSCO
2020-06-05,Shares of several companies in the broader technology space are trading higher as markets rally following strong US jobs data.,CSCO
2020-06-05,Shares of several companies in the broader technology sector are trading higher as markets rally following strong US jobs data.,CSCO
2020-06-03,"Zoom Analysts On Work-From-Home Boost, Churn Concerns After 'Historic' Q1 Print",CSCO
2020-06-01,"Slack, Zoom, And The ""Stay At Home"" Economy—Q1 Earnings Preview",CSCO
2020-06-01,"Shares of several companies in the broader technology sector are trading higher amid market volatility. The sector has performed well, partly due to the work-from-home environment, which has led to greater for virtual communication, e-commerce and software programs.",CSCO
2020-05-29,"Cisco Consolidates Cloud Software Foray, Acquires ThousandEyes For Nearly $1B",CSCO
2020-05-28,Cisco Shares Relatively Quiet Following Report Co. Near $1B Deal For ThousandEyes,CSCO
2020-05-28,"Cisco Press Release Confirms Will Buy ThousandEyes, No Terms Disclosed",CSCO
2020-05-28,"Finjan Reports Patent Infringement Trial With Cisco To Reset To Oct. 19, 2020",CSCO
2020-05-18,"Saudi Arabia On A Pandemic Bargain Hunt, Buys Shares in Facebook, Disney, Boeing, Others",CSCO
2020-05-18,Cisco shares are trading higher amid general stock market strength and after Saudi Arabia's sovereign wealth fund acquired approximately $500M of Cisco shares.,CSCO
2020-05-18,Why Boeing's Stock Is Trading Higher Today,CSCO
2020-05-17,"Barron's Picks And Pans: Cisco, Gilead, Netflix, Wayfair And More",CSCO
2020-05-15,"Cramer Weighs In On Ubiquiti, Callaway Golf And More",CSCO
2020-05-15,"China's Global Times Mentions Qualcomm, Cisco, Apple And Boeing As 'four companies named by Chinese sources as possible targets for retaliation amid US moves against China's Huawei'",CSCO
2020-05-15,60 Biggest Movers From Yesterday,CSCO
2020-05-15,Quick Retreat: Impressive Thursday Turnaround Halted in Its Tracks Amid Fresh Trade Tiff,CSCO
2020-05-15,US To Block Shipments Of Semiconductors To Huawei: Report,CSCO
2020-05-15,Cisco Is Among The First to Give a Bigger Picture of the Pandemic's Impact,CSCO
2020-05-14,32 Stocks Moving in Thursday's Pre-Market Session,CSCO
2020-05-14,Mid-Afternoon Market Update: Dow Turns Higher; Crude Oil Surges 9%,CSCO
2020-05-14,"Morgan Stanley Maintains Equal-Weight on Cisco Systems, Raises Price Target to $46",CSCO
2020-05-14,"UPDATE: Barclays Maintains Overweight On Cisco Systems, Raises Target To $50 Notes Co's 'F3Q results beat our reduced expectations, driven by record operating margin performance'",CSCO
2020-05-14,"Nomura Instinet Maintains Neutral on Cisco Systems, Raises Price Target to $46",CSCO
2020-05-14,"UPDATE: MKM Maintains Neutral On Cisco Systems, Raises Target To $48 Notes 'Impressive Quarter Led By The Americas and Service Provider, And Good Enterprise Execution'",CSCO
2020-05-14,10 Biggest Price Target Changes For Thursday,CSCO
2020-05-14,"UPDATE: Nomura Instinet Maintains Neutral On Cisco Systems, Raises Target To $46 Notes 'Upside to both F3Q results and F4Q guidance was not of the highest quality, but never mind - Cisco beat in a very difficult climate'",CSCO
2020-05-14,"UPDATE: Raymond James Maintains Outperform On Cisco Systems, Raises Target To $49 Notes 'We believe Cisco benefited from better than expected orders from Enterprises and Service Providers; even the Commercial orders were not as weak as we expected'",CSCO
2020-05-14,"MKM Partners Maintains Neutral on Cisco Systems, Raises Price Target to $48",CSCO
2020-05-14,"Barclays Maintains Overweight on Cisco Systems, Raises Price Target to $50",CSCO
2020-05-14,42 Stocks Moving In Thursday's Mid-Day Session,CSCO
2020-05-14,Cisco shares are trading higher after the company reported better-than-expected Q3 EPS and sales results. The company also issued Q4 EPS guidance above estimates.,CSCO
2020-05-14,Mid-Day Market Update: Virtusa Falls On Downbeat Q4 Results; Applied DNA Sciences Shares Jump,CSCO
2020-05-14,"UBS Maintains Buy on Cisco Systems, Lowers Price Target to $51",CSCO
2020-05-14,"Citigroup Maintains Buy on Cisco Systems, Raises Price Target to $48",CSCO
2020-05-14,Mid-Morning Market Update: Markets Open Lower; Cisco Beats Q3 Views,CSCO
2020-05-14,"Credit Suisse Maintains Neutral on Cisco Systems, Raises Price Target to $41",CSCO
2020-05-14,Cisco Earnings Beat Provides Bright Spot After Downbeat Economic Comments From Fed,CSCO
2020-05-14,"Raymond James Maintains Outperform on Cisco Systems, Raises Price Target to $49",CSCO
2020-05-14,"Piper Sandler Maintains Neutral on Cisco Systems, Raises Price Target to $44",CSCO
2020-05-14,A Peek Into The Markets: US Stock Futures Mixed; Jobless Claims Report In Focus,CSCO
2020-05-14,"5 Stocks To Watch For May 14, 2020",CSCO
2020-05-14,"Wells Fargo Maintains Overweight on Cisco Systems, Raises Price Target to $55",CSCO
2020-05-13,"5 Stocks To Watch For May 13, 2020",CSCO
2020-05-13,Cisco shares are trading higher after the company reported better-than-expected Q3 EPS and sales results. The company also issued Q4 EPS guidance above estimates.,CSCO
2020-05-13,A Peek Into The Markets: US Stock Futures Up Ahead Of Fed's Powell Speech,CSCO
2020-05-13,"Benzinga Pro's Top 5 Stocks To Watch For Wed., May 13, 2020: CSCO, PFE, NCLH, ALLK, SDC",CSCO
2020-05-13,Financial Stocks Could Be In Focus Today After Powell Speech; Cisco Reports This Afternoon,CSCO
2020-05-13,"Cisco Systems Q3 Adj. EPS $0.790 Beats $0.710 Estimate, Sales $12.000B Beat $11.880B Estimate",CSCO
2020-05-13,"Cisco Sees Q4 Adj. EPS $0.72-$0.74 vs $0.71 Estimate, Sales Down 8.5-11.5% Year Over Year",CSCO
2020-05-13,Cisco Systems Reports Q3 Earnings Beat,CSCO
2020-05-13,"Earnings Scheduled For May 13, 2020",CSCO
2020-05-12,"Cramer Gives His Opinion On Cisco, Uber And More",CSCO
2020-05-12,"""Stay at Home"" Stocks Still Rule the Roost as Nvidia, Microsoft, Apple Start Week Firmly",CSCO
2020-05-04,"Finjan Highlights Patent Infringement Trial With Cisco To Start Jun. 22, 2020",CSCO
2020-05-01,"Zoom Corrects Blog Saying It Had 300M Daily Active Users, Admits It Was Wrong",CSCO
2020-04-29,"Shares of several technology companies are trading higher amid market strength following positive data from a study of Gilead's Remdesivir, which is being evaluated for coronavirus. A successful treatment could mean a sooner return to economic activity. NOTE: Some names may also be moving in sympathy following recent earnings from Google and some semiconductor companies.",CSCO
2020-04-22,"Little Things Count: After Selloff To Start Week, A Bit of Light Arrives With Positive Earnings",CSCO
2020-04-21,Shares of several technology companies are trading lower amid overall market weakness following a collapse in oil prices. Oil has been negatively impacted by excess supply and low demand amid the coronavirus pandemic.,CSCO
2020-04-17,KeyBanc Downgrades Cisco Systems to Sector Weight,CSCO
2020-04-17,"Benzinga's Top Upgrades, Downgrades For April 17, 2020",CSCO
2020-04-17,A Peek Into The Markets: US Stock Futures Signal Higher Start On Wall Street,CSCO
2020-04-16,"Next 45 Days Will Be 'Most Critical Period' For US, Says Alan Lancz Who Predicted 1987 and 2008 Crises",CSCO
2020-04-15,Every Member Of Trump's 'Great American Economic Revival' Industry Groups,CSCO
2020-04-15,"Shares of several technology companies are trading lower as equities fall amid mixed earnings results from banks, a significant decline in the price of oil and worse than expected retail sales in March.",CSCO
2020-04-14,"MKM Partners Maintains Neutral on Cisco Systems, Lowers Price Target to $40",CSCO
2020-04-14,'Cisco will let customers defer 95% of their payments on new products until 2021' -Tweet From CNBC,CSCO
2020-04-09,"Credit Suisse Maintains Neutral on Cisco Systems, Lowers Price Target to $40",CSCO
2020-04-08,Google G Suite Shows Uptick In Business Users As Meet Use Explodes,CSCO
2020-04-07,"Shares of several technology, semiconductor, and software companies are trading higher amid optimism that coronavirus cases in Asia are potentially easing. Global slowing cases could raise hopes of a sooner return to spending and economic activity.",CSCO
2020-04-06,Shares of several semiconductor and large technology stocks are trading higher with the broader market on optimism that coronavirus cases in several US hotspots appear to be reaching their peak.,CSCO
2020-04-02,"RNC Genter Capital CEO Likes Tech, Health Care, Financials In Volatile Market",CSCO
2020-04-01,"Shares of several technology, semiconductor, and software companies are trading lower amid market weakness as macro concerns continue to grow as a result of the coronavirus pandemic. The White House said it expects a surge in cases over the next 2 weeks.",CSCO
2020-03-31,Microsoft Shares Jump 8.5% As Company Reports Massive Increase In Teams Usage,CSCO
2020-03-31,"Wells Fargo Maintains Overweight on Cisco Systems, Lowers Price Target to $50",CSCO
2020-03-30,Shares of several technology companies are trading higher as equities continue to rise following last week's rebound amid US stimulus measures.,CSCO
2020-03-30,Portfolio Manager Offers Buying Tips: Focus On What You Own,CSCO
2020-03-27,"Shares of several technology, semiconductor, and software companies are trading lower as a potential sell-off from this week's strength. While US stimulus legislation has boosted economic optimism, demand concerns still exist amid the coronavirus.",CSCO
2020-03-26,Slack To Integrate With Microsoft Teams For Cross-Platform Calls,CSCO
2020-03-26,Shares of several software companies are trading higher after the Senate passed a $2 trillion stimulus package in relief to the coronavirus pandemic. The coronavirus outbreak has caused many equities across sectors to be very volatile.,CSCO
2020-03-24,Shares of several technology companies are trading higher amid market strength on hopes of a US economic stimulus package agreement.,CSCO
2020-03-23,"Shares of some technology companies are trading lower amid market volatility. Sunday's fiscal stimulus bill failed a procedural senate vote while the Fed on Monday announced stimulus measures. NOTE: Sector is mixed, with some names up for the session.",CSCO
2020-03-23,"Nomura Maintains Neutral on Cisco Systems, Lowers Price Target to $43",CSCO
2020-03-23,9 Technology Stocks Moving In Monday's Pre-Market Session,CSCO
2020-03-23,3 ETFs To Short The Dow,CSCO
2020-03-23,A Peek Into The Markets: US Stock Futures Down; Dow Futures Fall Over 700 Points,CSCO
2020-03-23,Cisco Pledges $225M To Fight Global Coronavirus Pandemic,CSCO
2020-03-20,Microsoft Teams Adds 12M Customers In A Week As Coronavirus Forces Remote Work Boom,CSCO
2020-03-20,Cramer's Stocks Picks For During And After The Coronavirus Outbreak,CSCO
2020-03-19,"Morgan Stanley Maintains Equal-Weight on Cisco Systems, Lowers Price Target to $43",CSCO
2020-03-18,"Staples, Stay-At-Home Tech Stocks Holding Up, But Energy, Travel Washout Continues",CSCO
2020-03-17,"Shares of several technology, semiconductor, and software companies are trading higher, rebounding from Monday's crash. Stocks may also potentially be getting a boost from expectations of further stimulus proposals.",CSCO
2020-03-16,Shares of several technology stocks are trading lower amid demand and supply chain disruption concerns driven by coronavirus.,CSCO
2020-03-13,"Shares of several technology, software and semiconductor companies are trading higher as equities rebound following Thursday's crash. The sector has been negatively impacted recently as the coronavirus outbreak has disrupted economic outlook globally.",CSCO
2020-03-12,"Shares of several technology, software and semiconductor companies are trading lower as equities sell off amid continued global coronavirus concerns. The virus has caused global economic disruption and negatively impacted stocks across sectors.",CSCO
2020-03-12,Stocks That Hit 52-Week Lows On Thursday,CSCO
2020-03-11,"Shares of several companies in the technology, software and semiconductor space are trading lower as equities sell off amid coronavirus fears. The virus spread has disrupted economic activity across sectors and caused global macro uncertainty.",CSCO
2020-03-10,Shares of several technology companies are trading higher as markets look to rebound from Monday's selloff. The technology sector has been highly impacted by the coronavirus due to its China exposure and sensitivity to economic conditions.,CSCO
2020-03-10,The Main Challenges Faced By The Upcoming EV Era,CSCO
2020-03-09,"Shares of several companies in the technology, software and semiconductor space are trading lower as equities crash amid coronavirus fears. The virus spread has disrupted economic activity across sectors and caused global macro uncertainty.",CSCO
2020-03-09,Shares of several media and communication companies are trading lower as US equities crash amid coronavirus fears and OPEC failing to reach a production agreement.,CSCO
2020-03-09,Tech Companies Lend A Hand To Help Organizations During Coronavirus Outbreak,CSCO
2020-03-06,Shares of several technology companies are trading lower. Movement appears market related as markets continue to dip amid the global coronavirus outbreak.,CSCO
2020-03-06,21 Technology Stocks Moving In Friday's Pre-Market Session,CSCO
2020-03-06,Stocks That Hit 52-Week Lows On Friday,CSCO
2020-03-05,"Shares of several technology, semiconductor, and software companies are trading lower as global markets continue to experience volatility amid the coronavirus spread.",CSCO
2020-03-03,10 Technology Stocks Moving In Tuesday's Pre-Market Session,CSCO
2020-03-03,Big Tech Might Be Leading Us To A New Economic Downturn – Here's Why,CSCO
2020-02-28,Stocks That Hit 52-Week Lows On Friday,CSCO
2020-02-28,"Shares of companies in the technology, semiconductor, and software sector are trading lower as fears of a possible pandemic escalate, with cases of the new coronavirus surging outside China.",CSCO
2020-02-27,"Shares of companies in the software, technology and semiconductor spaces are trading lower as continued coronavirus fears cause weakness across sectors.",CSCO
2020-02-27,Stocks That Hit 52-Week Lows On Thursday,CSCO
2020-02-26,"March Outlook: Political Season Starts To Sizzle, But Coronavirus Still Hogs Headlines",CSCO
2020-02-25,"Shares of several communication companies are trading lower as markets fall amid the continued spread of the coronavirus, which has raised concerns of a global economic slowdown, impacting stocks across sectors.",CSCO
2020-02-24,Shares of several communication and media companies are trading lower amid continued spread of coronavirus including notable upticks in Iran and Italy. NOTE: The virus has raised fear of a global economic slowdown.,CSCO
2020-02-20,Phunware Shares Halted On Circuit Breaker; Shares Spiked After Co. Announced Partnering With Cisco Systems To Demonstrate Integrated Mobile Corporate Campus Solution at South By Southwest 2020,CSCO
2020-02-20,UPDATE: Phunware To Debut An Integrated Mobile Corporate Campus Solution Called On My Way In Collaboration With Cisco Systems,CSCO
2020-02-18,Cisco Stock Slightly Drops As Earnings Barely Edge Over Estimates,CSCO
2020-02-13,Cisco Systems  CSCO  Q2 Earnings And Revenues Beat Estimates,CSCO
2020-02-13,Cisco Offers Gloomy Outlook on Revenue  Earnings Beat in Q2,CSCO
2020-02-13,"Morgan Stanley Maintains Equal-Weight $50 Target On Cisco As Firm Notes 'Despite improvements in the macro backdrop, some uncertainty among customers persists, keeping us on the sidelines for now, particularly at current ~15x P/E valuation'",CSCO
2020-02-13,"UPDATE: Baird Maintains Outperform on Cisco Systems, Raises Price Target to $55 As Firm Notes 'we do continue to see an opportunity for Cisco to use its broad portfolio to restart growth as well as potential tailwinds including WiFi 6 and 5G.'",CSCO
2020-02-13,Cisco gives tepid current quarter forecast  sees weak client spending,CSCO
2020-02-13,Stocks making the biggest moves after hours  Cisco  Applied Materials  MGM Resorts and more,CSCO
2020-02-13,Dow Jones News  Cisco Reports Today  Disney Boosts Ticket Prices,CSCO
2020-02-13,"Raymond James Maintains Outperform on Cisco Systems, Lowers Price Target to $54",CSCO
2020-02-13,7 Technology Stocks Moving In Thursday's Pre-Market Session,CSCO
2020-02-13,Cisco Systems shares are trading lower after the company issued Q3 sales guidance to be down 1.5%-3.5% year-over-year.,CSCO
2020-02-13,"Credit Suisse Maintains Neutral on Cisco Systems, Lowers Price Target to $45",CSCO
2020-02-13,Should You Buy The Dip In Cisco?,CSCO
2020-02-13,"Nomura Maintains Neutral on Cisco Systems, Raises Price Target to $47",CSCO
2020-02-13,"Baird Maintains Outperform on Cisco Systems, Raises Price Target to $55",CSCO
2020-02-13,Cisco Denies FireEye M&A Rumors,CSCO
2020-02-13,Traders Circulate Report Suggesting Cisco Is Preparing To Acquire FireEye,CSCO
2020-02-13,Cisco beats on earnings  shares barely budge,CSCO
2020-02-13,Watch Now  Here s What s Moving Markets   Feb  12  Video ,CSCO
2020-02-13,Stocks   U S  Futures Point Higher as Virus Fears Ease,CSCO
2020-02-13,"Thursday's Market Minute: If You Can't Beat 'Em, Disappoint 'Em",CSCO
2020-02-13,Top 5 Things to Know in the Market on Wednesday  12th February,CSCO
2020-02-13,"UPDATE: Raymond James On Cisco Notes 'Management exuded a more constructive tone than the prior call, but noted caution on the part of customers, continued challenges in the Service provider vertical and the added uncertainty from the coronavirus'",CSCO
2020-02-13,Cisco Systems Inc  CSCO  Q2 2020 Earnings Call Transcript,CSCO
2020-02-13,"Coronavirus Fears Back On Big Earnings Day As Alibaba, PepsiCo, Nvidia All Report",CSCO
2020-02-13,"UPDATE: Raymond James Maintains Outperform On Cisco, Lowers Target To $54 Notes 'Although we thought Cisco would guide higher than down (2.5%) y/y at the midpoint, we did not anticipate the dividend increase'",CSCO
2020-02-13,Wall St  hits record highs as virus fears ease ,CSCO
2020-02-13,Why Cisco s Q2 Is Rock Solid,CSCO
2020-02-12,Tech Daily  FTC Investigation  Trump Testimony  MWC  More,CSCO
2020-02-12,Cisco Systems Sees Q3 Adj. EPS $0.79-$0.81 vs $0.80 Est.,CSCO
2020-02-12,Cisco Systems Reports Q2 Earnings Beat,CSCO
2020-02-12,Cisco Raises Quarterly Dividend From $0.35 To $0.36/Share,CSCO
2020-02-12,Cisco Systems Sees Q3 Sales Down 1.5%-3.5% YoY,CSCO
2020-02-12,"12 Stocks To Watch For February 12, 2020",CSCO
2020-02-12,"Earnings Scheduled For February 12, 2020",CSCO
2020-02-12,"Cisco Systems Q2 Adj. EPS $0.77 Beats $0.76 Estimate, Sales $12B Beat $11.98B Estimate",CSCO
2020-02-12,"CVS This Morning, Powell At Midday, And Cisco After The Bell As Earnings Roll On",CSCO
2020-02-12,Here's How Much Investing $100 In Cisco Stock Back In 2010 Would Be Worth Today,CSCO
2020-02-11,"Under Armour Gets Torn Up As Earnings Disappoint, But Coronavirus Fears Retreat Slightly",CSCO
2020-02-11,Cisco Says Will Withdraw From Participating In Mobile World Congress Feb. 24-27 In Barcelona Due To Concerns About Current Outbreak Of Coronavirus,CSCO
2020-02-10, Stock Market News For Feb 11  2020,CSCO
2020-02-10,Tech Is An Income Destination. Here's How To Play That Theme,CSCO
2020-02-10,Will Security   Applications Aid Cisco s  CSCO  Q2 Earnings ,CSCO
2020-02-10,"Big Week Of Earnings Ahead Featuring Cisco, Nvidia, UnderArmour, Among Others",CSCO
2020-02-09,Cisco  CVS  Lyft  Nvidia  Shopify  Roku and More Major Earnings Coming This Week,CSCO
2020-02-09,Equities Higher For The Week As Oil Drops,CSCO
2020-02-09,Week Ahead  Virus Risks Fuel Uncertainty  Powell Testifies To Congress,CSCO
2020-02-08,"Barron's Picks And Pans: GM, Kraft Heinz, Tesla, Under Armour And More",CSCO
2020-02-07, No concrete proposition  from U S  to back Huawei rival Ericsson  Swedish minister,CSCO
2020-02-03,Fabrinet  FN  Q2 Earnings Beat Estimates  Revenues Rise Y Y ,CSCO
2020-01-28,AMD CEO Lisa Su Joins Cisco Board,CSCO
2020-01-28,"﻿Shares of several communication companies are trading higher, rebounding as fears of the coronavirus's impact on the economy settle. NOTE:  Although the market rebounded, there are still concerns over the spread of the virus.",CSCO
2020-01-28,Why Cisco Is Overdue for a Reemergence,CSCO
2020-01-27,Shares of several technology and software stocks are trading lower as global equities continue to dip amid the spread of the Wuhan coronavirus. Analysts speculate uncertainty and volatility driven by virus concerns has caused rotation out of growth and risk names as well as more mature tech names.,CSCO
2020-01-27,Cisco Appoints AMD President And CEO Dr. Lisa T. Su To Board of Directors,CSCO
2020-01-26,"Barron's Picks And Pans: BioMarin, Caesars, Royal Caribbean And More",CSCO
2020-01-22,"KeyBanc Maintains Overweight on Cisco Systems, Raises Price Target to $54",CSCO
2020-01-22,"Cisco Systems Option Alert: Jan, 2021 $30 Puts at the Ask: 43500 @ $0.36 vs 1285 OI; Earnings 2/12 After Close Ref=$49.205",CSCO
2020-01-12,Better Buy  Arista Networks vs  Cisco,CSCO
2020-01-08,Cisco Systems cut to Neutral at BAML on lack of catalysts,CSCO
2020-01-08,"Benzinga's Top Upgrades, Downgrades For January 8, 2020",CSCO
2020-01-08,Bank of America Downgrades Cisco Systems to Neutral,CSCO
2020-01-06,Pros Discuss Apple Stock One Year After Profit Scare,CSCO
2020-01-03,22 Technology Stocks Moving In Friday's Pre-Market Session,CSCO
2019-12-27,Cisco Systems  CSCO  Stock Moves  0 17   What You Should Know,CSCO
2019-12-27,Huawei Exec Says WSJ Figure Of $75B In Aid 'Really Not Fair',CSCO
2019-12-22,How The Dow Jones Industrial Average Changed Over The Past Decade,CSCO
2019-12-20,Broomsticks Flying In For Quadruple Witching Ahead Of Reindeer Next Week,CSCO
2019-12-19,Cisco Systems shares are trading higher after Barclays upgraded the company's stock from Equal-Weight to Overweight and announced a $53 price target.,CSCO
2019-12-19,"Benzinga's Top Upgrades, Downgrades For December 19, 2019",CSCO
2019-12-19,13 Technology Stocks Moving In Thursday's Pre-Market Session,CSCO
2019-12-19,"Barclays Upgrades Cisco Systems to Overweight, Announces $53 Price Target",CSCO
2019-12-16,Cisco Systems shares are trading higher. The company has reportedly won a legal battle against Chinese counterfeits and secured an injunction that requires online marketplaces to halt sales of 'knockoff' items.,CSCO
2019-12-12,"Cramer Gives His Opinion On Synopsys, Cisco And More",CSCO
2019-12-12,Why Is Cisco  CSCO  Up 1 7  Since Last Earnings Report ,CSCO
2019-12-12,"Shares of communication companies are trading higher amid multiple positive US-China trade developments after the open, which have lifted global equities across sectors.",CSCO
2019-12-11,Cisco Unveils Details Behind Its 'Internet for the Future' Strategy,CSCO
2019-12-02,Salesforce Might Have Quite A Few Surprises Up Its Sleeve,CSCO
2019-11-19,Company logos vanish from Prince Andrew s website as sex scandal grows,CSCO
2019-11-16,"Bulls And Bears Of The Week: Apple, Disney, Microsoft, Uber And More",CSCO
2019-11-15,"Driving Higher: Market Keeps Hanging In, On Pace For Another Record-Setting Week",CSCO
2019-11-15,70 Biggest Movers From Yesterday,CSCO
2019-11-15,U S  China trade hopes revive stocks  protests leave scars,CSCO
2019-11-15,Cisco Sinks  Market Cycles Point To Plenty Of Pain Ahead,CSCO
2019-11-14,Cisco Falls 6 ,CSCO
2019-11-14,"MKM Partners Maintains Neutral on Cisco Systems, Lowers Price Target to $48",CSCO
2019-11-14,"Citigroup Maintains Buy on Cisco Systems, Lowers Price Target to $55",CSCO
2019-11-14,10 Biggest Price Target Changes For Thursday,CSCO
2019-11-14,Asian shares rise  but gains capped by weak sentiment,CSCO
2019-11-14,"Bank of America Maintains Buy on Cisco Systems, Lowers Price Target to $56",CSCO
2019-11-14,"Barclays Maintains Equal-Weight on Cisco Systems, Lowers Price Target to $47",CSCO
2019-11-14,"Nomura Maintains Neutral on Cisco Systems, Lowers Price Target to $45",CSCO
2019-11-14,"A Peek Into The Markets: US Stock Futures Down Ahead Of Producer Price Index, Fed Speakers",CSCO
2019-11-14,"Wells Fargo Maintains Outperform on Cisco Systems, Lowers Price Target to $58",CSCO
2019-11-14,"Cisco shares are trading lower after the company issued Q2 financial guidance below analyst estimates, despite reporting better-than-expected Q1 results.",CSCO
2019-11-14,5 Technology Stocks Moving In Thursday's Pre-Market Session,CSCO
2019-11-14,30 Stocks Moving in Thursday's Pre-Market Session,CSCO
2019-11-14,"UBS Maintains Buy on Cisco Systems, Lowers Price Target to $54",CSCO
2019-11-14,"Baird Maintains Outperform on Cisco Systems, Lowers Price Target to $52",CSCO
2019-11-14,"Morgan Stanley Maintains Equal-Weight on Cisco Systems, Lowers Price Target to $48",CSCO
2019-11-14,"Piper Jaffray Maintains Neutral on Cisco Systems, Lowers Price Target to $50",CSCO
2019-11-14,"JP Morgan Maintains Overweight on Cisco Systems, Lowers Price Target to $58",CSCO
2019-11-14,"11 Stocks To Watch For November 14, 2019",CSCO
2019-11-14,"Cisco's Stock Drops On Guidance, Sell-Side Lowers Price Targets",CSCO
2019-11-14,48 Stocks Moving In Thursday's Mid-Day Session,CSCO
2019-11-14,UPDATE: MKM Notes Cisco's 'significant deceleration in Commercial and Enterprise orders' 'is consistent with our view that Enterprise demand is significantly slowing due to macro conditions' And 'has started to spread to the Telco/Service Provider market',CSCO
2019-11-14,"UPDATE: MKM Maintains Neutral On Cisco, Lowers Target To $48 Notes Co. 'is doing a good job of controlling what it can' 'However, we do not like CSCO as an investment when macro conditions are weakening and orders are decelerating'",CSCO
