date,title,stock
2019-02-14,UPDATE: Citi Encourages 'investors to Buy Cisco stock as the company has transitioned to a higher profitable model with strong cash flows and returning cash to shareholders all evidenced by this quarter's better than expected results and outlook',CSCO
2019-02-14,Mid-Morning Market Update: Markets Open Lower; Cisco Earnings Top Estimates,CSCO
2019-02-14,Mid-Afternoon Market Update: NASDAQ Turns Higher; CyberArk Software Shares Gain On Upbeat Earnings,CSCO
2019-02-14,"Valentine's Card From The Market: Trade Optimism Continues, Cisco Posts Strong Quarter",CSCO
2019-02-14,"Benzinga Pro's Top 10 Most-Searched Tickers For Thurs., Feb. 14, 2019",CSCO
2019-02-14,52 Stocks Moving In Thursday's Mid-Day Session,CSCO
2019-02-14,Israeli software firm DriveNets raises  110 million in first funding round,CSCO
2019-02-14,"KeyBanc Maintains Overweight on Cisco Systems, Raises Price Target to $55",CSCO
2019-02-14,Analysts Say Cisco Has Limited Upside Following Earnings Beat,CSCO
2019-02-14,Cisco Rises 4 ,CSCO
2019-02-14,"Citigroup Maintains Buy on Cisco Systems, Raises Price Target to $56",CSCO
2019-02-14,Cisco Rises 3 ,CSCO
2019-02-14,"Wells Fargo Maintains Outperform on Cisco Systems, Raises Price Target to $57",CSCO
2019-02-14,"Cisco Systems shares are trading higher after the company announced mixed earnings, better than expected Q3 EPS guidance, increased its buyback by $15B and raised its quarterly dividend.",CSCO
2019-02-14,30 Stocks Moving In Thursday's Pre-Market Session,CSCO
2019-02-14,"A Peek Into The Markets: US Stock Futures Up Ahead Of Earnings, Economic Data",CSCO
2019-02-14,"11 Stocks To Watch For February 14, 2019",CSCO
2019-02-14,"UPDATE: Credit Suisse Reiterates Neutral On Cisco As Firm Believes 'the company is fairly valued at current levels of ~16x our FY19 EPS estimate of $3.08, at a premium compared to direct networking peers'",CSCO
2019-02-13,Cisco Systems  CSCO  Q2 Earnings And Revenues Surpass Estimates,CSCO
2019-02-13,6 Stocks Moving In Wednesday's After-Hours Session,CSCO
2019-02-13,"Cisco Systems Q2 EPS $0.73 Beats $0.72 Estimate, Sales $12.4B Miss $12.41B Estimate",CSCO
2019-02-13,Cisco Shares Rise on Top and Bottom Line Beats,CSCO
2019-02-13,Cisco Adds $15B To Buyback,CSCO
2019-02-13,Cisco Raises Qtr. Dividend From $0.33 To $0.35/Share,CSCO
2019-02-13,"Earnings Scheduled For February 13, 2019",CSCO
2019-02-13,ETFs To Surge On Cisco s Solid Results,CSCO
2019-02-13,Cisco Shares Rise After Q2 Earnings Beat,CSCO
2019-02-13,"13 Stocks To Watch For February 13, 2019",CSCO
2019-02-13,"Cisco Sees Q3 Adj. EPS $0.76-$0.78 vs $0.76 Estimate, Sales Growth 4-6% Year Over Year",CSCO
2019-02-13,"Cisco Systems shares are trading higher after the company reported Q2 EPS of $0.73, beating the $0.72 estimate; The company also issued Q3 sales guidance on the higher-end of analyst estimates.",CSCO
2019-02-13,Austria calls for European stance on Huawei to ensure competition,CSCO
2019-02-13,Cisco Systems Too Report Q2 Earnings After The Closing Bell; Co. Historically Issues Its Report At 4:05 p.m. ET,CSCO
2019-02-13,"Flashing Green: Global Stocks Follow U.S. Market Higher, With Cisco Reporting Later",CSCO
2019-02-13,A Preview Of Cisco Systems Q2 Earnings,CSCO
2019-02-12,Shutdown Avoided? Stocks Get Early Boost With Activision Blizzard Earnings Later,CSCO
2019-02-12,8 Biggest Price Target Changes For Tuesday,CSCO
2019-02-12,"Benzinga's Top Upgrades, Downgrades For February 12, 2019",CSCO
2019-02-12,"Morgan Stanley Downgrades Cisco Systems to Equal-Weight, Lowers Price Target to $49",CSCO
2019-02-12,Banks And Info Tech Lead Way In Sharp Rally Amid Hopes For Geopolitical Progress,CSCO
2019-02-11,"Earnings Potpourri: Coca-Cola, Deere, Cisco Report This Week, But Trade Talks Dominate",CSCO
2019-02-11,Former executive of Duo Security  Zscaler joins IronNet as co CEO,CSCO
2019-02-10,"Barron's Picks And Pans: BB&T, Best Buy, Boeing And More",CSCO
2019-02-10,Barron's On: The Most Sustainable Companies In America,CSCO
2019-02-10,Stock Market Mixed Week,CSCO
2019-02-07,Illumio raises  65 million  J P  Morgan Asset Management leads round,CSCO
2019-02-06,"'$FNJN $CSCO Markman opinion issued in the Finjan vs Cisco Systems patent infringement lawsuit.  The court adopted all of Finjans proposed claim constructions, nice win for $FNJN.' -TradeHawk Tweets",CSCO
2019-01-31,Cisco Systems  A Strong Short Level Is Near,CSCO
2019-01-30,Should Investors Buy The Dip In Juniper Networks? The Street Debates,CSCO
2019-01-23,Najarians On CNBC Mention Cisco Systems And Amarin As Unusual Options Plays,CSCO
2019-01-17,Rallying  Qatari Al Attiyah wins his third Dakar  Toyota s first,CSCO
2019-01-16,"Tech Sector Earnings: Revenue Growth Widely Expected To Slow, Will Global Uncertainty Weigh?",CSCO
2019-01-15,Top Picks 2019  Arista Networks Inc  ANET,CSCO
2019-01-15,Why The Earnings Surprise Streak Could Continue For Cisco  CSCO ,CSCO
2019-01-07,Cisco Systems  CSCO  Gains But Lags Market  What You Should Know,CSCO
2019-01-04,Cisco Rises 3 ,CSCO
2019-01-03,Cisco Falls 3 ,CSCO
2019-01-03,Shares of several tech stocks are trading down after Apple cut Q1 sales guidance.,CSCO
2019-01-02,Tech stocks shares are trading lower after Apple cut Q1 sales guidance drastically.,CSCO
2019-01-02,"Stocks That Will Be Trading Ex Dividend Thurs., Jan. 3, 2019",CSCO
2018-12-31,Cisco Systems Option Alert: Mar 15 $48 Calls at the Ask: 635 @ $0.651 vs 1823 OI; Earnings 2/13 After Close [est] Ref=$43.18,CSCO
2018-12-28,Cisco Systems  CSCO  Dips More Than Broader Markets  What You Should Know,CSCO
2018-12-26,Cisco Rises 3 ,CSCO
2018-12-24,Cisco Falls 3 ,CSCO
2018-12-21,Huawei s Rapid Growth  Alleged Theft Helped Sow Mistrust in U S ,CSCO
2018-12-19,Cisco Falls 3 ,CSCO
2018-12-18,"Cisco Announces Intent To Acquire Silicon Photonics Company, Luxtera, For $660M In Cash",CSCO
2018-12-18,Cisco Systems  CSCO  Stock Sinks As Market Gains  What You Should Know,CSCO
2018-12-17,Cisco Falls 3 ,CSCO
2018-12-14,"Nomura Downgrades Cisco Systems to Neutral, Announces $50",CSCO
2018-12-14,A Peek Into The Markets: US Stock Futures Tumble Ahead Of Economic Reports,CSCO
2018-12-14,"Benzinga's Top Upgrades, Downgrades For December 14, 2018",CSCO
2018-12-14,Cisco Falls 3 ,CSCO
2018-12-12,Loop Capital  A Cisco Luxtera deal threatens AAOI  FNSR,CSCO
2018-12-11,Cisco And WiLAN Sign License Agreement; Through Agreement WiLAN Has Granted License For Certain Patents To Cisco,CSCO
2018-12-11,"Jim Cramer Weighs In On Cisco, General Electric And More",CSCO
2018-12-07,Cisco Falls 3 ,CSCO
2018-12-04,Cisco Falls 3 ,CSCO
2018-12-04,TIBCO to buy data management firm Orchestra Networks  sources,CSCO
2018-11-30,Analysts Largely Bullish On Palo Alto After Q1 Print,CSCO
2018-11-29,Cisco Systems  CSCO  Gains As Market Dips  What You Should Know,CSCO
2018-11-26,Logitech Drops Acquisition Talks With Plantronics,CSCO
2018-11-21,Cisco to acquire UK based Ensoft,CSCO
2018-11-20,Cisco Falls 3 ,CSCO
2018-11-19,Cisco Systems  CSCO  Stock Moves  1 29   What You Should Know,CSCO
2018-11-16,Digital media company Technicolor explores options including sale  sources,CSCO
2018-11-16,"Benzinga Pro's Top 10 Most-Searched Tickers For Morning Of Fri., Nov. 16, 2018",CSCO
2018-11-15,Cisco Systems shares trade up 4.1% after the company reported Q1 EPS and revenue beats.,CSCO
2018-11-15,Cisco Rises 5% On A Strong Q1: This Chart Shoes More Room To Run,CSCO
2018-11-15,8 Biggest Price Target Changes For Thursday,CSCO
2018-11-15,"Benzinga Pro's Top 10 Most-Searched Tickers For Thurs., Nov. 15, 2016",CSCO
2018-11-15,Cisco Rises 5 ,CSCO
2018-11-15,Cisco's Post-Earnings Gain Mirrors Positive Wall Street Commentary,CSCO
2018-11-15,"Raymond James Maintains Outperform on Cisco Systems, Raises Price Target to $52",CSCO
2018-11-15,"Big Box Bonanza: Walmart Beats Most Estimates, But Brexit Could Steal Attention",CSCO
2018-11-15,"Credit Suisse Maintains Neutral on Cisco Systems, Raises Price Target to $44",CSCO
2018-11-15,34 Stocks Moving In Thursday's Pre-Market Session,CSCO
2018-11-15,"Deutsche Bank Maintains Buy on Cisco Systems, Raises Price Target to $60",CSCO
2018-11-15,A Peek Into The Markets: US Stock Futures Up Ahead Of Economic Reports,CSCO
2018-11-15,"10 Stocks To Watch For November 15, 2018",CSCO
2018-11-15,Cisco Rises On Solid Quarter  More Room To Run,CSCO
2018-11-14,"Earnings Scheduled For November 14, 2018",CSCO
2018-11-14, ETFs To Watch On Cisco s Solid Results ,CSCO
2018-11-14,Cisco Systems  CSCO  Q1 Earnings And Revenues Top Estimates,CSCO
2018-11-14,"8 Stocks To Watch For November 14, 2018",CSCO
2018-11-14,"Cisco Systems, Inc. Q1 Adj. EPS $0.75 Beats $0.72 Estimate, Sales $13.1B Beat $12.87B Estimate",CSCO
2018-11-14,"Cisco Sees Q2 Adj. EPS $0.71-$0.73 vs $0.72 Estimate, Sales Growth 5-7% Year Over Year",CSCO
2018-11-14,7 Stocks Moving In Wednesday's After-Hours Session,CSCO
2018-11-14,Cisco Earnings  Revenue beat in Q1,CSCO
2018-11-12,Cisco Falls 3 ,CSCO
2018-11-09,"Cold Start: Worries About Hawkish Fed, Rising Prices Seem To Weigh On Sentiment",CSCO
2018-11-09,Cisco Falls 3 ,CSCO
2018-11-08,"Jim Cramer Shares His Thoughts On Albermarle, Cisco And More",CSCO
2018-11-07,Cisco Rises 3 ,CSCO
2018-11-06,Cisco Systems  CSCO  Earnings Expected To Grow  What To Know Ahead Of Next Week s Release,CSCO
2018-10-31,Cisco Rises 3 ,CSCO
2018-10-30,Wild Times: Market Seems To Seek Solid Ground After Monday's Manic,CSCO
2018-10-26,Cisco Falls 3 ,CSCO
2018-10-25,Cisco Rises 3 ,CSCO
2018-10-24,Conspicuous Weakness In Market Internals A Bad Omen For Stocks ,CSCO
2018-10-16,"Jim Cramer Advises His Viewers On Cisco, Microsoft And More",CSCO
2018-10-12,Cisco Rises 3 ,CSCO
2018-10-11,Cisco Falls 3 ,CSCO
2018-10-11,India to raise import tariffs on electronic and communication items,CSCO
2018-10-10,Cisco Falls 3 ,CSCO
2018-10-08,Consolidated Comms expands ProConnect UC offering,CSCO
2018-10-05,Venture Capital Gathering Showcases Michigan's 'Secret Weapon': Collaboration,CSCO
2018-10-04,"Stocks Which Set New 52-Week High Yesterday, October 3rd",CSCO
2018-10-03,"Stocks That Will Trade Ex Dividend Thurs., Oct. 4, 2018",CSCO
2018-10-03,Cap-Weighted ETFs Are Still Pretty Good,CSCO
2018-10-02,"Stocks Which Set New 52-Week High Yesterday, October 1st",CSCO
2018-09-28,FCC Chairman Ajit Pai Reportedly Says Wants US To 'Lead The World In 5G',CSCO
2018-09-27,"Stocks Which Set New 52-Week High Yesterday, September 26th",CSCO
2018-09-26,"Stocks Which Set New 52-Week High Yesterday, September 25th",CSCO
2018-09-24,"Stocks Which Set New 52-Week High Friday, September 21",CSCO
2018-09-21,"Stocks That Made New 52-Week Highs So Far Today Include: Mosaic, Cooper Companies, Pfizer, Gartner, Yum Brands, Danaher, Anthem, Nike, Cisco, Honeywell, Advance Auto Parts, and Clorox",CSCO
2018-09-19,"Juniper Networks Powered By Several Growth Drivers, Nomura Instinet Says In Upgrade",CSCO
2018-09-12,Investors Try To Read The Trade Tea Leaves In The Latest IMX Report,CSCO
2018-09-12,"Market Appears To Be in Wait-and-See Mode Ahead of Apple, Central Bank Events",CSCO
2018-09-11,"Piper Jaffray Out On Cisco, Says Q1 Product Estimates May Be conservative As Mgmt. Is Embedding Lighter Than Normal Seasonality; Also Notes That The Co. CEO Expects To Have To Pass Through New U.S. Tariffs To Customers",CSCO
2018-09-11,Investor Movement Index August Summary,CSCO
2018-09-09,"Benzinga's Bulls & Bears Of The Week: Apple, Facebook, Nike, Tesla, More",CSCO
2018-09-07,Kudlow Says U S  Willing to Talk With China as Tariffs Loom,CSCO
2018-09-06,Finisar beats by  0 06  beats on revenue,CSCO
2018-09-05,"Stocks Which Set New 52-Week High Yesterday, September 4th",CSCO
2018-09-05,"Jim Cramer Shares His Thoughts On Citi, Schlumberger, Sprouts Farmers Market And More",CSCO
2018-09-05,Pros: Cisco Isn't Getting The Attention It Deserves,CSCO
2018-09-04,"Morgan Stanley Maintains Overweight on Cisco Systems, Raises Price Target to $51",CSCO
2018-09-04,"Stocks Which Set New 52-Week High Friday, August 31",CSCO
2018-08-31,Cisco Systems Option Alert: Jan 18 $50 Calls Sweep (36) near the Ask: 1409 @ $1.316 vs 19791 OI; Ref=$47.685,CSCO
2018-08-31,Cisco Systems Option Alert: Sep 21 $48 Calls at the Ask: 2785 @ $0.6 vs 11320 OI; Ref=$47.76,CSCO
2018-08-30,"Stocks Which Set New 52-Week High Yesterday, August 29th",CSCO
2018-08-29,"Stocks Which Set New 52-Week High Yesterday, August 28th",CSCO
2018-08-29,"Stocks That Made New 52-Week Highs So Far Today Include: Salesforce, Textron, TJX, Kansas City Southern, Dover, HCA, United Continental, Ingersoll-Rand, Xilinx, Thermo Fisher, Progressive, Microsoft, Apple, Paypal, Cisco, UnitedHealth, Visa & Mastercard",CSCO
2018-08-27,"Stocks Which Set New 52-Week High Friday, August 24th",CSCO
2018-08-23,Uber investor Lead Edge Capital closes  520 million fund,CSCO
2018-08-23,"Piper Jaffray Brightens On Finisar, Acacia Communications",CSCO
2018-08-22,"Stocks Which Set New 52-Week High Yesterday, August 21st",CSCO
2018-08-21,"Stocks Which Set New 52-Week High Tues., Aug. 21, 2018",CSCO
2018-08-17,"Cisco, Macy's, Nvidia, TLT: 'Fast Money' Picks For August 17",CSCO
2018-08-17,Headlights On Deere: Mixed Results As Company Cites Higher Costs,CSCO
2018-08-17,A Peek Into The Markets: US Stock Futures Edge Lower Ahead Of Economic Data,CSCO
2018-08-16,"Credit Suisse Maintains Neutral on Cisco Systems, Raises Price Target to $43",CSCO
2018-08-16,A Peek Into The Markets: US Stock Futures Surge Ahead Of Earnings,CSCO
2018-08-16,28 Stocks Moving In Thursday's Pre-Market Session,CSCO
2018-08-16,"10 Stocks To Watch For August 16, 2018",CSCO
2018-08-16,Benzinga Pro's 5 Stocks To Watch Today,CSCO
2018-08-16,Cisco Systems shares are up 4.3% after the company late Wednesday reported a Q4 earnings beat and issued upbeat Q1 guidance.,CSCO
2018-08-16,"Care Package: Walmart Results, China Trade Talks Might Help Lift Spirits",CSCO
2018-08-16,31 Stocks Moving In Thursday's Mid-Day Session,CSCO
2018-08-16,What Wall Street Thinks Of Cisco's Q4 Earnings,CSCO
2018-08-16,"BMO Capital Maintains Market Perform on Cisco Systems, Raises Price Target to $48",CSCO
2018-08-15,Cisco Systems Sees Q1 Adj. EPS $0.70-$0.72 vs $0.69 Est.,CSCO
2018-08-15,"Earnings Scheduled For August 15, 2018",CSCO
2018-08-15,"10 Stocks To Watch For August 15, 2018",CSCO
2018-08-15,Cisco Systems Q4 Earnings Preview,CSCO
2018-08-15,Cisco Systems Option Alert: Sep 21 $45 Calls Sweep (20) near the Ask: 560 @ $0.75 vs 16319 OI; Earnings 8/15 After Close Ref=$43.43,CSCO
2018-08-15,"Cisco Systems Q4 Adj. EPS $0.70 Beats $0.68 Estimate, Sales $12.8B Beat $12.77B Estimate",CSCO
2018-08-15,Cisco s software push fuels quarterly beat  strong forecast,CSCO
2018-08-15,After Hours Gainers   Losers  08 15 2018 ,CSCO
2018-08-15,Cisco Systems Sees Q1 Sales Up 7%-9% YoY,CSCO
2018-08-15,4 Stocks Moving In Wednesday's After-Hours Session,CSCO
2018-08-14,"13F Filing From Tiger Global Shows Reduced Stake In Adobe, Alphabet, Bank of America, Boot Barn, Cisco, JP Morgan, Ooma, & Norwegian Cruise Lines (from 435.1K Shares to 42.1K Shares);Raised Stake In Alibaba, Amazon, Delta Airlines, & Pure Storage",CSCO
2018-08-13,"The Week Ahead: Nvidia, Retailer Earnings In Focus",CSCO
2018-08-07,Investor Movement Index July Summary,CSCO
2018-08-07,The Highs And Lows Of Earnings Season Dominate July's IMX Results,CSCO
2018-08-06,Cisco Systems 8-K Indicates The $400M Arista Networks Will Pay To Co. As Result Of Litigation Will Be Reflected In Q1 2019 Results,CSCO
2018-08-06,Arista to pay  400 million to Cisco to resolve court fight,CSCO
2018-08-06,"Arista Networks Entered Into A Binding Term Sheet W/Cisco, Cos. Will Dismall All Pending Litigation Upon Its Execution And Arista Will Pay Cisco $400M By August 20th; The Companies Seek A Continuance Or Stay Of The Jury Trial That Was Set To Begin Today",CSCO
2018-08-02,"UPDATE: Cisco Confirms Purchase Of Duo Security For $2.35B In Cash, Assumed Equity Awards For Duo's Outstanding Shares, Warrants, Equity Incentives",CSCO
2018-08-02,Cisco Said To Be In Talks To Buy Duo Security For ~$2B,CSCO
2018-08-02,Cisco To Buy Michigan-Based Duo Security In $2.35B Deal,CSCO
2018-07-30,Deutsche Bank: Buy The Dip In Juniper Networks,CSCO
2018-07-26,2 Pros Talk Facebook Earnings,CSCO
2018-07-24,"Google Cloud Announces New Integrations With Cisco, Twilio and Vonage",CSCO
2018-07-19,FirstWave Cloud Technology Signs OEM License Agreement with Cisco,CSCO
2018-07-19,"Late Wednesday, Marketwatch Reported Amazon Denied July 13th Report From The Information That It Will Challenge Cisco With Networking Switch Sales",CSCO
2018-07-19,"Morgan Stanley Maintains Overweight on Cisco Systems, Lowers Price Target to $48",CSCO
2018-07-13,Investigating Cisco's Quest To Bring India Online,CSCO
2018-07-13,"Hearing Traders In Chatrooms Passing Word RBC And Morgan Stanley Have Both Come Out Downplaying Effect Of Earlier Rumor Amazon Considering Selling Network Switches, Unconfirmed",CSCO
2018-07-13,Cisco Systems Option Alert: Fri $43.5 Puts at the Bid: 800 @ $0.7 vs 2025 OI; Earnings 8/15 After Close [est] Ref=$42.78,CSCO
2018-07-13,The Information Reports Amazon Web Services Is Considering Selling Its Own Networking Switches For Business Customers-Hardware Devices That Move Traffic Around Networks; Could Price Its Switches Between 70-80% Less Than Cisco Switches,CSCO
2018-07-13,The Information Reports 'Amazon Web Services Targets Cisco in Networking',CSCO
2018-07-12,"Jim Cramer Shares His Thoughts On Cisco, Roku, Under Armour And More",CSCO
2018-07-09,5 Reasons Why Arista Is Now Piper Jaffray's No. 2 Networking Pick,CSCO
2018-07-09,Exclusive  Russia s telecoms security push hits snag   it needs foreign help,CSCO
2018-06-26,Disney Selects Cisco As Partner For Walt Disney Studios StudioLAB,CSCO
2018-06-20,"The Companies Celebrating, Lamenting Trump's Slackened Immigration Policy",CSCO
2018-06-19,Citi: F5 Networks Shares Fully Valued After Recent Rally,CSCO
2018-06-19,U S  congressional Republicans seek legislative fix to family separation crisis,CSCO
2018-06-19,"Cisco Earlier Reported Purchase Of July Systems, No Terms Disclosed",CSCO
2018-06-14,"AI, SOAR, Containers: Investors Predict What's Next For Cybersecurity",CSCO
2018-06-14,Cisco  CSCO  Down 2 6  Since Earnings Report  Can It Rebound ,CSCO
2018-06-12,Cisco CEO to Appear On CNBC's Mad Money with Jim Cramer Today 6pm ET,CSCO
2018-06-07,"Server Market Sizzles In Q1, Better Prospects Ahead In 2018",CSCO
2018-06-01,Stifel Raises AMD Price Target After Cisco Unveils EPYC-Powered Servers,CSCO
2018-06-01,AMD Shares Up 1.7% Premarket; Thursday AMD Announced Cisco As A Server Customer For 1st Time Ever,CSCO
2018-05-25,FBI warns Russians hacked hundreds of thousands of routers,CSCO
2018-05-23,U S  seeks to take control of infected routers from hackers,CSCO
2018-05-23,"Cybersecurity Stocks Appear Unaffected Amid Report Cisco, Other Cyber Firms Warned Of Hacking Campaign Which Infected 500K+ Routers In Ukraine, Dozens Of Other Nations",CSCO
2018-05-18,"Deere In Headlights: Earnings Miss, China Trade Talk Share Center Stage Friday",CSCO
2018-05-18,48 Biggest Movers From Yesterday,CSCO
2018-05-17,"Benzinga Pro's Top 10 Most-Searched Tickers For Afternoon Of Thurs., May 17, 2018",CSCO
2018-05-17,"10 Stocks To Watch For May 17, 2018",CSCO
2018-05-17,Baird still bullish on Cisco after  solid  Q3 report,CSCO
2018-05-17,What Wall Street Thinks Of Cisco's Q3 Earnings,CSCO
2018-05-17,Cisco Down Despite Upbeat Q3 Earnings,CSCO
2018-05-17,Intraday Examination  Cisco  Treasurys  S P  Nasdaq,CSCO
2018-05-17,Cisco Down On Earnings  Possible Double Top,CSCO
2018-05-17,"Take Advantage Of Cisco's Sell-Off, Baird Says",CSCO
2018-05-17,32 Stocks Moving In Thursday's Mid-Day Session,CSCO
2018-05-17,A Peek Into The Markets: US Stock Futures Down Ahead Of JC Penney Earnings,CSCO
2018-05-17,22 Stocks Moving In Thursday's Pre-Market Session,CSCO
2018-05-16,Cisco Systems Shares Down 4.3% After Hours Following Q3 Beat; Co. Issued In-Line Q4 EPS Guidance,CSCO
2018-05-16,Trade Desk  Scotts Miracle Gro And Cisco Systems Highlighted As Zacks Bull And Bear Of The Day ,CSCO
2018-05-16,5 Stocks Moving In Wednesday's After-Hours Session,CSCO
2018-05-16,Cisco  CSCO  Narrowly Beats Q3 Earnings   Revenue Estimates,CSCO
2018-05-16,Cisco s tepid forecast clouds quarterly beat  shares fall,CSCO
2018-05-16,Chart Of The Day  Is Cisco s  Earnings Downtrend  About To End ,CSCO
2018-05-16,"Earnings Scheduled For May 16, 2018",CSCO
2018-05-16,"8 Stocks To Watch For May 16, 2018",CSCO
2018-05-16,"Cisco Shares Fall ~0.5% Into Close, Mins. After Close Ahead Of Earnings Report; Not Yet Seeing Results Released",CSCO
2018-05-16,"Cisco Systems Q3 EPS $0.66 Beats $0.65 Estimate, Sales $12.46B Beat $12.43B Estimate",CSCO
2018-05-16,"Cisco Systems Sees Q4 EPS $0.68-0.70 vs $0.69 Est, Sales Growth 4-6%",CSCO
2018-05-15,Cisco To Report Q3 Earnings: What's In Store?,CSCO
2018-05-14,"The Week Ahead: Coindesk Conference, Walmart And Retailers Close Out Earnings Season",CSCO
2018-05-14,"Jim Cramer Shares His Thoughts On Xerox, Booking Holdings And More",CSCO
2018-05-12,"Juniper Networks Faces 'Ongoing' Business Pressures, Credit Suisse Says",CSCO
2018-05-10,"Benzinga's Top Upgrades, Downgrades For May 10, 2018",CSCO
2018-05-10,"Credit Suisse Initiates Coverage On Cisco Systems with Neutral Rating, Announces $41 Price Target",CSCO
2018-05-09,"Jim Cramer Gives His Opinion On Exxon Mobil, Pfizer And Cisco",CSCO
2018-05-07,Has Cisco Systems  CSCO  Outpaced Other Computer And Technology Stocks This Year ,CSCO
2018-05-03,"JP Morgan Initiates Coverage On Cisco Systems with Overweight Rating, Announces $57 Price Target",CSCO
2018-05-03,"Benzinga's Top Upgrades, Downgrades For May 3, 2018",CSCO
2018-05-01,Permira Funds to Acquire Cisco's Service Provider Video Software Solutions Business; Terms Not Disclosed,CSCO
2018-05-01,"Cisco Reports Purchase Of Accompany For $270M In Cash, Assumed Equity",CSCO
2018-04-30,Silicom beats by  0 03  misses on revenue,CSCO
2018-04-18,A Third Electric Vehicle ETF Charges Up,CSCO
2018-04-12,Cisco Names Former Adobe Systems CFO Mark Garrett To Board of Directors,CSCO
2018-04-07,Iran hit by global cyber attack that left U S  flag on screens,CSCO
2018-04-06,Vetr Crowd Downgrades Cisco,CSCO
2018-04-05,Vetr Crowd Upgrades Cisco Systems,CSCO
2018-04-04,"Cisco 1 Of 2 Bidders Which Offered Zscaler $2B, Zscaler Rebuffed Bids Before IPO",CSCO
2018-03-29,"Cisco Shares Tick Lower, Now At Session Low Down As Traders Circulate Article 'AT&T Develops Networking Switch, in Blow to Cisco'",CSCO
2018-03-28,"Cisco Names Gerri Elliott Chief Sales and Marketing Officer, Maria Martinez New Chief Customer Experience Officer",CSCO
2018-03-23,Cisco Shares Indicated Lower Despite Hearing Goldman Has Added Stock To America's Conviction List,CSCO
2018-03-23,"Nutanix Replaced By Cisco On Goldman Sachs' Conviction List, But Still A Buy",CSCO
2018-03-23,Benzinga Pro's 6 Stocks To Watch Today,CSCO
2018-03-23,"Goldman Removes Nutanix From Conviction Buy List, Adds Cisco Systems To Conviction Buy List",CSCO
2018-03-07,Cisco And Teradata Collaborate To Digitally Transform Cities,CSCO
2018-02-28,"Alibaba, Cisco, Intel: 'Fast Money' Picks For February 28",CSCO
2018-02-27,Cisco Issues Release Ahead Of Mobile World Congress Highlighting Signing Of Strategic Memorandum Of Understanding With Saudi Telecom Co. For Bringing 5G To Saudi Arabia,CSCO
2018-02-26,"Morgan Stanley Maintains Overweight on Cisco Systems, Raises Price Target to $50.00",CSCO
2018-02-26,7 Biggest Price Target Changes For Monday,CSCO
2018-02-26,Cisco's Partnership Spree Continues With Airtel And TIM Deals,CSCO
2018-02-21,Ubiquiti Plunges 25  On SEC Probe Into Business Practices,CSCO
2018-02-21,FTE Networks bags contract worth  27 5M,CSCO
2018-02-16,This Day In Market History: The Cisco Systems IPO,CSCO
2018-02-16,46 Biggest Movers From Yesterday,CSCO
2018-02-16,Tractors And Beverages: Deere And Coke Highlight Earnings Data As Weekend Nears,CSCO
2018-02-15,"BMO Capital Maintains Market Perform on Cisco Systems Inc, Raises price target to $43.00",CSCO
2018-02-15,"Goldman Sachs Technology and Internet Conference Concludes Today, Presenters Include Sabre, Cisco, Applied Materials, Visa, Snap and Cornerstone OnDemand",CSCO
2018-02-15,"Deutsche Bank Maintains Buy on Cisco Systems Inc, Raises price target to $55.00",CSCO
2018-02-15,22 Stocks Moving In Thursday's Pre-Market Session,CSCO
2018-02-15,"10 Stocks To Watch For February 15, 2018",CSCO
2018-02-15,Mid-Morning Market Update: Markets Open Higher; Cisco Profit Tops Estimates,CSCO
2018-02-15,Instant Replay? January Appears To Be Back On Wall Street Amid Fierce Rally,CSCO
2018-02-15,Stocks   U S  Futures Rise as Investors Shrug Off Inflation Data,CSCO
2018-02-15,KeyBanc Raises Cisco Price Target From $43 to $49 As The Co. Appears To Be Executing The Transition To A Recurring Software Model Driven By Strong Order Rates At Up 14% YoY,CSCO
2018-02-15,5 Biggest Price Target Changes For Thursday,CSCO
2018-02-15,40 Stocks Moving In Thursday's Mid-Day Session,CSCO
2018-02-15,Mid-Day Market Update: SolarEdge Technologies Gains Following Q4 Earnings Beat; Avid Bioservices Shares Slide,CSCO
2018-02-15,What Wall Street Is Saying About Cisco's Q2 Report,CSCO
2018-02-15,Mid-Afternoon Market Update: Build-A-Bear Surges On Upbeat Earnings; Inpixon Shares Drop,CSCO
2018-02-15,Cisco Pops On Earnings As New Rising Phase Starts,CSCO
2018-02-15,A Peek Into The Markets: U.S. Stock Futures Jump Ahead Of Economic Data,CSCO
2018-02-15,Benzinga Pro's 5 Stocks To Watch Today,CSCO
2018-02-14,Cisco Systems Q2 Earnings Preview,CSCO
2018-02-14,Earnings Preview: How Is Coca-Cola Battling 12 Years Of Falling Soda Sales?,CSCO
2018-02-14,"Cisco Reports Q2 Adj. EPS $0.63 vs $0.59 Est., Sales $11.9B vs $11.81B Est.",CSCO
2018-02-14,"Cisco Sees Q3 Adj. EPS $0.64-$0.66 vs $0.63 Est., Sales Growth 3-5% YoY",CSCO
2018-02-14,Cisco Raises Qtr. Dividend From $0.29 To $0.33/Share,CSCO
2018-02-14,Cisco Adds $25B To Buyback Plan,CSCO
