date,title,stock
2018-02-14,Mosaic network will reward researchers with its own cryptocurrency,GS
2018-02-14,U S  inflation test looms large  dollar pressured,GS
2018-02-13,Goldman Sachs betting big on Marcus,GS
2018-02-13,Twitter s CEO downplays chatter about possible acquisition,GS
2018-02-13,CEO  Twitter still too hard  he likes company  independence ,GS
2018-02-13,Investors await Goldman s  5 billion answers as trading picks up,GS
2018-02-13,Aussie Lifted Mildly By Business Confidence  Risk Sentiments Steady  ,GS
2018-02-13,VIX In Backwardation  Volatility ETFs In Focus,GS
2018-02-13,Oil Under Pressure As OPEC Raises Oil Supply Forecast for 2018,GS
2018-02-13,The Siren Song Of Gold Stocks,GS
2018-02-12,Goldman Finds Trump Deregulation Agenda Doing Little for Economy,GS
2018-02-12,Treasury Yields Will Climb to 3 5  on Fed  Goldman Asset Says,GS
2018-02-12,Farage warns  Brexit betrayal  would plunge UK into crisis,GS
2018-02-12,Watch These Financial Instruments For Equity Weakness,GS
2018-02-12,Oil gains 2 percent as global markets stabilize  dollar dips,GS
2018-02-12,Share buybacks could add fuel to Wall Street rebound,GS
2018-02-12,Global growth outlook seen intact as stock market rebounds,GS
2018-02-12,Rattled by U S  fiscal  monetary tug of war  investors start looking abroad,GS
2018-02-12,History suggests strong economy can ward off bear market,GS
2018-02-11,Market Correction A Hiccup Or Worse ,GS
2018-02-09,Goldman  GS  To Expand Online Lending Platform s Offerings,GS
2018-02-09,Take Five  World markets themes for the week ahead,GS
2018-02-08,Let s Trade This Volatility ,GS
2018-02-07,Fear Creeps Back Into Stocks  Shines Light On Gold,GS
2018-02-06,A Glimpse Of The Future ,GS
2018-02-06,Ripple s XRP is the biggest loser of the cryptocurrency bloodbath,GS
2018-02-06,Asian Shares Mostly Higher With Shanghai Bucking The Trend,GS
2018-02-05,Goldman Sees S P 500 Risks Going Either Way  Urges Options Hedge,GS
2018-02-05,Look For  Crypto  Effect In Nvidia s Earnings ,GS
2018-02-05,As Crude Oil Rallies  Wall Street Ups Outlook ,GS
2018-02-02,Can GGP Counter Impact Of Online Retail Boom In Q4 Earnings ,GS
2018-02-02,Citron takes aim at Nvidia  shares down 3 ,GS
2018-02-02,4 Utility Stocks Likely To Surpass Q4 Earnings Estimates,GS
2018-02-01,Deutsche Bank  DB  Incurs Net Loss In Q4  Revenues Down,GS
2018-02-01,Core Laboratories  CLB  Q4 Earnings   Revenues Meet Estimates,GS
2018-02-01,What s In The Store For Peabody Energy  BTU  In Q4 Earnings ,GS
2018-02-01,WestRock Rides On Acquisition  Corrugated Packaging Demand,GS
2018-02-01,Crude Oil Gains In Asia As Market Looks To US Rig Count,GS
2018-02-01,Anadarko Petroleum  APC  Q4 Earnings  Is A Beat In Store ,GS
2018-02-01,Puma  CANbridge Team Up To Commercialize Nerlynx In China,GS
2018-02-01,Goldman Sachs raises oil price forecasts on speedy market rebalancing,GS
2018-02-01,Weatherford  WFT  Q4 Loss Wider Than Expected,GS
2018-02-01,Essex Property  ESS  To Post Q4 Earnings  What s In Store ,GS
2018-02-01,Sprint  S  Betters Estimates In Q3 Earnings  Revenues Beat ,GS
2018-02-01,What s In The Cards For UDR Stock This Earnings Season ,GS
2018-02-01,Merck  MRK  Beats On Q4 Earnings  Lags Sales  Guides For  18,GS
2018-02-01,Is TransDigm  TDG  Poised For Another Earnings Beat In Q1 ,GS
2018-02-01,AstraZeneca  AZN  Beats On Q4 Earnings  Guides For 2018,GS
2018-02-01,General Motors   GM  Q4 Earnings  Is A Beat In The Cards ,GS
2018-02-01,Goldman loses more commodities traders in broader overhaul,GS
2018-02-01,Paycom  PAYC  To Report Q4 Earnings  What s In The Cards ,GS
2018-02-01,Why Earnings Season Could Be Great For Anadarko Petroleum  APC ,GS
2018-02-01,Sprint  S  Q3 Loss Betters Estimates  Revenues Beat,GS
2018-02-01,Nokia Corporation  NOK  Surges  Stock Moves 12 3  Higher,GS
2018-02-01,Gilead s  GILD  HCV Segment To Decline Further In Q4 Earnings ,GS
2018-02-01,Is The Predicted Stock Markets Fall A Correction Or End Of Bull Run  ,GS
2018-02-01,USG Beats Q4 Earnings Estimates  Raises Share Repurchase,GS
2018-02-01,Merck  MRK  Tops On Q4 Earnings  Misses Sales  Stock Up,GS
2018-02-01,LyondellBasell  LYB  Q4 Earnings  Sales Beat Estimates,GS
2018-02-01,Why Cabot Corp   CBT  Might Surprise This Earnings Season,GS
2018-02-01,Skyworks Solutions  SWKS  Jumps  Stock Rises 6 1 ,GS
2018-02-01,Why Earnings Season Could Be Great For General Motors  GM ,GS
2018-02-01,Why Earnings Season Could Be Great For AGCO Corp   AGCO ,GS
2018-02-01,Should You Buy Graphic Packaging  GPK  Ahead Of Earnings ,GS
2018-02-01,Why Centene Corporation  CNC  Might Surprise This Earnings Season,GS
2018-02-01,Phillips 66  PSX  Beats On Q4 Earnings ,GS
2018-02-01,Chevron  CVX  Q4 Earnings Jump  Helped By Rising Oil Price,GS
2018-02-01,Ferrari  RACE  Soars  Stock Adds 7 3  In Session,GS
2018-02-01,Should You Buy Arrow Electronics  ARW  Ahead Of Earnings ,GS
2018-02-01,Is A Surprise Coming For Gartner  IT  This Earnings Season ,GS
2018-02-01,Should You Buy HealthEquity  HQY  Ahead Of Earnings ,GS
2018-02-01,Is Surprise Coming For Haemonetics  HAE  This Earnings Season ,GS
2018-02-01,Open Text Corporation  OTEX  Jumps  Stock Rises 12 6 ,GS
2018-01-31,Another head rolls in Goldman s commodity unit,GS
2018-01-31,DXY  Hammered Again By Trump  Is FOMC Next ,GS
2018-01-31,Top Goldman executive says women still not adequately represented in its workforce,GS
2018-01-30,ETFs To Watch If U S  Pulls Out Of NAFTA,GS
2018-01-29,Risk Assets in Danger Zone as Bull Feeding Time Is a Frenzy,GS
2018-01-29,DriveNow deal paves way for BMW Daimler alliance   source,GS
2018-01-29,ECB Meeting Puts These Euro ETFs In Focus,GS
2018-01-29,Dogged by Brexit  Britain stumbles in race to woo China,GS
2018-01-29,JPMorgan promotes Pinto and Smith  fueling race to succeed Dimon,GS
2018-01-29,Forex   Dollar Holds Flat After Japan Data Sets As Attention Turns To Fed,GS
2018-01-29,Forex  Dollar Gains Further On Yen In Asia As Focus Turns To Fed,GS
2018-01-29,Gold Slips In Asia In Cautious Trade Ahead OF Fed Meeting Start,GS
2018-01-28,India likely to put pedal to metal on asset sales,GS
2018-01-28,With elections coming up  India s government will aim to woo rural voters in budget,GS
2018-01-26,Goldman  Barclays  SocGen interested in Commerzbank unit  Handelsblatt,GS
2018-01-26,  Amid Selloff  Bearish Chorus on Cryptocurrencies Grows Louder ,GS
2018-01-26,Copper Deals Off to Best Start in 12 Years as Prices Surge,GS
2018-01-26,Hedge Fund Sees  Significant Correction  in Emerging Markets,GS
2018-01-25,Exclusive  Commodities fund Jamison Capital to shut   source,GS
2018-01-25,Blankfein  Days of 30  ROE are over  but 15  doable,GS
2018-01-25,A Tale Of Two Currencies And The ETF Impact ,GS
2018-01-25,Easton Pharma inks distribution deal with Bayer Consumer Health for VS Sense in Mexico,GS
2018-01-24,Scaramucci hits pause button on Las Vegas hedge fund party,GS
2018-01-24,Bitcoin ETF Hype Meets Regulator Reality in Race to Be First,GS
2018-01-23,Goldman Sachs Outlook A Relief to Cryptocurrency Investors,GS
2018-01-23,Online lender SoFi nabs Twitter executive Noto as CEO,GS
2018-01-23,Trust in Latin America s growth outlook strengthens  poll,GS
2018-01-23,Palo Alto Networks  3 5  as Deutsche Bank sees growth ahead,GS
2018-01-22,European shares trade sideways  focus on MA,GS
2018-01-22,Goldman Sachs sees Ambev as Latin American outperformer,GS
2018-01-22,UK economy will cope with Brexit hit as global economy grows  O Neill,GS
2018-01-21,Groupon  GRPN  Looks Good  Stock Adds 9  In Session,GS
2018-01-18,Aramco CEO Says Ready for IPO as Listing Venues Up in Air,GS
2018-01-18,Morgan Stanley raises targets  but Wall Street wants more,GS
2018-01-18,Chart Of The Day  It May Be Time To Buy Goldman s Dip,GS
2018-01-18,Adtran tumbles 11 7  as CenturyLink pause spurs target cuts,GS
2018-01-18,Nokia  2 4  as Goldman cuts to Neutral,GS
2018-01-18,Home security company ADT Inc s IPO priced at  14 per share,GS
2018-01-18,Apollo owned security firm ADT s IPO prices below target,GS
2018-01-17,Goldman Sachs downgrades Shutterfly with 13  downside,GS
2018-01-17,Goldman Sachs Beats Consensus After Excluding Tax Charge  Shares Dip,GS
2018-01-17,Goldman Sachs beats by  0 76  beats on revenue,GS
2018-01-16,iFOREX Daily Analysis   January 16 2018,GS
2018-01-16,Warning light  Mexican car sales slump ahead of election,GS
2018-01-16,Goldman s Commodity Revenue Said to Drop 75  to Lowest on Record,GS
2018-01-16,Goldman to post historic tumble in commodity revenue,GS
2018-01-15,Xiaomi taps CLSA  Morgan Stanley  Goldman for IPO sponsor role  sources,GS
2018-01-12,Goldman thwarts fraud class action tied to Abacus CDO  U S  appeals court,GS
2018-01-12,Macroeconomic Outlook For 2018 and Gold,GS
2018-01-12,Ethereum Eyes Test of All Time Highs as Rivals Struggle To Pare Losses,GS
2018-01-11,S P cuts Brazil debt rating as pension reform doubts grow,GS
2018-01-11,iFOREX Daily Analysis   January 11 2018,GS
2018-01-11,HSBC revamping Asia Pacific business,GS
2018-01-11,Dropbox files confidentially for U S  IPO  source,GS
2018-01-11,Crude Oil Dips In Asia Despite Strong China Data on Oil Imports,GS
2018-01-10,Exclusive  Saudi Aramco working to raise cheap loans before IPO   banking sources,GS
2018-01-10,China s U S  bond rebalancing would hold few fears for Fed,GS
2018-01-10,Citi says crude oil could hit  80 amid geopolitical wildcards,GS
2018-01-10,Crude Advances to Highest Since 2014 as World s Surplus Shrivels,GS
2018-01-10,Oceaneering wins Johan Castberg contract,GS
2018-01-10,Crude Oil Mixed In Asia With Iran Economic Sanctions Waivers In Focus,GS
2018-01-10,British PM May to meet finance bosses on Brexit,GS
2018-01-10,Real estate investing startup Cadre partners with Goldman Sachs,GS
2018-01-09,GOLDMAN SACHS  2 areas of tax reform could throw investors for a loop this earnings season,GS
2018-01-09,Mexico inflation at 16 1 2 year high  seen pressuring central bank,GS
2018-01-09,Who will lead Britain s central bank after Brexit ,GS
2018-01-09,Goldman  Another weak year for the dollar,GS
2018-01-08,Exclusive  Bankers invited to Saudi Arabia to pitch for Aramco listing roles,GS
2018-01-08,Goldman  Citi Said to Be in Lead for Top Roles in Aramco IPO,GS
2018-01-08,3 Sector ETFs For 2018,GS
2018-01-07,Former WTO  Goldman and BP chief Peter Sutherland dies at 71,GS
2018-01-05,Morgan Stanley to take  1 25 billion hit in fourth quarter from tax bill,GS
2018-01-05,Investors sense opportunities in Big Oil   but mind the gap,GS
2018-01-04,Global private equity funds raise record  453 billion in 2017  Preqin,GS
2018-01-04,JPMorgan  Goldman Sachs come top of banker pay league in Britain,GS
2018-01-04,Symphony chat platform faces outage due to unplanned maintenance,GS
2018-01-04,Apollo Global Partners With Varde To Buy Stake In OneMain,GS
2018-01-03,U K  Said to Think Barnier Bluffing on No Brexit Deal for Banks,GS
2018-01-02,The Zacks Analyst Blog Highlights  Cambria Value And Momentum  PowerShares S P 500 Value With Momentum  Schwab 1000 Index  IQ Chaikin U S  Large Cap And CurrencyShares Euro,GS
2018-01-02,8 ETF Predictions For 2018,GS
2018-01-02,Forex   Aussie Down In Asia  Dollar Up As Geopolitical Tensions Worry,GS
2018-01-02,Forex   Aussie Gains In Asia On Upbeat Views Of China Growth,GS
2018-01-02,PG E drops after downgrades  Goldman warns fire claims could take years,GS
2018-01-01,Australia s Brambles estimates one time benefit from U S  tax reform,GS
2018-01-01,Goldman Sachs Sees Economy Stregthening in 2018  Warns About Crypto  Credit ,GS
2017-12-29,After A Stellar 2017  Will Euro ETFs Beat Greenback In 2018 ,GS
2017-12-28,Goldman Sachs picks Dublin for asset management unit post Brexit  source,GS
2017-12-28,Japan s Nomura poised to start China retail brokerage business  CEO,GS
2017-12-28,Bond bosses  best trades for 2018,GS
2017-12-26,Ex Kit Digital CEO  associate convicted in U S  of fraud schemes,GS
2017-12-26,3 Zacks Rank  1 Large Cap Value Mutual Funds To Buy,GS
2017-12-26,GS Looks Capped Here,GS
2017-12-25,Treasury Secretary Mnuchin was sent gift wrapped box of horse manure  reports,GS
2017-12-23,Bitcoin Climbs  Finding Floor After Worst Selloff Since 2015,GS
2017-12-23,Goldman Sees Rate Hikes Ahead as Slack Wrung Out of Labor Market,GS
2017-12-22,Bitcoin Plunges as  Sharks  Circle in Key Test of Cryptocurrency,GS
2017-12-22,Bitcoin Fights Back From  13 000 as Selloff Enters Fourth Day,GS
2017-12-22,Is EU Ahead Of A Political Storm  ,GS
2017-12-22,Bitcoin Tumbles Through  13 000 as  Sharks Start to Circle ,GS
2017-12-22,Goldman bearish on U S  Treasuries market in 2018,GS
2017-12-21,Central Bank To Directly Control Investment Banks In EU,GS
2017-12-21,Goldman Sachs to set up cryptocurrency trading desk  Bloomberg,GS
2017-12-21,Goldman putting together crypto trading desk   Bloomberg,GS
2017-12-21,iFOREX Daily Analysis   December 21 2017,GS
2017-12-21,Global demand may cut short OPEC cuts  Goldman says ,GS
2017-12-20,Crude Rises Near  58 as U S  Storage Tumbles  Exports Surge,GS
2017-12-20,Think This Is The Longest Bull Market Ever  Not Yet ,GS
2017-12-20,Bank of England to spare EU banks from costly rules  if Brexit goes well,GS
2017-12-19,Fed s Dots Have Lost the Plot as Economists Puzzle Over Outlook,GS
2017-12-19,U S  Bancorp declares  0 30 dividend,GS
2017-12-19,Fiat On Fire  Key Investor Tactics,GS
2017-12-18,German Vonovia climbs property ladder with  6 1 billion Buwog deal,GS
2017-12-18,Casino operator Penn National to buy Pinnacle in  2 8 billion deal,GS
2017-12-16,Zuma calls for party unity as ANC meets to elect new leader,GS
2017-12-15,Steinhoff s ex chairman Wiese calls off  2 6 billion Shoprite deal,GS
2017-12-15,Unilever to sell spreads business to KKR for  8 billion,GS
2017-12-15,iFOREX Daily Analysis   December 15 2017,GS
2017-12-14,Oil Peeks Above  57 a Barrel Amid Conflicting Signals on Glut,GS
2017-12-13,Bitcoin Frenzy is Not Taking Demand from Gold  Goldman Sachs Says ,GS
2017-12-13,DoubleLine s Gundlach says investors should add commodities in portfolios  CNBC,GS
2017-12-12,The Hot Spots That Defined a Year of Emerging Market Ebullience,GS
2017-12-12,Goldman Sachs to have Labour over for tea as City seeks warmer ties,GS
2017-12-12,Follow Goldman To Invest In Commodity ETFs For 2018,GS
2017-12-12,Is Bitcoin Stealing Gold s Luster   ,GS
2017-12-12,Bitcoin euphoria puts other retail bets in shade,GS
2017-12-12,Bitcoin Frenzy Poses No Threat to Bullion  Goldman Sachs Says,GS
2017-12-11,Brent Reaches Highest Since 2015 After Forties Pipeline Shutdown,GS
2017-12-11,U S  Treasury tax study slammed as  fake math  by Democrats,GS
2017-12-11,Here s Why Bluebird Bio  BLUE  Stock Skyrocketed Today,GS
2017-12-11,Inmarsat tumbles as Goldman cuts expectations until late 2018,GS
2017-12-11,Uber s London license appeal to be heard next year,GS
2017-12-08,iFOREX Daily Analysis   December 08 2017,GS
2017-12-08,Is Bitcoin The Paris Hilton Of The Currency World ,GS
2017-12-08,Exclusive  Contenders emerge for No 2 Fed job  search to narrow,GS
2017-12-08,Steinhoff shares climb off 14 year low in volatile trade,GS
2017-12-07,The Risk If Central Banks Get Trigger Happy in 2018  Daniel Moss,GS
2017-12-07,Goldman Sachs to clear bitcoin futures  spokeswoman,GS
2017-12-06,Tronox to fight FTC lawsuit  JPM sees standalone value at  16 without Cristal,GS
2017-12-06, We May Be Stupid  For Waiting On Bitcoin Futures  NYSE Chairman Says ,GS
2017-12-06,BGC Partners Wows Investors With New IPO Roadshow,GS
2017-12-06,Chemours  4 7  after Goldman downgrade,GS
2017-12-06,Bitcoin Party On Wall Street ,GS
2017-12-05,Goldman Sachs  Standard Chartered eye 750 new jobs in Poland,GS
2017-12-05,Fears over Rising U S  Wealth Inequality Take Shine off Tax Bill ,GS
2017-12-05,Senate Passage Of Tax Bill Sends The Dow And S p To New All time Highs   Sell,GS
2017-12-05,Crude Oil Mostly Steady In Asia After API Estimates  Risks Monitored,GS
2017-12-05,Oil Climbs as OPEC Tightening Dovetails With U S  Supply Drop,GS
2017-12-05,Top Investing Areas Of 2017   Their Top ETFs ,GS
2017-12-04,Democrat cites drafting error in proposed capital rule amendment,GS
2017-12-04,Crude Oil Prices Settle Lower  Focus Shifts to US Output,GS
2017-12-04,Dollar Higher On Senate Tax Bill Passage  Cautious Ahead Of Busy Week  ,GS
2017-12-04,Singapore Stocks To Watch,GS
2017-12-03,Forex   Dollar Gains Further On Yen With Senate Tax Cut Effort  US Politics Eyed,GS
2017-12-03,Asian Shares Gain With Hang Seng Up Smartly As US Tax Cuts Get Nearer,GS
2017-12-01,Crude Oil Prices Settle Higher  Traders Expected Inventory Drawdowns to Continue,GS
2017-12-01,Wall Street hiking corporate profit forecasts on tax cut expectations,GS
2017-11-30,Goldman eschews bitcoin but wants to help clients crypto trade,GS
2017-11-30,Post Harvest News  Ethanol Mandate Ahead,GS
2017-11-30,Blankfein Says Too Soon for Bitcoin Plan as Volatility Jumps,GS
2017-11-30,Financials help European shares shrug off tech tumble  OPEC anticipation,GS
2017-11-30,Hedge fund Hutchin Hill shuts down after three bad years,GS
2017-11-29,Dow Rallies  More Upside For ETFs ,GS
2017-11-29,Tech Stocks Rout Deepens in Asia as Rally Pauses  Markets Wrap,GS
2017-11-29,Exclusive  Goldman strengthens Italy foothold with bigger Milan office   sources,GS
2017-11-29,Oil Pulled Lower as  Done Deal  Proves Elusive on Supply Cuts,GS
2017-11-29,S P 500 Futures  Monday After Thanksgiving Keeps Giving,GS
2017-11-28,Crude Wavers Amid Russia s Shaky Stance on OPEC Deal Extension,GS
2017-11-28,Crude Oil Down In Asia On API Estimates  All Eyes On OPEC,GS
2017-11-28,Uber signs first Southeast Asian e wallet deal with Vietnam s MoMo,GS
2017-11-28,Goldman Sachs among bidders for Scotiabank s metals unit  sources,GS
2017-11-28,OPEC meeting outcome  more uncertain than usual    Goldman Sachs,GS
2017-11-27,Goldman calls outcome of upcoming OPEC meeting uncertain,GS
2017-11-26,Market Cycles Point Toward A Down Week For Stocks,GS
2017-11-24,JP Morgan  eyeing Brexit  rents more space in Frankfurt  source,GS
2017-11-24,Longest S P 500 Rally Ever  It s Wall Street s Official Forecast,GS
2017-11-24,Mexico economy shrinks for first time in nearly two years,GS
2017-11-24,U K  Labour Consults  57 Billion Hedge Fund Shorting Pound,GS
2017-11-23,Senior HSBC investment banker Westerman leaves after two years,GS
2017-11-23,Early November inflation spikes as Mexico central bank chief packs bags,GS
2017-11-22,GOLDMAN SACHS  Here s how to make a killing in the market this Black Friday,GS
2017-11-22,S P 500 To Hit 2800 In 2018  Play These ETFs,GS
2017-11-22,World stocks ride tech boom to scale new highs in pre Thanksgiving rally,GS
2017-11-22,Gold Fund Catches Bitcoin Fever as Crypto Bulls See  10 000,GS
2017-11-22,Bitcoin Will End the Year at  10 000 says Mike Novogratz ,GS
2017-11-21,Crowds to crowdfunding  Soccer ace targets fans  hearts and wallets,GS
2017-11-21,Indonesia court rules against Goldman in Hanson share ownership dispute,GS
2017-11-21,Follow Goldman With These ETFs For 2018,GS
2017-11-21,Paris watchdog win bolsters its fight for Brexit banks,GS
2017-11-21,One Country  Two Systems Roils China s Mills as Curbs Bite,GS
2017-11-20,Daily Currency Outlook  EUR JPY   November 20 2017,GS
2017-11-20,Prospect of post Brexit boom sparks worry as well as celebration in Frankfurt,GS
2017-11-20,Bitcoin  Blockchain Not Yet Investible  Canada Pension Says,GS
2017-11-20,Goldman to have two EU hubs post Brexit  Frankfurt and Paris  report,GS
2017-11-19,Goldman Sachs sees Fed raising rates four times in 2018,GS
2017-11-19,Former Obama administration official in bid for The Weinstein Co,GS
2017-11-17,How Morgan Stanley Outdid Goldman in Old Commodities Rivalry,GS
2017-11-17,Yield Curve To Completely Flatten In 2018  But How ,GS
2017-11-17,Goldman wins dismissal of lawsuit in U S  over ties to Malaysia leader,GS
2017-11-17,Global banks flag concerns over U S  Senate tax proposal,GS
2017-11-16,Goldman s Top Trades for 2018  Doubling Down on Global Economy,GS
2017-11-16,Goldman CEO Blankfein calls for second vote on Brexit,GS
2017-11-16,China Warning Wipes  6 6 Billion From Top Stock Loved by Goldman,GS
2017-11-15,Greece announces debt swap to bundle 30 billion euro notes into new benchmarks,GS
2017-11-15,Cash rich companies are dominating right now   and that s terrible news for the market,GS
2017-11-15,Like It or Not  You Will Soon Have Steven Mnuchin s Autograph,GS
2017-11-15,Commodities Back In Favor With Investors ,GS
2017-11-14,Is The Window Closing On A Good Brexit Deal For The UK ,GS
2017-11-13,Goldman Sachs Says Central Banks Mostly Avoid Confusing Markets,GS
2017-11-12,Wall Street bonuses may jump 10 percent this year  report,GS
2017-11-10,Junk Bond Rout Snowballed After Wall Street Called Late Cycle,GS
2017-11-10,Sinking feeling  Asian floating oil storage declines as crude market tightens,GS
2017-11-10,Oil markets creep higher on supply pact expectations,GS
2017-11-10,Uber loses UK appeal bid to overturn workers  rights decision,GS
2017-11-09,Sky high stock market has investors looking to commodities,GS
2017-11-08,Goldman promotes 509 people to managing director,GS
2017-11-08,CIC  Goldman Sachs establish China U S  industrial cooperation fund  U S  State depart,GS
2017-11-08,iFOREX Daily Analysis   November 08 2017,GS
2017-11-08,Copper Traders Place Huge Way Out Of The Money Calls That Price Will Rise 50  ,GS
2017-11-08,Banking stocks  dollar hit by U S  doubts,GS
2017-11-08,Goldman Sachs leads  10 million investment round in data startup Crux,GS
2017-11-07,Top Performing Leveraged ETFs In First Year Of Trump s Win,GS
2017-11-07,BP joins Shell in helping Mexico execute oil hedge  sources,GS
2017-11-07,5 Economic Change Agents Investors Need To Know About Now,GS
2017-11-06,Goldman Sachs  China s CIC to launch up to  5 billion fund  sources,GS
2017-11-06,Dudley to Leave Fed in Mid 2018 Amid Leadership Overhaul,GS
2017-11-06,Goldman teaming with China s CIC for  5B U S  investment fund   WSJ,GS
2017-11-06,Commodities Lead Markets For Second Week In A Row,GS
2017-11-06,Dudley s exit hangs another question over Fed leadership,GS
2017-11-06,Why You Should Add Goldman  GS  Stock To Your Basket Now ,GS
2017-11-06,Goldman Analysis Finds It Won t Be Just the Fed Hiking Next Year,GS
2017-11-05,Dudley to retire early as Fed overhaul gains steam,GS
2017-11-03,Under Powell  Wall Street Expects Steady Wins on Regulation,GS
2017-11-03,Singapore police examine Goldman s role in 1MDB deals  Bloomberg,GS
2017-11-02,Powell To Lead Fed  Best ETF Strategies,GS
2017-11-02,Goldman Sachs BDC declares  0 45 dividend,GS
2017-11-02,UK city Brighton renews Uber license for six months as it monitors London dispute,GS
2017-11-02,Core Molding declares  0 05 dividend,GS
2017-11-02,Goldman jokes  takes  bites  out of pizza to attract borrowers,GS
2017-11-02,Oil edges up to near two year highs as market tightens,GS
2017-11-01,The Next Chair Of The Fed And Gold ,GS
2017-11-01,Goldman raises U S  Oct  payrolls forecast to  340 000,GS
2017-10-31,Gold Stock ETFs  New Kid On Block,GS
2017-10-31,The  mother of all causes  for the record setting stock market is also everyone s biggest fear,GS
2017-10-31,Mexico economy likely shrank for first time in four years after quakes,GS
2017-10-31,Clariant CEO calls independent review  premature  amid shareholder row,GS
2017-10-31,2018 to be big year for bank stocks   Morgan Stanley,GS
2017-10-31,Oil Delivers Best October Since 2011 as OPEC Strategy Pays Off,GS
2017-10-30,Your Evening Briefing  Manafort  Blankfein  Catalonia  Croissants,GS
2017-10-30,Goldman CEO has high hopes for London HQ post Brexit  much outside his control,GS
2017-10-27,Activist investors scupper  20 billion Clariant Huntsman merger,GS
2017-10-26,Saudi investment ambitions impress but foreign money may be slow to come,GS
2017-10-25,Goldman plans private equity expansion to help offset trading funk,GS
2017-10-25,Retailer National Vision prices IPO above range at  22,GS
2017-10-25,Trump Is Said to Decide Against Adviser Cohn for Fed Chair,GS
2017-10-25,SCHUMER  It seems Steve Mnuchin is  deliberately lying  about the tax plan to  suck up to Trump ,GS
2017-10-25,Shutterfly drops after earnings  analyst comments  shares down nearly 8 ,GS
2017-10-24,AT T preview  Focus on video subs  Time Warner deal,GS
2017-10-24,Delphi to buy self driving tech startup nuTonomy for  450 million,GS
2017-10-24,At least three buyout groups seen advancing in Unilever spreads auction  sources,GS
2017-10-23,Firms not bluffing when they threaten to shift away from London  mayor,GS
2017-10-23,Goldman Sachs Warns  Peak Growth  May Spell Pain for U S  Stocks,GS
2017-10-23,In Japan s Record Stock Rally  the BOJ Is Sitting on Its Hands,GS
2017-10-23,New Jersey s Murphy echoes Sanders in Democratic bid for governor,GS
2017-10-22,Stock market s future in Trump s hands as Federal Reserve chair pick looms,GS
2017-10-20,Trump Fed Finalists Should Clear Senate  With a Bit of Drama,GS
2017-10-20,As Robots Invade Wall Street  Slow Footed Regulators Lose Ground,GS
2017-10-19,Goldman Sachs CEO Lloyd Blankfein trolls the UK on Twitter,GS
2017-10-19,The Case For 5 000 Gold,GS
2017-10-19,Blankfein visits Frankfurt,GS
2017-10-18,Factbox  Who will Trump pick to lead the Federal Reserve ,GS
2017-10-18,Special Report  Backroom battle imperils  230 million cryptocurrency venture,GS
2017-10-18,Oil prices rise on tighter U S  market  Middle East tensions,GS
2017-10-18,Nikkei 225 Edges Up In Asia With Shanghai Also Ahead As Party Meets,GS
2017-10-18,S P Marks New Record High As USD Remains Strong   Oil Inventories Watched ,GS
2017-10-17,U S  dollar up  yield curve flat  on inflation  stocks rise,GS
2017-10-17,Oil Continues To Climb As Iraq kurdistan Tensions Escalate ,GS
2017-10-17,Australia hires ex Goldman banker to head corporate watchdog,GS
2017-10-17,BOE Hawks Dominate As UK Inflation Hits 3 ,GS
2017-10-17,Opening Bell  Global Growth Prospects Spur Dollar  Metals  Stocks,GS
2017-10-17,Goldman And Morgan Stanley Round Out Big Bank Reporting Today ,GS
