date,title,stock
2016-12-19,Black swans and bonanzas  Market tips  bold calls and eyecatchers for 2017,GS
2016-12-19,West Texas Crude settles lower on Bakken news,GS
2016-12-19,Trump nominates trading firm founder Viola as Army secretary,GS
2016-12-16,Hopes rise that high risk lending curbs will ease under Trump,GS
2016-12-16,Goldman reshuffles research leadership ahead of new rule,GS
2016-12-16,Oil rises on signs of producers  compliance with output cuts,GS
2016-12-16,Exclusive  Foreign banks in Britain pay fraction of tax rate,GS
2016-12-15,Wall St higher after Fed tightening as banks benefit ,GS
2016-12-15,Goldman says newly promoted COOs and CFO to get same base salary,GS
2016-12-14,Goldman names Solomon  Schwartz as Cohn s successors,GS
2016-12-14,Top 5 Things to Know In the Market on Wednesday,GS
2016-12-14,Top 5 things to watch today ,GS
2016-12-13,Oil s Pumping Deficit,GS
2016-12-13,Australia s  1 57 trillion pension funds work to cut out the middleman,GS
2016-12-13,Goldman Sachs expected to name Solomon  Schwartz as Cohn successors  WSJ,GS
2016-12-13,Twitter As A Trump Trade,GS
2016-12-12,Trump puts Goldman Sachs in spotlight  for better or worse,GS
2016-12-12,Goldman Sachs  No  2 exec will get a big payout if he joins Trump s administration,GS
2016-12-12,Goldman s Cohn to accept key economic post  CNBC,GS
2016-12-12,Trump taps Goldman Sachs executive Cohn for key economic post,GS
2016-12-12,Oil output cut deal aimed at inventories  not just raising prices  Goldman Sachs,GS
2016-12-12,Oil hits highest since mid 2015 as global producers agree to cut,GS
2016-12-12,Lower Taxes  Higher Yields Should Boost S P 500 Earnings ,GS
2016-12-09,Trump to name Goldman executive Cohn to key economic post,GS
2016-12-09,What Lies Ahead For India ETFs ,GS
2016-12-08,OPEC s oil manipulation may be over,GS
2016-12-08,3M to sell identity management business to Gemalto,GS
2016-12-08,Trump World Corporate Taxes  Unclear Benefits  Many Questions,GS
2016-12-08,Treasury nominee Mnuchin retains strong ties to Goldman ,GS
2016-12-08,Poll  OPEC deal will pack little punch in raising oil prices,GS
2016-12-08,Wall St mixed after DJI hits new record high ,GS
2016-12-07,Regions Revises 2016 Outlook  Aims  400M Cost Cut By 2019,GS
2016-12-07,Black swans and bonanzas  Market tips  bold calls and eyecatchers for 2017,GS
2016-12-07,Payments start up Circle moves away from bitcoin business,GS
2016-12-06,KKR to buy majority stake in cybersecurity firm Optiv from Blackstone,GS
2016-12-06,Shenzhen Connect Opens Up  New China  To Foreign Investors,GS
2016-12-06,Blackstone s Schwarzman sees historic regulatory overhaul from Trump,GS
2016-12-05,Markets close higher on Monday,GS
2016-12-05,DJI hits fresh record high led by banks  energy stocks ,GS
2016-12-05,U S  makes new arrest in fraud probe of bankrupt video tech firm,GS
2016-12-05,Barclays  exit from energy trading stirs concerns over liquidity,GS
2016-12-05,Former hedge fund exec s Empire Report keeps tabs on New York,GS
2016-12-05,Morgan Stanley s commodities head swaps swagger for small and smart,GS
2016-12-02,Singapore slaps penalties on StanChart  Coutts in 1MDB related probe,GS
2016-12-01,Trump warns of consequences for U S  firms sending jobs abroad,GS
2016-12-01,Fed may face unnerving shake up under Trump administration,GS
2016-12-01,Trump considering Goldman Sachs COO Cohn for energy secretary  Fox Business Network,GS
2016-12-01,Trump considering Senator Heitkamp of North Dakota for Cabinet  source,GS
2016-12-01,Energy shares close higher on Wall Street,GS
2016-12-01,Questions resurface about who would succeed longtime Goldman CEO,GS
2016-12-01,Separation anxiety  Trump s management style poses challenges in Oval Office,GS
2016-12-01,Quick Guide To Goldman Sachs Income Builder A Fund  GSBFX ,GS
2016-11-30,Trump says will back away from business to focus on White House,GS
2016-11-30,Goldman s Cohn eyed for top Trump budget post  transition official,GS
2016-11-30,Energy stocks surge on OPEC news,GS
2016-11-30,Trump s Treasury pick targets taxes  trade reforms  media,GS
2016-11-30,Oil jumps 8 percent on prospects for big OPEC output cut,GS
2016-11-30,Plaza memories may unnerve Trump fueled dollar bulls,GS
2016-11-30,U S  should cede control of Fannie and Freddie  Mnuchin,GS
2016-11-30,Goldman shares hit highest level since financial crisis in post election rally,GS
2016-11-30,OPEC in first joint oil cut with Russia since 2001  Saudis take  big hit ,GS
2016-11-30,OPEC Finally Cuts Output  Energy Stocks   ETFs Up 10  Or More,GS
2016-11-30,Are Hedge Fund ETFs Good Bets For Only Uncertain Times ,GS
2016-11-30,Buyback ETFs  Trump Beneficiary Or Overhyped Bets ,GS
2016-11-29,Poll shows voters wary of GOP foes being picked for Trump s cabinet,GS
2016-11-29,Forget Growth  Buy These Value ETFs Instead,GS
2016-11-29,Iran  Iraq at loggerheads with Saudis ahead of OPEC meeting,GS
2016-11-29,Shares in Asia mixed as investors wait anxiously on OPEC meeting,GS
2016-11-29,Trump expected to name former Goldman banker Mnuchin for Treasury  source,GS
2016-11-29,Short Goldman Sachs Stock At  212 50,GS
2016-11-28,Oil prices gyrate as OPEC heavyweights head to Vienna,GS
2016-11-28,Will Goldman Sachs  GS  Crush Estimates At Its Next Earnings Report  ,GS
2016-11-27,Should You Buy Or Sell Oil ETFs Ahead Of The OPEC Meet ,GS
2016-11-24,Is Goldman Sachs Income Builder C Fund  GSBCX  Worth Another Look ,GS
2016-11-24,Trump s tax holiday to make American financial engineering great again  James Saft,GS
2016-11-24,Will Goldman Sachs Group  GS  Continue To Surge Higher ,GS
2016-11-23,After Barroso row  Juncker proposes tighter EU ethics rules,GS
2016-11-23,Black Friday could shine light on troubled U S  retail loans,GS
2016-11-23,An Historic Market Rally ,GS
2016-11-22,The Zacks Analyst Blog Highlights  McDermott International  Ultra Petroleum  Ocean Rig UDW  Transmontaigne Partners And Cypress Energy Partners ,GS
2016-11-22,ETF Winners   Losers As Dollar Hits 13 Year High,GS
2016-11-22,Welcome To The  Melt Up ,GS
2016-11-21,WisdomTree Invests  20M In AdvisorEngine To Expedite B2B,GS
2016-11-21,4 Asian Stocks To Buy On Encouraging Economic Data,GS
2016-11-21,5 Oil Stocks To Buy As Output Cut Hopes Rise,GS
2016-11-21,Citi becomes first U S  bank supervised by ECB since Brexit vote,GS
2016-11-20,S P 500 Rallies  But No New High  USB Continues Its Decline,GS
2016-11-18,Cybersecurity company Optiv files for IPO,GS
2016-11-18,Goldman upgraded at Macquarie  Citi cut,GS
2016-11-18,Buy Goldman on  New World Order    Macquarie,GS
2016-11-17,JPMorgan  JPM  To Pay  264M Fine For China Hiring Scandal,GS
2016-11-17,Kashkari hopes Twitter presence will help demystify Fed,GS
2016-11-17,JPMorgan to pay  264 million to resolve China hiring probe  SEC  DoJ,GS
2016-11-17,iFOREX Daily Analysis   November 17  2016,GS
2016-11-17,Trump Treasury candidate s bank accused of discrimination,GS
2016-11-17,Is The Treasury Bond ETF Rally About To End ,GS
2016-11-16,Ex Goldman director Gupta seeks reversal in insider trading case,GS
2016-11-16,JPMorgan CEO Dimon may be headed to U S  Treasury,GS
2016-11-16,Goldman makes Juniper Conviction Buy on Switching sales momentum,GS
2016-11-15,Credit Suisse hires banker in China onshore private banking push  memo,GS
2016-11-15,Federal Reserve says will be more open about  stress tests   GAO report,GS
2016-11-14,Can This Rally Continue ,GS
2016-11-13, The Only Market Winners Of This Presidential Election Are   ,GS
2016-11-11,LifeLock  13   go private talks reported  updated ,GS
2016-11-11,Dollar heads for best week in a year  Mexican peso sinks,GS
2016-11-10,There s a new Goldman Sachs partner class,GS
2016-11-10,Vexation gives way to pragmatism as Wall Street girds for Trump,GS
2016-11-10,Goldman considers Frankfurt move over Brexit,GS
2016-11-10,Goldman CEO Blankfein says Trump s plans may be good for economic growth,GS
2016-11-10,ECB review of capital models will aid euro zone wooing of London banks,GS
2016-11-10,Oil prices steady as markets recover from Trump shock,GS
2016-11-10,Trump outreach to Dimon for Treasury job may fall on deaf ears,GS
2016-11-10,iFOREX Daily Analysis   November 10  2016,GS
2016-11-10,What Investors Can Expect From Trump Revolution,GS
2016-11-10,Investors  economists brace for new dangerous game  parsing Trump s words,GS
2016-11-09,Why You Should Bet On Raymond James   RJF  Growth Potential,GS
2016-11-09,Exclusive  Goldman Sachs considers Frankfurt move over Brexit   sources,GS
2016-11-08,Banks warn clients to brace for FX volatility after U S  vote,GS
2016-11-08,Citigroup rings the register on trio of banks ahead of election,GS
2016-11-07,U S  telecom firm Windstream to buy EarthLink,GS
2016-11-07,WSJ  CBS hires Moelis  Goldman to advise on possible Viacom merger,GS
2016-11-05,EU s Juncker shocked by  liberal  German commissioner s remarks,GS
2016-11-04,Trumped up sterling bounce could spark bigger shakeout,GS
2016-11-04,Libyan sovereign fund seeks to appeal judgment in Goldman case,GS
2016-11-04,Could US Bank ETFs Benefit From Brexit ,GS
2016-11-04,Debunking The Absurd Notion That  The World Is Running Out Of Dollars ,GS
2016-11-03,Goldman Sachs  Paulson settle fraud lawsuit over Abacus,GS
2016-11-03,Trump wants ex Goldman partner Mnuchin to run U S  Treasury  Fox Business,GS
2016-11-03,Goldman  JPMorgan  Morgan Stanley defeat appeal over Facebook IPO,GS
2016-11-03,Wells Fargo says litigation costs could exceed provisions by  1 7 billion,GS
2016-11-02,Opening Bell  U S  Election Angst Continues To Weigh On Markets,GS
2016-11-02,Alibaba backed Lazada to buy Singapore online grocer RedMart,GS
2016-11-01,Trading compliance firm Droit gets  16 million in funding from Goldman  Wells Fargo,GS
2016-11-01,Oil prices rise from one month lows after OPEC approves strategy,GS
2016-11-01,Newest weapon in U S  hunt for insider traders paying off,GS
2016-11-01,Traders wake up to hedging as election jitters jolt stocks,GS
2016-11-01,Moving Averages  October Month End Update,GS
2016-10-31,Blackstone to buy TeamHealth in  6 1 billion deal,GS
2016-10-31,EU ethics committee clears Barroso of wrongdoing over Goldman job,GS
2016-10-28,Fund managers see Clinton win strengthening Mexico peso to 18 dollar  Reuters poll,GS
2016-10-28,Chipotle builds team to defend against Ackman,GS
2016-10-27,Court clears Icahn s CVR to sue Wachtell law firm for malpractice,GS
2016-10-27,Anthony Scaramucci on turning failure into success,GS
2016-10-26,Hearst buys Camp Systems  expands into aviation data,GS
2016-10-25,ETFs To Play 3 Affordable Sectors,GS
2016-10-22,Exclusive  Goldman Sachs  Latam investment bank chief to leave   source,GS
2016-10-21, Diva of Distressed  Tilton to face SEC fraud trial,GS
2016-10-20,JPMorgan in talks to sell out of Chinese securities JV,GS
2016-10-19,The current account deficit and what it means for Brexit Britain,GS
2016-10-19,Fed moves to quell charges of opacity  lack of diversity,GS
2016-10-18, Goldman Sachs shares move higher after Q3 earnings beat,GS
2016-10-18,Pound Surges On Solid UK inflation,GS
2016-10-18,3 Best Goldman Sachs Mutual Funds To Buy,GS
2016-10-18,Goldman  GS  Q3 Earnings Soar As Trading Revenues Surge,GS
2016-10-17,Brazil set to cut rates this week  economists split on size  Reuters poll,GS
2016-10-17,Ecuador cuts Julian Assange s internet access  WikiLeaks,GS
2016-10-17,Play These Inverse ETFs If You Hate This Bull Market,GS
2016-10-17,Copper Price Forecast  Downward Pressure On The Horizon ,GS
2016-10-16,ZTO Express eyes largest Chinese company U S  IPO since Alibaba,GS
2016-10-16,Goldman Sachs vindicated but bruised in court battle with Libyan fund,GS
2016-10-16,BRICS development bank to lend  2 5 billion next year,GS
2016-10-15,Transcripts of Clinton s Wall Street talks released in new Wikileaks dump,GS
2016-10-14,Clinton warned U S  would  ring China with missile defense   hacked email,GS
2016-10-14,Goldman Sachs wins  1 2 billion dispute with Libyan sovereign fund,GS
2016-10-14,Sales scandal costs Wells Fargo  JPMorgan and Citi please Wall Street,GS
2016-10-13,Stock Market News For October 14  2016,GS
2016-10-12,Oil edges up on record Indian imports  hopes of output caps,GS
2016-10-12,Drownings push hurricane death toll to 19 in flooded North Carolina,GS
2016-10-12,Snapchat picks Morgan Stanley  Goldman to lead IPO  sources,GS
2016-10-12,Is Deutsche Bank A Perfect Contrarian Play ,GS
2016-10-12,Exclusive  LPL Financial exploring a sale   sources,GS
2016-10-11,US 10 Year Yields Rise To 4 Month Highs,GS
2016-10-11,Deutsche Bank shakes up investment bank to regain lost ground,GS
2016-10-11,Crude oil prices slip from one year high on mixed Russian response to OPEC,GS
2016-10-11,Alibaba s  60 billion finance arm seeks growth before IPO  sources,GS
2016-10-10,Noble Group agrees  1 05 billion sale of U S  unit in planned move to cut debt,GS
2016-10-10,Goldman sees lower chance of oil market rebalancing in 2017,GS
2016-10-10,Banks ponder the meaning of life as Deutsche agonizes,GS
2016-10-10,Top Trade Ideas For The Week October 10  2016  Goldman Sachs,GS
2016-10-09,Banks ponder the meaning of life as Deutsche agonizes,GS
2016-10-07,U S  continues to  muddle  in low growth world  Goldman s Cohn,GS
2016-10-07,U S  jobs report preview  Average earnings may steal the show from NFPs,GS
2016-10-07,Brazil s inflation tumbles to lowest for September since 1998,GS
2016-10-06,Goldman  JPM  Glencore Aluminum Price Fixing Suit Tossed,GS
2016-10-05,Analysts cut Wells Fargo profit estimates ahead of results,GS
2016-10-05,UK s Hammond to tell Wall Street that London still top finance hub despite Brexit,GS
2016-10-04,Road to stagnation  China Inc gets a break from lenders,GS
2016-09-30,Goldman feels the heat in Asia as IPO engine slows,GS
2016-09-29,Fed Remains Dovish  Buy 6 Mutual Funds,GS
2016-09-29,Wells Fargo scandal reignites debate about big bank culture,GS
2016-09-29,Oil marches higher on OPEC optimism  analysts question deal,GS
2016-09-28,Oil ETFs  Short Term Threat  Long Term Opportunity ,GS
2016-09-28,Germany denies preparing to rescue Deutsche Bank,GS
2016-09-28,EU executive proposes tighter lobbying rules,GS
2016-09-27,Fund manager Perry Capital to liquidate its hedge funds,GS
2016-09-27,Goldman cuts fourth quarter crude oil price forecast by  7 on supply glut,GS
2016-09-27,Goldman Sachs cuts Q4 WTI forecast to  43 ,GS
2016-09-27,Federal Reserve Plans To Curb Banks  Commodity Holdings,GS
2016-09-27,Goldman Sachs  ex employee in Fed leak case settle fee dispute,GS
2016-09-26,Options traders start positioning for U S  election volatility,GS
2016-09-26,Goldman To Trim 30  Investment Banking Staff In Asia,GS
2016-09-26,GOLDMAN  Trump vs  Clinton is the biggest fight since Mayweather vs  Pacquiao,GS
2016-09-26,Trade Desk Gains On First Trading Day,GS
2016-09-26,Hong Kong small caps  ready for China fever ,GS
2016-09-25,Gold Firms Following Fed Theatrics,GS
2016-09-23,Exclusive  Goldman axing nearly 30 percent of Asia investment banking jobs   sources,GS
2016-09-23,Federal Reserve proposes new limits on Wall Street energy bets,GS
2016-09-23,Barroso says Goldman is  no drug cartel   blasts EU judgment,GS
2016-09-23,Yen weakens after Suga comments,GS
2016-09-21,SEC charges fund manager Cooperman with insider trading,GS
2016-09-21,FX  money market kinks fuel dollar bond issuance bonanza from Japan,GS
2016-09-20,4 Gold Stocks To Buy With Prices Set To Surge,GS
2016-09-20,Comcast Will Launch Mobile Phone Service In 2017,GS
2016-09-20,The Zacks Analyst Blog Highlights  Comcast  Verizon Communication  AT T  T Mobile And Sprint,GS
2016-09-20,Software company BlackLine prepares for IPO  sources,GS
2016-09-20,Atlanta Fed  Morgan Stanley  Goldman Sachs cut U S  Q3 GDP estimates ,GS
2016-09-19,Brazil economic activity edges down in July  central bank,GS
2016-09-19,The Zacks Analyst Blog Highlights  IShares Edge MSCI USA Quality Factor ETF  FlexShares Quality Dividend Index Fund  SPDR MSCI USA Quality Mix ETF  WisdomTree US Quality Dividend Growth ETF And VanEck Vectors Morningstar Wide Moat ETF,GS
2016-09-18,5 Millennial Friendly ETF Investing Ideas,GS
2016-09-18,6 Quality ETFs To Sail Through Uncertain Markets  ,GS
2016-09-16,Russia rate cut wouldn t boost lending,GS
2016-09-16,Credit Suisse details Zika precautions ahead of Miami credit conference,GS
2016-09-15,Exclusive  Macquarie prepares German metering firm Techem for sale   sources,GS
2016-09-14,3 Reasons Why Buyback ETFs May Lose Momentum,GS
2016-09-14,EU s Schulz calls for review of ethics code after Barroso goes to Goldman,GS
2016-09-14,On Juncker s big day  Barroso row casts shadow on EU,GS
2016-09-14,Bayer clinches Monsanto with improved  66 billion bid,GS
2016-09-14,Forex   Yen slightly weaker in Asia as focus on BoJ policy intensifies,GS
2016-09-14,Gold holds mostly steady in Asia as investors await BoJ  Fed next week,GS
2016-09-14,Forex   Yen rebounds in Asia as BoJ in focus  Aussie down on jobs,GS
2016-09-14,Shares in Asia fall as global monetary policy views spark caution,GS
2016-09-13,Dollar recovers against commodity currencies on risk aversion,GS
2016-09-13,Barroso accuses EU of discrimination over ethics probe  FT,GS
2016-09-13,Follow Goldman s Call On Dollar With These ETFs,GS
2016-09-13,New York issues cyber regulations for banks  insurers,GS
2016-09-13,Goldman Sachs Mid Cap Value A Fund  GCMAX  In Focus,GS
2016-09-12,Forget The S P 500  Buy These 3 High Growth Healthcare Stocks Instead,GS
2016-09-11,EU opens ethics probe into Barroso Goldman job,GS
2016-09-09,Deutsche Bank faces  2 4 billion plus U S  settlement demand  manager magazine,GS
2016-09-08,Federal Reserve asks Congress to limit Wall Street merchant banking,GS
2016-09-08,Tractor Supply  TSCO  Issues Q3 Guidance  Trims 2016 View,GS
2016-09-07,Goldman reduces expectations of September U S  rate hike,GS
2016-09-07,Barroso s Goldman job hits post Brexit EU as it battles for trust,GS
2016-09-06,August Job Data Muddles Fed Rate Hike Chance  ETFs To Buy ,GS
2016-09-02,Can REIT ETFs Really Enjoy Independence ,GS
2016-09-02,Wall Street still sees Fed on pace for one rate hike  in December  Reuters poll,GS
2016-09-01,Westlake Chemical  WLK  Wraps Up Axiall Acquisition,GS
2016-08-31,Goldman Sachs Just Turned Incredibly Bullish Today,GS
2016-08-30,Kiss it goodbye  the great buyback boom is on the wane  James Saft,GS
2016-08-30,Gibraltar Industries  WebMD  Caesar Stone  United Rentals And Trex Highlighted As Zacks Bull And Bear Of The Day ,GS
2016-08-30,Bull Of The Day  Gibraltar Industries  ROCK ,GS
2016-08-29,USD JPY  Yen Falters As Fed Hints Rate Hike Coming,GS
2016-08-29,The Zacks Analyst Blog Highlights  PowerShares DB US Dollar Bullish ETF  WisdomTree Japan Hedged SmallCap Equity ETF  CurrencyShares Japanese Yen ETF  Guggenheim S P SmallCap 600 Pure Growth ETF And VanEck Vectors BDC Income,GS
2016-08-28,ETF Winners   Losers Post Jackson Hole Meet,GS
2016-08-28,Conditions Are Ripe For 1 Fed Rate Hike In 2016 ,GS
2016-08-24,Goldman To Cut More Investment Banking Jobs In New York,GS
2016-08-24,Liquidity Risk Is Very Real,GS
2016-08-24,Libor rise  driven by U S  money market rules  seen topping near 1 0 percent,GS
2016-08-23,Oil up on Iran talk  stockpile build cited by API surprises,GS
2016-08-22,Morgan Stanley Doubtful Over OPEC Production Cut  4 Picks,GS
2016-08-22,S P 500 Futures  August Options Expiration Drop   Pop ,GS
2016-08-21,Hawkish Fed Vice Chairman Adds Strength To These ETFs,GS
2016-08-19,Goldman Upgrade Drives This Takeover Target,GS
2016-08-19,Goldman Raises Restoration Hardware To  Buy ,GS
2016-08-19,Vevo hires Goldman Sachs for up to  500 million capital raise  FT,GS
2016-08-19,Goldman seeks to force ex employee in Fed leak case to arbitrate,GS
2016-08-18,Chesapeake  CHK  Reveals Pricing   Upsizing Of Term Loan ,GS
2016-08-18,Tough Time Ahead For Buyback ETFs ,GS
2016-08-18,The BOJ s ETF Purchasing Program,GS
2016-08-17,ETFs To Watch On Cisco s Better Than Expected Q4 Results ,GS
2016-08-16,Believe In George Soros  Short S P 500 With These ETFs,GS
2016-08-16,SEC bars ex Goldman trader from industry in mortgage securities fraud case,GS
2016-08-15,Xylem to buy smart meter company Sensus for  1 7 billion,GS
2016-08-15,Libya s U N  backed government appoints panel to run  67 billion wealth fund,GS
2016-08-15,Pound tumbles awaiting key data,GS
2016-08-14,Gold s Wild Unchanged Week,GS
2016-08-11,Exclusive  Wall St  banks ask Fed for five more years to comply with Volcker rule,GS
2016-08-10,U S  prime money funds shorten up as new regulations loom,GS
2016-08-10,Wall Street bonuses expected to decline for bankers  traders  report,GS
2016-08-09,It s Almost Time To Buy Goldman Sachs,GS
2016-08-09,Gold Stocks Vs  Bullion  Inflation 101,GS
2016-08-08,What GST Bill Passage Means For India ETFs,GS
2016-08-08,Play Bumper Jobs Data With These 6 Mutual Funds,GS
2016-08-05,Trump s economic advisory group clashes with populist image,GS
2016-08-05,Exclusive  Genesys in bid to buy Avaya s call center business   sources,GS
2016-08-05,Bank of England s Broadbent says would back further cut in rates,GS
2016-08-05,3 Steps To Trade This Bull,GS
2016-08-05,BoE Cuts Rates  ETF   Stock Gainers ,GS
2016-08-04,iFOREX Daily Analysis   August 08  2016,GS
2016-08-04,As U S  crude wobbles near  40  new oil rally in doubt,GS
2016-08-04,New York regulator queries Goldman again on Malaysia s 1MDB fund  source,GS
2016-08-04,Low Volatility ETFs In Vogue Despite A Bull Market ,GS
2016-08-03,Fed penalizes Goldman Sachs for use of confidential data,GS
2016-08-03,Franklin Templeton launches global macro fund for retail investors,GS
2016-08-03,Goldman Sachs  GS  To Pay  36 3 Million For Using Confidential Data,GS
2016-08-03,Stock Pickers Rule,GS
2016-08-03,Goldman Sachs says UK midcaps vulnerable after rebound,GS
2016-08-01,U S  and China to win most gold in Rio   Goldman Sachs,GS
2016-07-30,U S  authorities subpoena Goldman in 1MDB probe  WSJ,GS
2016-07-29,Oil faces big monthly loss as oversupply bites,GS
2016-07-29,Goldman says oil s rebalancing remains fragile amid macro headwinds,GS
2016-07-27,Top Goldman Sachs hedge fund banker Gilly departs  sources,GS
2016-07-27,After Goldman  DB Warns About S P 500  Play Alternative ETFs,GS
2016-07-25,Fed prepares action against Goldman over NY Fed leak  NYT,GS
2016-07-22,Goldman Sachs raising  5 billion  8 billion for private equity fund  source,GS
2016-07-22,Goldman Sachs to invest  184 million in Brazil storage company  executive,GS
2016-07-21,Corzine  others settle with MF Global trustee over collapse,GS
2016-07-21,U S  lawsuits link Malaysian leader to stolen money from 1MDB fund,GS
2016-07-21,WeWork demands start up tenant take down critical blog,GS
2016-07-21,Ex Goldman banker Gordon Dyal beefs up M A boutique,GS
2016-07-21,4 Real Estate Mutual Funds To Buy On Optimistic Housing Data,GS
2016-07-21,Facebook Inc Earnings Preview  Pricing May Drive Upside,GS
2016-07-20,Should You Buy This Investment Bank Ahead Of Earnings ,GS
2016-07-20,Top 5 things to watch today ,GS
2016-07-20,Brazil keeps rates steady  sees no room for cuts yet,GS
2016-07-19,U S  stock index futures fall as rally falters ,GS
2016-07-19,Top 5 things to watch today ,GS
2016-07-19,Goldman Sachs Q2 EPS  3 72 vs  estimate  3 04 ,GS
2016-07-19,Goldman Sachs beats consensus with Q2 earnings  shares slip,GS
2016-07-19,Oil steady above  47  latest Libya hitch supports,GS
2016-07-19,These Big Banks Could Lose If Donald Trump Wins,GS
2016-07-18,Prudent Cost Management Drives Goldman  GS  Q2 Earnings,GS
2016-07-18,Earnings Preview  Morgan Stanley  MS  Vs  Goldman Sachs  GS  ,GS
2016-07-18,Read This Before Investing Another Cent  ,GS
2016-07-18,SocGen seeks to push back trial date in Libya fund case,GS
2016-07-18,Earnings Watch  Time To Short Goldman Sachs ,GS
2016-07-18,Goldman asset management executive Gottlieb to leave firm,GS
2016-07-17,Stock Market News For July 18  2016,GS
2016-07-15,How To Trade Goldman Sachs  GS  Ahead Of Earnings,GS
2016-07-15,Trades with Goldman too complex for Libya s SWF  witness tells court,GS
2016-07-15,Japanese chat app Line Corp soars in New York Tokyo dual listings,GS
2016-07-14,Dow  S P 500 close at fresh record high  as JPMorgan buoys financials,GS
2016-07-14,France s Hollande joins critics of Barroso s Goldman appointment,GS
2016-07-14,JP Morgan sets Q2 earnings bar high for banks,GS
2016-07-14,At Resistance  Goldman Sachs May Have Room To Run,GS
2016-07-14,Spain s Santander names ex JPMorgan executive Masters blockchain guru,GS
2016-07-14,ETF Strategies For 2H,GS
2016-07-13,Wetherspoon founder hits out at Brexit  doom mongers ,GS
2016-07-13,France urges ex chief of EU Commission to drop plan for Goldman job,GS
2016-07-13,The Zacks Analyst Blog Highlights  Honda Motor  Toyota Motor  Canon And Olympus,GS
2016-07-12,It s Time To Short Goldman Sachs,GS
2016-07-12,EU watchdog calls for tighter rules as Barroso takes Goldman job,GS
2016-07-12,Gold plunges in broad risk on trade  as Dow hits all time high,GS
2016-07-12,Clinton gets Sanders endorsement in show of party unity,GS
2016-07-12,Gold edges up in Asia as investors await China trade data,GS
2016-07-08,S P 500 brushes record high after blowout jobs report,GS
2016-07-08,U S  payrolls seen rebounding in June in boost to economy,GS
2016-07-08,Gold pares losses amid high volatility following robust U S  jobs report,GS
2016-07-08,Goldman Sachs hires former EU chief Barroso,GS
2016-07-07,Bull Of The Day  Corning Incorporated  GLW ,GS
2016-07-06,Do Not Make This Excuse For Losing Money In The Stock Market,GS
2016-07-06,Wall St opens lower in line with global stocks as Brexit fears hold sway ,GS
2016-07-05,Goldman compliance head queried internship in Libya fund case  court told,GS
2016-07-04,SPX  NDX Grab Back Losses  USD Reverses,GS
2016-07-01,How Did Gold Gain 25  In The First Half Of 2016 ,GS
2016-07-01,Around 20 banks  unfazed by Brexit  to invest 500 million sterling in Britain  PwC,GS
2016-07-01,London bankers face Brexit choice  lobby or leave,GS
