date,title,stock
2019-01-09,China s  flash boys  hedge funds eye end to hiatus,GS
2019-01-09,Fed Leans Dovish on Global Growth Worries  Rocky Markets  Minutes Show,GS
2019-01-09,This Market Is Going To End Terribly,GS
2019-01-09,EUR USD  Dollar Is Coming To A Soft Landing,GS
2019-01-08,Bear Of The Day  YY Inc   YY ,GS
2019-01-08,UK  European officials discussing possible Brexit delay  Telegraph,GS
2019-01-08,Risk Is Back as Morgan Stanley  Goldman Signal Bullish Way Out,GS
2019-01-08,Oil Surges on Trade Talks  WTI In Striking Distance of  50,GS
2019-01-08,Goldman Sachs  GS  Earnings Expected To Grow  Should You Buy ,GS
2019-01-07,Ex Goldman Sachs banker denied bail in Malaysia pending extradition to U S ,GS
2019-01-07,Goldman cuts 2019 oil price outlook on oversupply concerns  U S  shale growth,GS
2019-01-07,Oil Climbs on Trade Talks  Saudi Cuts  Caution Prevails,GS
2019-01-07,Forex   Dollar in Doldrums as U S  Services Activity Undershoot Estimates,GS
2019-01-07,EU moves closer to tightening rules on London based investment firms,GS
2019-01-07,European beer stocks stumble after Goldman cut,GS
2019-01-07,Oil prices gain 2 percent  extending rally from December lows,GS
2019-01-06,Goldman Says to Bet on Weaker U S  Dollar After Powell Comments,GS
2019-01-06,Fed to Weigh on Dollar  U S  China Talks  Jobs Report  Eco Day,GS
2019-01-06,Slowing Tech Cycle Will Hurt Asia s Exporters  Goldman Says,GS
2019-01-04,What Economists Are Saying Ahead of December s U S  Jobs Report,GS
2019-01-04,First jobs  How to get started saving the planet,GS
2019-01-03,Goldman Sachs  GS  Stock Moves  1 46   What You Should Know,GS
2019-01-02,4 Best Performing Mutual Funds Of 2018,GS
2018-12-30, Stock Market News  December 29  2018,GS
2018-12-30,The Year 2018 In Review  A Mountain Of Question Marks,GS
2018-12-30,A Volatile Year For The Stock Market,GS
2018-12-29,Emerging Markets Seen Bringing More Pain to Investors in 2019,GS
2018-12-28,Pimco Piles Into a Bond Paying the World s Highest Interest Rate,GS
2018-12-28,The Zacks Analyst Blog Highlights  Eclipse Resources  Gran Tierra Energy  Unit  Transportadora De Gas Del Sur And CrossAmerica Partners,GS
2018-12-26,Bear Still Stalks  Positive Early Tone  But Unclear if It Can Last Amid Volatility,GS
2018-12-25,Empty Stockings  S P 500 In Bear Market Territory ,GS
2018-12-25,Goldman Sachs just dropped its annual Christmas crossword   see how many clues you can get,GS
2018-12-24,The Worst Christmas Eve Ever Recorded For The Dow,GS
2018-12-23,Wall Street Quietly Shelves Its Bitcoin Dreams,GS
2018-12-21,Goldman Sachs CEO to employees  our compliance is strong,GS
2018-12-21,Malaysia seeks  7 5 billion in reparations from Goldman Sachs  FT,GS
2018-12-21,Crypto  Crypto And More Crypto,GS
2018-12-20,What To Expect From Bitcoin In 2019,GS
2018-12-20,Markets Signal Focus for Fed in 2019 Will Be Balance Sheet,GS
2018-12-20,Traders see Fed cutting rates  not raising them  in 2020,GS
2018-12-20,Dudley Says Fed Needed Financial Tightening to Restrain Economy,GS
2018-12-20,ETFs  major supporter of U S  stock market  stop buying the dip,GS
2018-12-19,The Fed s next decision is its most important in recent memory   and the future of the stock market is at stake,GS
2018-12-19,Home Builders Sentiment Falls  Second Largest Drop In History ,GS
2018-12-19,Singapore central bank bans former Goldman Sachs  banker for life,GS
2018-12-19,Malaysia charges another ex Goldman Sachs banker over 1MDB,GS
2018-12-19,Italy needs to woo private bond buyers as ECB bows out,GS
2018-12-19,Goldman Sachs  GS  Stock Moves  1 31   What You Should Know,GS
2018-12-18,Malaysia says Goldman Sachs failed to disclose key facts in 1MDB bond sales,GS
2018-12-18,China Watchers Split on Yuan Outlook  It All Comes Down to Trade,GS
2018-12-18,Euro rises as dollar wilts before expected Fed caution,GS
2018-12-17,Goldman Sachs slides after Malaysia files criminal charges against it and 2 of its former executives,GS
2018-12-17,Mexican Peso  Bonds Jump After Lopez Obrador s Solid Budget Release,GS
2018-12-17,Malaysia files criminal charges against Goldman,GS
2018-12-17,Malaysia Files 1MDB Linked Criminal Charges Against Goldman Sachs,GS
2018-12-17,Goldman Sachs fires back after Malaysia charges bank in 1MDB probe,GS
2018-12-17,Goldman Legal Woes Mount as Malaysia Slaps First Criminal Charge,GS
2018-12-16,Will Goldman  GS  Beat Estimates Again In Its Next Earnings Report ,GS
2018-12-16,China Holds the Key to Growth After Year s  Losses in Metals Markets  Experts Say ,GS
2018-12-16,China s Yuan Trading Likely to Get More Volatile  Goldman Says,GS
2018-12-13,Goldman Sachs  GS  Dips More Than Broader Markets  What You Should Know,GS
2018-12-13,Goldman and Citi Clash With Bond Traders  Dimming View of Inflation,GS
2018-12-13,Goldman  JPMorgan  Citi among group backing Access Fintech startup,GS
2018-12-13,Goldman Sachs  JPMorgan and others back risk management startup AccessFintech,GS
2018-12-12,Goldman Says Commodities Won t Repeat 2015 Crash as China Slows,GS
2018-12-11,Ellington Financial book value steady in November,GS
2018-12-11,Cboe builds up markets division,GS
2018-12-11,Messy Brexit Discourages EUR USD Bulls,GS
2018-12-10,Crude oil slides 3   giving up gains on OPEC production deal,GS
2018-12-10,Moscow residents turn to car sharing after parking crackdown,GS
2018-12-10,RBS Might Transfer Assets To Netherlands In No Deal Brexit,GS
2018-12-09,Weekly Market Summary For December 10,GS
2018-12-09,December Macro Update  Recession Risk Low  But Starting To Rise ,GS
2018-12-09,3 Zacks Rank  1 Goldman Sachs Funds To Buy Now,GS
2018-12-09,Goldman Says Chance of Fed Rate Hike in March Now Below 50 ,GS
2018-12-07,Uber makes confidential filing for long awaited IPO,GS
2018-12-07,Bank Stocks Are Radioactive  Here s Which To Pick In The Fallout,GS
2018-12-06,Moderna to raise  618 million in upsized IPO  braving market jitters  sources,GS
2018-12-05,Goldman Sachs likely to boost legal reserves for 1MDB  analysts,GS
2018-12-05,Malaysian fugitive Jho Low  four others hit with fresh 1MDB charges,GS
2018-12-04,Oil jumps 2 percent on expectations of production cuts,GS
2018-12-04,Teck sells stake in Quebrada Blanca copper project to Sumitomo for  1 2B,GS
2018-12-04,Goldman acquires minority stake in VC firm General Catalyst,GS
2018-12-04, Nexo Gains 35   Becomes Best Daily Performer After Announcing Dividend Payment ,GS
2018-12-04,JPMorgan CEO Dimon  Buybacks are for times when stock is cheap,GS
2018-12-04,Goldman Sees Another Weak Year for Markets After a Lousy 2018,GS
2018-12-03,Ping An backed Lufax raises  1 3 billion at lower valuation  sources,GS
2018-12-03,U S  China trade truce triggers European share surge,GS
2018-12-03,As Fed says on track  narrowing yield curve could complicate debate,GS
2018-12-03,Macron to call on U S  funds to build French start ups  not steal them,GS
2018-12-03,Christmas Comes Early For Oil   Energy ETFs ,GS
2018-12-02,Emerging Market Bulls Fuel Gains With Eyes on Trade  EM Review,GS
2018-12-02,Did The  Powell Put  Change Anything  ,GS
2018-12-01,Ex U S  Justice Department worker pleads guilty in case tied to 1MDB scandal,GS
2018-11-30,Emerging Market Bulls Fuel Monthly Gains Before G 20  EM Review,GS
2018-11-30,SoftBank becomes first Japan firm to forgo IPO price range  keeps view at 1 500 yen,GS
2018-11-30,Goldman Sachs  2 5  after BAML adds to stack of downgrades,GS
2018-11-30,As Fed Rethinks Path for Rates  Gold s Poised to Rally in 2019,GS
2018-11-29,WuXi AppTec to List in Hong Kong,GS
2018-11-29,Fed Ramps Up Goldman Probe Over 1MDB Compliance Failures,GS
2018-11-29,Trade deal possible at G20 but Chinese paper says U S  must be  fair minded ,GS
2018-11-28,Boom To Bust  Commodities  Changing Fortunes In 2018,GS
2018-11-28,Chinese medical tech platform WuXi AppTec launches  1 billion HK listing,GS
2018-11-28,Fed Rally Fizzles in Hong Kong After Mainland Investors Hit Sell,GS
2018-11-28,Intelsat  2 8  on 10M share secondary offering,GS
2018-11-28, CLS Launches Blockchain Based Platform with Goldman Sachs  Morgan Stanley ,GS
2018-11-28,Treasury s Mnuchin asks bond dealers about Fed policy  Bloomberg,GS
2018-11-28,Mnuchin asks advisory group  rate hike or balance sheet cut ,GS
2018-11-28,Mnuchin Asked About Fed Option That Could Avoid Rate Hikes,GS
2018-11-28,Buy These 3 Muni Bond Funds For Heavy Gains,GS
2018-11-27,Hedge funds  historic U S  rate view shift switches to 5 year bonds  McGeever,GS
2018-11-27,Parsley Energy upgraded to Buy at Goldman  citing coming cash flow inflection,GS
2018-11-27,Indonesian Bonds Back on Menu as Asia High Yielders Lure Inflows,GS
2018-11-26,Hong Kong s Home Market Suffering Worst Declines Since 2016,GS
2018-11-26,Follow Goldman With These Commodity ETFs ,GS
2018-11-26,Goldman Predicts Commodities Will Soar in 2019,GS
2018-11-26,Saudi Arabia pumps record amount of oil as Trump piles on pressure,GS
2018-11-25,Gold s Net Gain Of Nothing,GS
2018-11-23,Trump dismisses report he is unhappy with Treasury s Mnuchin,GS
2018-11-22,Pound Is Riding Over The Edge,GS
2018-11-22,Goldman Asset Says Buy Emerging Markets as Volatility Normal,GS
2018-11-22,Everything s Great in China s Economy  By Decree,GS
2018-11-21, Bitfury Hires Former SEC Commissioner   Seasoned Investment Banking Executive ,GS
2018-11-21,Goldman  JPMorgan Still Betting on Five Fed Hikes by End of 2019,GS
2018-11-21,Oil claws back some losses after 6 pct plunge  but outlook still weak,GS
2018-11-21,Wells Fargo Says Buy Now in Best Stocks Entry Point in Two Years,GS
2018-11-21,Japan threatens to cut solar power subsidies  angering investors,GS
2018-11-21,Abu Dhabi s IPIC files lawsuit against Goldman Sachs  others over 1MDB case,GS
2018-11-20,EUR USD Dollar Puts the Cart Before the Horse,GS
2018-11-20,Goldman Sachs sees  modest  emerging market rebound in 2019,GS
2018-11-19,Global stocks push higher  dollar sapped by rate hike uncertainty,GS
2018-11-19,EUR USD  I m Not A Coward  But I m Afraid,GS
2018-11-19,Goldman Sachs expects 11 percent returns from MSCI China in 2019,GS
2018-11-19,Apollo  Leon Black say ex partner s theft shows  betrayal ,GS
2018-11-19,Refiners get taste of post IMO world with gasoline diesel imbalance,GS
2018-11-18,Here s Why Bitcoin   Other Cryptocurrencies Are Falling Today,GS
2018-11-16,German ETFs In Focus As Economy Shows Signs Of Cooling,GS
2018-11-16,Nvidia Walloped  More Pain Before Bounce,GS
2018-11-15,Goldman CEO  personally outraged  by Malaysia s 1MDB corruption scandal,GS
2018-11-14,Goldman  GS  Down 11 3  Since Last Earnings Report  Can It Rebound ,GS
2018-11-14,Goldman Says Wall Street Banks  Exposure Was Behind Oil Rout,GS
2018-11-14,Malaysia s former first lady to face more charges  anti graft agency,GS
2018-11-13,Goldman Stock May Languish as 1MDB Questions Remain  KBW Says,GS
2018-11-13,Tencent Traders Prepare for Wildest Day Since 2015,GS
2018-11-13,Goldman Sachs bankers  cheated  Malaysia over 1MDB  PM Mahathir,GS
2018-11-12,Takeda s Shire takeover to bring  963 million fee bonanza,GS
2018-11-12,Chaos  deal or new vote  What is the grand Brexit finale ,GS
2018-11-12,Malaysia Seeking  Full Refund  From Goldman for 1MDB Deals,GS
2018-11-12,Wall Street equity traders to get biggest bonuses in 2018  study,GS
2018-11-12,Goldman Sachs Proposes A Eurozone Banks ETF,GS
2018-11-12,Disappointing third quarter earnings another blow to battered European market,GS
2018-11-12,Goldman Sachs Keeps On Tanking  Here s The Trade,GS
2018-11-11,Falling Oil Prices Are Becoming an Emerging Markets Catalyst,GS
2018-11-11,Traders Eye Yuan Proxies as China Intervention Risks Linger,GS
2018-11-09,Exclusive  Softbank s Saudi backed Vision Fund to raise  4 billion in debt,GS
2018-11-09,White House adviser Navarro to Wall Street  Stay out of U S  China trade talks,GS
2018-11-08,Bull Market Tailwinds Have Shifted,GS
2018-11-08,EUR USD Update,GS
2018-11-08,Portugal s OutSystems eyes rapid expansion after securing funding  CEO,GS
2018-11-08,Key Democratic lawmaker may invite bank CEOs to testify before U S  Congress,GS
2018-11-08,China s October new loans seen lower but credit easing on track  Reuters poll,GS
2018-11-08,Focus On These 3 Goldman Sachs Mutual Funds For Good Returns,GS
2018-11-07,Goldman Sachs  GS  Gains But Lags Market  What You Should Know,GS
2018-11-07,Goldman Sachs CEO  I feel horrible ex bankers broke law in 1MDB case,GS
2018-11-06,Big funds haven t been this heavily invested in stocks since the tech bubble   here s why that puts the market in a very dangerous position heading into 2019,GS
2018-11-06,Iran Sanctions Unlikely To Boost Oil ETFs In 2019 ,GS
2018-11-06, Ballers  star Rob Corddry had no Plan B if show business failed,GS
2018-11-05,Goldman tracking ahead of  5 billion revenue goal by 2020,GS
2018-11-05,Goldman Sachs  mega M A purveyor  looks for smaller deals,GS
2018-11-05,World stocks rally peters out as trade  Fed worries dominate,GS
2018-11-05,MarketPulse Europe  Investors Flee Italian Bank Stocks  ,GS
2018-11-04,Bitcoin Cash Surges Ahead Of Hardfork,GS
2018-11-04,Forget gridlock  Republican win may be better for stocks,GS
2018-11-02,Goldman Sachs BDC  GSBD  Surpasses Q3 Earnings And Revenue Estimates,GS
2018-11-02,SoftBank s mobile unit set to win listing approval on November 12   DealWatch,GS
2018-11-02,Oil Posts Biggest Weekly Drop Since February as U S  Approves Iran Waivers,GS
2018-11-02,Economy glides  but fading  Trump bump  may cast shadow over 2020 race,GS
2018-11-01,U S  charges financier  former Goldman bankers for 1MDB,GS
2018-11-01,Analysis Of ICO Projects By Tokenbox,GS
2018-11-01,Oil slips on signs of rising supplies  economic slowdown jitters,GS
2018-11-01,Goldman Sachs  GS  Outpaces Stock Market Gains  What You Should Know,GS
2018-10-31,Bolton Calls National Debt  Economic Threat  to U S ,GS
2018-10-31,Goldman Says Yuan Will Hit 7 as China Avoids Heavy Meddling,GS
2018-10-31,Chinese Stocks Rise on Stimulus Bets as Yuan Gains on Fixing,GS
2018-10-31, Crypto Backed Lending Platform Cred Hires Goldman  PayPal Executives ,GS
2018-10-30,Goldman Sachs Might Buy ING s Italian Real Estate Portfolio,GS
2018-10-30,Ex BlackRock credit chief eyes 2019 hedge fund launch  sources,GS
2018-10-30,Mexican economy recovers in third quarter as trade worries fade,GS
2018-10-30,ING to sell Italian real estate lease portfolio to Goldman  document,GS
2018-10-29,As stocks suffer  forex markets keep calm and carry on,GS
2018-10-29,China Aims to Pull More Currency Trading to Its Domestic Markets,GS
2018-10-29,EUR USD  Exhausted Domestic Resource,GS
2018-10-29,Morgan Stanley Says Sell Rallies as Goldman Sees Chance to Buy,GS
2018-10-26,Volkswagen has held kick off meeting for 2019 Traton IPO  sources,GS
2018-10-25,Elon Musk s SpaceX seeks  500 million loan via Goldman  Bloomberg,GS
2018-10-24, Coinbase Joins Stablecoin Hype Launching Support for USD Coin  USDC  ,GS
2018-10-24,RBC makes new appointments to European real estate team,GS
2018-10-24, Coinbase Joins Stablecoin Hype Launching Support for USD Coin  USDC  ,GS
2018-10-23,Oracle acquires AI company  Needham starts ORCL and Red Hat,GS
2018-10-23,CityFibre to invest 2 5 billion pounds in full fiber for UK homes,GS
2018-10-22,China s tax cuts next year expected to reach 1 percent of GDP  PBOC adviser,GS
2018-10-22,KKR s Calsonic buys Fiat Chrysler parts firm Magneti Marelli for  7 1 billion,GS
2018-10-22,Goldman Sachs changes Asia investment banking leadership  memo,GS
2018-10-22,Uber s dealmaking chief Poetzscher resigns,GS
2018-10-22,Sub zero  real  rates puts Turkey central bank in a bind,GS
2018-10-22,U S  Growth Engine Looks Able to Power Past Stock Market s Woes,GS
2018-10-21,Goldman backed fintech startup Marqeta launches in Europe,GS
2018-10-21,Chinese Stocks Rally Most Since 2016 as State Steps Up Support,GS
2018-10-21,Crypto Week Review  NEM s XEM Leads Top 20,GS
2018-10-19, Goldman Sachs  Michael Novogratz to Create  1 Trillion Crypto Wallet With BitGo ,GS
2018-10-19,Goldman Says It s Time to Buy the Dip in Beaten Down Emerging Markets,GS
2018-10-18,Goldman Sachs sees five more Fed rate hikes through end of 2019,GS
2018-10-18,U S  Stock Market Hasn t Bottomed Yet,GS
2018-10-18,Senator Warren urges Fed to require removal of Wells Fargo CEO,GS
2018-10-18,Bond alarm bells may ring sooner than Italian government expects,GS
2018-10-17,Citigroup  Bank Stock Ripe For A Powerful Rally,GS
2018-10-17,Is This Rebound The Real Deal ,GS
2018-10-17,Weaker China demand  regulation spell tough quarter for Europe s auto stocks  Goldman Sachs,GS
2018-10-16,Goldman gains 1 4  in premarket on  solid  Q3 results,GS
2018-10-16,Oil Ends up on Iran  U S  Stockpile Worry Limits Gains,GS
2018-10-16,Big U S  banks end third quarter on high note,GS
2018-10-16,Morgan Stanley profit beats on strength in equity trading  underwriting,GS
2018-10-16,Goldman Sachs profit beats on higher equity trading  investment banking,GS
2018-10-16,Lyft selects JPMorgan  Credit Suisse for IPO in 2019  source,GS
2018-10-16,Equity trading strength boosts profits at Morgan Stanley  Goldman,GS
2018-10-16,Uber IPO proposals value company at  120 billion  WSJ,GS
2018-10-15,Saudi Arabia Breaks 45 Year Taboo With Veiled Threat to Use Oil as a Weapon,GS
2018-10-15,Fidelity starts crypto unit,GS
2018-10-15,Bear or bull  Five reasons to claw or thunder,GS
2018-10-15, Ex Trump Economic Advisor Joins Blockchain Startup s Board of Advisors ,GS
2018-10-15,Exclusive  HNA held talks with Ant  others as it weighs options for IT unit Pactera   sources,GS
2018-10-14,Barclays to challenge Goldman in digital only bank market  FT,GS
2018-10-12,Dina Powell withdraws from consideration for U S  envoy to U N   source,GS
2018-10-12, CDRX Welcomes Lex Sokolin to Advisory Board ,GS
2018-10-12,Banks See Consumer Loan Costs Drop Despite Rising Rates,GS
2018-10-12,Gold  10 Years After Lehman Brothers,GS
2018-10-12,SoftBank picks Nomura  Goldman  three others to lead mobile unit s IPO  source,GS
2018-10-11,Goldman Sachs Says Growth Fears Are Causing the Equity Meltdown,GS
2018-10-11,China draws over  17 bln in orders for dollar bond sale,GS
2018-10-11,Oil extends losses as markets fall  inventories climb,GS
2018-10-11,Goldman Sachs to open new office in Britain for  Marcus  retail business,GS
2018-10-10,Former adviser Powell just one of many being eyed for U N   Trump says,GS
2018-10-10,Graphic  Rising U S  bond yields bring back Wall Street s sinking feeling,GS
2018-10-09,Trump s U N  envoy Nikki Haley quits  denies 2020 ambitions,GS
2018-10-09,Bain Capital Specialty Finance files for IPO  to list on NYSE,GS
2018-10-08,Volkswagen set to hire four banks for truck unit IPO  sources,GS
2018-10-08,China Sets Tone for Emerging Markets Suffering From Yield Fever,GS
2018-10-05,Crude Advances as Alarm Bells Sound Over Impending Supply Crunch,GS
2018-10-05,Oil Notches 4th Straight Weekly Gain Despite Sentiment Turn,GS
2018-10-05,Goldman Says Trade Fear Driven Slide in China Has Gone Too Far,GS
2018-10-05,After  600 Million Hit  India Oil Refiners May Face Further Pain,GS
2018-10-05,Oil prices rise on Iran sanctions  outlook uncertain,GS
2018-10-04,IMF deal will not shield Argentine peso from further losses  Reuters poll,GS
2018-10-03,China hires 12 banks for sovereign dollar bond issue,GS
2018-10-03,White House Economist Turns to Alternative Data to Boost Trump,GS
2018-10-03,Aston Martin skids on market debut,GS
2018-10-03,Market  discipline  on Italy  Be careful what you wish for  McGeever,GS
2018-10-03,Federal Reserve prepares for next crisis  bets it will begin like the last,GS
2018-10-03,Goldman forecasts South African economic rebound in 2019,GS
2018-10-03,Goldman Sachs raises stake in Spain s DIA to more than 15 percent,GS
2018-10-02,Italy Contagion Fears Bubbling Beneath Surface of Apparent Calm,GS
2018-10-02,Goldman Sees Risk That Oil Will Hold  80  on Iran  Hedging Moves,GS
2018-10-02,Global stocks turn tail as Italy angst grips Europe,GS
2018-10-02,Seahawks LB Kendricks suspended indefinitely,GS
2018-10-01,Canada s Husky Energy offers to buy MEG Energy in  5 billion deal,GS
2018-10-01,Danske Bank picks interim CEO to soothe investor concerns over scandal,GS
2018-09-28,Goldman Sees Italy Junk Risk Leading to  Sudden Stop  of Capital,GS
2018-09-28,Icahn  CVR lose malpractice case against Wachtell Lipton law firm,GS
2018-09-28,Goldman s Coleman Sees Significant Scope for Rand Strength,GS
2018-09-28, Goldman Sachs Heads  25 Million Investment Round in Blockchain Startup Veem ,GS
2018-09-27,Argentina s peso slips as investors fear volatility despite IMF deal,GS
2018-09-27,Uber  Cabify drivers strike in Madrid to protest against planned law changes,GS
2018-09-27,Bear Traps For Stocks ,GS
2018-09-27,Hong Kong queue of IPO hopefuls faces market reckoning,GS
2018-09-26,Oil Falters as Trump Ups Pressure While Goldman Dissuades Bulls,GS
2018-09-25,Goldman trading executive Bash Polley to depart at year end  memo,GS
2018-09-24,EUR USD Plays To Counterpart s Fears,GS
2018-09-24,Commodities Week Ahead  Gold Awaits Fed s Cue  Oil Bulls Emboldened By OPEC,GS
2018-09-24,Morgan Stanley shifts emerging market stance to Neutral from Negative,GS
2018-09-24,EU lawmakers move to tighten rules on London based investment banks,GS
2018-09-21,Fed s Powell between a rock and hard place  Ignore the yield curve or tight job market ,GS
2018-09-21,Copper sprints to best day in 19 months but gold falls as trade fears ease,GS
2018-09-21,Lehman Brothers workers share memories 10 years after the fall,GS
2018-09-21,Metal Prices in Rally Mode as Trade Fears Ease  Copper Soars to 12 Week High,GS
2018-09-21,Goldman  Stronger dollar unlikely to derail bullish view on commodities,GS
2018-09-20,Tencent Music Eyes  2 billion IPO in New York,GS
2018-09-20,Forex   Dollar Sinks to Near Four Month Low as Emerging Market Currencies Boom,GS
2018-09-20,iFOREX Daily Analysis   September 20 2018,GS
2018-09-20,Market Exploits USD Vulnerabilities As Capital Importer Amid Rise In Global Yields,GS
2018-09-20,Cryptocurrency has hit bottom  bitcoin due for renaissance  Novogratz,GS
2018-09-19,Goldman names Dan Dees as new investment banking co chief  Bloomberg,GS
2018-09-19,Bond Traders Move Closer to Fed  Ramping Up 2019 Rate Hike Bets,GS
2018-09-19,Foreign  Korean Investors Duke It Out Over Samsung Electronics,GS
2018-09-19,Goldman names Dan Dees as new investment banking co chief,GS
2018-09-18,Hong Kong to allow dependent visa for same sex couples after landmark ruling,GS
2018-09-18,South African fintech JUMO to expand in Asia with Goldman Sachs backing,GS
2018-09-18, Crypto Hedge Fund BlockTower Expanding despite Market Blues ,GS
2018-09-18, Crypto Exchange Service Provider AlphaPoint Adds ETF Executive to Directors Board ,GS
2018-09-17, Who broke the law   Cohn says in defending Wall Street s role in crisis,GS
2018-09-17,Goldman names Tim O Neill as vice chairman  memo,GS
2018-09-17,Goldman Sachs BDC amends revolving to reduce asset coverage requirement,GS
2018-09-14,China to ask Wall Street for ideas on improving U S  ties,GS
2018-09-14,Hedge Funds Trim Leverage Anew in Sign of Caution on U S  Stocks,GS
2018-09-14,Seahawks sign troubled LB Kendricks,GS
2018-09-14,iFOREX Daily Analysis   September 14 2018,GS
2018-09-14,Pimco s CEO Sees 55  Chance of Slowdown Over Next Two Years,GS
2018-09-14,UK Labour warns big banks must never again be masters of the economy,GS
2018-09-14,How JPMorgan s CFO became the top prospect to succeed Dimon,GS
2018-09-14, Crypto News Weekly 14 09 18  Citibank into crypto  SEC gets heavy  no more 1000x gains ,GS
2018-09-13,Reports  Seahawks to sign ex Eagles LB Kendricks,GS
2018-09-13,Morgan Stanley to offer bitcoin swap trading   Bloomberg,GS
2018-09-13,Cryptocurrencies Rise  Ethereum Surges 12  ,GS
2018-09-13,Bitcoin Gains Traction as Morgan Stanley Prepares Bitcoin Swap Trading,GS
2018-09-13,iM Global buys stake in U S  liquid alternatives firm,GS
2018-09-12, Crypto Market Cap Falls to Lowest Level Since Nov 1  Bitcoin Dominance Close to 58  ,GS
2018-09-12,Malaysia finance minister says asset recovery on 1MDB much slower than expected,GS
2018-09-11,Most Central Banks Haven t Been Shifting Reserves Into Yuan,GS
2018-09-11,The Catastrophe Bond Business Is Booming,GS
2018-09-11,UK finance minister says BoE governor to stay on as Brexit turbulence looms,GS
2018-09-11,Goldman banker had raised ethics concerns  NYT,GS
2018-09-10,Asia Equities Mostly Down on EM Jitters ,GS
2018-09-10,From QE to QT  Five questions for the ECB,GS
2018-09-10,Goldman Model Hints at More Pain for Some EM Currencies,GS
2018-09-10, Interview  Former Trader Hits Goldman Sachs  Misleading Information Crypto Market Manipulation  ,GS
2018-09-07, Goldman Sachs Executive Denies Leaving Bitcoin  BTC  Trading Desk Plan ,GS
2018-09-07, CV Market Watch   Weekly Trading Overview  August 31   September 7  ,GS
2018-09-07, Crypto News Weekly 07 09 18  Goldman Sachs short crypto market  Ethereum to zero ,GS
2018-09-07,More Signs Of A Correction Ahead  But How Soon And How Much ,GS
2018-09-07,Bitcoin Inches Down as Goldman Sachs Calls Recent Reports  Fake News ,GS
2018-09-07,Crypto Prices Rebound After Global Sell Off,GS
2018-09-07, Binance Hires Wall Street Specialist Wei Zhou as CFO ,GS
2018-09-06,Beware Buffet s Words  3 Critical Stock Market Indicators Signal Huge Losses,GS
2018-09-06,Are Bitcoin And Gold Bottoming ,GS
2018-09-06,Bitcoin  Ether Blasted As Goldman Postpones Plans For Crypto Trade Desk,GS
2018-09-06,Kendricks pleads guilty to insider trading,GS
2018-09-06, Bitcoin  BTC  Crash  Huge Short Position Bringing It Down  Here s What Is Happening ,GS
2018-09-06,Bitcoin sheds almost  1 000 in 24 hours,GS
2018-09-06, Korea Post to Take Crypto Lessons from Goldman Sachs ,GS
2018-09-06,China Tariffs  NAFTA Talks And Bitcoin Plunge,GS
2018-09-06,Bitcoin Plunges  Ethereum Down More Than 20  as Goldman Slows Trading Plans,GS
2018-09-06,Elliott Wave Ahead Of Bitcoin s Goldman Inspired Crash,GS
2018-09-06,Small Cap And Growth Factors Continue To Lead U S  Stocks In 2018,GS
