date,title,stock
2020-02-08,As China returns to work  it is hardly business as usual,GS
2020-02-07,Top 5 Things to Know in the Market on Friday  7th February,GS
2020-02-07,Stocks   U S  Futures Point Lower   Caution Sets in Ahead of Payrolls,GS
2020-02-07,Domino s Pizza  2  after Goldman Sachs warms up,GS
2020-02-07,Stocks   Uber  Pinterest Surge in Premarket  Credit Suisse Falls,GS
2020-02-07,A Major Executive Leaves Goldman Sachs   Should Investors be Worried ,GS
2020-02-07,Exclusive  Goldman Sachs to raise  8 billion for new buyout fund   sources,GS
2020-02-06,European banks shine as bond trading rebounds,GS
2020-02-06,Warner Music group files for initial public offering,GS
2020-02-06,Shares of U S  LNG firms tumble as China demand slumps,GS
2020-02-06,Crypto Trading Pioneer Rana Yared Leaves Goldman Sachs,GS
2020-02-06,Wall Street Warnings Grow Louder for Investors Defying Virus,GS
2020-02-06,Goldman bolsters Marcus staff as Britain spearheads consumer bank push,GS
2020-02-06,After two decade quest to become Malaysia s PM  Anwar says can wait a bit more,GS
2020-02-05,U S  Crackdown on Chinese Stocks Hasn t Been Ruled Out Yet,GS
2020-02-05,China January exports  imports seen falling  virus risks global trade disruptions  Reuters poll,GS
2020-02-05,Cold Turkey  investor exodus tests Erdogan s economic experiment,GS
2020-02-05,Asian stocks  valuations drop to three month low in January  Refinitiv data,GS
2020-02-05,BNP Paribas Keeps Pace With Wall Street on Trading,GS
2020-02-05,France s BNP Paribas on prowl for further European expansion,GS
2020-02-05,Brazil s BNDES raises  5 2 billion selling Petrobras stake  sources,GS
2020-02-05,Bushfires likely singed Aussie profit  coronavirus uncertainty looms,GS
2020-02-05,China ETFs To Gain On New Stimuli To Combat Coronavirus ,GS
2020-02-04,Oil flips into contango  indicating months of surplus,GS
2020-02-04,3 Best Funds From Goldman Sachs Portfolio,GS
2020-02-04,Goldman Sachs estimates modest hit to 2020 global growth from coronavirus,GS
2020-02-04,Should Goldman Sachs Equal Weight U S  Large Cap Equity ETF  GSEW  Be On Your Investing Radar ,GS
2020-02-04,Taps open for Saudi listings after Aramco s record IPO,GS
2020-02-04,Federal Reserve bars former Goldman Sachs executive for role in 1MDB scandal,GS
2020-02-03,Women s share of U S  corporate board seats rises  but not top roles  study,GS
2020-02-03,Goldman downgrades Exxon to  sell   slashes returns outlook,GS
2020-02-03,A Bernie Sanders Win in Iowa Could Ripple Through Markets,GS
2020-02-03,Coronavirus causes Goldman Sachs to cancel annual partners meeting,GS
2020-02-03,Wall Street Fixates on Every Fear Gauge to Map the Virus Fallout,GS
2020-02-03,Safe Haven Gold Prices Fall Despite Plunge in China s Stock Markets,GS
2020-02-02,Inverse ETFs That Gained More Than 20  In January,GS
2020-02-01,Play These Bond ETFs To Keep The Coronavirus Fear At Bay,GS
2020-01-31,Gold Has Best Month in 5 on Heightened Safe Haven Play to Virus    ,GS
2020-01-31,China s Factories Were Struggling Even Before the Virus Worsened,GS
2020-01-31,Goldman Sachs says virus outbreak to hit U S  and China growth,GS
2020-01-31,Gold Prices Rise as Markets Price in Virus Impact on World Economy,GS
2020-01-31,Goldman Sachs expects coronavirus outbreak to weigh on US economic growth this quarter,GS
2020-01-31,Brent Oil Has Worst Run in 14 Months as Virus Cripples Big Oil Buyer China,GS
2020-01-30,Are You Invested In These 3 Mutual Fund Misfires    January 31  2020,GS
2020-01-30,Avoid These 3 Mutual Fund Misfires   January 31  2020,GS
2020-01-30,Goldman Sachs  These 2 Stocks Are Poised to Surge by at Least 35 ,GS
2020-01-29,There s No Fever Like Gold Fever,GS
2020-01-29,First investor day from Goldman Sachs,GS
2020-01-29,Goldman Sachs shares rise after bank gives higher financial targets at first ever investor day,GS
2020-01-29,Stocks   Europe to See Limited Gains Ahead of Fed Decision,GS
2020-01-29,Goldman Sachs to offer consumers checking accounts next year through Marcus,GS
2020-01-28,Mexico posts biggest trade surplus in over 20 years on weak imports,GS
2020-01-28,If You Invested  5 000 in Goldman Sachs  IPO  This Is How Much Money You d Have Now,GS
2020-01-28,Column  Fear of China virus outstrips crude oil supply outages  Russell,GS
2020-01-28,Goldman says staff with mainland China exposure should avoid office,GS
2020-01-27,Oil drops below  60 as China virus drives demand concern,GS
2020-01-26,Week Ahead  Oil Aggressively Sells Off  FOMC And BOE Ahead,GS
2020-01-24,JPMorgan hires senior tech executive from Goldman Sachs  memo,GS
2020-01-24,Brent s Worst Week in 13 Months As Oil Crashes on Coronavirus,GS
2020-01-23,Goldman Sachs  These 3 Stocks Are Poised to Surge by at Least 15 ,GS
2020-01-23,Goldman Sachs to companies  Hire at least one woman director if you want to go public,GS
2020-01-23,Oil Falls Nearly 3  As Over Supply Concerns Weigh,GS
2020-01-23,Oil s Drop to 8 Week Low Tempered by WHO Decision  Stock Draw,GS
2020-01-23,Goldman Sachs  Buy Sea Limited  SE  Stock Because There s Still Room for Upside,GS
2020-01-23,Oil Hits 9 Week Lows as Coronavirus Is Cited as  Black Swan  Event,GS
2020-01-23,Lagarde Sets ECB on Policy Autopilot While It Stops to Think,GS
2020-01-22,3 Mutual Fund Misfires To Avoid   January 23  2020,GS
2020-01-22,Are You Invested In These 3 Mutual Fund Misfires    January 23  2020,GS
2020-01-22,Big Bank s Q4 Earnings Synopsis  Near Term View Constructive,GS
2020-01-22,3 Mutual Fund Misfires To Avoid In Your Retirement Portfolio   January 23  2020,GS
2020-01-22,Gold Caught In Coronavirus Cross Current,GS
2020-01-22,Sea Limited Sees Big Gains as Stock Jumps 8 ,GS
2020-01-22,WeWork offloads non core business Teem  stake in The Wing,GS
2020-01-22,Oil Hits 7 Week Lows  Pummeled by Coronavirus  U S  Fuel Builds,GS
2020-01-21,Sluggish Brazil economic growth to slowly pick up this year  Reuters poll,GS
2020-01-21,AppsFlyer raises  210 million in General Atlantic led private funding,GS
2020-01-21,Reynolds Consumer tees up first  1 billion plus U S  IPO of 2020,GS
2020-01-21,Goldman Says Oil Could Drop  3 If Virus Plays Out Like SARS,GS
2020-01-21,3 Mutual Fund Misfires To Avoid   January 22  2020,GS
2020-01-21,Goldman Says Palladium May Surge to Test  3 000  Then Slide,GS
2020-01-20,Goldman Sachs Opens Bank Branch in South Africa,GS
2020-01-17,Can Energy ETFs Rebound As China Promises Ramped up Purchases ,GS
2020-01-17,China s Upbeat Economic Data Hints Policy Moderation to Continue,GS
2020-01-17,Happy ending still elusive in Italian broadband drama  sources,GS
2020-01-16,China s U S  crude buying binge to set off global sweet oil shake up,GS
2020-01-16,Germany s RWE to cut one in three jobs in  2 9 billion coal exit deal,GS
2020-01-16,Goldman Sachs  These 2 Stocks Are Poised to Surge by at Least 20 ,GS
2020-01-16,U S  China Pact Leaves Currency Watchers Mostly Unimpressed,GS
2020-01-16,Goldman Sachs Drops While Profits Slump 24 ,GS
2020-01-15,Goldman Sachs exits Uber   CNBC,GS
2020-01-15,Goldman Sachs declares  1 25 dividend,GS
2020-01-15,Goldman Sachs  Q4 Earnings Miss on Rising Credit Provisions,GS
2020-01-15,Goldman Sachs is set to report fourth quarter earnings   here s what the Street expects,GS
2020-01-15,Goldman Sachs  Revenue Soars 23     Here s Why,GS
2020-01-15,Litigation Costs Weigh on Goldman Sachs Stock After Earnings,GS
2020-01-15,Fed could use negative rates if US recession strikes  Goldman Sachs chief economist predicts,GS
2020-01-15,Even at Goldman Sachs   1 Billion Leaves a Mark,GS
2020-01-15,Goldman Sachs EPS misses by  0 42  beats on revenue,GS
2020-01-14,Is Goldman Sachs Poised for a Big Win ,GS
2020-01-14,Gold  Key Indexes And Goldman,GS
2020-01-14,Goldman Sachs Q4 2019 Earnings Preview,GS
2020-01-14,A Decade Without Fed Hikes Comes Into View for Bond Investors,GS
2020-01-14,Goldman Sachs  GS  Q4 Earnings Disappoint  Expenses Flare Up,GS
2020-01-14,Goldman Sachs  GS  Misses Q4 Earnings Estimates,GS
2020-01-13,Bull Of The Day  CrowdStrike  CRWD ,GS
2020-01-13,The Zacks Analyst Blog Highlights  Taiwan Semi  JD com And America Movil SAB De CV,GS
2020-01-13,Goldman Readies a Hiring Spree and Capital to Meet Its China Ambitions,GS
2020-01-13,Why Goldman Sachs  GS  Might Surprise This Earnings Season,GS
2020-01-13,Wall Street s Biggest Oil Hedge Is Declared a State Secret,GS
2020-01-12,Economic Calendar   Top 5 Things to Watch This Week,GS
2020-01-10,Take Five  The burning bush,GS
2020-01-10,U S  Banks  Record Breaking Earnings Streak Has Probably Peaked,GS
2020-01-10,Emerging market FX set to falter again this year,GS
2020-01-10,Goldman Sachs is telling wealthy clients stock returns will be much less than 2019 this year,GS
2020-01-09,Fed s Kaplan says rates  appropriate   flags balance sheet concern,GS
2020-01-08,The Zacks Analyst Blog Highlights  Sibanye Gold  New Gold  U S  Gold  BHP Group And Silvercorp Metals,GS
2020-01-08,Oil prices shed gains as alarm over Iran rocket strike fades   for now,GS
2020-01-08,Saudi Aramco falls on U S  Iran tensions  debt markets little changed,GS
2020-01-08,Goldman Sachs Says 2020 Could Be Good Year for U K  Stock Market,GS
2020-01-08,Goldman Sachs  GS  Expected To Beat Earnings Estimates  What To Know Ahead Of Q4 Release,GS
2020-01-07,Former Goldman Sachs investment banker pleads guilty to insider trading,GS
2020-01-07,Goldman Sachs shakes up business units ahead of quarterly results,GS
2020-01-07,Gold Glitters On U S  Iran Geopolitical Conflict  5 Picks,GS
2020-01-06,Oil prices climb 2  as Iran  Trump trade threats,GS
2020-01-06,Blacklisted Chinese firm Megvii cleared for  500 million Hong Kong IPO,GS
2020-01-06,Gold Hits Highest Since 2013 as Goldman Backs Bullion in Crisis,GS
2020-01-06,Good Tidings Await Oil In 2020  5 Soaring Energy ETFs,GS
2020-01-06,Asia Market Wrap  Covering Tail Risk,GS
2020-01-06,Saudi Aramco Faces Tough Test Less Than a Month After IPO,GS
2020-01-06,Goldman Says Oil Rally Likely Shortlived Unless Supply Disrupted,GS
2020-01-05,2020 Predictictions  Global Crisis Or Stabilization Ahead ,GS
2020-01-05,South Korean restaurant owners voice concerns over  4 billion Delivery Hero deal,GS
2020-01-03,Gold and Silver Climb as Iran Attack Sends Haven Assets Higher,GS
2020-01-02,The Dollar s Losses May Just Be Getting Started,GS
2019-12-30,Does Your Retirement Portfolio Hold These 3 Mutual Fund Misfires    December 31  2019,GS
2019-12-30,Non Resident Deposits in Singapore Banks Rise  Suggesting Inflows From Hong Kong,GS
2019-12-27,5 ETFs Under  20 Up For Gains In 2020,GS
2019-12-26,The Zacks Analyst Blog Highlights  Momo  Covetrus  NIC  Vipshop And Zuora,GS
2019-12-26,Near Term Outlook Looks Bright For Investment Bank Industry,GS
2019-12-26,Top Ranked Small Cap ETFs To Buy For 2020,GS
2019-12-26,China Bucks Global Research Cuts as Analyst Count Hits Record,GS
2019-12-25,5 Top Ranked Internet Stocks To Buy For 2020,GS
2019-12-23,SoftBank s  3 billion WeWork financing talks stall with Japan banks  sources,GS
2019-12-20,Can Lebanon s newly designated PM save the economy ,GS
2019-12-20,Spain Has a  38 Billion Property Hangover,GS
2019-12-19,Goldman Sachs may admit guilt  pay  2 billion fine to settle U S  1MDB probes  source,GS
2019-12-19,Trump s Fed Attacks Do Shape Markets  Bank of Canada Study Finds,GS
2019-12-19,3 Mutual Fund Misfires To Avoid In Your Retirement Portfolio   December 20  2019,GS
2019-12-19,3 Mutual Fund Misfires To Avoid   December 20  2019,GS
2019-12-19,Commodities Up For A Solid 2020  ETFs To Benefit,GS
2019-12-18,CITIC poised to beat Goldman to become first China firm to lead Asia equity rankings,GS
2019-12-17, 5 billion flee Hong Kong funds amid unrest  Bank of England,GS
2019-12-17,WeWork arranges  1 75 billion credit line with Goldman Sachs,GS
2019-12-17,Exclusive  Daimler seeks majority control of its main China joint venture   sources,GS
2019-12-17,Exclusive  Daimler seeks majority control of its main China joint venture,GS
2019-12-16,U S  SEC settles with former Goldman banker over 1MDB scandal,GS
2019-12-16,Goldman Sachs  green goal   750 billion in work for environmental projects by 2030,GS
2019-12-16,Oil poised near three month highs on U S  China trade hopes  supply cuts,GS
2019-12-16,Wall Street banks court moderate Democrats to blunt Warren s hostility,GS
2019-12-16,Goldman Sachs raises 12 month commodity returns forecast,GS
2019-12-16,Factbox  Britain set to announce next Bank of England governor,GS
2019-12-15,Here s What Analysts Say About Hong Kong Stocks for 2020,GS
2019-12-15,Mutual Fund Misfires Of The Market   December 16  2019,GS
2019-12-15,Avoid These 3 Mutual Fund Misfires   December 16  2019,GS
2019-12-13,Shares of SoftBank backed OneConnect rise 5  in U S  market debut,GS
2019-12-13,3 Stocks To Consider As Retail Spending Slows ,GS
2019-12-13,Pulled IPOs cap subdued year for Canadian deals  signal challenges ahead,GS
2019-12-13,Bank of Russia Delivers Fifth Rate Cut as Inflation Plunges,GS
2019-12-12,Premarket London  WPP Announces Buyback  Ocado M S JV Sales Strong,GS
2019-12-11,Time To Buy Beaten Down Oil ETFs,GS
2019-12-11,U S  regulator homes in on climate risks to U S  markets,GS
2019-12-10,M S Sheds Label of Analysts  Least Favored U K  Retailer ,GS
2019-12-10,Labour s big state plans spook British business,GS
2019-12-10,Exclusive  Malaysia s Mahathir hopeful of 1MDB settlement with Goldman soon,GS
2019-12-10,Brazilian web services co Locaweb files for IPO  filing,GS
2019-12-10,Exclusive  Malaysia s Mahathir pledges to step down for Anwar  but not before November,GS
2019-12-10,Commodities Weekly  Gold Slides On Upbeat U S  Jobs,GS
2019-12-09,Pound Rally Passes Euro Milestone as Polls Back Conservatives,GS
2019-12-09,Texas Capital   Independent Bank To Merge  Assets To Be  48B,GS
2019-12-09,Obama  Greenspan  Powell  Recall  Tall Paul  Volcker s Legacy,GS
2019-12-09,Goldman raises 2020 oil price view on OPEC led inventory tightness,GS
2019-12-08,Goldman Lifts 2020 Oil Forecasts as OPEC Cuts Tighten Market,GS
2019-12-06,Goldman Says Case for Diversifying Into Gold  as Strong as Ever ,GS
2019-12-06,U S  agencies looking into Goldman 1MDB settlement below  2 billion  Bloomberg,GS
2019-12-06,Santander Brasil revamps investment banking with new hires,GS
2019-12-05,Is OneConnect s Downgrade Enough   Probably Not ,GS
2019-12-05,Japan firms back tighter foreign ownership reporting rules  Reuters poll,GS
2019-12-05,Play These 3 Goldman Sachs Mutual Funds For Stellar Gains,GS
2019-12-04,Johnson says Britain can soon stop talking about Brexit if he wins vote,GS
2019-12-04,ECB takes oversight of big investment banks fleeing Brexit,GS
2019-12-04,JPMorgan Among Banks Added to ECB Oversight as Brexit Looms,GS
2019-12-03,OPEC  Russia debate deeper oil cuts as new glut looms,GS
2019-12-03,Chinese AI startup Megvii delays Hong Kong IPO to 2020,GS
2019-12-03,Does Your Retirement Portfolio Hold These 3 Mutual Fund Misfires    December 04  2019,GS
2019-12-03,Australia s Economy Slows as Households Save Extra Cash,GS
2019-12-02,Premarket London  Ocado Issues Convertible Bonds to Fund Expansion,GS
2019-11-29,EU watchdog tells banks to get a grip on costs  merge or close,GS
2019-11-29,China Financial Warning Signs Are Flashing Almost Everywhere,GS
2019-11-28,Deutsche Continues Overhauling  Sells Bad Assets To Goldman,GS
2019-11-27,Goldman Says Germany Needs Large Fiscal Stimulus  China Bit More,GS
2019-11-27,Deutsche Bank sells  50 billion in assets to Goldman amid overhaul  sources,GS
2019-11-27,Global Risk Binge Gives Central Bankers Cause to Shudder,GS
2019-11-26,Commodities Weekly  Gold Slides As Trade Deal Hopes Rise,GS
2019-11-26,Shares in MTR May Soon Turn the Corner After Months of Protests  Goldman Says,GS
2019-11-26,U S  derivatives regulator fines Goldman Sachs  1 million for record keeping lapses,GS
2019-11-26,Erdogan leans on Turkish central bank for risky  single digit  rates,GS
2019-11-25,LVMH aims to restore Tiffany s sparkle with  16 2 billion takeover,GS
2019-11-22,Bridgewater Associates bets over  1 billion on market drop  WSJ,GS
2019-11-22,China s Xi Stresses Need for  Mutual Respect and Equality  in Trade Deal,GS
2019-11-22,Exclusive  Blacklisted Megvii s  500 million HK IPO hit by regulatory setback   sources,GS
2019-11-22,Goldman Sachs unveils internal campaign on use of gender identity pronouns,GS
2019-11-21,Australia s Westpac hit by Goldman downgrade over money laundering scandal,GS
2019-11-21,Asian Markets Mixed  Chinese Stocks Down Amid Lack of Sino U S  Trade Progress,GS
2019-11-21,China s Economy to Stabilize in 2020  Goldman Sachs Says,GS
2019-11-21,Swiss software group Avaloq hires banks for 2020 sale or IPO  sources,GS
2019-11-21,2 Investment Worries To Shrug Off  And Profit From  In 2020,GS
2019-11-20,Aramco Sees Nearly Enough Early Orders to Pull Off IPO,GS
2019-11-19,Aramco IPO banks face pared payday of  90 million or less  sources,GS
2019-11-19,Former Goldman Sachs CEO pushes back on Warren s criticism  wealth tax,GS
2019-11-19,Chinese power firm SDIC to press ahead with London listing,GS
2019-11-19,China s Megvii seeks approval for Hong Kong IPO despite U S  blacklist  sources,GS
2019-11-18,Hong Kong protesters pinned back on campus amid fears of crackdown,GS
2019-11-15,Hong Kong s cash pool tightens as Alibaba primes for  13 billion listing,GS
2019-11-14,Mutual Fund Misfires Of The Market   November 15  2019,GS
2019-11-14,Goldman s Blankfein calls Warren s criticism of billionaires  tribalism ,GS
2019-11-14,Venezuela Diaspora Boosts Colombian Growth to Fastest Since 2015,GS
2019-11-13,Why Is Goldman  GS  Up 5 7  Since Last Earnings Report ,GS
2019-11-13,Breakdown of trust in financial system deepens crisis in Lebanon,GS
2019-11-12,Oil rises further above  62 as trade hopes support,GS
2019-11-12,Giant Aramco listing a critical test for young Saudi exchange,GS
2019-11-11,Exclusive  Goldman Sachs plans shift from revenue goal at first investor day,GS
2019-11-09,AXA expects to book  3 1 billion gain from EQH exit,GS
2019-11-07,Reluctant PBOC Seen Limiting Support for China s Bond Market,GS
2019-11-07,Singapore and Shanghai Threaten Hong Kong s Status as Finance Hub,GS
2019-11-07,China Is Keeping Stimulus in Check  Here s What May Change That,GS
2019-11-06,Analysts cut Asian firms  2019 profit outlook by smaller margin,GS
2019-11-06,Taiwan s Surprisingly Strong Year Will Continue in 2020,GS
2019-11-06,Former Goldman Sachs executive to stand trial in Malaysia next year,GS
2019-11-06,Deutsche Bank Sees Interest Rates as Biggest Challenge in Europe,GS
2019-11-06,We Haven t Seen A Manufacturing Slowdown Like This Since The Last Financial Crisis,GS
2019-11-05,Goldman s Solomon Joins Critics of Europe s Negative Rate Policy,GS
2019-11-05,Saudi Aramco IPO Will Not Save Kingdom,GS
2019-11-04,It s Last Hurrah for Turkey Inflation s Brief Turn Below 10 ,GS
2019-11-01,Fisher loses another  584 million from high profile clients,GS
2019-11-01,3 Mutual Fund Misfires To Avoid   November 01  2019,GS
2019-11-01,Mutual Fund Misfires Of The Market   November 01  2019,GS
2019-10-31,Stronger together  Fiat Chrysler and Peugeot plan world s No 4 carmaker,GS
2019-10-31,StockBeat  Goldman Predicts 60  Jump in Lyft,GS
2019-10-30,U S  agrees  1 billion 1MDB recovery deal with Malaysian Jho Low,GS
2019-10-30,Peugeot  FCA accelerate merger talks  sources,GS
2019-10-29,Finance royalty descend on Saudi forum as Aramco listing looms,GS
2019-10-29,A Glimpse At The Future    Part III,GS
2019-10-29,Draghi leaves Lagarde to heal rift at European Central Bank,GS
2019-10-29,Energy ETFs Are Scary Enough To Dump Ahead Of Halloween ,GS
2019-10-28,Morgan Stanley Warns Growth Stock Underperformance Just Starting,GS
2019-10-28,3 Mutual Fund Misfires To Avoid In Your Retirement Portfolio   October 28  2019,GS
2019-10-27,Dividend ETFs To Invest As Odds For October Fed Rate Cut High,GS
2019-10-25,Deutsche Bank asset management arm sees 45  chance of  no Brexit ,GS
2019-10-25,Globe trotting Lebanese lenders face toughest test at home,GS
2019-10-25,Exclusive  Qatar pushes for Deutsche Bank chairman to go   sources,GS
2019-10-25,Russia Delivers Biggest Rate Cut Since 2017  Signals More Easing,GS
2019-10-25,Argentina s Frontrunner Is Signaling Bond Haircut of About 20 ,GS
2019-10-25,Does Your Retirement Portfolio Hold These 3 Mutual Fund Misfires    October 25  2019,GS
2019-10-24,These Asia Hold Outs Are One Shock Away From Quantitative Easing,GS
2019-10-24,Singapore Sees Cash Starting to Flow From Turbulent Hong Kong,GS
2019-10-23,Exclusive  Mexico taps banks  oil major as it nears end of 2020 oil hedge   sources,GS
2019-10-23,Draghi Dream Trade for Bond Bulls Faces Lagarde Wake Up Call,GS
2019-10-23,U K  Banks Emerge From PPI Scandal With Better Times Ahead,GS
2019-10-23,Malaysia s Najib clueless about millions banked in his account  lawyers say,GS
2019-10-23,Vodafone and MasMovil deny holding tie up talks in Spain,GS
2019-10-22,Oil Prices Rise but Gains Checked Ahead of Inventory Data,GS
2019-10-22,Goldman Sees U S  Election Putting a Brake on Share Buybacks,GS
2019-10-22,Yale Prof and Goldman Sachs Veteran Design DLT Based Facebook Rival,GS
2019-10-22,Morgan Stanley elbows out rivals for plum role in  1 5 billion IPO relaunch  sources,GS
2019-10-22,Pound Paths Are Narrowing as Traders Await Key Brexit Deal Votes,GS
2019-10-22,Malaysia  Goldman discuss smaller penalty over 1MDB scandal  Bloomberg,GS
2019-10-22,Goldman Sachs Is Either Mad or Brilliant on Junk Bonds,GS
2019-10-22,Malaysian prosecutor  Najib orchestrated graft like an  emperor ,GS
2019-10-22,Goldman Sachs lowers forecast 2020 U S  shale oil output growth,GS
2019-10-21,Investors Turn Defensive as Eskom s Day of Reckoning Approaches,GS
2019-10-21,Approach of Eskom s Day of Reckoning Puts Investors on Defensive,GS
2019-10-21,Japan s Shrinking Exports Raises Odds That BoJ Could Ease,GS
2019-10-20,Sterling slips from five month high on Brexit delay jitters,GS
2019-10-20,4 Best No Load Mutual Funds To Buy Today,GS
2019-10-19,Goldman Sachs investment banker charged in insider trading scheme,GS
2019-10-18,Ivanka Trump says developing countries must do more to empower women to get U S  aid,GS
2019-10-18,Newsbreak   Goya Foods Nears Sale  to Carlyle in  3 5B Deal   Report,GS
2019-10-18,Brexit on a knife edge as PM Johnson stakes all on  Super Saturday  vote,GS
2019-10-18,Ivanka Trump says developing countries must do more to empower women to get U S  aid,GS
2019-10-17,Goldman wants traders to be more like dealmakers and coders,GS
2019-10-17, 1 Billion Pulled From Hong Kong Hedge Funds  Most Since 2009,GS
2019-10-17,Malaysia  Goldman discuss dropping 1MDB charges  top prosecutor to Nikkei,GS
2019-10-17,Exclusive  WeWork owner creates committee to decide on financing lifeline,GS
2019-10-16,Goldman Loses Its Grip,GS
2019-10-16,Goldman Blasts Japan Plan for Foreign Investment Rules in Stocks,GS
2019-10-16,Brexit Bravado Begets Boris Bounce,GS
2019-10-16,Aramco Is Set to Pay Up to  450 Million in Fees to IPO Advisers,GS
2019-10-15,Fidelity criticizes money manager Fisher  who loses Philadelphia as client,GS
2019-10-15,Chart Of The Day  Trading Goldman Sachs  Wait For Earnings Before Acting,GS
2019-10-15,NewsBreak  Goldman Sachs Falls as Q3 Revenue Dips,GS
2019-10-15,JPMorgan beats profit estimates on strength in bond trading  underwriting,GS
2019-10-15,Opening Bell  Despite Fading Trade Deal Hopes  U S  Futures Climb  Yields Slip,GS
2019-10-15,Goldman Sachs  GS  Q3 Earnings And Revenues Lag Estimates,GS
2019-10-15,Pound Bounces On Telegraph Report,GS
2019-10-15,Earnings And Deal Talks Take Over,GS
2019-10-15,U S  Bancorp  USB  Q3 Earnings Top Estimates On High Revenues,GS
2019-10-15,JP Morgan Stands Out Among Big Banks  Earnings Reports,GS
2019-10-14,ETF Winners As  Phase 1  Deal Eases Trade Tensions,GS
2019-10-14,Citigroup s  C  Q3 Earnings Beat Estimates  Expenses Rise,GS
2019-10-14,First Republic  FRC  Q3 Earnings Beat Estimates  Costs Rise,GS
2019-10-14,Stocks  U S  Markets Recover Losses After Trade Reassurances,GS
2019-10-14,Sanctions stress makes Turkey s lira October s worst world currency,GS
2019-10-14,Pound Shaken Up by Positioning in Fear of Swift and Brutal Move,GS
2019-10-14,Latitude Gauges Demand for Australia s Biggest IPO in 2019,GS
2019-10-14,Malaysia Won t Raise Tax Even as Trade War Halts Fiscal Plan,GS
2019-10-14,Pound Rally Can Run  Goldman Says  If Brexit Hurdles Are Cleared,GS
2019-10-14,Seismograph  Brexit sensitive financial prices in critical week,GS
2019-10-13,Bank Holiday Ahead Of Q3 Earnings  Trade Negotiations,GS
2019-10-13,Major Banks To Flood Wall Street With Earnings Data ,GS
2019-10-11,What Brexit  London tightens grip in forex trading,GS
2019-10-11,Xi Upstages Trump With a Chinese Welcome Mat,GS
2019-10-10,Brazil retail sales rise in August  but only just,GS
2019-10-10,StockBeat  Financials Lifted as Bond Yields Gain on Trade Hopes,GS
2019-10-10,3 ETFs That Could Move In October,GS
2019-10-10,Banks To Get Respite After Fed Approves Simpler Volcker Rule,GS
2019-10-09,Deutsche Bank  DB  Might Cut Nearly 18 000 Jobs In Germany,GS
2019-10-08,3 Best Small Cap Value Funds To Buy For Excellent Returns,GS
2019-10-08,Deutsche Bank  DB  Might Cut Nearly 9 000 Jobs In Germany  Revised ,GS
2019-10-08,Nektar s Shares Drop On Rating Downgrade By Goldman Sachs,GS
2019-10-08,Goldman  Markets ignore Trump s Fed tweets  but key on those about trade,GS
2019-10-08,Clovis  CLVS  Shares Drop On Goldman Sachs  Bearish Outlook,GS
2019-10-08,Former Goldman programmer fails  again  to toss theft conviction,GS
2019-10-07,Earnings Preview  Goldman Sachs  GS  Q3 Earnings Expected To Decline,GS
2019-10-07,Longtime Morgan Stanley prime brokerage exec to retire  memo,GS
2019-10-07,Malaysia fines Najib s brother  others for receiving 1MDB funds,GS
2019-10-04,Bank of Russia Hints at Fourth Consecutive Rate Cut in October,GS
2019-10-04,Malaysia says no talks with Goldman Sachs on recovering funds lost in 1MDB scandal,GS
