date,title,anger,fear,negative,positive,sadness,trust,anticipation,joy,disgust,surprise,anticip,word_count
2017-01-16,Government to name underwriters for further Japan Post share sale,0.0,0.0,0.0,0.025,0.0,0.025,0.025,0.025,0.0,0.0,0.0,10
2017-01-16,Week Ahead  Get Ready For Volatility,0.0,0.0,0.0,0.0,0.0,0.0,0.0,0.0,0.0,0.0,0.0,6
2017-01-16,Oil up on Saudi commitment to cut  U S  output seen rising,0.0,0.0,0.0,0.027777777777777776,0.0,0.0,0.027777777777777776,0.027777777777777776,0.0,0.0,0.0,12
2017-01-15,Davos elites struggle for answers as Trump era dawns,0.027777777777777776,0.027777777777777776,0.027777777777777776,0.0,0.027777777777777776,0.0,0.0,0.0,0.0,0.0,0.0,9
2017-01-13,Hedge fund founder Scaramucci to join Trump s White House as liaison,0.0,0.0,0.041666666666666664,0.041666666666666664,0.0,0.0,0.0,0.0,0.0,0.0,0.0,12
2017-01-11,The Elusive Dow  20 000 ,0.0,0.0,0.0,0.0,0.0,0.0,0.0,0.0,0.0,0.0,0.0,5
2017-01-11,Exclusive  South Korea economy likely grew 2 7 percent in 2016  Trump uncertainty looms,0.0,0.0,0.0,0.0,0.0,0.07142857142857142,0.0,0.0,0.0,0.0,0.0,14
2017-01-11,Goldman private equity executive Pontarelli to retire,0.0,0.0,0.0,0.14285714285714285,0.0,0.0,0.0,0.0,0.0,0.0,0.0,7
2017-01-11,Trump s Treasury nominee Mnuchin pledges to divest assets worth millions,0.0,0.0,0.0,0.09090909090909091,0.0,0.0,0.0,0.0,0.0,0.0,0.0,11
2017-01-10,Natural Gas Flashes  Buy  Signal,0.0,0.0,0.0,0.0,0.0,0.0,0.0,0.0,0.0,0.0,0.0,5
2017-01-10,Energy Exposure  Balance And Rebalance,0.0,0.0,0.0,0.0,0.0,0.0,0.0,0.0,0.0,0.0,0.0,5
2017-01-10,Citi downgrades Goldman Sachs to  sell  on valuation,0.0,0.0,0.0,0.0,0.0,0.0,0.0,0.0,0.0,0.0,0.0,8
2017-01-10,Anti establishment wave to help push blockchain into real world in 2017,0.0,0.0,0.0,0.041666666666666664,0.0,0.041666666666666664,0.0,0.0,0.0,0.0,0.0,12
2017-01-10,Exclusive  Regulators criticize banks over Uber loan   sources,0.025,0.025,0.025,0.0,0.025,0.0,0.0,0.0,0.025,0.0,0.0,8
2017-01-09,Top U S  Senate Democrat says Trump s nominees need  thorough  vetting,0.0,0.0,0.0,0.0,0.0,0.0,0.0,0.0,0.0,0.0,0.0,12
2017-01-09,Supreme Court rejects Dow over  1 billion tax deduction claim,0.016666666666666666,0.016666666666666666,0.03333333333333333,0.0,0.03333333333333333,0.0,0.0,0.0,0.0,0.0,0.0,10
2017-01-09,Wall St mixed as oil falls over 2  ,0.0,0.0,0.0,0.0,0.0,0.0,0.0,0.0,0.0,0.0,0.0,8
2017-01-09,Takeda is buying Ariad Pharmaceuticals in a  5 2 billion deal,0.0,0.0,0.0,0.018181818181818184,0.0,0.018181818181818184,0.018181818181818184,0.018181818181818184,0.0,0.018181818181818184,0.0,11
2017-01-06,The  January effect  for stock markets is fading  Goldman,0.0,0.0,0.0,0.0,0.0,0.0,0.0,0.0,0.0,0.0,0.0,9
2017-01-06,U S  short seller distances itself from Hong Kong focused copycat,0.0303030303030303,0.0,0.0303030303030303,0.0,0.0,0.0,0.0,0.0,0.0303030303030303,0.0,0.0,11
2017-01-06,Goldman Sachs sees 84  chance of OPEC deal succeeding,0.0,0.0,0.0,0.022222222222222223,0.0,0.022222222222222223,0.022222222222222223,0.022222222222222223,0.0,0.022222222222222223,0.0,9
2017-01-05,Possible Fed limits on Wall Street energy bets will be  harmful   U S  Chamber,0.014285714285714287,0.014285714285714287,0.014285714285714287,0.0,0.014285714285714287,0.0,0.0,0.0,0.014285714285714287,0.0,0.0,14
2017-01-05,Corzine in  5 million settlement with US CFTC over MF Global collapse,0.0,0.020833333333333332,0.020833333333333332,0.0,0.020833333333333332,0.0,0.0,0.0,0.020833333333333332,0.0,0.0,12
2017-01-05,Oil prices rise as Saudi Arabia discusses supply cuts,0.0,0.0,0.0,0.1111111111111111,0.0,0.0,0.0,0.0,0.0,0.0,0.0,9
2017-01-04,U S  crude up 1 8  at settlement on Wednesday,0.0,0.0,0.05,0.0,0.0,0.0,0.0,0.0,0.05,0.0,0.0,10
2017-01-04,New Year Commences With A Bullish Optimism  But Will It Last ,0.0,0.0,0.0,0.0,0.0,0.0,0.0,0.0,0.0,0.0,0.0,11
2017-01-04,Canadian fintechs shine as investments near record,0.0,0.0,0.0,0.14285714285714285,0.0,0.0,0.0,0.0,0.0,0.0,0.0,7
2017-01-04,Trump to nominate Wall Street lawyer Clayton to lead SEC,0.02,0.02,0.02,0.02,0.0,0.0,0.0,0.0,0.02,0.0,0.0,10
2017-01-02,Remittances to Mexico jump by most in 10 years after Trump win,0.0,0.0,0.0,0.041666666666666664,0.0,0.0,0.0,0.041666666666666664,0.0,0.0,0.0,12
2017-01-02,New Congress prepares to undo Obamacare  weigh Trump personnel picks,0.0,0.0,0.03333333333333333,0.0,0.0,0.03333333333333333,0.03333333333333333,0.0,0.0,0.0,0.0,10
2017-01-02,Germany s Merkel to skip Davos on eve of Trump presidency,0.0,0.0,0.09090909090909091,0.0,0.0,0.0,0.0,0.0,0.0,0.0,0.0,11
2017-01-01,Moving Averages  December Month End Update,0.0,0.0,0.0,0.0,0.0,0.0,0.0,0.0,0.0,0.0,0.0,6
2016-12-22,Goldman names former DuPont CEO Kullman to board of directors,0.0,0.0,0.0,0.0,0.0,0.0,0.1,0.0,0.0,0.0,0.0,10
2016-12-22,Wall Street and oil take the 2016 spoils,0.0,0.0,0.0,0.0,0.0,0.0,0.0,0.0,0.0,0.0,0.0,8
2016-12-21,Impact investing growing quickly  but has long way to go  GIIN,0.0,0.0,0.0,0.0,0.0,0.0,0.09090909090909091,0.0,0.0,0.0,0.0,11
2016-12-21,U S  Stocks Leave European Peers Behind,0.0,0.0,0.0,0.0,0.0,0.0,0.0,0.0,0.0,0.0,0.0,7
2016-12-21,Goldman Sachs Sees Upside For Global Trade In 2017,0.0,0.0,0.0,0.0,0.0,0.0,0.0,0.0,0.0,0.0,0.0,9
2016-12-21,Goldman Sachs to pay  120 million over attempted ISDAFIX benchmark manipulation,0.012987012987012986,0.012987012987012986,0.012987012987012986,0.012987012987012986,0.0,0.012987012987012986,0.012987012987012986,0.012987012987012986,0.0,0.0,0.0,11
2016-12-20,Goldman Sachs sees Brent at  59 strong compliance with output cuts ,0.0,0.0,0.0,0.045454545454545456,0.0,0.045454545454545456,0.0,0.0,0.0,0.0,0.0,11
2016-12-20,Exclusive  China s Bright Food hires Goldman to sell UK firm Weetabix   sources,0.0,0.0,0.0,0.0,0.0,0.0,0.0,0.0,0.0,0.0,0.0,13
2016-12-20,Weekly Energy,0.0,0.0,0.0,0.0,0.0,0.0,0.0,0.0,0.0,0.0,0.0,2
2016-12-19,Oil prices rise in anticipation of tighter 2017 market,0.0,0.0,0.0,0.0,0.0,0.0,0.1111111111111111,0.0,0.0,0.0,0.0,9
2016-12-19,Black swans and bonanzas  Market tips  bold calls and eyecatchers for 2017,0.0,0.0,0.020833333333333332,0.020833333333333332,0.0,0.020833333333333332,0.020833333333333332,0.0,0.0,0.0,0.0,12
2016-12-19,West Texas Crude settles lower on Bakken news,0.0,0.0,0.0625,0.0,0.0625,0.0,0.0,0.0,0.0,0.0,0.0,8
2016-12-19,Trump nominates trading firm founder Viola as Army secretary,0.0,0.0,0.0,0.0,0.0,0.0,0.0,0.0,0.0,0.0,0.0,9
2016-12-16,Hopes rise that high risk lending curbs will ease under Trump,0.0,0.022727272727272728,0.022727272727272728,0.022727272727272728,0.0,0.0,0.022727272727272728,0.0,0.0,0.0,0.0,11
2016-12-16,Goldman reshuffles research leadership ahead of new rule,0.0,0.041666666666666664,0.0,0.041666666666666664,0.0,0.041666666666666664,0.0,0.0,0.0,0.0,0.0,8
2016-12-16,Oil rises on signs of producers  compliance with output cuts,0.0,0.0,0.0,0.05,0.0,0.05,0.0,0.0,0.0,0.0,0.0,10
2016-12-16,Exclusive  Foreign banks in Britain pay fraction of tax rate,0.0,0.0,0.016666666666666666,0.016666666666666666,0.016666666666666666,0.016666666666666666,0.016666666666666666,0.016666666666666666,0.0,0.0,0.0,10
2016-12-15,Wall St higher after Fed tightening as banks benefit ,0.0,0.0,0.0,0.1111111111111111,0.0,0.0,0.0,0.0,0.0,0.0,0.0,9
2016-12-15,Goldman says newly promoted COOs and CFO to get same base salary,0.0,0.0,0.0,0.016666666666666666,0.0,0.03333333333333333,0.016666666666666666,0.016666666666666666,0.0,0.0,0.0,12
2016-12-14,Goldman names Solomon  Schwartz as Cohn s successors,0.0,0.0,0.0,0.0,0.0,0.0,0.0,0.0,0.0,0.0,0.0,8
2016-12-14,Top 5 Things to Know In the Market on Wednesday,0.0,0.0,0.0,0.0,0.0,0.0,0.0,0.0,0.0,0.0,0.0,10
2016-12-14,Top 5 things to watch today ,0.0,0.08333333333333333,0.0,0.0,0.0,0.0,0.08333333333333333,0.0,0.0,0.0,0.0,6
2016-12-13,Oil s Pumping Deficit,0.0,0.0,0.0,0.0,0.0,0.0,0.0,0.0,0.0,0.0,0.0,4
2016-12-13,Australia s  1 57 trillion pension funds work to cut out the middleman,0.0,0.0,0.0,0.0,0.0,0.0,0.0,0.0,0.0,0.0,0.0,13
2016-12-13,Goldman Sachs expected to name Solomon  Schwartz as Cohn successors  WSJ,0.0,0.0,0.0,0.0,0.0,0.0,0.09090909090909091,0.0,0.0,0.0,0.0,11
2016-12-13,Twitter As A Trump Trade,0.0,0.0,0.0,0.0,0.0,0.0,0.0,0.0,0.0,0.0,0.0,5
2016-12-12,Trump puts Goldman Sachs in spotlight  for better or worse,0.0,0.03333333333333333,0.03333333333333333,0.0,0.03333333333333333,0.0,0.0,0.0,0.0,0.0,0.0,10
2016-12-12,Goldman Sachs  No  2 exec will get a big payout if he joins Trump s administration,0.0,0.0,0.0,0.0,0.0,0.0,0.0,0.0,0.0,0.0,0.0,16
2016-12-12,Goldman s Cohn to accept key economic post  CNBC,0.0,0.0,0.0,0.0,0.0,0.0,0.0,0.0,0.0,0.0,0.0,9
2016-12-12,Trump taps Goldman Sachs executive Cohn for key economic post,0.0,0.0,0.0,0.0,0.0,0.0,0.0,0.0,0.0,0.0,0.0,10
2016-12-12,Oil output cut deal aimed at inventories  not just raising prices  Goldman Sachs,0.0,0.0,0.0,0.015384615384615385,0.0,0.015384615384615385,0.015384615384615385,0.015384615384615385,0.0,0.015384615384615385,0.0,13
2016-12-12,Oil hits highest since mid 2015 as global producers agree to cut,0.0,0.011904761904761904,0.011904761904761904,0.023809523809523808,0.0,0.0,0.011904761904761904,0.011904761904761904,0.0,0.011904761904761904,0.0,12
2016-12-12,Lower Taxes  Higher Yields Should Boost S P 500 Earnings ,0.0,0.0,0.0,0.0,0.0,0.0,0.0,0.0,0.0,0.0,0.0,10
2016-12-09,Trump to name Goldman executive Cohn to key economic post,0.0,0.0,0.0,0.0,0.0,0.0,0.0,0.0,0.0,0.0,0.0,10
2016-12-09,What Lies Ahead For India ETFs ,0.0,0.0,0.0,0.0,0.0,0.0,0.0,0.0,0.0,0.0,0.0,6
2016-12-08,OPEC s oil manipulation may be over,0.047619047619047616,0.047619047619047616,0.047619047619047616,0.0,0.0,0.0,0.0,0.0,0.0,0.0,0.0,7
2016-12-08,3M to sell identity management business to Gemalto,0.0,0.0,0.0,0.0625,0.0,0.0625,0.0,0.0,0.0,0.0,0.0,8
2016-12-08,Trump World Corporate Taxes  Unclear Benefits  Many Questions,0.0,0.0,0.0,0.0,0.0,0.0,0.0,0.0,0.0,0.0,0.0,8
2016-12-08,Treasury nominee Mnuchin retains strong ties to Goldman ,0.0,0.0,0.0,0.0,0.0,0.0,0.0,0.0,0.0,0.0,0.0,8
2016-12-08,Poll  OPEC deal will pack little punch in raising oil prices,0.009090909090909092,0.009090909090909092,0.009090909090909092,0.009090909090909092,0.009090909090909092,0.009090909090909092,0.009090909090909092,0.009090909090909092,0.0,0.018181818181818184,0.0,11
2016-12-08,Wall St mixed after DJI hits new record high ,0.0,0.0,0.0,0.0,0.0,0.0,0.0,0.0,0.0,0.0,0.0,9
2016-12-07,Regions Revises 2016 Outlook  Aims  400M Cost Cut By 2019,0.0,0.0,0.0,0.0,0.0,0.0,0.0,0.0,0.0,0.0,0.0,10
2016-12-07,Black swans and bonanzas  Market tips  bold calls and eyecatchers for 2017,0.0,0.0,0.020833333333333332,0.020833333333333332,0.0,0.020833333333333332,0.020833333333333332,0.0,0.0,0.0,0.0,12
2016-12-07,Payments start up Circle moves away from bitcoin business,0.0,0.0,0.0,0.0,0.0,0.0,0.1111111111111111,0.0,0.0,0.0,0.0,9
2016-12-06,KKR to buy majority stake in cybersecurity firm Optiv from Blackstone,0.0,0.0,0.0,0.0303030303030303,0.0,0.0303030303030303,0.0,0.0303030303030303,0.0,0.0,0.0,11
2016-12-06,Shenzhen Connect Opens Up  New China  To Foreign Investors,0.0,0.0,0.0,0.0,0.0,0.0,0.0,0.0,0.0,0.0,0.0,9
2016-12-06,Blackstone s Schwarzman sees historic regulatory overhaul from Trump,0.0,0.05555555555555555,0.05555555555555555,0.0,0.0,0.0,0.0,0.0,0.0,0.0,0.0,9
2016-12-05,Markets close higher on Monday,0.0,0.0,0.0,0.0,0.0,0.0,0.0,0.0,0.0,0.0,0.0,5
2016-12-05,DJI hits fresh record high led by banks  energy stocks ,0.0,0.0,0.1,0.0,0.0,0.0,0.0,0.0,0.0,0.0,0.0,10
2016-12-05,U S  makes new arrest in fraud probe of bankrupt video tech firm,0.01282051282051282,0.01282051282051282,0.038461538461538464,0.0,0.01282051282051282,0.0,0.0,0.0,0.0,0.0,0.0,13
2016-12-05,Barclays  exit from energy trading stirs concerns over liquidity,0.0,0.0,0.0,0.0,0.0,0.0,0.0,0.0,0.0,0.0,0.0,9
2016-12-05,Former hedge fund exec s Empire Report keeps tabs on New York,0.0,0.0,0.0,0.0,0.0,0.0,0.0,0.0,0.0,0.0,0.0,12
2016-12-05,Morgan Stanley s commodities head swaps swagger for small and smart,0.0,0.0,0.09090909090909091,0.0,0.0,0.0,0.0,0.0,0.0,0.0,0.0,11
2016-12-02,Singapore slaps penalties on StanChart  Coutts in 1MDB related probe,0.0,0.0,0.0,0.0,0.0,0.1,0.0,0.0,0.0,0.0,0.0,10
2016-12-01,Trump warns of consequences for U S  firms sending jobs abroad,0.0,0.0,0.0,0.0,0.0,0.0,0.0,0.0,0.0,0.0,0.0,11
2016-12-01,Fed may face unnerving shake up under Trump administration,0.0,0.0,0.0,0.0,0.0,0.0,0.0,0.0,0.0,0.0,0.0,9
2016-12-01,Trump considering Goldman Sachs COO Cohn for energy secretary  Fox Business Network,0.0,0.0,0.0,0.0,0.0,0.0,0.0,0.0,0.0,0.0,0.0,12
2016-12-01,Trump considering Senator Heitkamp of North Dakota for Cabinet  source,0.0,0.0,0.0,0.0,0.0,0.0,0.0,0.0,0.0,0.0,0.0,10
2016-12-01,Energy shares close higher on Wall Street,0.0,0.0,0.0,0.0,0.0,0.0,0.0,0.0,0.0,0.0,0.0,7
2016-12-01,Questions resurface about who would succeed longtime Goldman CEO,0.0,0.0,0.0,0.022222222222222223,0.0,0.022222222222222223,0.022222222222222223,0.022222222222222223,0.0,0.022222222222222223,0.0,9
2016-12-01,Separation anxiety  Trump s management style poses challenges in Oval Office,0.012987012987012986,0.012987012987012986,0.012987012987012986,0.012987012987012986,0.012987012987012986,0.012987012987012986,0.012987012987012986,0.0,0.0,0.0,0.0,11
2016-12-01,Quick Guide To Goldman Sachs Income Builder A Fund  GSBFX ,0.0,0.0,0.0,0.0,0.0,0.0,0.0,0.0,0.0,0.0,0.0,10
2016-11-30,Trump says will back away from business to focus on White House,0.0,0.0,0.0,0.08333333333333333,0.0,0.0,0.0,0.0,0.0,0.0,0.0,12
2016-11-30,Goldman s Cohn eyed for top Trump budget post  transition official,0.0,0.0,0.0,0.018181818181818184,0.0,0.05454545454545454,0.018181818181818184,0.0,0.0,0.0,0.0,11
2016-11-30,Energy stocks surge on OPEC news,0.0,0.0,0.08333333333333333,0.0,0.0,0.0,0.0,0.0,0.0,0.08333333333333333,0.0,6
2016-11-30,Trump s Treasury pick targets taxes  trade reforms  media,0.0,0.0,0.0,0.05555555555555555,0.0,0.05555555555555555,0.0,0.0,0.0,0.0,0.0,9
2016-11-30,Oil jumps 8 percent on prospects for big OPEC output cut,0.0,0.0,0.0,0.0,0.0,0.0,0.0,0.0,0.0,0.0,0.0,11
2016-11-30,Plaza memories may unnerve Trump fueled dollar bulls,0.0,0.0,0.0,0.0,0.0,0.0,0.0,0.0,0.0,0.0,0.0,8
2016-11-30,U S  should cede control of Fannie and Freddie  Mnuchin,0.0,0.0,0.1,0.0,0.0,0.0,0.0,0.0,0.0,0.0,0.0,10
2016-11-30,Goldman shares hit highest level since financial crisis in post election rally,0.007575757575757576,0.007575757575757576,0.022727272727272724,0.015151515151515152,0.0,0.007575757575757576,0.007575757575757576,0.007575757575757576,0.0,0.007575757575757576,0.0,12
2016-11-30,OPEC in first joint oil cut with Russia since 2001  Saudis take  big hit ,0.03571428571428571,0.0,0.03571428571428571,0.0,0.0,0.0,0.0,0.0,0.0,0.0,0.0,14
2016-11-30,OPEC Finally Cuts Output  Energy Stocks   ETFs Up 10  Or More,0.0,0.0,0.0,0.0,0.0,0.0,0.0,0.0,0.0,0.0,0.0,11
2016-11-30,Are Hedge Fund ETFs Good Bets For Only Uncertain Times ,0.0,0.0,0.0,0.0,0.0,0.0,0.0,0.0,0.0,0.0,0.0,10
2016-11-30,Buyback ETFs  Trump Beneficiary Or Overhyped Bets ,0.0,0.0,0.0,0.0,0.0,0.0,0.0,0.0,0.0,0.0,0.0,7
2016-11-29,Poll shows voters wary of GOP foes being picked for Trump s cabinet,0.0,0.02564102564102564,0.0,0.02564102564102564,0.0,0.02564102564102564,0.0,0.0,0.0,0.0,0.0,13
2016-11-29,Forget Growth  Buy These Value ETFs Instead,0.0,0.0,0.0,0.0,0.0,0.0,0.0,0.0,0.0,0.0,0.0,7
2016-11-29,Iran  Iraq at loggerheads with Saudis ahead of OPEC meeting,0.0,0.0,0.0,0.1,0.0,0.0,0.0,0.0,0.0,0.0,0.0,10
2016-11-29,Shares in Asia mixed as investors wait anxiously on OPEC meeting,0.0,0.0,0.045454545454545456,0.0,0.0,0.0,0.045454545454545456,0.0,0.0,0.0,0.0,11
2016-11-29,Trump expected to name former Goldman banker Mnuchin for Treasury  source,0.0,0.0,0.0,0.0,0.0,0.045454545454545456,0.045454545454545456,0.0,0.0,0.0,0.0,11
2016-11-29,Short Goldman Sachs Stock At  212 50,0.0,0.0,0.0,0.0,0.0,0.0,0.0,0.0,0.0,0.0,0.0,7
2016-11-28,Oil prices gyrate as OPEC heavyweights head to Vienna,0.0,0.0,0.0,0.0,0.0,0.0,0.0,0.0,0.0,0.0,0.0,9
2016-11-28,Will Goldman Sachs  GS  Crush Estimates At Its Next Earnings Report  ,0.0,0.0,0.0,0.0,0.0,0.0,0.0,0.0,0.0,0.0,0.0,11
2016-11-27,Should You Buy Or Sell Oil ETFs Ahead Of The OPEC Meet ,0.0,0.0,0.0,0.0,0.0,0.0,0.0,0.0,0.0,0.0,0.0,12
2016-11-24,Is Goldman Sachs Income Builder C Fund  GSBCX  Worth Another Look ,0.0,0.0,0.0,0.0,0.0,0.0,0.0,0.0,0.0,0.0,0.0,11
2016-11-24,Trump s tax holiday to make American financial engineering great again  James Saft,0.0,0.0,0.015384615384615385,0.015384615384615385,0.015384615384615385,0.0,0.015384615384615385,0.015384615384615385,0.0,0.0,0.0,13
2016-11-24,Will Goldman Sachs Group  GS  Continue To Surge Higher ,0.0,0.0,0.0,0.0,0.0,0.0,0.0,0.0,0.0,0.0,0.0,9
2016-11-23,After Barroso row  Juncker proposes tighter EU ethics rules,0.037037037037037035,0.0,0.037037037037037035,0.037037037037037035,0.0,0.0,0.0,0.0,0.0,0.0,0.0,9
2016-11-23,Black Friday could shine light on troubled U S  retail loans,0.0,0.0,0.0,0.09090909090909091,0.0,0.0,0.0,0.0,0.0,0.0,0.0,11
2016-11-23,An Historic Market Rally ,0.0,0.0,0.0,0.0,0.0,0.0,0.0,0.0,0.0,0.0,0.0,4
2016-11-22,The Zacks Analyst Blog Highlights  McDermott International  Ultra Petroleum  Ocean Rig UDW  Transmontaigne Partners And Cypress Energy Partners ,0.0,0.0,0.0,0.0,0.0,0.0,0.0,0.0,0.0,0.0,0.0,18
2016-11-22,ETF Winners   Losers As Dollar Hits 13 Year High,0.0,0.0,0.0,0.0,0.0,0.0,0.0,0.0,0.0,0.0,0.0,9
2016-11-22,Welcome To The  Melt Up ,0.0,0.0,0.0,0.0,0.0,0.0,0.0,0.0,0.0,0.0,0.0,5
2016-11-21,WisdomTree Invests  20M In AdvisorEngine To Expedite B2B,0.0,0.0,0.0,0.0,0.0,0.0,0.0,0.0,0.0,0.0,0.0,8
2016-11-21,4 Asian Stocks To Buy On Encouraging Economic Data,0.0,0.0,0.0,0.0,0.0,0.0,0.0,0.0,0.0,0.0,0.0,9
2016-11-21,5 Oil Stocks To Buy As Output Cut Hopes Rise,0.0,0.0,0.0,0.0,0.0,0.0,0.0,0.0,0.0,0.0,0.0,10
2016-11-21,Citi becomes first U S  bank supervised by ECB since Brexit vote,0.009259259259259259,0.0,0.009259259259259259,0.009259259259259259,0.009259259259259259,0.018518518518518517,0.009259259259259259,0.009259259259259259,0.0,0.009259259259259259,0.0,12
2016-11-20,S P 500 Rallies  But No New High  USB Continues Its Decline,0.0,0.0,0.0,0.0,0.0,0.0,0.0,0.0,0.0,0.0,0.0,12
2016-11-18,Cybersecurity company Optiv files for IPO,0.0,0.0,0.0,0.0,0.0,0.0,0.0,0.0,0.0,0.0,0.0,6
2016-11-18,Goldman upgraded at Macquarie  Citi cut,0.0,0.0,0.0,0.0,0.0,0.0,0.0,0.0,0.0,0.0,0.0,6
2016-11-18,Buy Goldman on  New World Order    Macquarie,0.0,0.0,0.0,0.0,0.0,0.0,0.0,0.0,0.0,0.0,0.0,7
2016-11-17,JPMorgan  JPM  To Pay  264M Fine For China Hiring Scandal,0.0,0.0,0.0,0.0,0.0,0.0,0.0,0.0,0.0,0.0,0.0,10
2016-11-17,Kashkari hopes Twitter presence will help demystify Fed,0.0,0.0,0.0,0.125,0.0,0.0,0.0,0.0,0.0,0.0,0.0,8
2016-11-17,JPMorgan to pay  264 million to resolve China hiring probe  SEC  DoJ,0.0,0.0,0.0,0.020833333333333332,0.0,0.020833333333333332,0.020833333333333332,0.020833333333333332,0.0,0.0,0.0,12
2016-11-17,iFOREX Daily Analysis   November 17  2016,0.0,0.0,0.0,0.0,0.0,0.0,0.0,0.0,0.0,0.0,0.0,6
2016-11-17,Trump Treasury candidate s bank accused of discrimination,0.025,0.025,0.025,0.0125,0.0125,0.0125,0.0,0.0,0.0125,0.0,0.0,8
2016-11-17,Is The Treasury Bond ETF Rally About To End ,0.0,0.0,0.0,0.0,0.0,0.0,0.0,0.0,0.0,0.0,0.0,9
2016-11-16,Ex Goldman director Gupta seeks reversal in insider trading case,0.01111111111111111,0.01111111111111111,0.02222222222222222,0.01111111111111111,0.01111111111111111,0.01111111111111111,0.0,0.0,0.01111111111111111,0.01111111111111111,0.0,10
2016-11-16,JPMorgan CEO Dimon may be headed to U S  Treasury,0.0,0.0,0.0,0.0,0.0,0.0,0.0,0.0,0.0,0.0,0.0,10
2016-11-16,Goldman makes Juniper Conviction Buy on Switching sales momentum,0.0,0.0,0.0,0.05555555555555555,0.0,0.0,0.05555555555555555,0.0,0.0,0.0,0.0,9
2016-11-15,Credit Suisse hires banker in China onshore private banking push  memo,0.0,0.0,0.0,0.0,0.0,0.09090909090909091,0.0,0.0,0.0,0.0,0.0,11
2016-11-15,Federal Reserve says will be more open about  stress tests   GAO report,0.0,0.0,0.08333333333333333,0.0,0.0,0.0,0.0,0.0,0.0,0.0,0.0,12
2016-11-14,Can This Rally Continue ,0.0,0.0,0.0,0.0,0.0,0.0,0.0,0.0,0.0,0.0,0.0,4
2016-11-13, The Only Market Winners Of This Presidential Election Are   ,0.0,0.0,0.0,0.0,0.0,0.0,0.0,0.0,0.0,0.0,0.0,9
2016-11-11,LifeLock  13   go private talks reported  updated ,0.0,0.0,0.0,0.0,0.0,0.0,0.0,0.0,0.0,0.0,0.0,7
2016-11-11,Dollar heads for best week in a year  Mexican peso sinks,0.0,0.0,0.0,0.0,0.0,0.0,0.0,0.0,0.0,0.0,0.0,11
2016-11-10,There s a new Goldman Sachs partner class,0.0,0.0,0.0,0.125,0.0,0.0,0.0,0.0,0.0,0.0,0.0,8
2016-11-10,Vexation gives way to pragmatism as Wall Street girds for Trump,0.0,0.0,0.0,0.0,0.0,0.0,0.0,0.0,0.0,0.0,0.0,11
2016-11-10,Goldman considers Frankfurt move over Brexit,0.0,0.0,0.0,0.0,0.0,0.0,0.0,0.0,0.0,0.0,0.0,6
2016-11-10,Goldman CEO Blankfein says Trump s plans may be good for economic growth,0.0,0.0,0.0,0.02564102564102564,0.0,0.01282051282051282,0.01282051282051282,0.01282051282051282,0.0,0.01282051282051282,0.0,13
2016-11-10,ECB review of capital models will aid euro zone wooing of London banks,0.0,0.0,0.0,0.07692307692307693,0.0,0.0,0.0,0.0,0.0,0.0,0.0,13
2016-11-10,Oil prices steady as markets recover from Trump shock,0.018518518518518517,0.018518518518518517,0.018518518518518517,0.0,0.0,0.018518518518518517,0.0,0.0,0.0,0.037037037037037035,0.0,9
2016-11-10,Trump outreach to Dimon for Treasury job may fall on deaf ears,0.0,0.0,0.041666666666666664,0.020833333333333332,0.020833333333333332,0.0,0.0,0.0,0.0,0.0,0.0,12
2016-11-10,iFOREX Daily Analysis   November 10  2016,0.0,0.0,0.0,0.0,0.0,0.0,0.0,0.0,0.0,0.0,0.0,6
2016-11-10,What Investors Can Expect From Trump Revolution,0.0,0.0,0.0,0.0,0.0,0.0,0.0,0.0,0.0,0.0,0.0,7
2016-11-10,Investors  economists brace for new dangerous game  parsing Trump s words,0.022727272727272728,0.022727272727272728,0.045454545454545456,0.0,0.0,0.0,0.0,0.0,0.0,0.0,0.0,11
2016-11-09,Why You Should Bet On Raymond James   RJF  Growth Potential,0.0,0.0,0.0,0.0,0.0,0.0,0.0,0.0,0.0,0.0,0.0,10
2016-11-09,Exclusive  Goldman Sachs considers Frankfurt move over Brexit   sources,0.0,0.0,0.0,0.0,0.0,0.0,0.0,0.0,0.0,0.0,0.0,9
2016-11-08,Banks warn clients to brace for FX volatility after U S  vote,0.009259259259259259,0.009259259259259259,0.013888888888888888,0.004629629629629629,0.004629629629629629,0.009259259259259259,0.013888888888888888,0.004629629629629629,0.0,0.013888888888888888,0.0,12
2016-11-08,Citigroup rings the register on trio of banks ahead of election,0.0,0.0,0.0,0.09090909090909091,0.0,0.0,0.0,0.0,0.0,0.0,0.0,11
2016-11-07,U S  telecom firm Windstream to buy EarthLink,0.0,0.0,0.0,0.0,0.0,0.0,0.0,0.0,0.0,0.0,0.0,8
2016-11-07,WSJ  CBS hires Moelis  Goldman to advise on possible Viacom merger,0.0,0.0,0.0,0.045454545454545456,0.0,0.045454545454545456,0.0,0.0,0.0,0.0,0.0,11
2016-11-05,EU s Juncker shocked by  liberal  German commissioner s remarks,0.0,0.0,0.05,0.05,0.0,0.0,0.0,0.0,0.0,0.0,0.0,10
2016-11-04,Trumped up sterling bounce could spark bigger shakeout,0.020833333333333332,0.0,0.020833333333333332,0.020833333333333332,0.0,0.020833333333333332,0.020833333333333332,0.020833333333333332,0.0,0.0,0.0,8
2016-11-04,Libyan sovereign fund seeks to appeal judgment in Goldman case,0.0,0.016666666666666666,0.016666666666666666,0.0,0.016666666666666666,0.016666666666666666,0.016666666666666666,0.0,0.0,0.016666666666666666,0.0,10
2016-11-04,Could US Bank ETFs Benefit From Brexit ,0.0,0.0,0.0,0.0,0.0,0.0,0.0,0.0,0.0,0.0,0.0,7
2016-11-04,Debunking The Absurd Notion That  The World Is Running Out Of Dollars ,0.0,0.0,0.0,0.0,0.0,0.0,0.0,0.0,0.0,0.0,0.0,12
2016-11-03,Goldman Sachs  Paulson settle fraud lawsuit over Abacus,0.03125,0.015625,0.03125,0.0,0.015625,0.0,0.0,0.0,0.015625,0.015625,0.0,8
2016-11-03,Trump wants ex Goldman partner Mnuchin to run U S  Treasury  Fox Business,0.0,0.0,0.0,0.07692307692307693,0.0,0.0,0.0,0.0,0.0,0.0,0.0,13
2016-11-03,Goldman  JPMorgan  Morgan Stanley defeat appeal over Facebook IPO,0.0,0.0,0.05555555555555555,0.0,0.0,0.0,0.05555555555555555,0.0,0.0,0.0,0.0,9
2016-11-03,Wells Fargo says litigation costs could exceed provisions by  1 7 billion,0.0,0.0,0.020833333333333332,0.020833333333333332,0.0,0.0,0.020833333333333332,0.020833333333333332,0.0,0.0,0.0,12
2016-11-02,Opening Bell  U S  Election Angst Continues To Weigh On Markets,0.0,0.0,0.0,0.0,0.0,0.0,0.0,0.0,0.0,0.0,0.0,11
2016-11-02,Alibaba backed Lazada to buy Singapore online grocer RedMart,0.0,0.0,0.0,0.0,0.0,0.0,0.0,0.0,0.0,0.0,0.0,9
2016-11-01,Trading compliance firm Droit gets  16 million in funding from Goldman  Wells Fargo,0.0,0.0,0.0,0.038461538461538464,0.0,0.038461538461538464,0.0,0.0,0.0,0.0,0.0,13
2016-11-01,Oil prices rise from one month lows after OPEC approves strategy,0.0,0.0,0.0,0.0,0.0,0.0,0.0,0.0,0.0,0.0,0.0,11
2016-11-01,Newest weapon in U S  hunt for insider traders paying off,0.0,0.0,0.0,0.0,0.0,0.0,0.0,0.0,0.0,0.0,0.0,11
2016-11-01,Traders wake up to hedging as election jitters jolt stocks,0.0,0.0,0.05,0.0,0.0,0.0,0.0,0.0,0.0,0.05,0.0,10
2016-11-01,Moving Averages  October Month End Update,0.0,0.0,0.0,0.0,0.0,0.0,0.0,0.0,0.0,0.0,0.0,6
2016-10-31,Blackstone to buy TeamHealth in  6 1 billion deal,0.0,0.0,0.0,0.022222222222222223,0.0,0.022222222222222223,0.022222222222222223,0.022222222222222223,0.0,0.022222222222222223,0.0,9
2016-10-31,EU ethics committee clears Barroso of wrongdoing over Goldman job,0.014285714285714285,0.0,0.014285714285714285,0.02857142857142857,0.014285714285714285,0.014285714285714285,0.0,0.0,0.014285714285714285,0.0,0.0,10
2016-10-28,Fund managers see Clinton win strengthening Mexico peso to 18 dollar  Reuters poll,0.0,0.0,0.0,0.019230769230769232,0.0,0.038461538461538464,0.0,0.019230769230769232,0.0,0.0,0.0,13
2016-10-28,Chipotle builds team to defend against Ackman,0.0,0.047619047619047616,0.0,0.047619047619047616,0.0,0.047619047619047616,0.0,0.0,0.0,0.0,0.0,7
2016-10-27,Court clears Icahn s CVR to sue Wachtell law firm for malpractice,0.027777777777777776,0.0,0.027777777777777776,0.0,0.013888888888888888,0.013888888888888888,0.0,0.0,0.0,0.0,0.0,12
