date,title,anger,fear,negative,positive,sadness,trust,anticipation,joy,disgust,surprise,anticip,word_count
2018-11-21, Bitfury Hires Former SEC Commissioner   Seasoned Investment Banking Executive ,0.0,0.0,0.0,0.0,0.0,0.0,0.0,0.0,0.0,0.0,0.0,9
2018-11-21,Goldman  JPMorgan Still Betting on Five Fed Hikes by End of 2019,0.0,0.0,0.0,0.0,0.0,0.0,0.0,0.0,0.0,0.0,0.0,12
2018-11-21,Oil claws back some losses after 6 pct plunge  but outlook still weak,0.0,0.038461538461538464,0.038461538461538464,0.0,0.0,0.0,0.0,0.0,0.0,0.0,0.0,13
2018-11-21,Wells Fargo Says Buy Now in Best Stocks Entry Point in Two Years,0.0,0.0,0.0,0.0,0.0,0.0,0.0,0.0,0.0,0.0,0.0,13
2018-11-21,Japan threatens to cut solar power subsidies  angering investors,0.0,0.0,0.0,0.0,0.0,0.0,0.0,0.0,0.0,0.0,0.0,9
2018-11-21,Abu Dhabi s IPIC files lawsuit against Goldman Sachs  others over 1MDB case,0.008547008547008546,0.017094017094017092,0.017094017094017092,0.0,0.017094017094017092,0.0,0.0,0.0,0.008547008547008546,0.008547008547008546,0.0,13
2018-11-20,EUR USD Dollar Puts the Cart Before the Horse,0.0,0.0,0.0,0.0,0.0,0.0,0.0,0.0,0.0,0.0,0.0,9
2018-11-20,Goldman Sachs sees  modest  emerging market rebound in 2019,0.0,0.0,0.0,0.05555555555555555,0.0,0.05555555555555555,0.0,0.0,0.0,0.0,0.0,9
2018-11-19,Global stocks push higher  dollar sapped by rate hike uncertainty,0.0,0.0,0.1,0.0,0.0,0.0,0.0,0.0,0.0,0.0,0.0,10
2018-11-19,EUR USD  I m Not A Coward  But I m Afraid,0.0,0.0,0.0,0.0,0.0,0.0,0.0,0.0,0.0,0.0,0.0,11
2018-11-19,Goldman Sachs expects 11 percent returns from MSCI China in 2019,0.0,0.0,0.0,0.0,0.0,0.0,0.0,0.0,0.0,0.0,0.0,11
2018-11-19,Apollo  Leon Black say ex partner s theft shows  betrayal ,0.02,0.01,0.02,0.01,0.02,0.0,0.0,0.0,0.02,0.0,0.0,10
2018-11-19,Refiners get taste of post IMO world with gasoline diesel imbalance,0.0,0.0,0.0,0.0,0.0,0.0,0.0,0.0,0.0,0.0,0.0,11
2018-11-18,Here s Why Bitcoin   Other Cryptocurrencies Are Falling Today,0.0,0.0,0.0,0.0,0.0,0.0,0.0,0.0,0.0,0.0,0.0,9
2018-11-16,German ETFs In Focus As Economy Shows Signs Of Cooling,0.0,0.0,0.0,0.0,0.0,0.0,0.0,0.0,0.0,0.0,0.0,10
2018-11-16,Nvidia Walloped  More Pain Before Bounce,0.0,0.0,0.0,0.0,0.0,0.0,0.0,0.0,0.0,0.0,0.0,6
2018-11-15,Goldman CEO  personally outraged  by Malaysia s 1MDB corruption scandal,0.0,0.025,0.05,0.0,0.0,0.0,0.0,0.0,0.025,0.0,0.0,10
2018-11-14,Goldman  GS  Down 11 3  Since Last Earnings Report  Can It Rebound ,0.0,0.0,0.0,0.0,0.0,0.0,0.0,0.0,0.0,0.0,0.0,12
2018-11-14,Goldman Says Wall Street Banks  Exposure Was Behind Oil Rout,0.0,0.0,0.0,0.0,0.0,0.0,0.0,0.0,0.0,0.0,0.0,10
2018-11-14,Malaysia s former first lady to face more charges  anti graft agency,0.0,0.0,0.0,0.0,0.0,0.0,0.0,0.0,0.0,0.0,0.0,12
2018-11-13,Goldman Stock May Languish as 1MDB Questions Remain  KBW Says,0.0,0.0,0.0,0.0,0.0,0.0,0.0,0.0,0.0,0.0,0.0,10
2018-11-13,Tencent Traders Prepare for Wildest Day Since 2015,0.0,0.0,0.0,0.0,0.0,0.0,0.0,0.0,0.0,0.0,0.0,8
2018-11-13,Goldman Sachs bankers  cheated  Malaysia over 1MDB  PM Mahathir,0.0,0.0,0.0,0.0,0.0,0.0,0.0,0.0,0.0,0.0,0.0,9
2018-11-12,Takeda s Shire takeover to bring  963 million fee bonanza,0.025,0.0,0.025,0.025,0.0,0.0,0.0,0.025,0.0,0.0,0.0,10
2018-11-12,Chaos  deal or new vote  What is the grand Brexit finale ,0.006993006993006993,0.0,0.006993006993006993,0.013986013986013986,0.006993006993006993,0.013986013986013986,0.013986013986013986,0.013986013986013986,0.0,0.013986013986013986,0.0,11
2018-11-12,Malaysia Seeking  Full Refund  From Goldman for 1MDB Deals,0.0,0.0,0.0,0.0,0.0,0.0,0.0,0.0,0.0,0.0,0.0,9
2018-11-12,Wall Street equity traders to get biggest bonuses in 2018  study,0.0,0.0,0.0,0.09090909090909091,0.0,0.0,0.0,0.0,0.0,0.0,0.0,11
2018-11-12,Goldman Sachs Proposes A Eurozone Banks ETF,0.0,0.0,0.0,0.0,0.0,0.0,0.0,0.0,0.0,0.0,0.0,7
2018-11-12,Disappointing third quarter earnings another blow to battered European market,0.0,0.03333333333333333,0.03333333333333333,0.0,0.03333333333333333,0.0,0.0,0.0,0.0,0.0,0.0,10
2018-11-12,Goldman Sachs Keeps On Tanking  Here s The Trade,0.0,0.0,0.0,0.0,0.0,0.0,0.0,0.0,0.0,0.0,0.0,9
2018-11-11,Falling Oil Prices Are Becoming an Emerging Markets Catalyst,0.0,0.0,0.0,0.0,0.0,0.0,0.0,0.0,0.0,0.0,0.0,9
2018-11-11,Traders Eye Yuan Proxies as China Intervention Risks Linger,0.0,0.0,0.0,0.0,0.0,0.0,0.0,0.0,0.0,0.0,0.0,9
2018-11-09,Exclusive  Softbank s Saudi backed Vision Fund to raise  4 billion in debt,0.0,0.0,0.038461538461538464,0.0,0.038461538461538464,0.0,0.0,0.0,0.0,0.0,0.0,13
2018-11-09,White House adviser Navarro to Wall Street  Stay out of U S  China trade talks,0.0,0.0,0.0,0.02222222222222222,0.0,0.04444444444444444,0.0,0.0,0.0,0.0,0.0,15
2018-11-08,Bull Market Tailwinds Have Shifted,0.0,0.0,0.0,0.0,0.0,0.0,0.0,0.0,0.0,0.0,0.0,5
2018-11-08,EUR USD Update,0.0,0.0,0.0,0.0,0.0,0.0,0.0,0.0,0.0,0.0,0.0,3
2018-11-08,Portugal s OutSystems eyes rapid expansion after securing funding  CEO,0.0,0.0,0.0,0.0,0.0,0.0,0.0,0.0,0.0,0.1,0.0,10
2018-11-08,Key Democratic lawmaker may invite bank CEOs to testify before U S  Congress,0.0,0.0,0.0,0.01282051282051282,0.0,0.02564102564102564,0.01282051282051282,0.01282051282051282,0.0,0.01282051282051282,0.0,13
2018-11-08,China s October new loans seen lower but credit easing on track  Reuters poll,0.0,0.0,0.011904761904761904,0.011904761904761904,0.011904761904761904,0.023809523809523808,0.011904761904761904,0.0,0.0,0.0,0.0,14
2018-11-08,Focus On These 3 Goldman Sachs Mutual Funds For Good Returns,0.0,0.0,0.0,0.0,0.0,0.0,0.0,0.0,0.0,0.0,0.0,11
2018-11-07,Goldman Sachs  GS  Gains But Lags Market  What You Should Know,0.0,0.0,0.0,0.0,0.0,0.0,0.0,0.0,0.0,0.0,0.0,11
2018-11-07,Goldman Sachs CEO  I feel horrible ex bankers broke law in 1MDB case,0.006993006993006993,0.020979020979020976,0.020979020979020976,0.0,0.013986013986013986,0.006993006993006993,0.0,0.0,0.006993006993006993,0.0,0.0,13
2018-11-06,Big funds haven t been this heavily invested in stocks since the tech bubble   here s why that puts the market in a very dangerous position heading into 2019,0.0,0.005747126436781609,0.017241379310344827,0.005747126436781609,0.0,0.005747126436781609,0.0,0.0,0.0,0.0,0.0,29
2018-11-06,Iran Sanctions Unlikely To Boost Oil ETFs In 2019 ,0.0,0.0,0.0,0.0,0.0,0.0,0.0,0.0,0.0,0.0,0.0,9
2018-11-06, Ballers  star Rob Corddry had no Plan B if show business failed,0.0,0.0,0.0,0.016666666666666666,0.0,0.03333333333333333,0.016666666666666666,0.016666666666666666,0.0,0.0,0.0,12
2018-11-05,Goldman tracking ahead of  5 billion revenue goal by 2020,0.0,0.0,0.0,0.1,0.0,0.0,0.0,0.0,0.0,0.0,0.0,10
2018-11-05,Goldman Sachs  mega M A purveyor  looks for smaller deals,0.0,0.0,0.0,0.0,0.0,0.0,0.0,0.0,0.0,0.0,0.0,10
2018-11-05,World stocks rally peters out as trade  Fed worries dominate,0.016666666666666666,0.016666666666666666,0.03333333333333333,0.016666666666666666,0.0,0.016666666666666666,0.0,0.0,0.0,0.0,0.0,10
2018-11-05,MarketPulse Europe  Investors Flee Italian Bank Stocks  ,0.0,0.0,0.0,0.0,0.0,0.0,0.0,0.0,0.0,0.0,0.0,7
2018-11-04,Bitcoin Cash Surges Ahead Of Hardfork,0.0,0.0,0.0,0.0,0.0,0.0,0.0,0.0,0.0,0.0,0.0,6
2018-11-04,Forget gridlock  Republican win may be better for stocks,0.0,0.0,0.1111111111111111,0.0,0.0,0.0,0.0,0.0,0.0,0.0,0.0,9
2018-11-02,Goldman Sachs BDC  GSBD  Surpasses Q3 Earnings And Revenue Estimates,0.0,0.0,0.0,0.0,0.0,0.0,0.0,0.0,0.0,0.0,0.0,10
2018-11-02,SoftBank s mobile unit set to win listing approval on November 12   DealWatch,0.0,0.0,0.0,0.038461538461538464,0.0,0.0,0.038461538461538464,0.0,0.0,0.0,0.0,13
2018-11-02,Oil Posts Biggest Weekly Drop Since February as U S  Approves Iran Waivers,0.0,0.0,0.0,0.0,0.0,0.0,0.0,0.0,0.0,0.0,0.0,13
2018-11-02,Economy glides  but fading  Trump bump  may cast shadow over 2020 race,0.0,0.0,0.0,0.0,0.0,0.0,0.0,0.0,0.0,0.0,0.0,12
2018-11-01,U S  charges financier  former Goldman bankers for 1MDB,0.0,0.0,0.0,0.0,0.0,0.0,0.0,0.0,0.0,0.0,0.0,9
2018-11-01,Analysis Of ICO Projects By Tokenbox,0.0,0.0,0.0,0.0,0.0,0.0,0.0,0.0,0.0,0.0,0.0,6
2018-11-01,Oil slips on signs of rising supplies  economic slowdown jitters,0.0,0.0,0.0,0.05,0.0,0.0,0.025,0.025,0.0,0.0,0.0,10
2018-11-01,Goldman Sachs  GS  Outpaces Stock Market Gains  What You Should Know,0.0,0.0,0.0,0.0,0.0,0.0,0.0,0.0,0.0,0.0,0.0,11
2018-10-31,Bolton Calls National Debt  Economic Threat  to U S ,0.0,0.0,0.0,0.0,0.0,0.0,0.0,0.0,0.0,0.0,0.0,9
2018-10-31,Goldman Says Yuan Will Hit 7 as China Avoids Heavy Meddling,0.0,0.0,0.0,0.0,0.0,0.0,0.0,0.0,0.0,0.0,0.0,11
2018-10-31,Chinese Stocks Rise on Stimulus Bets as Yuan Gains on Fixing,0.0,0.0,0.0,0.0,0.0,0.0,0.0,0.0,0.0,0.0,0.0,11
2018-10-31, Crypto Backed Lending Platform Cred Hires Goldman  PayPal Executives ,0.0,0.0,0.0,0.0,0.0,0.0,0.0,0.0,0.0,0.0,0.0,9
2018-10-30,Goldman Sachs Might Buy ING s Italian Real Estate Portfolio,0.0,0.0,0.0,0.0,0.0,0.0,0.0,0.0,0.0,0.0,0.0,10
2018-10-30,Ex BlackRock credit chief eyes 2019 hedge fund launch  sources,0.0,0.0,0.0,0.05,0.0,0.025,0.025,0.0,0.0,0.0,0.0,10
2018-10-30,Mexican economy recovers in third quarter as trade worries fade,0.0,0.0,0.03333333333333333,0.0,0.0,0.06666666666666667,0.0,0.0,0.0,0.0,0.0,10
2018-10-30,ING to sell Italian real estate lease portfolio to Goldman  document,0.0,0.0,0.0,0.045454545454545456,0.0,0.045454545454545456,0.0,0.0,0.0,0.0,0.0,11
2018-10-29,As stocks suffer  forex markets keep calm and carry on,0.0,0.0,0.06666666666666667,0.03333333333333333,0.0,0.0,0.0,0.0,0.0,0.0,0.0,10
2018-10-29,China Aims to Pull More Currency Trading to Its Domestic Markets,0.0,0.0,0.0,0.0,0.0,0.0,0.0,0.0,0.0,0.0,0.0,11
2018-10-29,EUR USD  Exhausted Domestic Resource,0.0,0.0,0.0,0.0,0.0,0.0,0.0,0.0,0.0,0.0,0.0,5
2018-10-29,Morgan Stanley Says Sell Rallies as Goldman Sees Chance to Buy,0.0,0.0,0.0,0.0,0.0,0.0,0.0,0.0,0.0,0.0,0.0,11
2018-10-26,Volkswagen has held kick off meeting for 2019 Traton IPO  sources,0.045454545454545456,0.0,0.045454545454545456,0.0,0.0,0.0,0.0,0.0,0.0,0.0,0.0,11
2018-10-25,Elon Musk s SpaceX seeks  500 million loan via Goldman  Bloomberg,0.0,0.0,0.0,0.0,0.0,0.0,0.0,0.0,0.0,0.0,0.0,11
2018-10-24, Coinbase Joins Stablecoin Hype Launching Support for USD Coin  USDC  ,0.0,0.0,0.0,0.0,0.0,0.0,0.0,0.0,0.0,0.0,0.0,10
2018-10-24,RBC makes new appointments to European real estate team,0.0,0.0,0.0,0.037037037037037035,0.0,0.07407407407407407,0.0,0.0,0.0,0.0,0.0,9
2018-10-24, Coinbase Joins Stablecoin Hype Launching Support for USD Coin  USDC  ,0.0,0.0,0.0,0.0,0.0,0.0,0.0,0.0,0.0,0.0,0.0,10
2018-10-23,Oracle acquires AI company  Needham starts ORCL and Red Hat,0.0,0.0,0.0,0.0,0.0,0.0,0.0,0.0,0.0,0.0,0.0,10
2018-10-23,CityFibre to invest 2 5 billion pounds in full fiber for UK homes,0.0,0.0,0.0,0.07692307692307693,0.0,0.0,0.0,0.0,0.0,0.0,0.0,13
2018-10-22,China s tax cuts next year expected to reach 1 percent of GDP  PBOC adviser,0.0,0.0,0.013333333333333334,0.013333333333333334,0.013333333333333334,0.013333333333333334,0.013333333333333334,0.0,0.0,0.0,0.0,15
2018-10-22,KKR s Calsonic buys Fiat Chrysler parts firm Magneti Marelli for  7 1 billion,0.0,0.0,0.0,0.0,0.0,0.0,0.0,0.0,0.0,0.0,0.0,14
2018-10-22,Goldman Sachs changes Asia investment banking leadership  memo,0.0,0.0,0.0,0.0,0.0,0.0,0.0,0.0,0.0,0.0,0.0,8
2018-10-22,Uber s dealmaking chief Poetzscher resigns,0.0,0.0,0.0,0.0,0.0,0.0,0.0,0.0,0.0,0.0,0.0,6
2018-10-22,Sub zero  real  rates puts Turkey central bank in a bind,0.0,0.0,0.0,0.0303030303030303,0.0,0.0606060606060606,0.0,0.0,0.0,0.0,0.0,11
2018-10-22,U S  Growth Engine Looks Able to Power Past Stock Market s Woes,0.0,0.0,0.0,0.0,0.0,0.0,0.0,0.0,0.0,0.0,0.0,13
2018-10-21,Goldman backed fintech startup Marqeta launches in Europe,0.0,0.0,0.0,0.0,0.0,0.0,0.0,0.0,0.0,0.0,0.0,8
2018-10-21,Chinese Stocks Rally Most Since 2016 as State Steps Up Support,0.0,0.0,0.0,0.0,0.0,0.0,0.0,0.0,0.0,0.0,0.0,11
2018-10-21,Crypto Week Review  NEM s XEM Leads Top 20,0.0,0.0,0.0,0.0,0.0,0.0,0.0,0.0,0.0,0.0,0.0,9
2018-10-19, Goldman Sachs  Michael Novogratz to Create  1 Trillion Crypto Wallet With BitGo ,0.0,0.0,0.0,0.0,0.0,0.0,0.0,0.0,0.0,0.0,0.0,12
2018-10-19,Goldman Says It s Time to Buy the Dip in Beaten Down Emerging Markets,0.0,0.0,0.0,0.0,0.0,0.0,0.0,0.0,0.0,0.0,0.0,14
2018-10-18,Goldman Sachs sees five more Fed rate hikes through end of 2019,0.0,0.0,0.0,0.0,0.0,0.0,0.0,0.0,0.0,0.0,0.0,12
2018-10-18,U S  Stock Market Hasn t Bottomed Yet,0.0,0.0,0.0,0.0,0.0,0.0,0.0,0.0,0.0,0.0,0.0,8
2018-10-18,Senator Warren urges Fed to require removal of Wells Fargo CEO,0.0,0.0,0.09090909090909091,0.0,0.0,0.0,0.0,0.0,0.0,0.0,0.0,11
2018-10-18,Bond alarm bells may ring sooner than Italian government expects,0.0,0.04,0.04,0.0,0.0,0.0,0.0,0.0,0.0,0.02,0.0,10
2018-10-17,Citigroup  Bank Stock Ripe For A Powerful Rally,0.0,0.0,0.0,0.0,0.0,0.0,0.0,0.0,0.0,0.0,0.0,8
2018-10-17,Is This Rebound The Real Deal ,0.0,0.0,0.0,0.0,0.0,0.0,0.0,0.0,0.0,0.0,0.0,6
2018-10-17,Weaker China demand  regulation spell tough quarter for Europe s auto stocks  Goldman Sachs,0.014285714285714287,0.0,0.04285714285714286,0.0,0.014285714285714287,0.0,0.0,0.0,0.0,0.0,0.0,14
2018-10-16,Goldman gains 1 4  in premarket on  solid  Q3 results,0.0,0.0,0.0,0.1,0.0,0.0,0.0,0.0,0.0,0.0,0.0,10
2018-10-16,Oil Ends up on Iran  U S  Stockpile Worry Limits Gains,0.0,0.0,0.0,0.0,0.0,0.0,0.0,0.0,0.0,0.0,0.0,11
2018-10-16,Big U S  banks end third quarter on high note,0.0,0.0,0.0,0.0,0.0,0.0,0.0,0.0,0.0,0.0,0.0,10
2018-10-16,Morgan Stanley profit beats on strength in equity trading  underwriting,0.0,0.0,0.0,0.06666666666666667,0.0,0.03333333333333333,0.0,0.0,0.0,0.0,0.0,10
2018-10-16,Goldman Sachs profit beats on higher equity trading  investment banking,0.0,0.0,0.0,0.1,0.0,0.0,0.0,0.0,0.0,0.0,0.0,10
2018-10-16,Lyft selects JPMorgan  Credit Suisse for IPO in 2019  source,0.0,0.0,0.0,0.0,0.0,0.0,0.0,0.0,0.0,0.0,0.0,10
2018-10-16,Equity trading strength boosts profits at Morgan Stanley  Goldman,0.0,0.0,0.0,0.05555555555555555,0.0,0.05555555555555555,0.0,0.0,0.0,0.0,0.0,9
2018-10-16,Uber IPO proposals value company at  120 billion  WSJ,0.0,0.0,0.0,0.0,0.0,0.0,0.0,0.0,0.0,0.0,0.0,9
2018-10-15,Saudi Arabia Breaks 45 Year Taboo With Veiled Threat to Use Oil as a Weapon,0.0,0.0,0.0,0.0,0.0,0.0,0.0,0.0,0.0,0.0,0.0,15
2018-10-15,Fidelity starts crypto unit,0.0,0.0,0.0,0.0,0.0,0.0,0.0,0.0,0.0,0.0,0.0,4
2018-10-15,Bear or bull  Five reasons to claw or thunder,0.037037037037037035,0.037037037037037035,0.037037037037037035,0.0,0.0,0.0,0.0,0.0,0.0,0.0,0.0,9
2018-10-15, Ex Trump Economic Advisor Joins Blockchain Startup s Board of Advisors ,0.0,0.0,0.0,0.0,0.0,0.0,0.0,0.0,0.0,0.0,0.0,11
2018-10-15,Exclusive  HNA held talks with Ant  others as it weighs options for IT unit Pactera   sources,0.0,0.0,0.0,0.0,0.0,0.0,0.0,0.0,0.0,0.0,0.0,16
2018-10-14,Barclays to challenge Goldman in digital only bank market  FT,0.025,0.025,0.025,0.0,0.0,0.025,0.0,0.0,0.0,0.0,0.0,10
2018-10-12,Dina Powell withdraws from consideration for U S  envoy to U N   source,0.0,0.0,0.0,0.0,0.0,0.0,0.0,0.0,0.0,0.0,0.0,13
2018-10-12, CDRX Welcomes Lex Sokolin to Advisory Board ,0.0,0.0,0.0,0.0,0.0,0.0,0.0,0.0,0.0,0.0,0.0,7
2018-10-12,Banks See Consumer Loan Costs Drop Despite Rising Rates,0.0,0.0,0.0,0.0,0.0,0.0,0.0,0.0,0.0,0.0,0.0,9
2018-10-12,Gold  10 Years After Lehman Brothers,0.0,0.0,0.0,0.0,0.0,0.0,0.0,0.0,0.0,0.0,0.0,6
2018-10-12,SoftBank picks Nomura  Goldman  three others to lead mobile unit s IPO  source,0.0,0.0,0.0,0.038461538461538464,0.0,0.0,0.038461538461538464,0.0,0.0,0.0,0.0,13
2018-10-11,Goldman Sachs Says Growth Fears Are Causing the Equity Meltdown,0.0,0.0,0.0,0.0,0.0,0.0,0.0,0.0,0.0,0.0,0.0,10
2018-10-11,China draws over  17 bln in orders for dollar bond sale,0.0,0.0,0.0,0.0,0.0,0.0,0.0,0.0,0.0,0.0,0.0,11
2018-10-11,Oil extends losses as markets fall  inventories climb,0.0,0.0,0.0625,0.0,0.0625,0.0,0.0,0.0,0.0,0.0,0.0,8
2018-10-11,Goldman Sachs to open new office in Britain for  Marcus  retail business,0.0,0.0,0.0,0.0,0.0,0.0,0.0,0.0,0.0,0.0,0.0,12
2018-10-10,Former adviser Powell just one of many being eyed for U N   Trump says,0.0,0.0,0.0,0.03571428571428571,0.0,0.03571428571428571,0.0,0.0,0.0,0.0,0.0,14
2018-10-10,Graphic  Rising U S  bond yields bring back Wall Street s sinking feeling,0.007692307692307693,0.007692307692307693,0.007692307692307693,0.007692307692307693,0.007692307692307693,0.007692307692307693,0.007692307692307693,0.007692307692307693,0.007692307692307693,0.007692307692307693,0.0,13
2018-10-09,Trump s U N  envoy Nikki Haley quits  denies 2020 ambitions,0.0,0.0,0.0,0.0,0.0,0.0,0.0,0.0,0.0,0.0,0.0,11
2018-10-09,Bain Capital Specialty Finance files for IPO  to list on NYSE,0.0,0.0,0.0,0.0,0.0,0.0,0.0,0.0,0.0,0.0,0.0,11
2018-10-08,Volkswagen set to hire four banks for truck unit IPO  sources,0.0,0.0,0.0,0.018181818181818184,0.0,0.03636363636363637,0.018181818181818184,0.018181818181818184,0.0,0.0,0.0,11
2018-10-08,China Sets Tone for Emerging Markets Suffering From Yield Fever,0.0,0.0,0.0,0.0,0.0,0.0,0.0,0.0,0.0,0.0,0.0,10
2018-10-05,Crude Advances as Alarm Bells Sound Over Impending Supply Crunch,0.0,0.0,0.0,0.0,0.0,0.0,0.0,0.0,0.0,0.0,0.0,10
2018-10-05,Oil Notches 4th Straight Weekly Gain Despite Sentiment Turn,0.0,0.0,0.0,0.0,0.0,0.0,0.0,0.0,0.0,0.0,0.0,9
2018-10-05,Goldman Says Trade Fear Driven Slide in China Has Gone Too Far,0.0,0.0,0.0,0.0,0.0,0.0,0.0,0.0,0.0,0.0,0.0,12
2018-10-05,After  600 Million Hit  India Oil Refiners May Face Further Pain,0.0,0.0,0.0,0.0,0.0,0.0,0.0,0.0,0.0,0.0,0.0,11
2018-10-05,Oil prices rise on Iran sanctions  outlook uncertain,0.025,0.025,0.025,0.0,0.0,0.0,0.0,0.0,0.025,0.025,0.0,8
2018-10-04,IMF deal will not shield Argentine peso from further losses  Reuters poll,0.0,0.0,0.0,0.013888888888888888,0.0,0.027777777777777776,0.013888888888888888,0.013888888888888888,0.0,0.013888888888888888,0.0,12
2018-10-03,China hires 12 banks for sovereign dollar bond issue,0.0,0.0,0.0,0.0,0.0,0.1111111111111111,0.0,0.0,0.0,0.0,0.0,9
2018-10-03,White House Economist Turns to Alternative Data to Boost Trump,0.0,0.0,0.0,0.0,0.0,0.0,0.0,0.0,0.0,0.0,0.0,10
2018-10-03,Aston Martin skids on market debut,0.0,0.0,0.0,0.0,0.0,0.0,0.0,0.0,0.0,0.0,0.0,6
2018-10-03,Market  discipline  on Italy  Be careful what you wish for  McGeever,0.0,0.0303030303030303,0.0303030303030303,0.0303030303030303,0.0,0.0,0.0,0.0,0.0,0.0,0.0,11
2018-10-03,Federal Reserve prepares for next crisis  bets it will begin like the last,0.0,0.0,0.07692307692307693,0.0,0.0,0.0,0.0,0.0,0.0,0.0,0.0,13
2018-10-03,Goldman forecasts South African economic rebound in 2019,0.0,0.0,0.0,0.0,0.0,0.0,0.0,0.0,0.0,0.0,0.0,8
2018-10-03,Goldman Sachs raises stake in Spain s DIA to more than 15 percent,0.0,0.0,0.0,0.0,0.0,0.0,0.0,0.0,0.0,0.0,0.0,13
2018-10-02,Italy Contagion Fears Bubbling Beneath Surface of Apparent Calm,0.0,0.0,0.0,0.0,0.0,0.0,0.0,0.0,0.0,0.0,0.0,9
2018-10-02,Goldman Sees Risk That Oil Will Hold  80  on Iran  Hedging Moves,0.0,0.0,0.0,0.0,0.0,0.0,0.0,0.0,0.0,0.0,0.0,12
2018-10-02,Global stocks turn tail as Italy angst grips Europe,0.0,0.0,0.1111111111111111,0.0,0.0,0.0,0.0,0.0,0.0,0.0,0.0,9
2018-10-02,Seahawks LB Kendricks suspended indefinitely,0.0,0.0,0.0,0.0,0.0,0.0,0.0,0.0,0.0,0.0,0.0,5
2018-10-01,Canada s Husky Energy offers to buy MEG Energy in  5 billion deal,0.0,0.0,0.0,0.015384615384615385,0.0,0.015384615384615385,0.015384615384615385,0.015384615384615385,0.0,0.015384615384615385,0.0,13
2018-10-01,Danske Bank picks interim CEO to soothe investor concerns over scandal,0.0,0.022727272727272728,0.022727272727272728,0.022727272727272728,0.0,0.0,0.022727272727272728,0.0,0.0,0.0,0.0,11
2018-09-28,Goldman Sees Italy Junk Risk Leading to  Sudden Stop  of Capital,0.0,0.0,0.0,0.0,0.0,0.0,0.0,0.0,0.0,0.0,0.0,11
2018-09-28,Icahn  CVR lose malpractice case against Wachtell Lipton law firm,0.016666666666666666,0.016666666666666666,0.025,0.0,0.016666666666666666,0.008333333333333333,0.0,0.0,0.008333333333333333,0.008333333333333333,0.0,10
2018-09-28,Goldman s Coleman Sees Significant Scope for Rand Strength,0.0,0.0,0.0,0.0,0.0,0.0,0.0,0.0,0.0,0.0,0.0,9
2018-09-28, Goldman Sachs Heads  25 Million Investment Round in Blockchain Startup Veem ,0.0,0.0,0.0,0.0,0.0,0.0,0.0,0.0,0.0,0.0,0.0,11
2018-09-27,Argentina s peso slips as investors fear volatility despite IMF deal,0.013986013986013986,0.013986013986013986,0.013986013986013986,0.006993006993006993,0.0,0.006993006993006993,0.013986013986013986,0.006993006993006993,0.0,0.013986013986013986,0.0,11
2018-09-27,Uber  Cabify drivers strike in Madrid to protest against planned law changes,0.027777777777777776,0.0,0.027777777777777776,0.0,0.0,0.027777777777777776,0.0,0.0,0.0,0.0,0.0,12
2018-09-27,Bear Traps For Stocks ,0.0,0.0,0.0,0.0,0.0,0.0,0.0,0.0,0.0,0.0,0.0,4
2018-09-27,Hong Kong queue of IPO hopefuls faces market reckoning,0.0,0.0,0.0,0.0,0.0,0.0,0.0,0.0,0.0,0.0,0.0,9
2018-09-26,Oil Falters as Trump Ups Pressure While Goldman Dissuades Bulls,0.0,0.0,0.0,0.0,0.0,0.0,0.0,0.0,0.0,0.0,0.0,10
2018-09-25,Goldman trading executive Bash Polley to depart at year end  memo,0.0,0.0,0.0,0.0,0.045454545454545456,0.0,0.045454545454545456,0.0,0.0,0.0,0.0,11
2018-09-24,EUR USD Plays To Counterpart s Fears,0.0,0.0,0.0,0.0,0.0,0.0,0.0,0.0,0.0,0.0,0.0,7
2018-09-24,Commodities Week Ahead  Gold Awaits Fed s Cue  Oil Bulls Emboldened By OPEC,0.0,0.0,0.0,0.0,0.0,0.0,0.0,0.0,0.0,0.0,0.0,13
2018-09-24,Morgan Stanley shifts emerging market stance to Neutral from Negative,0.0,0.0,0.0,0.0,0.0,0.0,0.0,0.0,0.0,0.0,0.0,10
2018-09-24,EU lawmakers move to tighten rules on London based investment banks,0.09090909090909091,0.0,0.0,0.0,0.0,0.0,0.0,0.0,0.0,0.0,0.0,11
2018-09-21,Fed s Powell between a rock and hard place  Ignore the yield curve or tight job market ,0.0,0.0,0.0,0.058823529411764705,0.0,0.0,0.0,0.0,0.0,0.0,0.0,17
2018-09-21,Copper sprints to best day in 19 months but gold falls as trade fears ease,0.0,0.0,0.0,0.04444444444444444,0.0,0.02222222222222222,0.0,0.0,0.0,0.0,0.0,15
2018-09-21,Lehman Brothers workers share memories 10 years after the fall,0.0,0.0,0.016666666666666666,0.016666666666666666,0.016666666666666666,0.016666666666666666,0.016666666666666666,0.016666666666666666,0.0,0.0,0.0,10
2018-09-21,Metal Prices in Rally Mode as Trade Fears Ease  Copper Soars to 12 Week High,0.0,0.0,0.0,0.0,0.0,0.0,0.0,0.0,0.0,0.0,0.0,15
2018-09-21,Goldman  Stronger dollar unlikely to derail bullish view on commodities,0.0,0.0,0.0,0.0,0.0,0.0,0.0,0.0,0.0,0.0,0.0,10
2018-09-20,Tencent Music Eyes  2 billion IPO in New York,0.0,0.0,0.0,0.0,0.0,0.0,0.0,0.0,0.0,0.0,0.0,9
2018-09-20,Forex   Dollar Sinks to Near Four Month Low as Emerging Market Currencies Boom,0.0,0.0,0.0,0.0,0.0,0.0,0.0,0.0,0.0,0.0,0.0,13
2018-09-20,iFOREX Daily Analysis   September 20 2018,0.0,0.0,0.0,0.0,0.0,0.0,0.0,0.0,0.0,0.0,0.0,6
2018-09-20,Market Exploits USD Vulnerabilities As Capital Importer Amid Rise In Global Yields,0.0,0.0,0.0,0.0,0.0,0.0,0.0,0.0,0.0,0.0,0.0,12
2018-09-20,Cryptocurrency has hit bottom  bitcoin due for renaissance  Novogratz,0.022222222222222223,0.0,0.044444444444444446,0.022222222222222223,0.022222222222222223,0.0,0.0,0.0,0.0,0.0,0.0,9
2018-09-19,Goldman names Dan Dees as new investment banking co chief  Bloomberg,0.0,0.0,0.0,0.0,0.0,0.0,0.0,0.0,0.0,0.0,0.0,11
2018-09-19,Bond Traders Move Closer to Fed  Ramping Up 2019 Rate Hike Bets,0.0,0.0,0.0,0.0,0.0,0.0,0.0,0.0,0.0,0.0,0.0,12
2018-09-19,Foreign  Korean Investors Duke It Out Over Samsung Electronics,0.0,0.0,0.0,0.0,0.0,0.0,0.0,0.0,0.0,0.0,0.0,9
2018-09-19,Goldman names Dan Dees as new investment banking co chief,0.0,0.0,0.0,0.0,0.0,0.0,0.0,0.0,0.0,0.0,0.0,10
2018-09-18,Hong Kong to allow dependent visa for same sex couples after landmark ruling,0.0,0.0,0.009615384615384616,0.019230769230769232,0.0,0.028846153846153848,0.009615384615384616,0.009615384615384616,0.0,0.0,0.0,13
2018-09-18,South African fintech JUMO to expand in Asia with Goldman Sachs backing,0.0,0.0,0.0,0.0,0.0,0.0,0.0,0.0,0.0,0.0,0.0,12
2018-09-18, Crypto Hedge Fund BlockTower Expanding despite Market Blues ,0.0,0.0,0.0,0.0,0.0,0.0,0.0,0.0,0.0,0.0,0.0,8
2018-09-18, Crypto Exchange Service Provider AlphaPoint Adds ETF Executive to Directors Board ,0.0,0.0,0.0,0.0,0.0,0.0,0.0,0.0,0.0,0.0,0.0,11
2018-09-17, Who broke the law   Cohn says in defending Wall Street s role in crisis,0.0,0.011904761904761904,0.023809523809523808,0.011904761904761904,0.011904761904761904,0.011904761904761904,0.0,0.0,0.0,0.0,0.0,14
2018-09-17,Goldman names Tim O Neill as vice chairman  memo,0.0,0.0,0.037037037037037035,0.037037037037037035,0.0,0.037037037037037035,0.0,0.0,0.0,0.0,0.0,9
2018-09-17,Goldman Sachs BDC amends revolving to reduce asset coverage requirement,0.0,0.0,0.0,0.1,0.0,0.0,0.0,0.0,0.0,0.0,0.0,10
2018-09-14,China to ask Wall Street for ideas on improving U S  ties,0.0,0.0,0.0,0.08333333333333333,0.0,0.0,0.0,0.0,0.0,0.0,0.0,12
2018-09-14,Hedge Funds Trim Leverage Anew in Sign of Caution on U S  Stocks,0.0,0.0,0.0,0.0,0.0,0.0,0.0,0.0,0.0,0.0,0.0,13
2018-09-14,Seahawks sign troubled LB Kendricks,0.0,0.0,0.0,0.0,0.0,0.0,0.0,0.0,0.0,0.0,0.0,5
2018-09-14,iFOREX Daily Analysis   September 14 2018,0.0,0.0,0.0,0.0,0.0,0.0,0.0,0.0,0.0,0.0,0.0,6
2018-09-14,Pimco s CEO Sees 55  Chance of Slowdown Over Next Two Years,0.0,0.0,0.0,0.0,0.0,0.0,0.0,0.0,0.0,0.0,0.0,12
2018-09-14,UK Labour warns big banks must never again be masters of the economy,0.0,0.0,0.0,0.0,0.0,0.07692307692307693,0.0,0.0,0.0,0.0,0.0,13
2018-09-14,How JPMorgan s CFO became the top prospect to succeed Dimon,0.0,0.0,0.0,0.0303030303030303,0.0,0.0202020202020202,0.0202020202020202,0.0101010101010101,0.0,0.0101010101010101,0.0,11
2018-09-14, Crypto News Weekly 14 09 18  Citibank into crypto  SEC gets heavy  no more 1000x gains ,0.0,0.0,0.0,0.0,0.0,0.0,0.0,0.0,0.0,0.0,0.0,16
2018-09-13,Reports  Seahawks to sign ex Eagles LB Kendricks,0.0,0.0,0.0,0.0,0.0,0.0,0.0,0.0,0.0,0.0,0.0,8
2018-09-13,Morgan Stanley to offer bitcoin swap trading   Bloomberg,0.0,0.0,0.0,0.125,0.0,0.0,0.0,0.0,0.0,0.0,0.0,8
2018-09-13,Cryptocurrencies Rise  Ethereum Surges 12  ,0.0,0.0,0.0,0.0,0.0,0.0,0.0,0.0,0.0,0.0,0.0,5
