date,title,anger,fear,negative,positive,sadness,trust,anticipation,joy,disgust,surprise,anticip,word_count
2018-02-01,Chevron  CVX  Q4 Earnings Jump  Helped By Rising Oil Price,0.0,0.0,0.0,0.0,0.0,0.0,0.0,0.0,0.0,0.0,0.0,10
2018-02-01,Ferrari  RACE  Soars  Stock Adds 7 3  In Session,0.0,0.0,0.0,0.0,0.0,0.0,0.0,0.0,0.0,0.0,0.0,9
2018-02-01,Should You Buy Arrow Electronics  ARW  Ahead Of Earnings ,0.0,0.0,0.0,0.0,0.0,0.0,0.0,0.0,0.0,0.0,0.0,9
2018-02-01,Is A Surprise Coming For Gartner  IT  This Earnings Season ,0.0,0.0,0.0,0.0,0.0,0.0,0.0,0.0,0.0,0.0,0.0,10
2018-02-01,Should You Buy HealthEquity  HQY  Ahead Of Earnings ,0.0,0.0,0.0,0.0,0.0,0.0,0.0,0.0,0.0,0.0,0.0,8
2018-02-01,Is Surprise Coming For Haemonetics  HAE  This Earnings Season ,0.0,0.0,0.0,0.0,0.0,0.0,0.0,0.0,0.0,0.0,0.0,9
2018-02-01,Open Text Corporation  OTEX  Jumps  Stock Rises 12 6 ,0.0,0.0,0.0,0.0,0.0,0.0,0.0,0.0,0.0,0.0,0.0,9
2018-01-31,Another head rolls in Goldman s commodity unit,0.0,0.0,0.0,0.0,0.0,0.0,0.0,0.0,0.0,0.0,0.0,8
2018-01-31,DXY  Hammered Again By Trump  Is FOMC Next ,0.0,0.0,0.0,0.0,0.0,0.0,0.0,0.0,0.0,0.0,0.0,8
2018-01-31,Top Goldman executive says women still not adequately represented in its workforce,0.0,0.0,0.0,0.08333333333333333,0.0,0.0,0.0,0.0,0.0,0.0,0.0,12
2018-01-30,ETFs To Watch If U S  Pulls Out Of NAFTA,0.0,0.0,0.0,0.0,0.0,0.0,0.0,0.0,0.0,0.0,0.0,10
2018-01-29,Risk Assets in Danger Zone as Bull Feeding Time Is a Frenzy,0.0,0.0,0.0,0.0,0.0,0.0,0.0,0.0,0.0,0.0,0.0,12
2018-01-29,DriveNow deal paves way for BMW Daimler alliance   source,0.0,0.0,0.0,0.018518518518518517,0.0,0.037037037037037035,0.018518518518518517,0.018518518518518517,0.0,0.018518518518518517,0.0,9
2018-01-29,ECB Meeting Puts These Euro ETFs In Focus,0.0,0.0,0.0,0.0,0.0,0.0,0.0,0.0,0.0,0.0,0.0,8
2018-01-29,Dogged by Brexit  Britain stumbles in race to woo China,0.0,0.0,0.0,0.0,0.0,0.0,0.0,0.0,0.0,0.0,0.0,10
2018-01-29,JPMorgan promotes Pinto and Smith  fueling race to succeed Dimon,0.0,0.0,0.0,0.02,0.0,0.02,0.02,0.02,0.0,0.02,0.0,10
2018-01-29,Forex   Dollar Holds Flat After Japan Data Sets As Attention Turns To Fed,0.0,0.0,0.0,0.0,0.0,0.0,0.0,0.0,0.0,0.0,0.0,13
2018-01-29,Forex  Dollar Gains Further On Yen In Asia As Focus Turns To Fed,0.0,0.0,0.0,0.0,0.0,0.0,0.0,0.0,0.0,0.0,0.0,13
2018-01-29,Gold Slips In Asia In Cautious Trade Ahead OF Fed Meeting Start,0.0,0.0,0.0,0.0,0.0,0.0,0.0,0.0,0.0,0.0,0.0,12
2018-01-28,India likely to put pedal to metal on asset sales,0.0,0.0,0.0,0.0,0.0,0.0,0.0,0.0,0.0,0.0,0.0,10
2018-01-28,With elections coming up  India s government will aim to woo rural voters in budget,0.0,0.016666666666666666,0.016666666666666666,0.0,0.0,0.016666666666666666,0.016666666666666666,0.0,0.0,0.0,0.0,15
2018-01-26,Goldman  Barclays  SocGen interested in Commerzbank unit  Handelsblatt,0.0,0.0,0.0,0.041666666666666664,0.041666666666666664,0.0,0.0,0.0,0.041666666666666664,0.0,0.0,8
2018-01-26,  Amid Selloff  Bearish Chorus on Cryptocurrencies Grows Louder ,0.0,0.0,0.0,0.0,0.0,0.0,0.0,0.0,0.0,0.0,0.0,8
2018-01-26,Copper Deals Off to Best Start in 12 Years as Prices Surge,0.0,0.0,0.0,0.0,0.0,0.0,0.0,0.0,0.0,0.0,0.0,12
2018-01-26,Hedge Fund Sees  Significant Correction  in Emerging Markets,0.0,0.0,0.0,0.0,0.0,0.0,0.0,0.0,0.0,0.0,0.0,8
2018-01-25,Exclusive  Commodities fund Jamison Capital to shut   source,0.0,0.0,0.0,0.0,0.0,0.0,0.0,0.0,0.0,0.0,0.0,8
2018-01-25,Blankfein  Days of 30  ROE are over  but 15  doable,0.0,0.0,0.0,0.0,0.0,0.0,0.0,0.0,0.0,0.0,0.0,10
2018-01-25,A Tale Of Two Currencies And The ETF Impact ,0.0,0.0,0.0,0.0,0.0,0.0,0.0,0.0,0.0,0.0,0.0,9
2018-01-25,Easton Pharma inks distribution deal with Bayer Consumer Health for VS Sense in Mexico,0.0,0.0,0.0,0.014285714285714287,0.0,0.014285714285714287,0.014285714285714287,0.014285714285714287,0.0,0.014285714285714287,0.0,14
2018-01-24,Scaramucci hits pause button on Las Vegas hedge fund party,0.0,0.0,0.0,0.0,0.0,0.0,0.0,0.0,0.0,0.0,0.0,10
2018-01-24,Bitcoin ETF Hype Meets Regulator Reality in Race to Be First,0.0,0.0,0.0,0.0,0.0,0.0,0.0,0.0,0.0,0.0,0.0,11
2018-01-23,Goldman Sachs Outlook A Relief to Cryptocurrency Investors,0.0,0.0,0.0,0.0,0.0,0.0,0.0,0.0,0.0,0.0,0.0,8
2018-01-23,Online lender SoFi nabs Twitter executive Noto as CEO,0.0,0.0,0.0,0.0,0.0,0.1111111111111111,0.0,0.0,0.0,0.0,0.0,9
2018-01-23,Trust in Latin America s growth outlook strengthens  poll,0.0,0.0,0.0,0.05555555555555555,0.0,0.05555555555555555,0.0,0.0,0.0,0.0,0.0,9
2018-01-23,Palo Alto Networks  3 5  as Deutsche Bank sees growth ahead,0.0,0.0,0.0,0.09090909090909091,0.0,0.0,0.0,0.0,0.0,0.0,0.0,11
2018-01-22,European shares trade sideways  focus on MA,0.0,0.0,0.0,0.07142857142857142,0.0,0.07142857142857142,0.0,0.0,0.0,0.0,0.0,7
2018-01-22,Goldman Sachs sees Ambev as Latin American outperformer,0.0,0.0,0.0,0.0,0.0,0.0,0.0,0.0,0.0,0.0,0.0,8
2018-01-22,UK economy will cope with Brexit hit as global economy grows  O Neill,0.019230769230769232,0.0,0.019230769230769232,0.0,0.0,0.038461538461538464,0.0,0.0,0.0,0.0,0.0,13
2018-01-21,Groupon  GRPN  Looks Good  Stock Adds 9  In Session,0.0,0.0,0.0,0.0,0.0,0.0,0.0,0.0,0.0,0.0,0.0,9
2018-01-18,Aramco CEO Says Ready for IPO as Listing Venues Up in Air,0.0,0.0,0.0,0.0,0.0,0.0,0.0,0.0,0.0,0.0,0.0,12
2018-01-18,Morgan Stanley raises targets  but Wall Street wants more,0.0,0.0,0.0,0.0,0.0,0.0,0.0,0.0,0.0,0.0,0.0,9
2018-01-18,Chart Of The Day  It May Be Time To Buy Goldman s Dip,0.0,0.0,0.0,0.0,0.0,0.0,0.0,0.0,0.0,0.0,0.0,13
2018-01-18,Adtran tumbles 11 7  as CenturyLink pause spurs target cuts,0.0,0.0,0.0,0.0,0.0,0.0,0.0,0.0,0.0,0.0,0.0,10
2018-01-18,Nokia  2 4  as Goldman cuts to Neutral,0.0,0.0,0.0,0.0,0.0,0.0,0.0,0.0,0.0,0.0,0.0,8
2018-01-18,Home security company ADT Inc s IPO priced at  14 per share,0.0,0.0,0.0,0.020833333333333332,0.0,0.020833333333333332,0.020833333333333332,0.020833333333333332,0.0,0.0,0.0,12
2018-01-18,Apollo owned security firm ADT s IPO prices below target,0.0,0.0,0.0,0.0,0.0,0.0,0.0,0.0,0.0,0.0,0.0,10
2018-01-17,Goldman Sachs downgrades Shutterfly with 13  downside,0.0,0.0,0.0,0.0,0.0,0.0,0.0,0.0,0.0,0.0,0.0,7
2018-01-17,Goldman Sachs Beats Consensus After Excluding Tax Charge  Shares Dip,0.0,0.0,0.0,0.0,0.0,0.0,0.0,0.0,0.0,0.0,0.0,10
2018-01-17,Goldman Sachs beats by  0 76  beats on revenue,0.0,0.0,0.0,0.0,0.0,0.0,0.0,0.0,0.0,0.0,0.0,9
2018-01-16,iFOREX Daily Analysis   January 16 2018,0.0,0.0,0.0,0.0,0.0,0.0,0.0,0.0,0.0,0.0,0.0,6
2018-01-16,Warning light  Mexican car sales slump ahead of election,0.0,0.0,0.037037037037037035,0.037037037037037035,0.037037037037037035,0.0,0.0,0.0,0.0,0.0,0.0,9
2018-01-16,Goldman s Commodity Revenue Said to Drop 75  to Lowest on Record,0.0,0.0,0.0,0.0,0.0,0.0,0.0,0.0,0.0,0.0,0.0,12
2018-01-16,Goldman to post historic tumble in commodity revenue,0.0,0.0,0.125,0.0,0.0,0.0,0.0,0.0,0.0,0.0,0.0,8
2018-01-15,Xiaomi taps CLSA  Morgan Stanley  Goldman for IPO sponsor role  sources,0.0,0.0,0.0,0.045454545454545456,0.0,0.045454545454545456,0.0,0.0,0.0,0.0,0.0,11
2018-01-12,Goldman thwarts fraud class action tied to Abacus CDO  U S  appeals court,0.02564102564102564,0.01282051282051282,0.01282051282051282,0.01282051282051282,0.0,0.0,0.01282051282051282,0.0,0.0,0.0,0.0,13
2018-01-12,Macroeconomic Outlook For 2018 and Gold,0.0,0.0,0.0,0.0,0.0,0.0,0.0,0.0,0.0,0.0,0.0,6
2018-01-12,Ethereum Eyes Test of All Time Highs as Rivals Struggle To Pare Losses,0.0,0.0,0.0,0.0,0.0,0.0,0.0,0.0,0.0,0.0,0.0,13
2018-01-11,S P cuts Brazil debt rating as pension reform doubts grow,0.008264462809917356,0.008264462809917356,0.01652892561983471,0.01652892561983471,0.01652892561983471,0.008264462809917356,0.008264462809917356,0.008264462809917356,0.0,0.0,0.0,11
2018-01-11,iFOREX Daily Analysis   January 11 2018,0.0,0.0,0.0,0.0,0.0,0.0,0.0,0.0,0.0,0.0,0.0,6
2018-01-11,HSBC revamping Asia Pacific business,0.0,0.0,0.0,0.0,0.0,0.0,0.0,0.0,0.0,0.0,0.0,5
2018-01-11,Dropbox files confidentially for U S  IPO  source,0.0,0.0,0.0,0.0,0.0,0.125,0.0,0.0,0.0,0.0,0.0,8
2018-01-11,Crude Oil Dips In Asia Despite Strong China Data on Oil Imports,0.0,0.0,0.0,0.0,0.0,0.0,0.0,0.0,0.0,0.0,0.0,12
2018-01-10,Exclusive  Saudi Aramco working to raise cheap loans before IPO   banking sources,0.0,0.0,0.041666666666666664,0.041666666666666664,0.0,0.0,0.0,0.0,0.0,0.0,0.0,12
2018-01-10,China s U S  bond rebalancing would hold few fears for Fed,0.0,0.0,0.0,0.0,0.0,0.0,0.0,0.0,0.0,0.0,0.0,12
2018-01-10,Citi says crude oil could hit  80 amid geopolitical wildcards,0.025,0.0,0.05,0.0,0.0,0.0,0.0,0.0,0.025,0.0,0.0,10
2018-01-10,Crude Advances to Highest Since 2014 as World s Surplus Shrivels,0.0,0.0,0.0,0.0,0.0,0.0,0.0,0.0,0.0,0.0,0.0,11
2018-01-10,Oceaneering wins Johan Castberg contract,0.0,0.0,0.0,0.0,0.0,0.0,0.0,0.0,0.0,0.0,0.0,5
2018-01-10,Crude Oil Mixed In Asia With Iran Economic Sanctions Waivers In Focus,0.0,0.0,0.0,0.0,0.0,0.0,0.0,0.0,0.0,0.0,0.0,12
2018-01-10,British PM May to meet finance bosses on Brexit,0.0,0.0,0.0,0.0,0.0,0.0,0.0,0.0,0.0,0.0,0.0,9
2018-01-10,Real estate investing startup Cadre partners with Goldman Sachs,0.0,0.0,0.0,0.0,0.0,0.0,0.0,0.0,0.0,0.0,0.0,9
2018-01-09,GOLDMAN SACHS  2 areas of tax reform could throw investors for a loop this earnings season,0.0,0.0,0.020833333333333332,0.020833333333333332,0.020833333333333332,0.0,0.0,0.0,0.0,0.0,0.0,16
2018-01-09,Mexico inflation at 16 1 2 year high  seen pressuring central bank,0.0,0.027777777777777776,0.027777777777777776,0.0,0.0,0.027777777777777776,0.0,0.0,0.0,0.0,0.0,12
2018-01-09,Who will lead Britain s central bank after Brexit ,0.0,0.0,0.0,0.05555555555555555,0.0,0.05555555555555555,0.0,0.0,0.0,0.0,0.0,9
2018-01-09,Goldman  Another weak year for the dollar,0.0,0.0,0.0,0.0,0.0,0.0,0.0,0.0,0.0,0.0,0.0,7
2018-01-08,Exclusive  Bankers invited to Saudi Arabia to pitch for Aramco listing roles,0.0,0.0,0.0,0.0,0.0,0.0,0.0,0.0,0.0,0.0,0.0,12
2018-01-08,Goldman  Citi Said to Be in Lead for Top Roles in Aramco IPO,0.0,0.0,0.0,0.0,0.0,0.0,0.0,0.0,0.0,0.0,0.0,13
2018-01-08,3 Sector ETFs For 2018,0.0,0.0,0.0,0.0,0.0,0.0,0.0,0.0,0.0,0.0,0.0,5
2018-01-07,Former WTO  Goldman and BP chief Peter Sutherland dies at 71,0.0,0.0,0.0,0.0,0.0,0.0,0.0,0.0,0.0,0.0,0.0,11
2018-01-05,Morgan Stanley to take  1 25 billion hit in fourth quarter from tax bill,0.017857142857142856,0.0,0.03571428571428571,0.0,0.017857142857142856,0.0,0.0,0.0,0.0,0.0,0.0,14
2018-01-05,Investors sense opportunities in Big Oil   but mind the gap,0.0,0.0,0.05,0.05,0.0,0.0,0.0,0.0,0.0,0.0,0.0,10
2018-01-04,Global private equity funds raise record  453 billion in 2017  Preqin,0.0,0.0,0.0,0.09090909090909091,0.0,0.0,0.0,0.0,0.0,0.0,0.0,11
2018-01-04,JPMorgan  Goldman Sachs come top of banker pay league in Britain,0.0,0.0,0.0,0.0303030303030303,0.0,0.0303030303030303,0.0202020202020202,0.0101010101010101,0.0,0.0,0.0,11
2018-01-04,Symphony chat platform faces outage due to unplanned maintenance,0.0,0.0,0.0,0.0,0.0,0.1111111111111111,0.0,0.0,0.0,0.0,0.0,9
2018-01-04,Apollo Global Partners With Varde To Buy Stake In OneMain,0.0,0.0,0.0,0.0,0.0,0.0,0.0,0.0,0.0,0.0,0.0,10
2018-01-03,U K  Said to Think Barnier Bluffing on No Brexit Deal for Banks,0.0,0.0,0.0,0.0,0.0,0.0,0.0,0.0,0.0,0.0,0.0,13
2018-01-02,The Zacks Analyst Blog Highlights  Cambria Value And Momentum  PowerShares S P 500 Value With Momentum  Schwab 1000 Index  IQ Chaikin U S  Large Cap And CurrencyShares Euro,0.0,0.0,0.0,0.0,0.0,0.0,0.0,0.0,0.0,0.0,0.0,28
2018-01-02,8 ETF Predictions For 2018,0.0,0.0,0.0,0.0,0.0,0.0,0.0,0.0,0.0,0.0,0.0,5
2018-01-02,Forex   Aussie Down In Asia  Dollar Up As Geopolitical Tensions Worry,0.0,0.0,0.0,0.0,0.0,0.0,0.0,0.0,0.0,0.0,0.0,11
2018-01-02,Forex   Aussie Gains In Asia On Upbeat Views Of China Growth,0.0,0.0,0.0,0.0,0.0,0.0,0.0,0.0,0.0,0.0,0.0,11
2018-01-02,PG E drops after downgrades  Goldman warns fire claims could take years,0.0,0.08333333333333333,0.0,0.0,0.0,0.0,0.0,0.0,0.0,0.0,0.0,12
2018-01-01,Australia s Brambles estimates one time benefit from U S  tax reform,0.0,0.0,0.016666666666666666,0.03333333333333333,0.016666666666666666,0.0,0.016666666666666666,0.0,0.0,0.0,0.0,12
2018-01-01,Goldman Sachs Sees Economy Stregthening in 2018  Warns About Crypto  Credit ,0.0,0.0,0.0,0.0,0.0,0.0,0.0,0.0,0.0,0.0,0.0,11
2017-12-29,After A Stellar 2017  Will Euro ETFs Beat Greenback In 2018 ,0.0,0.0,0.0,0.0,0.0,0.0,0.0,0.0,0.0,0.0,0.0,11
2017-12-28,Goldman Sachs picks Dublin for asset management unit post Brexit  source,0.0,0.0,0.0,0.045454545454545456,0.0,0.045454545454545456,0.0,0.0,0.0,0.0,0.0,11
2017-12-28,Japan s Nomura poised to start China retail brokerage business  CEO,0.0,0.0,0.0,0.0,0.0,0.0,0.09090909090909091,0.0,0.0,0.0,0.0,11
2017-12-28,Bond bosses  best trades for 2018,0.0,0.0,0.0,0.0,0.0,0.0,0.0,0.0,0.0,0.0,0.0,6
2017-12-26,Ex Kit Digital CEO  associate convicted in U S  of fraud schemes,0.020833333333333332,0.0,0.020833333333333332,0.020833333333333332,0.0,0.020833333333333332,0.0,0.0,0.0,0.0,0.0,12
2017-12-26,3 Zacks Rank  1 Large Cap Value Mutual Funds To Buy,0.0,0.0,0.0,0.0,0.0,0.0,0.0,0.0,0.0,0.0,0.0,11
2017-12-26,GS Looks Capped Here,0.0,0.0,0.0,0.0,0.0,0.0,0.0,0.0,0.0,0.0,0.0,4
2017-12-25,Treasury Secretary Mnuchin was sent gift wrapped box of horse manure  reports,0.0,0.0,0.011904761904761904,0.011904761904761904,0.0,0.011904761904761904,0.011904761904761904,0.011904761904761904,0.011904761904761904,0.011904761904761904,0.0,12
2017-12-23,Bitcoin Climbs  Finding Floor After Worst Selloff Since 2015,0.0,0.0,0.0,0.0,0.0,0.0,0.0,0.0,0.0,0.0,0.0,9
2017-12-23,Goldman Sees Rate Hikes Ahead as Slack Wrung Out of Labor Market,0.0,0.0,0.0,0.0,0.0,0.0,0.0,0.0,0.0,0.0,0.0,12
2017-12-22,Bitcoin Plunges as  Sharks  Circle in Key Test of Cryptocurrency,0.0,0.0,0.0,0.0,0.0,0.0,0.0,0.0,0.0,0.0,0.0,10
2017-12-22,Bitcoin Fights Back From  13 000 as Selloff Enters Fourth Day,0.0,0.0,0.0,0.0,0.0,0.0,0.0,0.0,0.0,0.0,0.0,11
2017-12-22,Is EU Ahead Of A Political Storm  ,0.0,0.0,0.0,0.0,0.0,0.0,0.0,0.0,0.0,0.0,0.0,7
2017-12-22,Bitcoin Tumbles Through  13 000 as  Sharks Start to Circle ,0.0,0.0,0.0,0.0,0.0,0.0,0.0,0.0,0.0,0.0,0.0,10
2017-12-22,Goldman bearish on U S  Treasuries market in 2018,0.05555555555555555,0.05555555555555555,0.0,0.0,0.0,0.0,0.0,0.0,0.0,0.0,0.0,9
2017-12-21,Central Bank To Directly Control Investment Banks In EU,0.0,0.0,0.0,0.0,0.0,0.0,0.0,0.0,0.0,0.0,0.0,9
2017-12-21,Goldman Sachs to set up cryptocurrency trading desk  Bloomberg,0.0,0.0,0.0,0.0,0.0,0.0,0.0,0.0,0.0,0.0,0.0,9
2017-12-21,Goldman putting together crypto trading desk   Bloomberg,0.0,0.0,0.0,0.0,0.0,0.0,0.0,0.0,0.0,0.0,0.0,7
2017-12-21,iFOREX Daily Analysis   December 21 2017,0.0,0.0,0.0,0.0,0.0,0.0,0.0,0.0,0.0,0.0,0.0,6
2017-12-21,Global demand may cut short OPEC cuts  Goldman says ,0.05555555555555555,0.0,0.05555555555555555,0.0,0.0,0.0,0.0,0.0,0.0,0.0,0.0,9
2017-12-20,Crude Rises Near  58 as U S  Storage Tumbles  Exports Surge,0.0,0.0,0.0,0.0,0.0,0.0,0.0,0.0,0.0,0.0,0.0,11
2017-12-20,Think This Is The Longest Bull Market Ever  Not Yet ,0.0,0.0,0.0,0.0,0.0,0.0,0.0,0.0,0.0,0.0,0.0,10
2017-12-20,Bank of England to spare EU banks from costly rules  if Brexit goes well,0.0,0.0,0.0,0.0,0.0,0.0,0.0,0.0,0.0,0.0,0.0,14
2017-12-19,Fed s Dots Have Lost the Plot as Economists Puzzle Over Outlook,0.0,0.0,0.0,0.0,0.0,0.0,0.0,0.0,0.0,0.0,0.0,12
2017-12-19,U S  Bancorp declares  0 30 dividend,0.0,0.0,0.0,0.0,0.0,0.0,0.0,0.0,0.0,0.0,0.0,7
2017-12-19,Fiat On Fire  Key Investor Tactics,0.0,0.0,0.0,0.0,0.0,0.0,0.0,0.0,0.0,0.0,0.0,6
2017-12-18,German Vonovia climbs property ladder with  6 1 billion Buwog deal,0.0,0.0,0.0,0.018181818181818184,0.0,0.018181818181818184,0.018181818181818184,0.018181818181818184,0.0,0.018181818181818184,0.0,11
2017-12-18,Casino operator Penn National to buy Pinnacle in  2 8 billion deal,0.0,0.0,0.0,0.016666666666666666,0.0,0.016666666666666666,0.016666666666666666,0.016666666666666666,0.0,0.016666666666666666,0.0,12
2017-12-16,Zuma calls for party unity as ANC meets to elect new leader,0.0,0.0,0.009259259259259259,0.027777777777777776,0.0,0.037037037037037035,0.009259259259259259,0.0,0.0,0.0,0.0,12
2017-12-15,Steinhoff s ex chairman Wiese calls off  2 6 billion Shoprite deal,0.0,0.0,0.008333333333333333,0.016666666666666666,0.0,0.024999999999999998,0.016666666666666666,0.008333333333333333,0.0,0.008333333333333333,0.0,12
2017-12-15,Unilever to sell spreads business to KKR for  8 billion,0.0,0.0,0.0,0.0,0.0,0.0,0.0,0.0,0.0,0.0,0.0,10
2017-12-15,iFOREX Daily Analysis   December 15 2017,0.0,0.0,0.0,0.0,0.0,0.0,0.0,0.0,0.0,0.0,0.0,6
2017-12-14,Oil Peeks Above  57 a Barrel Amid Conflicting Signals on Glut,0.0,0.0,0.0,0.0,0.0,0.0,0.0,0.0,0.0,0.0,0.0,11
2017-12-13,Bitcoin Frenzy is Not Taking Demand from Gold  Goldman Sachs Says ,0.0,0.0,0.0,0.0,0.0,0.0,0.0,0.0,0.0,0.0,0.0,11
2017-12-13,DoubleLine s Gundlach says investors should add commodities in portfolios  CNBC,0.0,0.0,0.0,0.0,0.0,0.0,0.0,0.0,0.0,0.0,0.0,11
2017-12-12,The Hot Spots That Defined a Year of Emerging Market Ebullience,0.0,0.0,0.0,0.0,0.0,0.0,0.0,0.0,0.0,0.0,0.0,11
2017-12-12,Goldman Sachs to have Labour over for tea as City seeks warmer ties,0.0,0.0,0.0,0.0,0.0,0.0,0.0,0.0,0.0,0.0,0.0,13
2017-12-12,Follow Goldman To Invest In Commodity ETFs For 2018,0.0,0.0,0.0,0.0,0.0,0.0,0.0,0.0,0.0,0.0,0.0,9
2017-12-12,Is Bitcoin Stealing Gold s Luster   ,0.0,0.0,0.0,0.0,0.0,0.0,0.0,0.0,0.0,0.0,0.0,6
2017-12-12,Bitcoin euphoria puts other retail bets in shade,0.0,0.0,0.0,0.0,0.0,0.0,0.0,0.0,0.0,0.0,0.0,8
2017-12-12,Bitcoin Frenzy Poses No Threat to Bullion  Goldman Sachs Says,0.0,0.0,0.0,0.0,0.0,0.0,0.0,0.0,0.0,0.0,0.0,10
2017-12-11,Brent Reaches Highest Since 2015 After Forties Pipeline Shutdown,0.0,0.0,0.0,0.0,0.0,0.0,0.0,0.0,0.0,0.0,0.0,9
2017-12-11,U S  Treasury tax study slammed as  fake math  by Democrats,0.0,0.0,0.045454545454545456,0.022727272727272728,0.022727272727272728,0.0,0.0,0.0,0.0,0.0,0.0,11
2017-12-11,Here s Why Bluebird Bio  BLUE  Stock Skyrocketed Today,0.0,0.0,0.0,0.0,0.0,0.0,0.0,0.0,0.0,0.0,0.0,9
2017-12-11,Inmarsat tumbles as Goldman cuts expectations until late 2018,0.0,0.0,0.05555555555555555,0.0,0.05555555555555555,0.0,0.0,0.0,0.0,0.0,0.0,9
2017-12-11,Uber s London license appeal to be heard next year,0.0,0.0,0.0,0.0,0.0,0.0,0.1,0.0,0.0,0.0,0.0,10
2017-12-08,iFOREX Daily Analysis   December 08 2017,0.0,0.0,0.0,0.0,0.0,0.0,0.0,0.0,0.0,0.0,0.0,6
2017-12-08,Is Bitcoin The Paris Hilton Of The Currency World ,0.0,0.0,0.0,0.0,0.0,0.0,0.0,0.0,0.0,0.0,0.0,9
2017-12-08,Exclusive  Contenders emerge for No 2 Fed job  search to narrow,0.0,0.0,0.0,0.09090909090909091,0.0,0.0,0.0,0.0,0.0,0.0,0.0,11
2017-12-08,Steinhoff shares climb off 14 year low in volatile trade,0.0,0.0,0.0,0.0,0.0,0.1,0.0,0.0,0.0,0.0,0.0,10
2017-12-07,The Risk If Central Banks Get Trigger Happy in 2018  Daniel Moss,0.0,0.0,0.0,0.0,0.0,0.0,0.0,0.0,0.0,0.0,0.0,12
2017-12-07,Goldman Sachs to clear bitcoin futures  spokeswoman,0.0,0.0,0.0,0.0,0.0,0.0,0.0,0.0,0.0,0.0,0.0,7
2017-12-06,Tronox to fight FTC lawsuit  JPM sees standalone value at  16 without Cristal,0.017094017094017092,0.017094017094017092,0.017094017094017092,0.0,0.008547008547008546,0.0,0.0,0.0,0.008547008547008546,0.008547008547008546,0.0,13
2017-12-06, We May Be Stupid  For Waiting On Bitcoin Futures  NYSE Chairman Says ,0.0,0.0,0.0,0.0,0.0,0.0,0.0,0.0,0.0,0.0,0.0,12
2017-12-06,BGC Partners Wows Investors With New IPO Roadshow,0.0,0.0,0.0,0.0,0.0,0.0,0.0,0.0,0.0,0.0,0.0,8
2017-12-06,Chemours  4 7  after Goldman downgrade,0.0,0.0,0.0,0.0,0.0,0.0,0.0,0.0,0.0,0.0,0.0,6
2017-12-06,Bitcoin Party On Wall Street ,0.0,0.0,0.0,0.0,0.0,0.0,0.0,0.0,0.0,0.0,0.0,5
2017-12-05,Goldman Sachs  Standard Chartered eye 750 new jobs in Poland,0.0,0.0,0.0,0.0,0.0,0.0,0.0,0.0,0.0,0.0,0.0,10
2017-12-05,Fears over Rising U S  Wealth Inequality Take Shine off Tax Bill ,0.0,0.0,0.0,0.0,0.0,0.0,0.0,0.0,0.0,0.0,0.0,12
2017-12-05,Senate Passage Of Tax Bill Sends The Dow And S p To New All time Highs   Sell,0.0,0.0,0.0,0.0,0.0,0.0,0.058823529411764705,0.0,0.0,0.0,0.0,17
2017-12-05,Crude Oil Mostly Steady In Asia After API Estimates  Risks Monitored,0.0,0.0,0.0,0.0,0.0,0.0,0.0,0.0,0.0,0.0,0.0,11
2017-12-05,Oil Climbs as OPEC Tightening Dovetails With U S  Supply Drop,0.0,0.0,0.0,0.0,0.0,0.0,0.0,0.0,0.0,0.0,0.0,11
2017-12-05,Top Investing Areas Of 2017   Their Top ETFs ,0.0,0.0,0.0,0.0,0.0,0.0,0.0,0.0,0.0,0.0,0.0,8
2017-12-04,Democrat cites drafting error in proposed capital rule amendment,0.0,0.027777777777777776,0.027777777777777776,0.0,0.027777777777777776,0.027777777777777776,0.0,0.0,0.0,0.0,0.0,9
2017-12-04,Crude Oil Prices Settle Lower  Focus Shifts to US Output,0.0,0.0,0.0,0.0,0.0,0.0,0.0,0.0,0.0,0.0,0.0,10
2017-12-04,Dollar Higher On Senate Tax Bill Passage  Cautious Ahead Of Busy Week  ,0.0,0.0,0.0,0.0,0.0,0.0,0.0,0.0,0.0,0.0,0.0,12
2017-12-04,Singapore Stocks To Watch,0.0,0.0,0.0,0.0,0.0,0.0,0.0,0.0,0.0,0.0,0.0,4
2017-12-03,Forex   Dollar Gains Further On Yen With Senate Tax Cut Effort  US Politics Eyed,0.0,0.0,0.0,0.0,0.0,0.0,0.0,0.0,0.0,0.0,0.0,14
2017-12-03,Asian Shares Gain With Hang Seng Up Smartly As US Tax Cuts Get Nearer,0.0,0.0,0.0,0.0,0.0,0.0,0.0,0.0,0.0,0.0,0.0,14
2017-12-01,Crude Oil Prices Settle Higher  Traders Expected Inventory Drawdowns to Continue,0.0,0.0,0.0,0.0,0.0,0.0,0.0,0.0,0.0,0.0,0.0,11
2017-12-01,Wall Street hiking corporate profit forecasts on tax cut expectations,0.0,0.0,0.05,0.0,0.05,0.0,0.0,0.0,0.0,0.0,0.0,10
2017-11-30,Goldman eschews bitcoin but wants to help clients crypto trade,0.0,0.0,0.0,0.0,0.0,0.1,0.0,0.0,0.0,0.0,0.0,10
2017-11-30,Post Harvest News  Ethanol Mandate Ahead,0.0,0.0,0.0,0.0,0.0,0.0,0.0,0.0,0.0,0.0,0.0,6
2017-11-30,Blankfein Says Too Soon for Bitcoin Plan as Volatility Jumps,0.0,0.0,0.0,0.0,0.0,0.0,0.0,0.0,0.0,0.0,0.0,10
2017-11-30,Financials help European shares shrug off tech tumble  OPEC anticipation,0.0,0.0,0.05,0.0,0.0,0.0,0.05,0.0,0.0,0.0,0.0,10
2017-11-30,Hedge fund Hutchin Hill shuts down after three bad years,0.02,0.02,0.02,0.0,0.02,0.0,0.0,0.0,0.02,0.0,0.0,10
2017-11-29,Dow Rallies  More Upside For ETFs ,0.0,0.0,0.0,0.0,0.0,0.0,0.0,0.0,0.0,0.0,0.0,6
2017-11-29,Tech Stocks Rout Deepens in Asia as Rally Pauses  Markets Wrap,0.0,0.0,0.0,0.0,0.0,0.0,0.0,0.0,0.0,0.0,0.0,11
2017-11-29,Exclusive  Goldman strengthens Italy foothold with bigger Milan office   sources,0.0,0.0,0.0,0.0,0.0,0.0,0.0,0.0,0.0,0.0,0.0,10
2017-11-29,Oil Pulled Lower as  Done Deal  Proves Elusive on Supply Cuts,0.0,0.0,0.0,0.0,0.0,0.0,0.0,0.0,0.0,0.0,0.0,11
2017-11-29,S P 500 Futures  Monday After Thanksgiving Keeps Giving,0.0,0.0,0.0,0.0,0.0,0.0,0.0,0.0,0.0,0.0,0.0,9
2017-11-28,Crude Wavers Amid Russia s Shaky Stance on OPEC Deal Extension,0.0,0.0,0.0,0.0,0.0,0.0,0.0,0.0,0.0,0.0,0.0,11
2017-11-28,Crude Oil Down In Asia On API Estimates  All Eyes On OPEC,0.0,0.0,0.0,0.0,0.0,0.0,0.0,0.0,0.0,0.0,0.0,12
2017-11-28,Uber signs first Southeast Asian e wallet deal with Vietnam s MoMo,0.0,0.0,0.0,0.016666666666666666,0.0,0.016666666666666666,0.016666666666666666,0.016666666666666666,0.0,0.016666666666666666,0.0,12
2017-11-28,Goldman Sachs among bidders for Scotiabank s metals unit  sources,0.0,0.0,0.0,0.0,0.0,0.0,0.0,0.0,0.0,0.0,0.0,10
2017-11-28,OPEC meeting outcome  more uncertain than usual    Goldman Sachs,0.013888888888888888,0.013888888888888888,0.013888888888888888,0.027777777777777776,0.0,0.013888888888888888,0.0,0.0,0.013888888888888888,0.013888888888888888,0.0,9
2017-11-27,Goldman calls outcome of upcoming OPEC meeting uncertain,0.013888888888888888,0.013888888888888888,0.027777777777777776,0.013888888888888888,0.0,0.013888888888888888,0.013888888888888888,0.0,0.013888888888888888,0.013888888888888888,0.0,8
2017-11-26,Market Cycles Point Toward A Down Week For Stocks,0.0,0.0,0.0,0.0,0.0,0.0,0.0,0.0,0.0,0.0,0.0,9
2017-11-24,JP Morgan  eyeing Brexit  rents more space in Frankfurt  source,0.0,0.0,0.0,0.0,0.0,0.0,0.0,0.0,0.0,0.0,0.0,10
2017-11-24,Longest S P 500 Rally Ever  It s Wall Street s Official Forecast,0.0,0.0,0.0,0.0,0.0,0.0,0.0,0.0,0.0,0.0,0.0,13
2017-11-24,Mexico economy shrinks for first time in nearly two years,0.0,0.0,0.0,0.0,0.0,0.05,0.05,0.0,0.0,0.0,0.0,10
2017-11-24,U K  Labour Consults  57 Billion Hedge Fund Shorting Pound,0.0,0.0,0.0,0.0,0.0,0.0,0.0,0.0,0.0,0.0,0.0,10
2017-11-23,Senior HSBC investment banker Westerman leaves after two years,0.0,0.0,0.0,0.0,0.0,0.1111111111111111,0.0,0.0,0.0,0.0,0.0,9
2017-11-23,Early November inflation spikes as Mexico central bank chief packs bags,0.0,0.0303030303030303,0.0303030303030303,0.0,0.0,0.0303030303030303,0.0,0.0,0.0,0.0,0.0,11
2017-11-22,GOLDMAN SACHS  Here s how to make a killing in the market this Black Friday,0.016666666666666666,0.016666666666666666,0.016666666666666666,0.0,0.016666666666666666,0.0,0.0,0.0,0.0,0.0,0.0,15
2017-11-22,S P 500 To Hit 2800 In 2018  Play These ETFs,0.0,0.0,0.0,0.0,0.0,0.0,0.0,0.0,0.0,0.0,0.0,11
2017-11-22,World stocks ride tech boom to scale new highs in pre Thanksgiving rally,0.0,0.0,0.07692307692307693,0.0,0.0,0.0,0.0,0.0,0.0,0.0,0.0,13
2017-11-22,Gold Fund Catches Bitcoin Fever as Crypto Bulls See  10 000,0.0,0.0,0.0,0.0,0.0,0.0,0.0,0.0,0.0,0.0,0.0,11
2017-11-22,Bitcoin Will End the Year at  10 000 says Mike Novogratz ,0.0,0.0,0.0,0.0,0.0,0.0,0.0,0.0,0.0,0.0,0.0,11
2017-11-21,Crowds to crowdfunding  Soccer ace targets fans  hearts and wallets,0.0,0.0,0.0,0.1,0.0,0.0,0.0,0.0,0.0,0.0,0.0,10
2017-11-21,Indonesia court rules against Goldman in Hanson share ownership dispute,0.02,0.01,0.01,0.02,0.0,0.01,0.02,0.01,0.0,0.0,0.0,10
2017-11-21,Follow Goldman With These ETFs For 2018,0.0,0.0,0.0,0.0,0.0,0.0,0.0,0.0,0.0,0.0,0.0,7
2017-11-21,Paris watchdog win bolsters its fight for Brexit banks,0.022222222222222223,0.022222222222222223,0.022222222222222223,0.022222222222222223,0.0,0.022222222222222223,0.0,0.0,0.0,0.0,0.0,9
2017-11-21,One Country  Two Systems Roils China s Mills as Curbs Bite,0.0,0.0,0.0,0.0,0.0,0.0,0.0,0.0,0.0,0.0,0.0,11
2017-11-20,Daily Currency Outlook  EUR JPY   November 20 2017,0.0,0.0,0.0,0.0,0.0,0.0,0.0,0.0,0.0,0.0,0.0,8
