date,title,anger,fear,negative,positive,sadness,trust,anticipation,joy,disgust,surprise,anticip,word_count
2017-05-09,Here s How To Play IBM Post Buffett,0.0,0.0,0.0,0.0,0.0,0.0,0.0,0.0,0.0,0.0,0.0,8
2017-05-08,IBM dips on S P downgrade,0.0,0.0,0.0,0.0,0.0,0.0,0.0,0.0,0.0,0.0,0.0,6
2017-05-08,Jim Cramer On IBM's Future After Buffett Cut Stake,0.0,0.0,0.0,0.0,0.0,0.0,0.0,0.0,0.0,0.0,0.0,10
2017-05-08,Benzinga's Bulls And Bears For The Past Week: Semiconductors And Warren Buffett,0.0,0.0,0.0,0.0,0.0,0.0,0.0,0.0,0.0,0.0,0.0,14
2017-05-08,"At Berkshire Hathaway General Meeting, Charlie Munger Apologizes For Not Buying Google And Wal-Mart",0.0,0.0,0.0,0.0,0.0,0.0,0.0,0.0,0.0,0.0,0.0,15
2017-05-07,CA Inc  CA  To Report Q4 Earnings  What s In The Cards  ,0.0,0.0,0.0,0.0,0.0,0.0,0.0,0.0,0.0,0.0,0.0,12
2017-05-07,Chaos Theory And The Financial Markets,0.0,0.0,0.0,0.0,0.0,0.0,0.0,0.0,0.0,0.0,0.0,6
2017-05-06,Buffett Says Thought IBM Would Have Done Better Over Six Years Than It Has; Says Will Find Out Whether I'm Right or Wrong on Apple Investment,0.0,0.0,0.0,0.0,0.0,0.0,0.0,0.0,0.0,0.0,0.0,28
2017-05-05,Are You Selling IBM Just Because Buffett Trimmed His Position?,0.0,0.0,0.0,0.0,0.0,0.0,0.0,0.0,0.0,0.0,0.0,11
2017-05-05,"Pre-Market Imbalance Update: IBM 110K Shares to Sell, Twitter 100K to Sell, Ford 63K Shares to Buy, Merck 62K to Sell, Disney 38K to Sell, P&G 20K to Sell",0.0,0.0,0.0,0.0,0.0,0.0,0.0,0.0,0.0,0.0,0.0,37
2017-05-05,IBM Sellers Get Carried Away After Buffett Disclosure,0.0,0.0,0.0,0.0,0.0,0.0,0.0,0.0,0.0,0.0,0.0,8
2017-05-05,U S  stock index futures flat before U S  jobs report  IBM eyed ,0.0,0.0,0.0,0.0,0.0,0.0,0.0,0.0,0.0,0.0,0.0,13
2017-05-05,Kevin O'Leary Talks The 'Buffett Curse' And Why Apple Would Be Foolish To Buy Netflix,0.0,0.0,0.0,0.0,0.0,0.0,0.0,0.0,0.0,0.0,0.0,16
2017-05-05,"IBM -1.3% Premarket @$157 Following CNBC Report Warren Buffet Sold One-Third of Stake During Q1, Q2",0.0,0.0,0.0,0.0,0.0,0.0,0.0,0.0,0.0,0.0,0.0,20
2017-05-05,Warren Buffett Explains Why He Dumped A Third Of His IBM Stock,0.0,0.0,0.0,0.0,0.0,0.0,0.0,0.0,0.0,0.0,0.0,12
2017-05-05,Top 5 things to watch today ,0.0,0.08333333333333333,0.0,0.0,0.0,0.0,0.08333333333333333,0.0,0.0,0.0,0.0,6
2017-05-05,IBM falls after Buffett discloses move,0.0,0.0,0.0,0.0,0.0,0.0,0.0,0.0,0.0,0.0,0.0,6
2017-05-05,S P cuts IBM s credit rating,0.023809523809523808,0.023809523809523808,0.023809523809523808,0.023809523809523808,0.023809523809523808,0.023809523809523808,0.0,0.0,0.0,0.0,0.0,7
2017-05-04,Buffett  I ve sold a third of IBM stake this year,0.0,0.0,0.0,0.0,0.0,0.0,0.0,0.0,0.0,0.0,0.0,11
2017-05-04,Here's How Trump's Tax Plan Could Impact 8 Of The Largest US Tech Giants,0.0,0.0,0.0,0.0,0.0,0.0,0.0,0.0,0.0,0.0,0.0,16
2017-05-04,CNBCnow  Tweet: BREAKING: Warren Buffett tells CNBC that he sold off about a third of his $IBM stake in the 1st and 2nd quarters of 2017,0.0,0.0,0.0,0.0,0.0,0.0,0.0,0.0,0.0,0.0,0.0,29
2017-05-03,Moody s downgrades IBM on cash flow  profit concerns,0.015873015873015872,0.015873015873015872,0.0,0.031746031746031744,0.0,0.015873015873015872,0.015873015873015872,0.015873015873015872,0.0,0.0,0.0,9
2017-05-02,German project looks to home photovoltaic systems to help grid,0.0,0.0,0.0,0.0,0.0,0.0,0.0,0.0,0.0,0.0,0.0,10
2017-05-02,"Jim Cramer Shares His Thoughts On IBM, Oclaro And Johnson Controls",0.0,0.0,0.0,0.0,0.0,0.0,0.0,0.0,0.0,0.0,0.0,12
2017-05-01,Here s How To Trade IBM,0.0,0.0,0.0,0.0,0.0,0.0,0.0,0.0,0.0,0.0,0.0,6
2017-04-25,IBM Raises Qtr. Dividend from $1.40 to $1.50/Share,0.0,0.0,0.0,0.0,0.0,0.0,0.0,0.0,0.0,0.0,0.0,11
2017-04-25,IBM holds shareholder meeting,0.0,0.0,0.0,0.0,0.0,0.0,0.0,0.0,0.0,0.0,0.0,4
2017-04-25,ABB  IBM partner on industrial AI,0.0,0.0,0.0,0.16666666666666666,0.0,0.0,0.0,0.0,0.0,0.0,0.0,6
2017-04-24,WANdisco  Good Progress Continues ,0.0,0.0,0.0,0.0,0.0,0.0,0.0,0.0,0.0,0.0,0.0,4
2017-04-24,Wells Fargo sees smaller dividend hike coming from IBM,0.0,0.0,0.0,0.0,0.0,0.0,0.1111111111111111,0.0,0.0,0.0,0.0,9
2017-04-23,IBM Celebrates An Awkward Anniversary,0.0,0.0,0.0,0.0,0.0,0.0,0.0,0.0,0.0,0.0,0.0,5
2017-04-22,Warren Buffett Lost A Lot Of Money On IBM This Week,0.0,0.0,0.0,0.0,0.0,0.0,0.0,0.0,0.0,0.0,0.0,11
2017-04-21,Pro: Top Technology Tips Include Industry Juggernauts And Struggling Fitbit,0.0,0.0,0.0,0.0,0.0,0.0,0.0,0.0,0.0,0.0,0.0,11
2017-04-21,Steer Clear Of The Ugliest Earnings Streak In Tech,0.0,0.0,0.0,0.0,0.0,0.0,0.0,0.0,0.0,0.0,0.0,9
2017-04-20,Q1 Earnings Results Collide With Geopolitics And Oil,0.0,0.0,0.0,0.0,0.0,0.0,0.0,0.0,0.0,0.0,0.0,8
2017-04-20,The Lucky Beneficiaries Of Tax Day,0.0,0.0,0.0,0.0,0.0,0.0,0.0,0.0,0.0,0.0,0.0,6
2017-04-20,iFOREX Daily Analysis   April 20 2017,0.0,0.0,0.0,0.0,0.0,0.0,0.0,0.0,0.0,0.0,0.0,6
2017-04-20,The Zacks Analyst Blog Highlights  IBM  Abbott  Dow Chemical  Delta Air Lines And Exelon,0.0,0.0,0.0,0.0,0.0,0.0,0.0,0.0,0.0,0.0,0.0,14
2017-04-19,"Stepping Back From IBM's Weak Quarter, 'Big Blue' Is Still An Attractive Risk-Reward",0.0,0.0,0.0,0.0,0.0,0.0,0.0,0.0,0.0,0.0,0.0,16
2017-04-19,22 Stocks Moving In Wednesday's Pre-Market Session,0.0,0.0,0.0,0.0,0.0,0.0,0.0,0.0,0.0,0.0,0.0,8
2017-04-19,15 Biggest Mid-Day Losers For Wednesday,0.0,0.0,0.0,0.0,0.0,0.0,0.0,0.0,0.0,0.0,0.0,6
2017-04-19,Stock Market News For April 20  2017,0.0,0.0,0.0,0.0,0.0,0.0,0.0,0.0,0.0,0.0,0.0,7
2017-04-19,"IBM's Q1 Feeds The Bear Case, But Catalysts Remain Intact",0.0,0.0,0.0,0.0,0.0,0.0,0.0,0.0,0.0,0.0,0.0,12
2017-04-19,"10 Stocks To Watch For April 19, 2017",0.0,0.0,0.0,0.0,0.0,0.0,0.0,0.0,0.0,0.0,0.0,9
2017-04-19,Forget IBM  Buy These Thematic Tech ETFs Instead,0.0,0.0,0.0,0.0,0.0,0.0,0.0,0.0,0.0,0.0,0.0,8
2017-04-19,Premarket Losers as of 9 05 am,0.0,0.0,0.0,0.0,0.0,0.0,0.0,0.0,0.0,0.0,0.0,7
2017-04-19,"IBM Pummeled After Mixed Q1 Earnings, Lower Guidance",0.0,0.0,0.0,0.0,0.0,0.0,0.0,0.0,0.0,0.0,0.0,9
2017-04-19,"Morgan Stanley's Impressive Q1 Bolsters Confidence, But Volatility Remains High",0.0,0.0,0.0,0.0,0.0,0.0,0.0,0.0,0.0,0.0,0.0,12
2017-04-19,IBM's Profitability Remains A Concern Following Mixed Q1 Results,0.0,0.0,0.0,0.0,0.0,0.0,0.0,0.0,0.0,0.0,0.0,10
2017-04-19,A Peek Into The Markets: U.S. Stock Futures Up Ahead Of Earnings,0.0,0.0,0.0,0.0,0.0,0.0,0.0,0.0,0.0,0.0,0.0,13
2017-04-19,IBM Oil Scrambles Market ,0.0,0.0,0.0,0.0,0.0,0.0,0.0,0.0,0.0,0.0,0.0,4
2017-04-19,IBM Profits Down By 13   Shares Sink,0.0,0.0,0.0,0.0,0.0,0.0,0.0,0.0,0.0,0.0,0.0,7
2017-04-19,Wall St mixed after earnings reports  IBM sinks ,0.0,0.0,0.0,0.0,0.0,0.0,0.0,0.0,0.0,0.0,0.0,8
2017-04-19,IBM  5  after disappointing earnings  trimmed price targets,0.0,0.0,0.0625,0.0,0.0625,0.0,0.0,0.0,0.0,0.0,0.0,8
2017-04-18,IBM Sees FY17 Adj. EPS At Least $13.80 vs $14.12 Est.,0.0,0.0,0.0,0.0,0.0,0.0,0.0,0.0,0.0,0.0,0.0,15
2017-04-18,IBM Falls On Q1 Earnings Beat  Revenue Miss,0.0,0.0,0.0,0.0,0.0,0.0,0.0,0.0,0.0,0.0,0.0,8
2017-04-18,Should You Buy IBM ETFs Post Q1 Result ,0.0,0.0,0.0,0.0,0.0,0.0,0.0,0.0,0.0,0.0,0.0,8
2017-04-18,"Earnings Scheduled For April 18, 2017",0.0,0.0,0.0,0.0,0.0,0.0,0.0,0.0,0.0,0.0,0.0,7
2017-04-18,"IBM Reports Q1 Adj EPS $2.38 vs $2.35 Est., Sales $18.2B vs $18.4B Est.",0.0,0.0,0.0,0.0,0.0,0.0,0.0,0.0,0.0,0.0,0.0,20
2017-04-18,"10 Stocks To Watch For April 18, 2017",0.0,0.0,0.0,0.0,0.0,0.0,0.0,0.0,0.0,0.0,0.0,9
2017-04-18,Trump To Sign Order Directing Tighter Enforcement Of Foreign Work Visas,0.0,0.0,0.0,0.0,0.0,0.0,0.0,0.0,0.0,0.0,0.0,11
2017-04-18,IBM posts first revenue miss in five quarters  shares tumble,0.0,0.0,0.1,0.0,0.0,0.0,0.0,0.0,0.0,0.0,0.0,10
2017-04-18,5 Stocks With Great Earnings Charts ,0.0,0.0,0.0,0.0,0.0,0.0,0.0,0.0,0.0,0.0,0.0,6
2017-04-18,IBM  3 6  as quarterly revenue drops yet again,0.0,0.0,0.0,0.0,0.0,0.0,0.0,0.0,0.0,0.0,0.0,9
2017-04-18, U S  stocks drop on geopolitics  disappointing earnings and data,0.0,0.0,0.06666666666666667,0.0,0.03333333333333333,0.0,0.0,0.0,0.0,0.0,0.0,10
2017-04-17,"Earnings: Another Financial Roundup With BAC, GS, and MS",0.0,0.0,0.0,0.0,0.0,0.0,0.0,0.0,0.0,0.0,0.0,12
2017-04-13,Q1 Earnings Season Ramps Up,0.0,0.0,0.0,0.0,0.0,0.0,0.0,0.0,0.0,0.0,0.0,5
2017-04-13,Tech Sector Earnings: Starting The Year Strong?,0.0,0.0,0.0,0.0,0.0,0.0,0.0,0.0,0.0,0.0,0.0,9
2017-04-12,International Business Machines  Is IBM A Good Value Stock ,0.0,0.0,0.0,0.0,0.0,0.0,0.0,0.0,0.0,0.0,0.0,9
2017-04-10,Machine Learning And AI: New Report Shows 40% Of Hedge Funds Created Last Year Were Systematic,0.0,0.0,0.0,0.0,0.0,0.0,0.0,0.0,0.0,0.0,0.0,18
2017-04-10,IBM bear says free cash flow is overstated,0.027777777777777776,0.027777777777777776,0.0,0.027777777777777776,0.0,0.013888888888888888,0.013888888888888888,0.013888888888888888,0.0,0.0,0.0,8
2017-04-10,Banks scramble to fix old systems as IT  cowboys  ride into sunset,0.0,0.0,0.0,0.041666666666666664,0.0,0.0,0.041666666666666664,0.0,0.0,0.0,0.0,12
2017-04-06,Crunchbase Accelerates Product Pipeline With $18 Million Series B Funding,0.0,0.0,0.0,0.0,0.0,0.0,0.0,0.0,0.0,0.0,0.0,11
2017-04-06,"World Retail Congress Concludes Today; Presenters Include Alphabet's Google, Lululemon, Walmart, Martha Stewart & Sequential Brand Group, IBM, And Adidas",0.0,0.0,0.0,0.0,0.0,0.0,0.0,0.0,0.0,0.0,0.0,27
2017-04-06,Buffett Hasn't Embraced Tech Stocks - He Has Embraced Massive Share Repurchase Programs,0.0,0.0,0.0,0.0,0.0,0.0,0.0,0.0,0.0,0.0,0.0,14
2017-04-06,Delphi takes stake in companies to profit from data in connected cars,0.0,0.0,0.0,0.0,0.0,0.0,0.0,0.0,0.0,0.0,0.0,12
2017-04-06,Green Jacket pours greenbacks into Augusta economy,0.0,0.0,0.0,0.0,0.0,0.14285714285714285,0.0,0.0,0.0,0.0,0.0,7
2017-04-05,IBM Shares Tick to Session Highs as Traders Circulating Rumor of Carl Icahn Interest,0.0,0.0,0.0,0.0,0.0,0.0,0.0,0.0,0.0,0.0,0.0,14
2017-04-05,Augusta hangs up on idea of smart phones at Masters,0.0,0.0,0.0,0.0,0.0,0.0,0.0,0.0,0.0,0.0,0.0,10
2017-04-04,"Benzinga's Top Upgrades, Downgrades For April 4, 2017",0.0,0.0,0.0,0.0,0.0,0.0,0.0,0.0,0.0,0.0,0.0,11
2017-04-04,Berenberg Initiates Coverage On IBM With Sell,0.0,0.0,0.0,0.0,0.0,0.0,0.0,0.0,0.0,0.0,0.0,7
2017-04-03,Here's What To Expect From This Year's World Retail Congress,0.0,0.0,0.0,0.0,0.0,0.0,0.0,0.0,0.0,0.0,0.0,12
2017-04-03,"Benzinga Premarket Prep Host Dennis Dick Tweets: Notable opening imbalances: $PFE -243K, $MRK -93K, $BABA +115K, $KO +104K, $T +111K, $CAT -55K, $IBM -42K",0.0,0.0,0.0,0.0,0.0,0.0,0.0,0.0,0.0,0.0,0.0,39
2017-04-03,FCC Announces April 'Infrastructure Month' - These Companies Stand To Benefit,0.0,0.0,0.0,0.0,0.0,0.0,0.0,0.0,0.0,0.0,0.0,12
2017-03-30,IBM Issues Release Announce Patent for Cognitive System to Manage Self-Driving Autos,0.0,0.0,0.0,0.0,0.0,0.0,0.0,0.0,0.0,0.0,0.0,12
2017-03-29,Book Review  Aldridge   Krawciw  Real Time Risk,0.0,0.0,0.0,0.0,0.0,0.0,0.0,0.0,0.0,0.0,0.0,7
2017-03-28,The Astonishing Truth About IBM Earnings And Options,0.0,0.0,0.0,0.0,0.0,0.0,0.0,0.0,0.0,0.0,0.0,8
2017-03-26,"Benzinga's Picks And Pans: IBM, Nike, Sears And More",0.0,0.0,0.0,0.0,0.0,0.0,0.0,0.0,0.0,0.0,0.0,13
2017-03-23,Accenture s full year profit forecast disappoints  shares fall,0.0,0.0,0.022222222222222223,0.022222222222222223,0.022222222222222223,0.022222222222222223,0.022222222222222223,0.0,0.0,0.0,0.0,9
2017-03-22,IBM Is An 'Attractive Growth Story For Patient Investors',0.0,0.0,0.0,0.0,0.0,0.0,0.0,0.0,0.0,0.0,0.0,10
2017-03-22,7 Biggest Price Target Changes For Wednesday,0.0,0.0,0.0,0.0,0.0,0.0,0.0,0.0,0.0,0.0,0.0,7
2017-03-22,"Argus Reiterates Buy On IBM, Raises Price Target To $192",0.0,0.0,0.0,0.0,0.0,0.0,0.0,0.0,0.0,0.0,0.0,12
2017-03-21,Wandisco  In A Good Place ,0.0,0.0,0.0,0.0,0.0,0.0,0.0,0.0,0.0,0.0,0.0,5
2017-03-21,Rocket Fuel Reports Expanded Partnership with IBM Related to Embedding Watson Cognitive Capabilities Into Marketing Platform,0.0,0.0,0.0,0.0,0.0,0.0,0.0,0.0,0.0,0.0,0.0,16
2017-03-20,"IBM Reports New Pricing Model to Change Economics of Cloud Storage, Expands Partnership With NetApp For New Cloud Object Storage Solutions",0.0,0.0,0.0,0.0,0.0,0.0,0.0,0.0,0.0,0.0,0.0,22
2017-03-19,Wanda to Enter Public Cloud Business through Formation of Company Built on IBM Cloud Platform,0.0,0.0,0.0,0.0,0.0,0.0,0.0,0.0,0.0,0.0,0.0,15
2017-03-17,"Offshore Cash Repatriation, And The Bull Case For Apple",0.0,0.0,0.0,0.0,0.0,0.0,0.0,0.0,0.0,0.0,0.0,10
2017-03-16,IBM to integrate MedyMatch technology to help spot brain bleeding,0.0,0.02,0.02,0.02,0.02,0.0,0.0,0.0,0.02,0.0,0.0,10
2017-03-15,Can Oracle Keep Up Its Cloud Revenue Growth In The Third Quarter?,0.0,0.0,0.0,0.0,0.0,0.0,0.0,0.0,0.0,0.0,0.0,13
2017-03-13,Wall Street's M&A Chatter From March 10-12,0.0,0.0,0.0,0.0,0.0,0.0,0.0,0.0,0.0,0.0,0.0,10
2017-03-09,Salesforce And Why This Is The Year Of 'Einstein',0.0,0.0,0.0,0.0,0.0,0.0,0.0,0.0,0.0,0.0,0.0,10
2017-03-08,Salesforce Remains A Favorite Among Cloud Stocks In 2017,0.0,0.0,0.0,0.0,0.0,0.0,0.0,0.0,0.0,0.0,0.0,9
2017-03-08,"Munich Leukemia Laboratory Selects IBM Watson, Illumina for Leukemia Research Collaboration",0.0,0.0,0.0,0.0,0.0,0.0,0.0,0.0,0.0,0.0,0.0,12
2017-03-08,"Among Dow 30 CEOs, Day Without 'A Woman' Is Spot On",0.0,0.0,0.0,0.0,0.0,0.0,0.0,0.0,0.0,0.0,0.0,13
2017-03-07,The Market In 5 Minutes,0.0,0.0,0.0,0.0,0.0,0.0,0.0,0.0,0.0,0.0,0.0,5
2017-03-06,"IBM, Salesforce Report Global Strategic Partnership",0.0,0.0,0.0,0.0,0.0,0.0,0.0,0.0,0.0,0.0,0.0,7
2017-03-06,"Virtual Assistants, Voice Technology: Winners And Losers",0.0,0.0,0.0,0.0,0.0,0.0,0.0,0.0,0.0,0.0,0.0,9
2017-03-01,"With Confidence In AWS Shaken, Who Could Benefit?",0.0,0.0,0.0,0.0,0.0,0.0,0.0,0.0,0.0,0.0,0.0,10
2017-02-25,Buffett's Bucket List Buys: The Oracle Making Unexpected Plays Late In The Game,0.0,0.0,0.0,0.0,0.0,0.0,0.0,0.0,0.0,0.0,0.0,15
2017-02-21,"Social Media And Anti-Trends: Trip Chowdhry Explains The Phenomenon, Provides Insight",0.0,0.0,0.0,0.0,0.0,0.0,0.0,0.0,0.0,0.0,0.0,13
2017-02-20,Accenture has acquired one of the biggest digital agencies in Germany,0.0,0.0,0.0,0.0,0.0,0.0,0.0,0.0,0.0,0.0,0.0,11
2017-02-16,VIX Jumps As Stock Market Overbought In The Short Term,0.0,0.0,0.0,0.0,0.0,0.0,0.0,0.0,0.0,0.0,0.0,10
2017-02-14,"13F Roundup: Apple, Bank Of America And Other Stocks Hedge Funds Love/Hate",0.0,0.0,0.0,0.0,0.0,0.0,0.0,0.0,0.0,0.0,0.0,14
2017-02-13,IBM Looking Bullish  Trans Continues To Outperform,0.0,0.0,0.0,0.0,0.0,0.0,0.0,0.0,0.0,0.0,0.0,7
2017-02-13,"What Was Life Like When The Dow Crossed 7,000 For The First Time?",0.0,0.0,0.0,0.0,0.0,0.0,0.0,0.0,0.0,0.0,0.0,14
2017-02-08,Grain: The Intuitive Stock Market Search Engine,0.0,0.0,0.0,0.0,0.0,0.0,0.0,0.0,0.0,0.0,0.0,8
2017-02-08,"AT&T, IBM, Nokia, Palo Alto Networks, Symantec and Trustonic Form IoT Cybersecurity Alliance",0.0,0.0,0.0,0.0,0.0,0.0,0.0,0.0,0.0,0.0,0.0,19
2017-02-08,Oil Weakness A Possible Drag On Market As Earnings Season Keeps Rolling,0.0,0.0,0.0,0.0,0.0,0.0,0.0,0.0,0.0,0.0,0.0,12
2017-02-07,Dubai government  companies team up with IBM on blockchain project,0.0,0.03333333333333333,0.03333333333333333,0.0,0.0,0.03333333333333333,0.0,0.0,0.0,0.0,0.0,10
2017-01-31,Trump's Executive Order On Entry: Which Countries Will Be Next?,0.0,0.0,0.0,0.0,0.0,0.0,0.0,0.0,0.0,0.0,0.0,13
2017-01-31,"6 Hot Stocks Among Shorts: IBM, Exxon Mobil And More",0.0,0.0,0.0,0.0,0.0,0.0,0.0,0.0,0.0,0.0,0.0,12
2017-01-27,Bosch  Cisco  BNY Mellon  others launch new blockchain consortium,0.0,0.0,0.0,0.05555555555555555,0.0,0.0,0.05555555555555555,0.0,0.0,0.0,0.0,9
2017-01-26,Warren Buffett Had A Very Good Day,0.0,0.0,0.0,0.0,0.0,0.0,0.0,0.0,0.0,0.0,0.0,7
2017-01-26,ServiceNow's Beat And Raise Quarter Tops Even The Most Bullish Expectations,0.0,0.0,0.0,0.0,0.0,0.0,0.0,0.0,0.0,0.0,0.0,12
2017-01-25,Dow 10K's Hottest Stocks: Where Are They Now?,0.0,0.0,0.0,0.0,0.0,0.0,0.0,0.0,0.0,0.0,0.0,11
2017-01-25,Reaons To Short IBM,0.0,0.0,0.0,0.0,0.0,0.0,0.0,0.0,0.0,0.0,0.0,4
2017-01-24,Employment Boom  10 Companies That Have Promised To Add Jobs In The U S ,0.0,0.0,0.0,0.0,0.0,0.0,0.0,0.0,0.0,0.0,0.0,14
2017-01-24,Even The Adoption Of Innovation Is Different,0.0,0.0,0.0,0.0,0.0,0.0,0.0,0.0,0.0,0.0,0.0,7
2017-01-24,Watch These 7 Huge Call Purchases In Tuesday Trade,0.0,0.0,0.0,0.0,0.0,0.0,0.0,0.0,0.0,0.0,0.0,9
2017-01-24,Old Tech Vs. New Tech: Which Will Be Better Investments For 2017?,0.0,0.0,0.0,0.0,0.0,0.0,0.0,0.0,0.0,0.0,0.0,14
2017-01-24,Technical Alert: IBM At Highest Level Since May 2015,0.0,0.0,0.0,0.0,0.0,0.0,0.0,0.0,0.0,0.0,0.0,10
2017-01-24,2017: The State Of Cryptocurrencies (Part 2),0.0,0.0,0.0,0.0,0.0,0.0,0.0,0.0,0.0,0.0,0.0,10
2017-01-23,"New President, Same Markets: Investors Await More Detail From Washington",0.0,0.0,0.0,0.0,0.0,0.0,0.0,0.0,0.0,0.0,0.0,12
2017-01-23,"Option Alert: IBM Mar. 3 Weekly $170 Calls Sweep at the Ask: Volume of 2,059 at $3.05 vs Open Interest 162",0.0,0.0,0.0,0.0,0.0,0.0,0.0,0.0,0.0,0.0,0.0,26
2017-01-23,2017: The State Of Cryptocurrencies (Part 1),0.0,0.0,0.0,0.0,0.0,0.0,0.0,0.0,0.0,0.0,0.0,10
2017-01-23,Benzinga's Option Alert Recap From January 23,0.0,0.0,0.0,0.0,0.0,0.0,0.0,0.0,0.0,0.0,0.0,8
2017-01-23,Wells Fargo Bitcoin Expert Headed for IBM -NY Post,0.0,0.0,0.0,0.0,0.0,0.0,0.0,0.0,0.0,0.0,0.0,9
2017-01-23,WANdisco  Turning Point ,0.0,0.0,0.0,0.0,0.0,0.0,0.0,0.0,0.0,0.0,0.0,3
2017-01-22,Looking Past The S P 500 s Post Inauguration Yawn,0.0,0.0,0.0,0.0,0.0,0.0,0.0,0.0,0.0,0.0,0.0,10
2017-01-20,Can IBM's Cloud Growth Outpace Declines In Its Core Business?,0.0,0.0,0.0,0.0,0.0,0.0,0.0,0.0,0.0,0.0,0.0,12
2017-01-20,"IBM To Trade Sideways As Headwinds Persist, Says Barclays",0.0,0.0,0.0,0.0,0.0,0.0,0.0,0.0,0.0,0.0,0.0,10
2017-01-20,IBM Earnings 'Unlikely To Influence Bulls Or Bears',0.0,0.0,0.0,0.0,0.0,0.0,0.0,0.0,0.0,0.0,0.0,9
2017-01-20,Goldman Calls IBM's Earnings Low Quality,0.0,0.0,0.0,0.0,0.0,0.0,0.0,0.0,0.0,0.0,0.0,7
2017-01-20,A Peek Into The Markets: U.S. Stock Futures Edge Higher; Crude Oil Rises,0.0,0.0,0.0,0.0,0.0,0.0,0.0,0.0,0.0,0.0,0.0,15
2017-01-20,"10 Stocks To Watch For January 20, 2017",0.0,0.0,0.0,0.0,0.0,0.0,0.0,0.0,0.0,0.0,0.0,9
2017-01-20,The Market In 5 Minutes: Trump Inauguration Takes Center Stage,0.0,0.0,0.0,0.0,0.0,0.0,0.0,0.0,0.0,0.0,0.0,11
2017-01-20,Inauguration Day: Trump Speech In Focus As New President Prepares To Take Office,0.0,0.0,0.0,0.0,0.0,0.0,0.0,0.0,0.0,0.0,0.0,14
2017-01-20,The Sell-Side Less Than Impressed By IBM's Q4 Beat,0.0,0.0,0.0,0.0,0.0,0.0,0.0,0.0,0.0,0.0,0.0,10
2017-01-20,U S  stocks close higher with Trump administration underway,0.0,0.0,0.1111111111111111,0.0,0.0,0.0,0.0,0.0,0.0,0.0,0.0,9
2017-01-19,IBM Sees FY17 Adj EPS At Least $13.80 vs $13.74 Est,0.0,0.0,0.0,0.0,0.0,0.0,0.0,0.0,0.0,0.0,0.0,13
2017-01-19,"Earnings Scheduled For January 19, 2017",0.0,0.0,0.0,0.0,0.0,0.0,0.0,0.0,0.0,0.0,0.0,7
2017-01-19,"Keep an Eye on These 10 Stocks for January 19, 2017",0.0,0.0,0.0,0.0,0.0,0.0,0.0,0.0,0.0,0.0,0.0,12
2017-01-19,IBM Kicks Off The Big Tech Earnings Season,0.0,0.0,0.0,0.0,0.0,0.0,0.0,0.0,0.0,0.0,0.0,8
2017-01-19,"As Inauguration Looms, Market Participants Eager To Hear Policy Plans",0.0,0.0,0.0,0.0,0.0,0.0,0.0,0.0,0.0,0.0,0.0,11
2017-01-19,Technical Alert: IBM Lower Ahead Of Q4 Report,0.0,0.0,0.0,0.0,0.0,0.0,0.0,0.0,0.0,0.0,0.0,9
2017-01-19,What Does GE Mean To The Entire Stock Market?,0.0,0.0,0.0,0.0,0.0,0.0,0.0,0.0,0.0,0.0,0.0,10
2017-01-19,"IBM Reports Q4 Adj. EPS $5.01 vs $4.88 Est., Sales $21.8B vs $21.64B Est.",0.0,0.0,0.0,0.0,0.0,0.0,0.0,0.0,0.0,0.0,0.0,21
2017-01-19,IBM and GE Set to Release Earnings,0.0,0.0,0.0,0.0,0.0,0.0,0.0,0.0,0.0,0.0,0.0,7
2017-01-19,"IBM Shares Trading Up 3% Following Better-Than-Expected Q4 Results, FY17 Outlook",0.0,0.0,0.0,0.0,0.0,0.0,0.0,0.0,0.0,0.0,0.0,13
2017-01-19,"IBM, Coming Off Record Year Of Innovation, Beats Q4 Estimates",0.0,0.0,0.0,0.0,0.0,0.0,0.0,0.0,0.0,0.0,0.0,12
2017-01-19,IBM Prepares For Another Quarter Of Negative Growth,0.0,0.0,0.0,0.0,0.0,0.0,0.0,0.0,0.0,0.0,0.0,8
2017-01-19,IBM revenue fall dims upbeat profit forecast,0.0,0.0,0.03571428571428571,0.0,0.03571428571428571,0.03571428571428571,0.03571428571428571,0.0,0.0,0.0,0.0,7
2017-01-18,"Banks Still In Spotlight As Goldman Sachs Puts In Big Quarter, Netflix Up Next",0.0,0.0,0.0,0.0,0.0,0.0,0.0,0.0,0.0,0.0,0.0,15
2017-01-18,IBM Reports U.S. Army Cloud Deal For $62M,0.0,0.0,0.0,0.0,0.0,0.0,0.0,0.0,0.0,0.0,0.0,9
2017-01-17,Wealth Creation Is Another Name For Poverty Reduction,0.0,0.0,0.0,0.0,0.0,0.0,0.0,0.0,0.0,0.0,0.0,8
2017-01-17,Brexit Is Back: May's Speech Weighs On Market Despite Strong Morgan Stanley Results,0.0,0.0,0.0,0.0,0.0,0.0,0.0,0.0,0.0,0.0,0.0,15
2017-01-16,Danske Daily   16 January 2017 ,0.0,0.0,0.0,0.0,0.0,0.0,0.0,0.0,0.0,0.0,0.0,5
2017-01-16,IBM Breaks Innovation Record In 2016,0.0,0.0,0.0,0.0,0.0,0.0,0.0,0.0,0.0,0.0,0.0,6
2017-01-13,"Greek Philosophy, Tough Guys, And Rubber Necking",0.0,0.0,0.0,0.0,0.0,0.0,0.0,0.0,0.0,0.0,0.0,9
2017-01-13,Patience About To Pay Off For Buffett On His IBM Investment,0.0,0.0,0.0,0.0,0.0,0.0,0.0,0.0,0.0,0.0,0.0,11
2017-01-13,"Big Banks Benefit From Trading Binge After Election, But Retail Sales Come In Light",0.0,0.0,0.0,0.0,0.0,0.0,0.0,0.0,0.0,0.0,0.0,15
2017-01-12,IBM Q4 Earnings Preview: 4 Key Metrics To Monitor,0.0,0.0,0.0,0.0,0.0,0.0,0.0,0.0,0.0,0.0,0.0,10
2017-01-12,IBM to Develop Online Music Copyright Management Platform,0.0,0.0,0.0,0.0,0.0,0.0,0.0,0.0,0.0,0.0,0.0,8
2017-01-12,How Wal-Mart Contract Will Boost Workday Revenue,0.0,0.0,0.0,0.0,0.0,0.0,0.0,0.0,0.0,0.0,0.0,7
2017-01-12,Why Companies Are Willing To Let Trump Take Credit For Previously-Planned Job Creation,0.0,0.0,0.0,0.0,0.0,0.0,0.0,0.0,0.0,0.0,0.0,13
2017-01-12,What's In Store For IBM's Q4 Earnings Report?,0.0,0.0,0.0,0.0,0.0,0.0,0.0,0.0,0.0,0.0,0.0,11
2017-01-09,IBM Watson and Illumina Partner to Standardize Genomic Data Interpretation,0.0,0.0,0.0,0.0,0.0,0.0,0.0,0.0,0.0,0.0,0.0,10
2017-01-09,Box Is One Of Oppenheimer's Top Picks For 2017,0.0,0.0,0.0,0.0,0.0,0.0,0.0,0.0,0.0,0.0,0.0,10
2017-01-09,DTCC to rebuild credit default swaps processing platform with blockchain,0.0,0.016666666666666666,0.016666666666666666,0.016666666666666666,0.016666666666666666,0.016666666666666666,0.0,0.0,0.016666666666666666,0.0,0.0,10
2017-01-04,Guggenheim Initiates Coverage On IBM at Neutral,0.0,0.0,0.0,0.0,0.0,0.0,0.0,0.0,0.0,0.0,0.0,7
2017-01-04,Technical Alert: IBM Higher,0.0,0.0,0.0,0.0,0.0,0.0,0.0,0.0,0.0,0.0,0.0,5
2016-12-28,Why NVIDIA's Recent Run Shouldn't Come As A Surprise,0.0,0.0,0.0,0.0,0.0,0.0,0.0,0.0,0.0,0.0,0.0,11
2016-12-27,Fast Money Picks For December 27,0.0,0.0,0.0,0.0,0.0,0.0,0.0,0.0,0.0,0.0,0.0,6
2016-12-22,"Meet The New Dogs: 2017's Dogs Of The Dow Include Coca-Cola, Boeing",0.0,0.0,0.0,0.0,0.0,0.0,0.0,0.0,0.0,0.0,0.0,15
2016-12-21,Wandisco  Partners Getting Into Gear ,0.0,0.0,0.0,0.0,0.0,0.0,0.0,0.0,0.0,0.0,0.0,5
2016-12-21,Glassdoor Chief Economist On The Gender Wage Gap: Data Is Key To Understanding The Problem,0.0,0.0,0.0,0.0,0.0,0.0,0.0,0.0,0.0,0.0,0.0,16
2016-12-20,7 Companies That Could Be Acquired In 2017,0.0,0.0,0.0,0.0,0.0,0.0,0.0,0.0,0.0,0.0,0.0,8
2016-12-20,IBM On The Verge Of A Sharp Fall,0.0,0.0,0.0,0.0,0.0,0.0,0.0,0.0,0.0,0.0,0.0,8
2016-12-15,Trump's Tech Summit: Attendees And Trump Team's Response,0.0,0.0,0.0,0.0,0.0,0.0,0.0,0.0,0.0,0.0,0.0,11
2016-12-15,"Trump Transition Team Issues Statement On Tech Summit, Says Meeting Focused On Job Creation, Tax Cuts, Improving Digital Infrastructure, Etc.",0.0,0.0,0.0,0.0,0.0,0.0,0.0,0.0,0.0,0.0,0.0,25
2016-12-15,Traders Circulating Possible Activist Chatter In IBM,0.0,0.0,0.0,0.0,0.0,0.0,0.0,0.0,0.0,0.0,0.0,7
2016-12-15,U S  futures point to steady to higher open after Fed move,0.0,0.0,0.0,0.0,0.0,0.041666666666666664,0.0,0.0,0.0,0.041666666666666664,0.0,12
2016-12-14,Technical Alert: IBM Higher,0.0,0.0,0.0,0.0,0.0,0.0,0.0,0.0,0.0,0.0,0.0,5
2016-12-13,USA Today Recently Publishes 'We need to fill 'new collar' jobs that employers demand: IBM's Rometty',0.016666666666666666,0.0,0.016666666666666666,0.0,0.0,0.016666666666666666,0.0,0.0,0.0,0.0,0.0,20
2016-12-13,Slack data management exposed BP to high safety risk  leaked report,0.0,0.01515151515151515,0.0303030303030303,0.01515151515151515,0.0,0.01515151515151515,0.01515151515151515,0.0,0.0,0.0,0.0,11
2016-12-13,"IBM Vice President Stanley Sutula To Resign Effective Jan. 20, 2017 To Become CFO At Another Public Company",0.0,0.0,0.0,0.0,0.0,0.0,0.0,0.0,0.0,0.0,0.0,19
2016-12-13,IBM promises to hire Americans as tech executives set to meet Trump,0.0,0.0,0.0,0.020833333333333332,0.0,0.020833333333333332,0.020833333333333332,0.020833333333333332,0.0,0.0,0.0,12
2016-12-09,Fast Money Traders Share Their Picks In Tech Space,0.0,0.0,0.0,0.0,0.0,0.0,0.0,0.0,0.0,0.0,0.0,9
2016-12-08,The Zacks Analyst Blog Highlights  Goldman Sachs Group  JPMorgan  3M And IBM,0.0,0.0,0.0,0.0,0.0,0.0,0.0,0.0,0.0,0.0,0.0,12
2016-12-07,The Zacks Analyst Blog Highlights  MasterCard  Merck  Cisco And Visa,0.0,0.0,0.0,0.0,0.0,0.0,0.0,0.0,0.0,0.0,0.0,10
2016-12-07,Can You Guess This Chart?,0.0,0.0,0.0,0.0,0.0,0.0,0.0,0.0,0.0,0.0,0.0,6
2016-12-05,What We Know About Soon-To-Be Starbucks CEO Kevin Johnson,0.0,0.0,0.0,0.0,0.0,0.0,0.0,0.0,0.0,0.0,0.0,9
2016-12-01,"Forbes Healthcare Summit Concludes Today; Presenters Include Express Scripts, Allergan, IBM, Bristol-Myers Squibb, Merck, Anthem, Eli Lilly, And Regeneron",0.0,0.0,0.0,0.0,0.0,0.0,0.0,0.0,0.0,0.0,0.0,27
2016-12-01,"IBM, Pfizer to Accelerate Immuno-oncology Research with Watson for Drug Discovery",0.0,0.0,0.0,0.0,0.0,0.0,0.0,0.0,0.0,0.0,0.0,12
2016-11-30,DA Davidson Upgrades Super Micro Computer Despite Tough Comps,0.0,0.0,0.0,0.0,0.0,0.0,0.0,0.0,0.0,0.0,0.0,9
2016-11-30,Airline Stock Roundup  American Airlines  JetBlue Commence Flights To Havana  Lufthansa In Focus,0.0,0.0,0.0,0.0,0.0,0.0,0.0,0.0,0.0,0.0,0.0,13
2016-11-30,The Zacks Analyst Blog Highlights  American Airlines Group  JetBlue Airways  Delta Air Lines  United Continental Holdings And Lufthansa,0.0,0.0,0.0,0.0,0.0,0.0,0.0,0.0,0.0,0.0,0.0,18
2016-11-29,IBM Employee Answers CEO's Open Letter To Trump With An Open Letter Of Her Own,0.0,0.0,0.0,0.0,0.0,0.0,0.0,0.0,0.0,0.0,0.0,16
