date,title,anger,fear,negative,positive,sadness,trust,anticipation,joy,disgust,surprise,anticip,word_count
2020-06-11,"Shares of several technology companies are trading lower, selling off from Wednesday strength as an increase in coronavirus cases in some US states has led to concerns of a second wave of the virus.",0.0,0.0,0.007936507936507936,0.011904761904761904,0.003968253968253968,0.003968253968253968,0.0,0.0,0.0,0.0,0.0,36
2020-06-11,Amazon Places One-Year Moratorium On Police Use Of Facial Recognition Technology,0.0,0.0,0.0,0.0,0.0,0.0,0.0,0.0,0.0,0.0,0.0,11
2020-06-10,"Cloudera Analysts Examine Potential Suitors, Takeout Price Amid Sale Rumor",0.0,0.0,0.0,0.0,0.0,0.0,0.0,0.0,0.0,0.0,0.0,11
2020-06-09,Shares of several technology companies are trading lower as equities sell off following recent rally. Stocks have rallied over the past week amid optimism towards the US economy reopening and investors have potentially taken some profits following run up.,0.0,0.0,0.0027100271002710027,0.005420054200542005,0.0027100271002710027,0.005420054200542005,0.0027100271002710027,0.0027100271002710027,0.0,0.0027100271002710027,0.0,41
2020-06-09,"IBM Discontinues Facial Recognition Technology, Says It Can't Condone 'Racial Profiling' Or 'Mass Surveillance'",0.0,0.0,0.0,0.0,0.0,0.0,0.0,0.0,0.0,0.0,0.0,18
2020-06-05,Shares of several companies in the broader technology sector are trading higher as markets rally on strong US jobs data.,0.0,0.0,0.0,0.047619047619047616,0.0,0.0,0.0,0.0,0.0,0.0,0.0,21
2020-06-03,"Shares of several technology companies are trading higher as equities continue to gain on optimism over an economic reopening as well as a smaller-than-expected drop in nonfarm payrolls. The sector has performed well this year amid the stay-at-home environment, which has been a positive for virtual communication, enterprise software and e-commerce.",0.0,0.0,0.0,0.005594405594405594,0.0,0.004195804195804196,0.004195804195804196,0.002797202797202797,0.0,0.0013986013986013986,0.0,55
2020-06-03,IBM Services and Aegon Sign Contract of Portfolio Administration for 800K Individual Life Insurance Contracts,0.0,0.0,0.0,0.0,0.0,0.0,0.0,0.0,0.0,0.0,0.0,15
2020-05-27,This New Tool Will Tell You Whether Or Not An Options Spread Is A Good Deal,0.0,0.0,0.0,0.0,0.0,0.0,0.0,0.0,0.0,0.0,0.0,16
2020-05-26,Shares of several technology companies are trading higher in sympathy with the overall market as equities rally on coronavirus vaccine hopes as well as a pickup in economic activity as some US states reopen businesses.,0.0,0.0,0.0,0.020833333333333332,0.006944444444444444,0.0,0.0,0.0,0.0,0.0,0.0,36
2020-05-22,IBM Is Cutting 'Several Thousand' Jobs,0.0,0.0,0.0,0.0,0.0,0.0,0.0,0.0,0.0,0.0,0.0,7
2020-05-22,IBM's Announces Company-Wide Job Cuts As New CEO Attempts Restructuring,0.0,0.0,0.0,0.0,0.0,0.0,0.0,0.0,0.0,0.0,0.0,11
2020-05-21,IBM Cutting Unspecified Number of Jobs,0.0,0.0,0.0,0.0,0.0,0.0,0.0,0.0,0.0,0.0,0.0,6
2020-05-18,Shares of several technology companies are trading higher amid market strength as news from a Moderna trial stoked optimism about a potential coronavirus vaccine.,0.0,0.0,0.0,0.017777777777777778,0.0,0.008888888888888889,0.0044444444444444444,0.0044444444444444444,0.0,0.0044444444444444444,0.0,25
2020-05-13,"VMWare Announces Creation Of Next-Gen SOC Alliance With Splunk, IBM Security, Google Cloud's Chronicle, Exabeam And Sumo Logic",0.0,0.0,0.0,0.0,0.0,0.0,0.0,0.0,0.0,0.0,0.0,22
2020-05-13,Financial Stocks Could Be In Focus Today After Powell Speech; Cisco Reports This Afternoon,0.0,0.0,0.0,0.0,0.0,0.0,0.0,0.0,0.0,0.0,0.0,15
2020-05-13,"Shares of several technology companies are trading lower amid market weakness, selling off from recent sector strength. Equities have moved lower for the session, potentially related to cautious comments from Fed Chair Powell, who suggested uncertainty and 'significant' downside risks in the economy.",0.0,0.0014577259475218659,0.004373177842565598,0.004373177842565598,0.0029154518950437317,0.0058309037900874635,0.0014577259475218659,0.0,0.0,0.0,0.0,49
2020-05-12,'India's Airtel looks to IBM for cloud help' -LightReading Report,0.0,0.0,0.0,0.0,0.0,0.0,0.0,0.0,0.0,0.0,0.0,12
2020-05-11,Former Google CEO Eric Schmidt Cut Last Ties With The Company: Report,0.0,0.0,0.0,0.0,0.0,0.0,0.0,0.0,0.0,0.0,0.0,13
2020-05-01,Shares of several technology companies are trading lower on market weakness as investor uncertainty grows following quarterly earnings results from multiple companies. NOTE: This could potentially be a sell-off after the S&P 500 rallied 12.7% over the past month.,0.0,0.0,0.011111111111111112,0.005555555555555556,0.005555555555555556,0.0,0.0,0.0,0.0,0.0,0.0,45
2020-04-29,"Benzinga Pro's Top 5 Stocks To Watch For Wed., Apr. 29, 2020: FB, IBM, SHOP, MNST, MYOS",0.0,0.0,0.0,0.0,0.0,0.0,0.0,0.0,0.0,0.0,0.0,26
2020-04-29,"Locked Down, Demand Up: Amazon Shines As Virus Economy Plays To Its Strengths",0.0,0.0,0.0,0.0,0.0,0.0,0.0,0.0,0.0,0.0,0.0,15
2020-04-29,Zoom Uses Oracle's Cloud Computing Services To Handle Demand Surge During Pandemic,0.0,0.0,0.0,0.0,0.0,0.0,0.0,0.0,0.0,0.0,0.0,13
2020-04-28,Blue Chip Stocks Resisting COVID-19,0.0,0.0,0.0,0.0,0.0,0.0,0.0,0.0,0.0,0.0,0.0,5
2020-04-28,IBM Raises Qtr. Dividend From $1.62 To $1.63/Share,0.0,0.0,0.0,0.0,0.0,0.0,0.0,0.0,0.0,0.0,0.0,11
2020-04-22,"Little Things Count: After Selloff To Start Week, A Bit of Light Arrives With Positive Earnings",0.0,0.0,0.0,0.0,0.0,0.0,0.0,0.0,0.0,0.0,0.0,18
2020-04-22,"Citigroup Maintains Neutral on IBM, Raises Price Target to $120",0.0,0.0,0.0,0.0,0.0,0.0,0.0,0.0,0.0,0.0,0.0,12
2020-04-21,"8 Stocks To Watch For April 21, 2020",0.0,0.0,0.0,0.0,0.0,0.0,0.0,0.0,0.0,0.0,0.0,9
2020-04-21,10 Biggest Price Target Changes For Tuesday,0.0,0.0,0.0,0.0,0.0,0.0,0.0,0.0,0.0,0.0,0.0,7
2020-04-21,"Morgan Stanley Maintains Equal-Weight on IBM, Raises Price Target to $111",0.0,0.0,0.0,0.0,0.0,0.0,0.0,0.0,0.0,0.0,0.0,13
2020-04-21,"UPDATE: Wedbush Maintains Neutral On IBM, Lowers Price Target To $140 As Firm Notes Co's 'Mixed Q1/CY20 Results; Decelerating Revenue Growth At Red Hat/Cloud/Cognitive'",0.0,0.0,0.0,0.0,0.0,0.0,0.0,0.0,0.0,0.0,0.0,30
2020-04-21,"CocaCola, IBM Earnings Under Scrutiny As Both Multinationals Withdraw Guidance, Netflix Later",0.0,0.0,0.0,0.0,0.0,0.0,0.0,0.0,0.0,0.0,0.0,14
2020-04-21,10 Technology Stocks Moving In Tuesday's Pre-Market Session,0.0,0.0,0.0,0.0,0.0,0.0,0.0,0.0,0.0,0.0,0.0,9
2020-04-21,44 Stocks Moving In Tuesday's Mid-Day Session,0.0,0.0,0.0,0.0,0.0,0.0,0.0,0.0,0.0,0.0,0.0,8
2020-04-21,"UPDATE: Morgan Stanley Maintains Equal-Weight On IBM. Raises Target To $111 Notes 'New CEO, Arvind Krishna, is committed to returning IBM to sustainable growth, incl. more M&A or divestitures, but results are years away'",0.0,0.0,0.0,0.014814814814814814,0.0,0.007407407407407407,0.0,0.0,0.0,0.0,0.0,45
2020-04-21,"UPDATE: Morgan Stanley On IBM Notes 'Near-term, we lower our already below cons. CY20 EPS to $10.25 but peer multiple expansion drives our PT to $111, from $107'",0.0,0.0,0.013888888888888888,0.0,0.013888888888888888,0.0,0.0,0.0,0.0,0.0,0.0,36
2020-04-21,Why IBM's Stock Is Trading Lower Today,0.0,0.0,0.0,0.0,0.0,0.0,0.0,0.0,0.0,0.0,0.0,8
2020-04-21,"A Peek Into The Markets: US Stock Futures Fall Ahead Of Coca-Cola, Lockheed Martin Earnings",0.0,0.0,0.0,0.0,0.0,0.0,0.0,0.0,0.0,0.0,0.0,17
2020-04-21,30 Stocks Moving in Tuesday's Pre-Market Session,0.0,0.0,0.0,0.0,0.0,0.0,0.0,0.0,0.0,0.0,0.0,8
2020-04-21,"UBS Maintains Neutral on IBM, Lowers Price Target to $120",0.0,0.0,0.0,0.0,0.0,0.0,0.0,0.0,0.0,0.0,0.0,12
2020-04-21,"Wedbush Maintains Neutral on IBM, Lowers Price Target to $140",0.0,0.0,0.0,0.0,0.0,0.0,0.0,0.0,0.0,0.0,0.0,12
2020-04-21,International Business Machines shares are trading lower after the company reported worse-than-expected Q1 sales results. The company also withdrew FY20 guidance.,0.0,0.0,0.010869565217391304,0.010869565217391304,0.010869565217391304,0.010869565217391304,0.0,0.0,0.0,0.0,0.0,23
2020-04-20,A Peek Into The Markets: US Stock Futures Down Ahead Of Earnings,0.0,0.0,0.0,0.0,0.0,0.0,0.0,0.0,0.0,0.0,0.0,13
2020-04-20,"5 Stocks To Watch For April 20, 2020",0.0,0.0,0.0,0.0,0.0,0.0,0.0,0.0,0.0,0.0,0.0,9
2020-04-20,"IBM CFO Says Co Grew Substantially In China In March, After Being Down Significantly Through February",0.0,0.0,0.0,0.0,0.0,0.0,0.0,0.0,0.0,0.0,0.0,17
2020-04-20,IBM: Q1 Earnings Insights,0.0,0.0,0.0,0.0,0.0,0.0,0.0,0.0,0.0,0.0,0.0,5
2020-04-20,IBM Withdraws FY20 Guidance,0.0,0.0,0.0,0.0,0.0,0.0,0.0,0.0,0.0,0.0,0.0,4
2020-04-20,"IBM Q1 Cloud Revenue $5.4B, Up 19%",0.0,0.0,0.0,0.0,0.0,0.0,0.0,0.0,0.0,0.0,0.0,10
2020-04-20,"IBM Q1 Adj. EPS $1.840 Beats $1.790 Estimate, Sales $17.570B Miss $17.620B Estimate",0.0,0.0,0.0,0.0,0.0,0.0,0.0,0.0,0.0,0.0,0.0,19
2020-04-20,"Earnings Scheduled For April 20, 2020",0.0,0.0,0.0,0.0,0.0,0.0,0.0,0.0,0.0,0.0,0.0,7
2020-04-17,Shares of several technology companies are trading higher as markets gain on optimistic coronavirus outlook following positive remdesivir data from Gilead. Hopes of a treatment candidate have raised hopes of a rebound in economic activity in the future.,0.0,0.0,0.0,0.015,0.0,0.0,0.005,0.005,0.0,0.0,0.0,40
2020-04-17,"Big Earnings Day As Honeywell, Procter & Gamble, Schlumberger Among Those Reporting",0.0,0.0,0.0,0.0,0.0,0.0,0.0,0.0,0.0,0.0,0.0,14
2020-04-15,"Shares of several technology companies are trading lower as equities fall amid mixed earnings results from banks, a significant decline in the price of oil and worse than expected retail sales in March.",0.0,0.002857142857142857,0.011428571428571429,0.002857142857142857,0.008571428571428572,0.0,0.002857142857142857,0.0,0.0,0.0,0.0,35
2020-04-15,"Stifel Maintains Buy on IBM, Lowers Price Target to $147",0.0,0.0,0.0,0.0,0.0,0.0,0.0,0.0,0.0,0.0,0.0,12
2020-04-15,Every Member Of Trump's 'Great American Economic Revival' Industry Groups,0.0,0.0,0.0,0.0,0.0,0.0,0.0,0.0,0.0,0.0,0.0,12
2020-04-15,"Credit Suisse Maintains Outperform on IBM, Lowers Price Target to $150",0.0,0.0,0.0,0.0,0.0,0.0,0.0,0.0,0.0,0.0,0.0,13
2020-04-14,"Wells Fargo Maintains Equal-Weight on IBM, Lowers Price Target to $120",0.0,0.0,0.0,0.0,0.0,0.0,0.0,0.0,0.0,0.0,0.0,13
2020-04-08,"Cramer Shares His Thoughts On IBM, Enphase And More",0.0,0.0,0.0,0.0,0.0,0.0,0.0,0.0,0.0,0.0,0.0,10
2020-04-07,"Shares of several technology, semiconductor, and software companies are trading higher amid optimism that coronavirus cases in Asia are potentially easing. Global slowing cases could raise hopes of a sooner return to spending and economic activity.",0.0,0.0,0.0,0.008333333333333333,0.0,0.004166666666666667,0.004166666666666667,0.004166666666666667,0.0,0.004166666666666667,0.0,40
2020-04-07,IBM Is Getting Ready To Fight For A Place In The Cloud Universe,0.0,0.0,0.0,0.0,0.0,0.0,0.0,0.0,0.0,0.0,0.0,13
2020-04-07,Will The Remote Office Become Habit After The Coronavirus Pandemic?,0.0,0.0,0.0,0.0,0.0,0.0,0.0,0.0,0.0,0.0,0.0,11
2020-04-06,Shares of several semiconductor and large technology stocks are trading higher with the broader market on optimism that coronavirus cases in several US hotspots appear to be reaching their peak.,0.0,0.0,0.004608294930875576,0.009216589861751152,0.0,0.004608294930875576,0.004608294930875576,0.004608294930875576,0.0,0.004608294930875576,0.0,31
2020-04-01,"Shares of several technology, semiconductor, and software companies are trading lower amid market weakness as macro concerns continue to grow as a result of the coronavirus pandemic. The White House said it expects a surge in cases over the next 2 weeks.",0.0,0.001358695652173913,0.004076086956521739,0.004076086956521739,0.002717391304347826,0.002717391304347826,0.004076086956521739,0.001358695652173913,0.0,0.001358695652173913,0.0,46
2020-03-30,Portfolio Manager Offers Buying Tips: Focus On What You Own,0.0,0.0,0.0,0.0,0.0,0.0,0.0,0.0,0.0,0.0,0.0,11
2020-03-30,Shares of several technology companies are trading higher as equities continue to rise following last week's rebound amid US stimulus measures.,0.0,0.0,0.0,0.021739130434782608,0.0,0.010869565217391304,0.010869565217391304,0.0,0.0,0.0,0.0,23
2020-03-30,7 Safe Dividend Plays For 2020,0.0,0.0,0.0,0.0,0.0,0.0,0.0,0.0,0.0,0.0,0.0,6
2020-03-27,"Shares of several technology, semiconductor, and software companies are trading lower as a potential sell-off from this week's strength. While US stimulus legislation has boosted economic optimism, demand concerns still exist amid the coronavirus.",0.0020833333333333333,0.0,0.004166666666666667,0.00625,0.0020833333333333333,0.004166666666666667,0.0020833333333333333,0.0020833333333333333,0.0,0.0020833333333333333,0.0,40
2020-03-25,"Airline Shares Jump As Stimulus Agreement Offers Relief, While Nike Up On Earnings",0.0,0.0,0.0,0.0,0.0,0.0,0.0,0.0,0.0,0.0,0.0,14
2020-03-25,"Morgan Stanley Maintains Equal-Weight on IBM, Lowers Price Target to $107",0.0,0.0,0.0,0.0,0.0,0.0,0.0,0.0,0.0,0.0,0.0,13
2020-03-24,Shares of several technology companies are trading higher amid market strength on hopes of a US economic stimulus package agreement.,0.0,0.0,0.0,0.02857142857142857,0.0,0.01904761904761905,0.0,0.0,0.0,0.0,0.0,21
2020-03-24,"Rise In Semiconductor, Cloud Computing Stocks Could Set Tone For Broader Economy",0.0,0.0,0.0,0.0,0.0,0.0,0.0,0.0,0.0,0.0,0.0,13
2020-03-23,3 ETFs To Short The Dow,0.0,0.0,0.0,0.0,0.0,0.0,0.0,0.0,0.0,0.0,0.0,6
2020-03-23,"Shares of some technology companies are trading lower amid market volatility. Sunday's fiscal stimulus bill failed a procedural senate vote while the Fed on Monday announced stimulus measures. NOTE: Sector is mixed, with some names up for the session.",0.00261437908496732,0.00130718954248366,0.00392156862745098,0.00261437908496732,0.00261437908496732,0.00261437908496732,0.00261437908496732,0.00130718954248366,0.0,0.00261437908496732,0.0,45
2020-03-23,Stocks That Hit 52-Week Lows On Monday,0.0,0.0,0.0,0.0,0.0,0.0,0.0,0.0,0.0,0.0,0.0,7
2020-03-23,White House Partners With IBM To Create Supercomputer Power To Combat COVID-19,0.0,0.0,0.0,0.0,0.0,0.0,0.0,0.0,0.0,0.0,0.0,12
2020-03-23,"Nomura Maintains Buy on IBM, Lowers Price Target to $135",0.0,0.0,0.0,0.0,0.0,0.0,0.0,0.0,0.0,0.0,0.0,12
2020-03-23,"Shares of several financial services companies are trading lower after a coronavirus stimulus bill failed a procedural Senate vote on Sunday. The sector has been impacted by the virus, which has slowed economic activity and led to to rate cuts.",0.0021141649048625794,0.0,0.006342494714587738,0.0021141649048625794,0.004228329809725159,0.0021141649048625794,0.0021141649048625794,0.0021141649048625794,0.0,0.0021141649048625794,0.0,43
2020-03-19,"Shares of several technology, software and semiconductor companies are trading lower amid continued global coronavirus concerns. The virus has caused global economic disruption and negatively impacted supply chains for many tech companies. UPDATE: Several stocks in the sector have since reversed.",0.002173913043478261,0.002173913043478261,0.008695652173913044,0.004347826086956522,0.002173913043478261,0.0,0.0,0.0,0.0,0.002173913043478261,0.0,46
2020-03-18,"Shares of several technology, software and semiconductor companies are trading lower as equities sell off amid continued global coronavirus concerns. The virus has caused global economic disruption and negatively impacted stocks across sectors.",0.0030864197530864196,0.0030864197530864196,0.012345679012345678,0.0030864197530864196,0.0030864197530864196,0.0,0.0,0.0,0.0,0.0030864197530864196,0.0,36
2020-03-17,All The Major Events Canceled By Coronavirus (Updated),0.0,0.0,0.0,0.0,0.0,0.0,0.0,0.0,0.0,0.0,0.0,10
2020-03-17,"Shares of several technology, semiconductor, and software companies are trading higher, rebounding from Monday's crash. Stocks may also potentially be getting a boost from expectations of further stimulus proposals.",0.0,0.005714285714285714,0.005714285714285714,0.005714285714285714,0.005714285714285714,0.0,0.0,0.0,0.0,0.005714285714285714,0.0,35
2020-03-16,Shares of several technology stocks are trading lower amid demand and supply chain disruption concerns driven by coronavirus.,0.009569377990430622,0.004784688995215311,0.019138755980861243,0.009569377990430622,0.004784688995215311,0.0,0.0,0.0,0.0,0.004784688995215311,0.0,19
2020-03-13,No.3 In Cloud Sales Belongs To Google Or IBM?,0.0,0.0,0.0,0.0,0.0,0.0,0.0,0.0,0.0,0.0,0.0,10
2020-03-13,"Adobe Beats Q1 Targets, But Expects A Coronavirus-Caused Hit In Q2",0.0,0.0,0.0,0.0,0.0,0.0,0.0,0.0,0.0,0.0,0.0,12
2020-03-13,"Shares of several technology, software and semiconductor companies are trading higher as equities rebound following Thursday's crash. The sector has been negatively impacted recently as the coronavirus outbreak has disrupted economic outlook globally.",0.0,0.005405405405405406,0.005405405405405406,0.005405405405405406,0.005405405405405406,0.0,0.0,0.0,0.0,0.005405405405405406,0.0,37
2020-03-12,Stocks That Hit 52-Week Lows On Thursday,0.0,0.0,0.0,0.0,0.0,0.0,0.0,0.0,0.0,0.0,0.0,7
2020-03-12,Venture Capital Firm New Enterprise Associates Closes On $3.6-Billion Fund,0.0,0.0,0.0,0.0,0.0,0.0,0.0,0.0,0.0,0.0,0.0,11
2020-03-12,"Shares of several technology, software and semiconductor companies are trading lower as equities sell off amid continued global coronavirus concerns. The virus has caused global economic disruption and negatively impacted stocks across sectors.",0.0030864197530864196,0.0030864197530864196,0.012345679012345678,0.0030864197530864196,0.0030864197530864196,0.0,0.0,0.0,0.0,0.0030864197530864196,0.0,36
2020-03-11,"Shares of several companies in the technology, software and semiconductor space are trading lower as equities sell off amid coronavirus fears. The virus spread has disrupted economic activity across sectors and caused global macro uncertainty.",0.0,0.0,0.013157894736842105,0.006578947368421052,0.006578947368421052,0.0,0.0,0.0,0.0,0.0,0.0,38
2020-03-10,Shares of several technology companies are trading higher as markets look to rebound from Monday's selloff. The technology sector has been highly impacted by the coronavirus due to its China exposure and sensitivity to economic conditions.,0.0,0.0,0.0,0.02564102564102564,0.0,0.0,0.0,0.0,0.0,0.0,0.0,39
2020-03-09,"Shares of several companies in the technology, software and semiconductor space are trading lower as equities crash amid coronavirus fears. The virus spread has disrupted economic activity across sectors and caused global macro uncertainty.",0.0,0.0033783783783783786,0.010135135135135136,0.0033783783783783786,0.006756756756756757,0.0,0.0,0.0,0.0,0.0033783783783783786,0.0,37
2020-03-09,"Just Like With Any Champion, Steady Growth And Earnings Expected From Adobe",0.0,0.0,0.0,0.0,0.0,0.0,0.0,0.0,0.0,0.0,0.0,13
2020-03-06,Stocks That Hit 52-Week Lows On Friday,0.0,0.0,0.0,0.0,0.0,0.0,0.0,0.0,0.0,0.0,0.0,7
2020-03-06,Shares of several technology companies are trading lower. Movement appears market related as markets continue to dip amid the global coronavirus outbreak.,0.0,0.0,0.005952380952380952,0.011904761904761904,0.005952380952380952,0.011904761904761904,0.005952380952380952,0.0,0.0,0.0,0.0,24
2020-03-05,"Shares of several technology, semiconductor, and software companies are trading lower as global markets continue to experience volatility amid the coronavirus spread.",0.0036363636363636364,0.0036363636363636364,0.007272727272727273,0.007272727272727273,0.0036363636363636364,0.0036363636363636364,0.007272727272727273,0.0,0.0,0.0036363636363636364,0.0,25
2020-03-05,Cramer Calls For End Of Sector ETFs,0.0,0.0,0.0,0.0,0.0,0.0,0.0,0.0,0.0,0.0,0.0,7
2020-03-04,IBM's Think 2020 Event Will Be Digital Only,0.0,0.0,0.0,0.0,0.0,0.0,0.0,0.0,0.0,0.0,0.0,9
2020-03-03,Shares of several technology companies are trading lower in sympathy with the overall market. The Fed cut rates to combat the coronavirus outbreak which caused an initial spike but then continued to trade lower.,0.0023148148148148147,0.004629629629629629,0.006944444444444444,0.004629629629629629,0.006944444444444444,0.0023148148148148147,0.0,0.0,0.0,0.0,0.0,36
2020-02-28,"Shares of companies in the technology, semiconductor, and software sector are trading lower as fears of a possible pandemic escalate, with cases of the new coronavirus surging outside China.",0.003787878787878788,0.003787878787878788,0.011363636363636364,0.003787878787878788,0.007575757575757576,0.0,0.0,0.0,0.0,0.0,0.0,33
2020-02-28,Stocks That Hit 52-Week Lows On Friday,0.0,0.0,0.0,0.0,0.0,0.0,0.0,0.0,0.0,0.0,0.0,7
2020-02-25,Technology Lesson For The New Era – Can You Do It Twice?,0.0,0.0,0.0,0.0,0.0,0.0,0.0,0.0,0.0,0.0,0.0,13
2020-02-24,Shares of several technology companies are trading lower amid continued spread of coronavirus including notable upticks in Iran and Italy. NOTE: The virus has raised fear of a global economic slowdown.,0.0026737967914438505,0.0026737967914438505,0.00802139037433155,0.00802139037433155,0.0026737967914438505,0.0026737967914438505,0.0,0.0026737967914438505,0.0,0.0,0.0,34
2020-02-12,Google Joins Blockchain Startup Hedera Hashgraph's Governing Council,0.0,0.0,0.0,0.0,0.0,0.0,0.0,0.0,0.0,0.0,0.0,9
2020-02-11,Piper Sandler Remains Bullish On Slack On Broader Enterprise Adoption,0.0,0.0,0.0,0.0,0.0,0.0,0.0,0.0,0.0,0.0,0.0,10
2020-02-10,Tech Is An Income Destination. Here's How To Play That Theme,0.0,0.0,0.0,0.0,0.0,0.0,0.0,0.0,0.0,0.0,0.0,13
2020-02-10,"Stephens Maintains Overweight, $37 Target On Slack Notes IBM's Enterprise-Wide Adoption 'is another data point indicating Slack is the preferred option for enterprise collaboration (vs. Microsoft Teams)'",0.0,0.0,0.0,0.030303030303030304,0.0,0.0,0.0,0.0,0.0,0.0,0.0,33
2020-02-10,Tech Companies Who Have Superpowers To Change Their Industry- And The World,0.0,0.0,0.0,0.0,0.0,0.0,0.0,0.0,0.0,0.0,0.0,12
2020-02-10,Slack's Stock Trades Higher On Report IBM Moves Employees To Platform,0.0,0.0,0.0,0.0,0.0,0.0,0.0,0.0,0.0,0.0,0.0,12
2020-02-10,"Amazon Wants To Depose Trump, Pentagon Officials In $10B JEDI Contract Protest",0.0,0.0,0.0,0.0,0.0,0.0,0.0,0.0,0.0,0.0,0.0,14
2020-02-10,"Slack 8-K Includes Response to Business Insider Article On IBM, Says 'IBM has been Slack's largest customer for several years and has expanded its usage of Slack over that time'",0.0,0.0,0.0,0.015151515151515152,0.0,0.0,0.015151515151515152,0.0,0.0,0.0,0.0,33
2020-02-07,Zacks com Featured Highlights Include  Ralph Lauren  Sharps Compliance And IBM,0.0,0.0,0.0,0.0,0.0,0.0,0.0,0.0,0.0,0.0,0.0,11
2020-02-07,Dow Jones News  IBM Rally Hits a Wall  Boeing s Starliner Suffered From Software Bug,0.0,0.0,0.0,0.0,0.0,0.0,0.0,0.0,0.0,0.0,0.0,15
2020-02-07,The Zacks Analyst Blog Highlights  Microsoft  IBM  Intel  Apple And McDonald s,0.0,0.0,0.0,0.0,0.0,0.0,0.0,0.0,0.0,0.0,0.0,12
2020-02-07,The Zacks Analyst Blog Highlights  Exxon Mobil  Chevron  IBM  Gilead And Edwards Lifesciences,0.0,0.0,0.0,0.0,0.0,0.0,0.0,0.0,0.0,0.0,0.0,13
2020-02-06,French Food Company Looks to IBM s Blockchain Network for Better Sourcing,0.0,0.0,0.0,0.0,0.0,0.0,0.0,0.0,0.0,0.0,0.0,12
2020-02-06,PreMarket Prep Stock Of The Day: IBM,0.0,0.0,0.0,0.0,0.0,0.0,0.0,0.0,0.0,0.0,0.0,8
2020-02-06,"There Was A Big Rotation In The Market On Wednesday: PreMarket Prep Recap For Feb. 6, 2020",0.0,0.0,0.0,0.0,0.0,0.0,0.0,0.0,0.0,0.0,0.0,19
2020-02-06,IBM Post Earnings  Mainframe Cycle Could Buy Time For RedHat Integration,0.0,0.0,0.0,0.0,0.0,0.0,0.0,0.0,0.0,0.0,0.0,11
2020-02-06,Stocks That Hit 52-Week Highs On Thursday,0.0,0.0,0.0,0.0,0.0,0.0,0.0,0.0,0.0,0.0,0.0,7
2020-02-05,Why IBM Stock Just Popped 5 ,0.0,0.0,0.0,0.0,0.0,0.0,0.0,0.0,0.0,0.0,0.0,6
2020-02-05,Buy 5 Blue Chip Stocks That Have Surged YTD Defying Volatility,0.0,0.0,0.0,0.0,0.0,0.0,0.0,0.0,0.0,0.0,0.0,11
2020-02-05,IBM shares are trading higher as unconfirmed reports of progress towards a coronavirus treatment raise investor sentiment amid the virus outbreak. NOTE: The WHO played down these reports and said there are no known treatments.,0.0,0.0,0.006578947368421052,0.006578947368421052,0.0,0.0,0.006578947368421052,0.006578947368421052,0.0,0.0,0.0,38
2020-02-05,IBM Stock Rises 4 ,0.0,0.0,0.0,0.0,0.0,0.0,0.0,0.0,0.0,0.0,0.0,4
2020-02-05,3 Top Ranked Stocks With Upgraded Broker Ratings To Buy Now,0.0,0.0,0.0,0.0,0.0,0.0,0.0,0.0,0.0,0.0,0.0,11
2020-02-05,US  IBM Leads Top Patent Assignees With Patents in AI and Blockchain,0.0,0.0,0.0,0.0,0.0,0.0,0.0,0.0,0.0,0.0,0.0,12
2020-02-04,Splunk  Baozun  Bank Of America  Intel And IBM As Zacks Bull And Bear Of The Day,0.0,0.0,0.0,0.0,0.0,0.0,0.0,0.0,0.0,0.0,0.0,16
2020-02-04,3 Extra Large Caps With Great Zacks Ranks,0.0,0.0,0.0,0.0,0.0,0.0,0.0,0.0,0.0,0.0,0.0,8
2020-02-04,IBM Option Alert: Mar 20 $155 Calls at the Ask: 1500 @ $1.0 vs 3087 OI; Ref=$148.2148,0.0,0.0,0.0,0.0,0.0,0.0,0.0,0.0,0.0,0.0,0.0,24
2020-02-03,IBM Offers Blockchain Solution for Casual Labor Contracts,0.0,0.0,0.0,0.0,0.0,0.0,0.0,0.0,0.0,0.0,0.0,8
2020-02-03,Edward Jones Earlier Upgraded IBM to Buy,0.0,0.0,0.0,0.0,0.0,0.0,0.0,0.0,0.0,0.0,0.0,7
2020-02-03,Tech Stocks  Earnings Roster For Feb 5  CTSH  PAYC   More,0.0,0.0,0.0,0.0,0.0,0.0,0.0,0.0,0.0,0.0,0.0,10
2020-02-03,82 Biggest Movers From Friday,0.0,0.0,0.0,0.0,0.0,0.0,0.0,0.0,0.0,0.0,0.0,5
2020-02-02,Has International Business Machines  IBM  Outpaced Other Computer And Technology Stocks This Year ,0.0,0.0,0.0,0.0,0.0,0.0,0.0,0.0,0.0,0.0,0.0,13
2020-01-31,IBM Shares Surge As Company Names Cloud Chief New CEO,0.0,0.0,0.0,0.0,0.0,0.0,0.0,0.0,0.0,0.0,0.0,10
2020-01-31,"12 Stocks To Watch For January 31, 2020",0.0,0.0,0.0,0.0,0.0,0.0,0.0,0.0,0.0,0.0,0.0,9
2020-01-31,International Business Machines shares are trading higher after the company announced it has elected Arvind Krishna as CEO of the company.,0.0,0.0,0.0,0.0,0.0,0.0,0.0,0.0,0.0,0.0,0.0,22
2020-01-31,33 Stocks Moving in Friday's Pre-Market Session,0.0,0.0,0.0,0.0,0.0,0.0,0.0,0.0,0.0,0.0,0.0,8
2020-01-31,8 Technology Stocks Moving In Friday's Pre-Market Session,0.0,0.0,0.0,0.0,0.0,0.0,0.0,0.0,0.0,0.0,0.0,9
