date,title,anger,fear,negative,positive,sadness,trust,anticipation,joy,disgust,surprise,anticip,word_count
2019-04-18,"IBM Reports Deal With Fukui Bank To Migrate Its Distributed Processing System To IBM Cloud, No Terms Disclosed",0.0,0.0,0.0,0.0,0.0,0.0,0.0,0.0,0.0,0.0,0.0,19
2019-04-18,"IBM Reports Renewed Deal With Boursorama For Hybrid Cloud Contract For 5 Years, No Terms Disclosed",0.0,0.0,0.0,0.0,0.0,0.0,0.0,0.0,0.0,0.0,0.0,17
2019-04-18,64 Biggest Movers From Yesterday,0.0,0.0,0.0,0.0,0.0,0.0,0.0,0.0,0.0,0.0,0.0,5
2019-04-17,42 Stocks Moving In Wednesday's Mid-Day Session,0.0,0.0,0.0,0.0,0.0,0.0,0.0,0.0,0.0,0.0,0.0,8
2019-04-17,"Hot, Fresh Earnings On The Menu As Netflix, Morgan Stanley Results In Focus",0.0,0.0,0.0,0.0,0.0,0.0,0.0,0.0,0.0,0.0,0.0,15
2019-04-17,"BMO Capital Maintains Market Perform on IBM, Raises Price Target to $155",0.0,0.0,0.0,0.0,0.0,0.0,0.0,0.0,0.0,0.0,0.0,14
2019-04-17,Company News For Apr 18  2019,0.0,0.0,0.0,0.0,0.0,0.0,0.0,0.0,0.0,0.0,0.0,6
2019-04-17,IBM shares are trading lower following mixed Q1 results and inline Q2 EPS guidance.,0.0,0.0,0.016666666666666666,0.016666666666666666,0.016666666666666666,0.016666666666666666,0.0,0.0,0.0,0.0,0.0,15
2019-04-17,IBM Falls 6 ,0.0,0.0,0.0,0.0,0.0,0.0,0.0,0.0,0.0,0.0,0.0,3
2019-04-17,"Cloud, Services Strong Again For IBM, But Earnings Reaction Tepid",0.0,0.0,0.0,0.0,0.0,0.0,0.0,0.0,0.0,0.0,0.0,12
2019-04-17,"Citigroup Maintains Neutral on IBM, Raises Price Target to $140",0.0,0.0,0.0,0.0,0.0,0.0,0.0,0.0,0.0,0.0,0.0,12
2019-04-17,28 Stocks Moving In Wednesday's Pre-Market Session,0.0,0.0,0.0,0.0,0.0,0.0,0.0,0.0,0.0,0.0,0.0,8
2019-04-17,A Peek Into The Markets: US Stock Futures Edge Higher; Morgan Stanley Beats Q1 Views,0.0,0.0,0.0,0.0,0.0,0.0,0.0,0.0,0.0,0.0,0.0,17
2019-04-17,"8 Stocks To Watch For April 17, 2019",0.0,0.0,0.0,0.0,0.0,0.0,0.0,0.0,0.0,0.0,0.0,9
2019-04-16,"IBM shares trading lower following mixed Q1 results, inline Q2 EPS guidance.",0.0,0.0,0.017857142857142856,0.017857142857142856,0.017857142857142856,0.017857142857142856,0.0,0.0,0.0,0.0,0.0,14
2019-04-16,IBM quarterly revenue misses on weak mainframe computer business,0.0,0.0,0.0,0.0,0.0,0.0,0.0,0.0,0.0,0.0,0.0,9
2019-04-16,"IBM Q1 Adj. EPS $2.25 vs $2.22 Estimate, Sales $18.2B vs $18.51B Est.",0.0,0.0,0.0,0.0,0.0,0.0,0.0,0.0,0.0,0.0,0.0,20
2019-04-16,"Earnings Scheduled For April 16, 2019",0.0,0.0,0.0,0.0,0.0,0.0,0.0,0.0,0.0,0.0,0.0,7
2019-04-16,"IBM Tops Street Estimates On Earnings, Comes Up Short On Sales Expectations",0.0,0.0,0.0,0.0,0.0,0.0,0.0,0.0,0.0,0.0,0.0,13
2019-04-16,Banks On Parade: Bank of America Becomes Latest Big Financial Company To Report,0.0,0.0,0.0,0.0,0.0,0.0,0.0,0.0,0.0,0.0,0.0,14
2019-04-16,IBM To Report Q1 Earnings After The Closing Bell; Co. Historically Issues Its Report Just After 4:05 p.m. ET,0.0,0.0,0.0,0.0,0.0,0.0,0.0,0.0,0.0,0.0,0.0,22
2019-04-16,IBM Sees FY19 Adj. EPS At Least $13.90 vs $13.91 Estimate,0.0,0.0,0.0,0.0,0.0,0.0,0.0,0.0,0.0,0.0,0.0,14
2019-04-16,6 Stocks Moving In Tuesday's After-Hours Session,0.0,0.0,0.0,0.0,0.0,0.0,0.0,0.0,0.0,0.0,0.0,8
2019-04-16,IBM  IBM  Q1 Earnings Top Estimates,0.0,0.0,0.0,0.0,0.0,0.0,0.0,0.0,0.0,0.0,0.0,6
2019-04-16,IBM Earnings Beat  Revenue Misses In Q1,0.0,0.0,0.0,0.0,0.0,0.0,0.0,0.0,0.0,0.0,0.0,7
2019-04-16,IBM ETFs To Watch Post Q1 Earnings,0.0,0.0,0.0,0.0,0.0,0.0,0.0,0.0,0.0,0.0,0.0,7
2019-04-16,"10 Stocks To Watch For April 16, 2019",0.0,0.0,0.0,0.0,0.0,0.0,0.0,0.0,0.0,0.0,0.0,9
2019-04-15,"Earnings Parade Rolls Along As Citigroup, Goldman Sachs Report And SPX Now Tops 2900",0.0,0.0,0.0,0.0,0.0,0.0,0.0,0.0,0.0,0.0,0.0,15
2019-04-15,Nestl   Carrefour Work With IBM to Track Mashed Potato Brand With Blockchain,0.0,0.0,0.0,0.0,0.0,0.0,0.0,0.0,0.0,0.0,0.0,12
2019-04-14,Should You Avoid IBM ETFs Ahead Of Q1 Earnings ,0.0,0.0,0.0,0.0,0.0,0.0,0.0,0.0,0.0,0.0,0.0,9
2019-04-12,This Day In Market History: The Yahoo! IPO,0.0,0.0,0.0,0.0,0.0,0.0,0.0,0.0,0.0,0.0,0.0,10
2019-04-11,"Benzinga's Top Upgrades, Downgrades For April 11, 2019",0.0,0.0,0.0,0.0,0.0,0.0,0.0,0.0,0.0,0.0,0.0,11
2019-04-11,"Credit Suisse Initiates Coverage On IBM with Outperform Rating, Announces $173 Price Target",0.0,0.0,0.0,0.0,0.0,0.0,0.0,0.0,0.0,0.0,0.0,15
2019-04-11,A Look At The Dow And FANG Stocks In 2019,0.0,0.0,0.0,0.0,0.0,0.0,0.0,0.0,0.0,0.0,0.0,10
2019-04-11,"Credit Suisse Initiates IBM with Outperform, $173 Price Target",0.0,0.0,0.0,0.0,0.0,0.0,0.0,0.0,0.0,0.0,0.0,11
2019-04-10,Oracle And IBM Are Officially Out Of The Race For A Key $10B Defense Cloud Contract As Amazon And Microsoft Move Ahead,0.0,0.0,0.0,0.0,0.0,0.0,0.0,0.0,0.0,0.0,0.0,23
2019-04-08,IBM Patents Blockchain Implementation to Manage Data For Autonomous Vehicles,0.0,0.0,0.0,0.0,0.0,0.0,0.0,0.0,0.0,0.0,0.0,10
2019-04-08,Earnings Preview  IBM  IBM  Q1 Earnings Expected To Decline,0.0,0.0,0.0,0.0,0.0,0.0,0.0,0.0,0.0,0.0,0.0,9
2019-04-08,Ripple s CTO does not believe the Stellar IBM partnership solves the issue of centralization ,0.0,0.0,0.0,0.03333333333333333,0.0,0.03333333333333333,0.0,0.0,0.0,0.0,0.0,15
2019-04-05,Cryptocurrency Gaining Steam And Disrupting Different Industries,0.0,0.0,0.0,0.0,0.0,0.0,0.0,0.0,0.0,0.0,0.0,7
2019-04-04,Centerbridge Partners To Acquire IBM's Marketing Platform And Commerce Software Offerings To Form Standalone Marketing And Advertising Technology Company,0.0,0.0,0.0,0.0,0.0,0.0,0.0,0.0,0.0,0.0,0.0,20
2019-04-04,Blockchain Battles On DApps Are Underway  Who Will Win ,0.0,0.0,0.0,0.0,0.0,0.0,0.0,0.0,0.0,0.0,0.0,9
2019-04-04,Ripple  SWIFT and IBM join 100 other firms in the newly launched EU Blockchain Group,0.0,0.0,0.0,0.06666666666666667,0.0,0.0,0.0,0.0,0.0,0.0,0.0,15
2019-04-02,IBM Surprises  Chooses Stellar Platform For New Payment Transfer Service,0.0,0.0,0.0,0.0,0.0,0.0,0.0,0.0,0.0,0.0,0.0,10
2019-04-02,Deutsche Telekom s T Systems to boost core profits  strives for cash,0.011904761904761904,0.011904761904761904,0.0,0.023809523809523808,0.0,0.011904761904761904,0.011904761904761904,0.011904761904761904,0.0,0.0,0.0,12
2019-03-28,Stellar  XLM  Support Added to TrustWallet by Binance,0.0,0.0,0.0,0.0,0.0,0.0,0.0,0.0,0.0,0.0,0.0,8
2019-03-28,"China To Offer Foreign Tech Firms Better Access To Cloud-Computing Sector, Sources Say; Plan Would Allow Foreigners To Own Cloud Operations In Free-Trade Zone",0.0,0.0,0.0,0.0,0.0,0.0,0.0,0.0,0.0,0.0,0.0,26
2019-03-27,"IBM 8-K Shows Co. To Report Sales, Pre-Tax Income, External Gross Profit For 5 Segments: 1. Cloud And Cognitive Software, 2. Global Business Services, 3. Global Technology Services, 4. Systems, 5. Global Financing",0.0,0.0,0.0,0.0,0.0,0.0,0.0,0.0,0.0,0.0,0.0,45
2019-03-27,XRP/USD Stages A Recovery As XRP Futures Go Live On Huobi Exchange,0.0,0.0,0.0,0.0,0.0,0.0,0.0,0.0,0.0,0.0,0.0,12
2019-03-26,China will open further to foreign investment  premier assures global executives,0.0,0.0,0.045454545454545456,0.045454545454545456,0.0,0.0,0.0,0.0,0.0,0.0,0.0,11
2019-03-25,Red Hat  IBM Rise in After Hours Trading,0.0,0.0,0.0,0.0,0.0,0.0,0.0,0.0,0.0,0.0,0.0,8
2019-03-25,Autonomy boss Lynch ramped sales ahead of HP deal  court told,0.0101010101010101,0.0101010101010101,0.0,0.0202020202020202,0.0,0.0101010101010101,0.0202020202020202,0.0101010101010101,0.0,0.0101010101010101,0.0,11
2019-03-24,Hodler s Digest  March 18 24  Hodler s Digest  Top Stories  Price Movements  Quotes and FUD of the Week,0.0,0.0,0.0,0.0,0.0,0.0,0.0,0.0,0.0,0.0,0.0,19
2019-03-22,Autonomy founder Lynch set for  5 billion Hewlett Packard court showdown,0.0303030303030303,0.0303030303030303,0.0,0.0,0.0,0.0,0.0303030303030303,0.0,0.0,0.0,0.0,11
2019-03-20,"Jim Cramer Weighs In On Alibaba, Kimberly Clark And More",0.0,0.0,0.0,0.0,0.0,0.0,0.0,0.0,0.0,0.0,0.0,11
2019-03-20,Pet Stablecoins  Why Some Banks Issue Their Own Digital Tokens  While Others Don t,0.0,0.0,0.0,0.0,0.0,0.0,0.0,0.0,0.0,0.0,0.0,14
2019-03-19,IBM World Wire Goes Live  Six International Banks to Issue Stablecoins on New Network,0.0,0.0,0.0,0.0,0.0,0.0,0.0,0.0,0.0,0.0,0.0,14
2019-03-19,Is The Crypto Winter Coming To An End ,0.0,0.0,0.0,0.0,0.0,0.0,0.0,0.0,0.0,0.0,0.0,8
2019-03-19,IMB Partners With Stellar And Shares Rise,0.0,0.0,0.0,0.0,0.0,0.0,0.0,0.0,0.0,0.0,0.0,7
2019-03-18,"IBM Announces IBM Blockchain World Wire, A Real-Time Global Payments Network For Regulated Financial Institutions, Is Officially Accessible In A Growing Number Of Markets",0.0,0.0,0.0,0.0,0.0,0.0,0.0,0.0,0.0,0.0,0.0,26
2019-03-18,Six Global Banks Sign up to Issue Stablecoins on IBM s Now Live Blockchain Network,0.0,0.0,0.0,0.0,0.0,0.0,0.0,0.0,0.0,0.0,0.0,15
2019-03-16,Headline  Enterprise Blockchain on the Rise Despite Criticisms,0.0,0.0,0.0,0.0,0.0,0.0,0.0,0.0,0.0,0.0,0.0,8
2019-03-16,French Court Clerks to Use IBM Blockchain Platform for Corporate Registry,0.0,0.0,0.0,0.0,0.0,0.0,0.0,0.0,0.0,0.0,0.0,11
2019-03-16,IBM Hints at Stablecoin Cross Border Payments Solution for Financial Institutions,0.0,0.0,0.0,0.0,0.0,0.0,0.0,0.0,0.0,0.0,0.0,11
2019-03-16,Enterprise Blockchain on the Rise Despite Criticisms,0.0,0.0,0.0,0.0,0.0,0.0,0.0,0.0,0.0,0.0,0.0,7
2019-03-14,Tech Trends Of The Next 5 Years,0.0,0.0,0.0,0.0,0.0,0.0,0.0,0.0,0.0,0.0,0.0,7
2019-03-14,IBM Publishes Patent for Resisting Replay Attacks in Permissioned Blockchains,0.0,0.0,0.0,0.0,0.0,0.0,0.0,0.0,0.0,0.0,0.0,10
2019-03-12,Cisco Has the Fundamentals  but Shares Are Looking Frothy,0.0,0.0,0.0,0.0,0.0,0.0,0.0,0.0,0.0,0.0,0.0,9
2019-03-11,CULedger And IBM Announce Collaboration To Deliver Blockchain Services For Financial Cooperatives And Credit Unions Worldwide,0.0,0.0,0.0,0.0,0.0,0.0,0.0,0.0,0.0,0.0,0.0,16
2019-03-11,Stellar  XLM  Rallies on Expectations of  Special Announcement ,0.0,0.0,0.0,0.0,0.0,0.0,0.0,0.0,0.0,0.0,0.0,8
2019-03-08,IBM Reveals Two Further Blockchain Patents for Security And Database Management,0.0,0.0,0.0,0.0,0.0,0.0,0.0,0.0,0.0,0.0,0.0,11
2019-03-08,"CargoX's Blockchain-Based Smart ""Bill Of Lading"" Solution Is Now On dexFreight's Platform",0.0,0.0,0.0,0.0,0.0,0.0,0.0,0.0,0.0,0.0,0.0,16
2019-03-07,Regulatory Hurdles Threaten To Slow Blockchain Development In The U.S.,0.0,0.0,0.0,0.0,0.0,0.0,0.0,0.0,0.0,0.0,0.0,11
2019-03-06,Undercover Down Under  Miners study gum leaves  groundwater for new finds,0.0,0.0,0.0,0.09090909090909091,0.0,0.0,0.0,0.0,0.0,0.0,0.0,11
2019-03-06,"IBM Files Mixed Securities Offering For IBM Int'l. Group Capital, No Size Disclosed",0.0,0.0,0.0,0.0,0.0,0.0,0.0,0.0,0.0,0.0,0.0,15
2019-03-05,IBM X-Force Red Launches New Service For Blockchain Security Testing,0.0,0.0,0.0,0.0,0.0,0.0,0.0,0.0,0.0,0.0,0.0,10
2019-03-04, MKR  Maker Price Prediction 2019 2020 5 Years,0.0,0.0,0.0,0.0,0.0,0.0,0.0,0.0,0.0,0.0,0.0,8
2019-03-04,"IBM Achieves Highest Quantum Volume to Date, Establishes Roadmap for Reaching Quantum Advantage",0.0,0.0,0.0,0.0,0.0,0.0,0.0,0.0,0.0,0.0,0.0,14
2019-02-25,India s growth momentum likely slowed in late 2018  Reuters poll,0.0,0.0,0.01515151515151515,0.0303030303030303,0.01515151515151515,0.01515151515151515,0.01515151515151515,0.0,0.0,0.0,0.0,11
2019-02-20,IBM  IBM  Up 3 9  Since Last Earnings Report  Can It Continue ,0.0,0.0,0.0,0.0,0.0,0.0,0.0,0.0,0.0,0.0,0.0,12
2019-02-19,How To Replicate Hedge Fund Strategies With ETFs,0.0,0.0,0.0,0.0,0.0,0.0,0.0,0.0,0.0,0.0,0.0,8
2019-02-18,"Bulls & Bears Of The Week: Cisco, Coca-Cola, IBM, Tesla And More",0.0,0.0,0.0,0.0,0.0,0.0,0.0,0.0,0.0,0.0,0.0,16
2019-02-15,Analysts Applaud IBM's Move To Make Watson Available Cross-Cloud,0.0,0.0,0.0,0.0,0.0,0.0,0.0,0.0,0.0,0.0,0.0,10
2019-02-08,How IBM Watson Plays In The Fintech Space,0.0,0.0,0.0,0.0,0.0,0.0,0.0,0.0,0.0,0.0,0.0,8
2019-02-07,India inflation seen speeding up in Jan but still below target  Reuters poll,0.0,0.02564102564102564,0.02564102564102564,0.0,0.0,0.02564102564102564,0.0,0.0,0.0,0.0,0.0,13
2019-02-07,India unexpectedly cuts key rate  changes stance to neutral,0.0,0.0,0.0,0.0,0.0,0.037037037037037035,0.037037037037037035,0.0,0.0,0.037037037037037035,0.0,9
2019-02-06,IBM develops new technology to help prevent power outages,0.0,0.05555555555555555,0.0,0.05555555555555555,0.0,0.0,0.0,0.0,0.0,0.0,0.0,9
2019-02-06,China hacked Norway s Visma to steal client secrets  investigators,0.025,0.025,0.025,0.0,0.025,0.0,0.0,0.0,0.0,0.0,0.0,10
2019-02-06,Rosenblatt defends Tableau after earnings,0.0,0.0,0.0,0.0,0.0,0.0,0.0,0.0,0.0,0.0,0.0,5
2019-02-05,Cryptocurrencies Are Disrupting The Commodities Market,0.0,0.0,0.0,0.0,0.0,0.0,0.0,0.0,0.0,0.0,0.0,6
2019-02-01,IBM  Pacific International Lines Complete Blockchain Shipping Trial With Oranges,0.0,0.0,0.0,0.0,0.0,0.0,0.0,0.0,0.0,0.0,0.0,10
2019-01-30,PreMarket Prep Opening NYSE Imbalance Update: IBM 184k Shares To Sell,0.0,0.0,0.0,0.0,0.0,0.0,0.0,0.0,0.0,0.0,0.0,12
2019-01-28,Nestle  IBM Food Trust Blockchain Set to Expand to New Suppliers  Consumers in 2019,0.0,0.0,0.0,0.0,0.0,0.0,0.0,0.0,0.0,0.0,0.0,14
2019-01-27,IBM  Is It Time To Buy ,0.0,0.0,0.0,0.0,0.0,0.0,0.0,0.0,0.0,0.0,0.0,6
2019-01-25,Insurance Giant Aetna Partners With IBM on Blockchain Network for Healthcare Industry,0.0,0.0,0.0,0.0,0.0,0.0,0.0,0.0,0.0,0.0,0.0,12
2019-01-24,54 Biggest Movers From Yesterday,0.0,0.0,0.0,0.0,0.0,0.0,0.0,0.0,0.0,0.0,0.0,5
2019-01-24,IBM  Aetna  PNC Explore Medical Data Blockchain for 100 Million Health Plans,0.0,0.0,0.0,0.0,0.0,0.0,0.0,0.0,0.0,0.0,0.0,12
2019-01-24,"IBM Nails Earnings, But May Be Overbought In The Near Term",0.0,0.0,0.0,0.0,0.0,0.0,0.0,0.0,0.0,0.0,0.0,12
2019-01-24,Gloomy data shoves euro lower ahead of ECB meeting,0.0,0.0,0.037037037037037035,0.037037037037037035,0.037037037037037035,0.0,0.0,0.0,0.0,0.0,0.0,9
2019-01-24,Norges Bank And ECB Take Centre Stage ,0.0,0.0,0.0,0.0,0.0,0.0,0.0,0.0,0.0,0.0,0.0,7
2019-01-24,"Benzinga Pro's Top 10 Most-Searched Tickers For Morning Of Thurs., Jan. 24, 2019",0.0,0.0,0.0,0.0,0.0,0.0,0.0,0.0,0.0,0.0,0.0,16
2019-01-24,"Market Seems Generally Pleased With Earnings Results, But Geopolitics Still Weigh",0.0,0.0,0.0,0.0,0.0,0.0,0.0,0.0,0.0,0.0,0.0,12
2019-01-23,Analysts Debate IBM: One-Time Fluke Or Sustainable Recovery?,0.0,0.0,0.0,0.0,0.0,0.0,0.0,0.0,0.0,0.0,0.0,10
2019-01-23,28 Stocks Moving In Wednesday's Pre-Market Session,0.0,0.0,0.0,0.0,0.0,0.0,0.0,0.0,0.0,0.0,0.0,8
2019-01-23,U S  China Trade Optimism Reverses Earnings Losses,0.0,0.0,0.0,0.0,0.0,0.0,0.0,0.0,0.0,0.0,0.0,8
2019-01-23,IBM Nails Earnings But May Be Overbought In The Near Term,0.0,0.0,0.0,0.0,0.0,0.0,0.0,0.0,0.0,0.0,0.0,11
2019-01-23,IBM shares are trading higher after the company reported better than expected Q4 EPS and revenue results.,0.0,0.0,0.0,0.0,0.0,0.0,0.05555555555555555,0.0,0.0,0.0,0.0,18
2019-01-23,IBM signs  260M bank services agreement,0.0,0.0,0.0,0.05555555555555555,0.0,0.1111111111111111,0.0,0.0,0.0,0.0,0.0,6
2019-01-23,Earnings Rescue Market From Morning Drop ,0.0,0.0,0.0,0.0,0.0,0.0,0.0,0.0,0.0,0.0,0.0,6
2019-01-23,IBM Rises 7 ,0.0,0.0,0.0,0.0,0.0,0.0,0.0,0.0,0.0,0.0,0.0,3
2019-01-23,A Peek Into The Markets: US Stock Futures Surge Ahead Of Earnings,0.0,0.0,0.0,0.0,0.0,0.0,0.0,0.0,0.0,0.0,0.0,13
2019-01-23,"Geopolitics Aside, How About Those Earnings? Investors Appear To Switch Focus",0.0,0.0,0.0,0.0,0.0,0.0,0.0,0.0,0.0,0.0,0.0,13
2019-01-23,Today's Pickup: Markets Mixed; Stock Futures Rise; Shutdown Having Big Impact On U.S.,0.0,0.0,0.0,0.0,0.0,0.0,0.0,0.0,0.0,0.0,0.0,18
2019-01-23,40 Stocks Moving In Wednesday's Mid-Day Session,0.0,0.0,0.0,0.0,0.0,0.0,0.0,0.0,0.0,0.0,0.0,8
2019-01-23,"12 Stocks To Watch For January 23, 2019",0.0,0.0,0.0,0.0,0.0,0.0,0.0,0.0,0.0,0.0,0.0,9
2019-01-23,"Benzinga Pro's Top 10 Most-Searched Tickers For Morning Of Wed., Jan. 23, 2019",0.0,0.0,0.0,0.0,0.0,0.0,0.0,0.0,0.0,0.0,0.0,16
2019-01-22,"10 Stocks To Watch For January 22, 2019",0.0,0.0,0.0,0.0,0.0,0.0,0.0,0.0,0.0,0.0,0.0,9
2019-01-22,"Earnings Scheduled For January 22, 2019",0.0,0.0,0.0,0.0,0.0,0.0,0.0,0.0,0.0,0.0,0.0,7
2019-01-22,ETFs To Buy On IBM s Annual Revenue Growth Story ,0.0,0.0,0.0,0.0,0.0,0.0,0.0,0.0,0.0,0.0,0.0,10
2019-01-22,Relief Rally In Global Equity Markets To Be Tested This Week ,0.0,0.0,0.0,0.0,0.0,0.0,0.0,0.0,0.0,0.0,0.0,11
2019-01-22,A Peek Into The Markets: US Stock Futures Drop Ahead Of Earnings,0.0,0.0,0.0,0.0,0.0,0.0,0.0,0.0,0.0,0.0,0.0,13
2019-01-22,GDP Comes under Pressure Due to Shutdown,0.0,0.0,0.0,0.0,0.0,0.0,0.0,0.0,0.0,0.0,0.0,7
2019-01-22,IBM Sees FY19 Adj. EPS Of At Least $13.90 vs $13.84 Est.; Sees Free Cash Flow Of Approximately $12B,0.0,0.0,0.0,0.0,0.0,0.0,0.0,0.0,0.0,0.0,0.0,25
2019-01-22,IBM To Report Q4 Earnings After The Closing Bell; Co. Historically Issues Its Report Before 4:10 p.m. ET,0.0,0.0,0.0,0.0,0.0,0.0,0.0,0.0,0.0,0.0,0.0,21
2019-01-22,IBM revenue beats estimates on strength in cloud  services businesses,0.0,0.0,0.0,0.05,0.0,0.05,0.0,0.0,0.0,0.0,0.0,10
2019-01-22,IBM Climbs After Hours  Results and Guidance Top Forecasts,0.0,0.0,0.0,0.0,0.0,0.0,0.0,0.0,0.0,0.0,0.0,9
2019-01-22,"IBM Q4 Adj. EPS $4.87 Beats $4.84 Estimate, Sales $21.76B Beat $21.75B Estimate",0.0,0.0,0.0,0.0,0.0,0.0,0.0,0.0,0.0,0.0,0.0,19
2019-01-22,China s Weak Economic Data And News From EBay  IBM  Halliburton    More ,0.0,0.0,0.0,0.0,0.0,0.0,0.0,0.0,0.0,0.0,0.0,12
2019-01-22,5 Stocks Moving In Tuesday's After-Hours Session,0.0,0.0,0.0,0.0,0.0,0.0,0.0,0.0,0.0,0.0,0.0,8
2019-01-22,"IBM Rises After Q4 Earnings Beat, Cloud Revenue Up 12%",0.0,0.0,0.0,0.0,0.0,0.0,0.0,0.0,0.0,0.0,0.0,12
2019-01-21,Should You Buy IBM ETFs Ahead Of Q4 Results ,0.0,0.0,0.0,0.0,0.0,0.0,0.0,0.0,0.0,0.0,0.0,9
2019-01-21,Digital Securities Platform Joins IBM Blockchain Accelerator Program,0.0,0.0,0.0,0.0,0.0,0.0,0.0,0.0,0.0,0.0,0.0,8
2019-01-21,Spanish Port Authority Joins Blockchain Platform Developed by IBM and Maersk,0.0,0.0,0.0,0.0,0.0,0.0,0.0,0.0,0.0,0.0,0.0,11
2019-01-21,Vodafone  IBM Join Forces To Enhance Market Share In Europe,0.0,0.0,0.0,0.0,0.0,0.0,0.0,0.0,0.0,0.0,0.0,10
2019-01-20,After MLK Day Today  Markets Go For 5 Straight Up Weeks,0.0,0.0,0.0,0.0,0.0,0.0,0.0,0.0,0.0,0.0,0.0,11
2019-01-18,Grayscale s Newest Crypto Investment Trust Will Hold Stellar Lumens,0.0,0.0,0.0,0.0,0.0,0.0,0.0,0.0,0.0,0.0,0.0,10
2019-01-16,"Tech Sector Earnings: Revenue Growth Widely Expected To Slow, Will Global Uncertainty Weigh?",0.0,0.0,0.0,0.0,0.0,0.0,0.0,0.0,0.0,0.0,0.0,16
2019-01-16,"IBM Reports Its Services Unit Reached $325M Deal With Juniper Networks Under Which IBM Will Assist Juniper In Managing Existing Infrastructure, App, IT Services",0.0,0.0,0.0,0.0,0.0,0.0,0.0,0.0,0.0,0.0,0.0,27
2019-01-16,"Jim Cramer Gives His Opinion On Barrick Gold, Exxon, Nike And More",0.0,0.0,0.0,0.0,0.0,0.0,0.0,0.0,0.0,0.0,0.0,14
2019-01-16,Red Hat 8-K Shows Shareholders At Special Meeting Approved Deal With IBM,0.0,0.0,0.0,0.0,0.0,0.0,0.0,0.0,0.0,0.0,0.0,12
2019-01-16,Ford  LG to Pilot IBM Blockchain in Fight Against Child Labor,0.0,0.0,0.0,0.0,0.0,0.0,0.0,0.0,0.0,0.0,0.0,11
2019-01-16,Ford and IBM among quartet in Congo cobalt blockchain project,0.0,0.0,0.0,0.0,0.0,0.0,0.0,0.0,0.0,0.0,0.0,10
2019-01-16,IBM  Ford Blockchain Pilot Targets Cobalt Supplies From Democratic Republic of Congo,0.0,0.0,0.0,0.0,0.0,0.0,0.0,0.0,0.0,0.0,0.0,12
2019-01-16,Red Hat holders vote for IBM merger,0.017857142857142856,0.0,0.017857142857142856,0.017857142857142856,0.017857142857142856,0.017857142857142856,0.017857142857142856,0.017857142857142856,0.0,0.017857142857142856,0.0,7
2019-01-16,IBM  Juniper announce cloud agreement,0.0,0.0,0.0,0.1,0.0,0.1,0.0,0.0,0.0,0.0,0.0,5
2019-01-15,Red Hat  RHT  Down 0 2  Since Last Earnings Report  Can It Rebound ,0.0,0.0,0.0,0.0,0.0,0.0,0.0,0.0,0.0,0.0,0.0,13
2019-01-14,Analysts Estimate IBM  IBM  To Report A Decline In Earnings  What To Look Out For,0.0,0.0,0.0,0.0,0.0,0.0,0.0,0.0,0.0,0.0,0.0,15
2019-01-10,Investing In Precious Commodities  What Does The Future Hold ,0.0,0.0,0.0,0.0,0.0,0.0,0.0,0.0,0.0,0.0,0.0,9
2019-01-09,Earnings Preview  IBM  IBM  Q4 Earnings Expected To Decline,0.0,0.0,0.0,0.0,0.0,0.0,0.0,0.0,0.0,0.0,0.0,9
2019-01-08,"IBM Announces $540 Million Multi-year Agreement With Nordea, Under Which Nordea Bank Will Outsource Its IBM Z Operations to IBM",0.0,0.0,0.0,0.0,0.0,0.0,0.0,0.0,0.0,0.0,0.0,22
2019-01-08,IBM keeps U S  patent crown in 2018,0.0,0.0,0.0,0.125,0.0,0.0,0.0,0.0,0.0,0.0,0.0,8
2019-01-08,IBM signs  540M services agreement,0.0,0.0,0.0,0.1,0.0,0.1,0.0,0.0,0.0,0.0,0.0,5
2019-01-08,U S  initiative warns firms of hacking by China  other countries,0.0,0.0,0.0,0.0,0.0,0.0,0.0,0.0,0.0,0.0,0.0,11
2019-01-08,"""Deep Data"" To Become The Greatest Natural Resource, Tech Execs Say",0.0,0.0,0.0,0.0,0.0,0.0,0.0,0.0,0.0,0.0,0.0,14
2019-01-07,Juniper Networks Enters Master Service Agreement With IBM,0.0,0.0,0.0,0.0,0.0,0.0,0.0,0.0,0.0,0.0,0.0,8
2019-01-04,IBM Rises 3 ,0.0,0.0,0.0,0.0,0.0,0.0,0.0,0.0,0.0,0.0,0.0,3
2019-01-03,IBM  IBM  Stock Moves  1 98   What You Should Know,0.0,0.0,0.0,0.0,0.0,0.0,0.0,0.0,0.0,0.0,0.0,10
2019-01-02,Tech stocks shares are trading lower after Apple cut Q1 sales guidance drastically.,0.0,0.0,0.028571428571428574,0.014285714285714287,0.014285714285714287,0.014285714285714287,0.0,0.0,0.0,0.0,0.0,14
2018-12-31,The Best And Worst Stocks Of 2018,0.0,0.0,0.0,0.0,0.0,0.0,0.0,0.0,0.0,0.0,0.0,7
2018-12-26,"Macronix, IBM Extend Partnership through Early 2022",0.0,0.0,0.0,0.0,0.0,0.0,0.0,0.0,0.0,0.0,0.0,8
2018-12-26,IBM s Focus On Digital Overhaul Of Sports Holds Promise,0.0,0.0,0.0,0.0,0.0,0.0,0.0,0.0,0.0,0.0,0.0,10
2018-12-26,IBM Rises 3 ,0.0,0.0,0.0,0.0,0.0,0.0,0.0,0.0,0.0,0.0,0.0,3
2018-12-24,IBM Falls 3 ,0.0,0.0,0.0,0.0,0.0,0.0,0.0,0.0,0.0,0.0,0.0,3
2018-12-20,"China Hacked HP Enterprise, IBM, Then Attacked Clients",0.0,0.0,0.0,0.0,0.0,0.0,0.0,0.0,0.0,0.0,0.0,10
2018-12-20,IBM Expands Strategic Partnership With Samsung To Include 7nm Chip Manufacturing,0.0,0.0,0.0,0.0,0.0,0.0,0.0,0.0,0.0,0.0,0.0,11
2018-12-20,"'Hackers working on behalf of China's Ministry of State Security breached the networks of Hewlett Packard Enterprise Co HPE.N and IBM IBM.N, then used their access to hack into their clients' computers' -Reuters",0.0,0.0,0.0,0.02702702702702703,0.0,0.0,0.0,0.0,0.0,0.0,0.0,37
2018-12-20,Reuters  IBM  HPE victims of Chinese hacking,0.0,0.0,0.0,0.0,0.0,0.0,0.0,0.0,0.0,0.0,0.0,7
2018-12-20,IBM Falls 3 ,0.0,0.0,0.0,0.0,0.0,0.0,0.0,0.0,0.0,0.0,0.0,3
2018-12-20,IBM manager Jetter seen in lead to become Deutsche Boerse chairman  source,0.0,0.0,0.0,0.05555555555555555,0.0,0.027777777777777776,0.0,0.0,0.0,0.0,0.0,12
2018-12-18,IBM  IBM  Outpaces Stock Market Gains  What You Should Know,0.0,0.0,0.0,0.0,0.0,0.0,0.0,0.0,0.0,0.0,0.0,10
2018-12-18,2 Analysts React To Red Hat's Q3 Earnings Print,0.0,0.0,0.0,0.0,0.0,0.0,0.0,0.0,0.0,0.0,0.0,10
2018-12-17,"BZ NOTE: IBM In October Announced It Will Acquire Red Hat, Watch For Movement In IBM Following Red Hat's Q3 Earnings",0.0,0.0,0.0,0.0,0.0,0.0,0.0,0.0,0.0,0.0,0.0,24
2018-12-17,IBM Falls 3 ,0.0,0.0,0.0,0.0,0.0,0.0,0.0,0.0,0.0,0.0,0.0,3
2018-12-17,"RBC Capital Maintains Outperform on IBM, Lowers Price Target to $167",0.0,0.0,0.0,0.0,0.0,0.0,0.0,0.0,0.0,0.0,0.0,13
2018-12-17,Red Hat  RHT  Q3 Earnings Beat Estimates  Revenues Up Y Y,0.0,0.0,0.0,0.0,0.0,0.0,0.0,0.0,0.0,0.0,0.0,11
2018-12-15,From South Korea to IBM Food Trust   How Blockchain Is Used in the Food Industry,0.0,0.0,0.0,0.0,0.0,0.0,0.0,0.0,0.0,0.0,0.0,15
2018-12-14,"Jim Cramer Gives His Opinion On Walmart, IBM And More",0.0,0.0,0.0,0.0,0.0,0.0,0.0,0.0,0.0,0.0,0.0,11
2018-12-12,IBM Research Teams up With Agritech Firm to Boost African Agribusiness with Blockchain,0.0,0.0,0.0,0.0,0.0,0.0,0.0,0.0,0.0,0.0,0.0,13
2018-12-12,Sell-Side Convinced Of Pivotal Software's Fundamentals In Wake Of Q3 Beat,0.0,0.0,0.0,0.0,0.0,0.0,0.0,0.0,0.0,0.0,0.0,12
2018-12-12, IBM Might Provide its DLT Solutions to Indian Telecoms ,0.0,0.0,0.0,0.0,0.0,0.0,0.0,0.0,0.0,0.0,0.0,9
2018-12-12,"Red Hat Shares Volatile Here As Traders Circulate 'IBM's $34 billion Red Hat acquisition came after deal talks with Microsoft, Google and Amazon, sources say' -Business Insider",0.0,0.0,0.0,0.00625,0.0,0.00625,0.00625,0.00625,0.0,0.00625,0.0,32
2018-12-11, Abu Dhabi National Oil Company and IBM Pilot Blockchain Powered Supply Chain System ,0.0,0.0,0.0,0.0,0.0,0.0,0.0,0.0,0.0,0.0,0.0,13
2018-12-11, The List of Banks Using Blockchain Technology May Be Short  but the Future Is Still Bright ,0.0,0.0,0.0,0.0,0.0,0.0,0.0,0.0,0.0,0.0,0.0,16
2018-12-11, IBM to Trial Blockchain Agricultural System for sub Saharan Africa ,0.0,0.0,0.0,0.0,0.0,0.0,0.0,0.0,0.0,0.0,0.0,10
2018-12-10,This Day In Market History: First Nobel Prizes Awarded,0.0,0.0,0.0,0.0,0.0,0.0,0.0,0.0,0.0,0.0,0.0,10
2018-12-07,IBM Falls 3 ,0.0,0.0,0.0,0.0,0.0,0.0,0.0,0.0,0.0,0.0,0.0,3
2018-12-07,In biggest Indian IT deal  HCL Tech to buy  1 8 billion of IBM software,0.0,0.0,0.0,0.013333333333333334,0.0,0.013333333333333334,0.013333333333333334,0.013333333333333334,0.0,0.013333333333333334,0.0,15
2018-12-06,IBM  IBM  Gains As Market Dips  What You Should Know,0.0,0.0,0.0,0.0,0.0,0.0,0.0,0.0,0.0,0.0,0.0,10
2018-12-06,IBM Reports Sale Of 7 Select IBM Software Products To HCL For $1.8B,0.0,0.0,0.0,0.0,0.0,0.0,0.0,0.0,0.0,0.0,0.0,14
2018-12-06,HCL Technologies to Acquire Select IBM Software Products for $1.8B,0.0,0.0,0.0,0.0,0.0,0.0,0.0,0.0,0.0,0.0,0.0,11
2018-12-04,IBM Falls 3 ,0.0,0.0,0.0,0.0,0.0,0.0,0.0,0.0,0.0,0.0,0.0,3
2018-12-03,Israel Chemical Files a Law Suit in Tel Aviv Against IBM Israel for $300M,0.0,0.0,0.0,0.0,0.0,0.0,0.0,0.0,0.0,0.0,0.0,15
2018-12-03,IBM Ready to Embrace Upcoming Bank 4.0 Era,0.0,0.0,0.0,0.0,0.0,0.0,0.0,0.0,0.0,0.0,0.0,8
2018-11-30,Watching Red Hat Shares As Traders Circulate Tweet Highlighting Reorg.com Article From Tues. Highlighting EC Could Take An Extended Look At Co.'s Deal With IBM,0.0,0.0,0.0,0.0,0.0,0.0,0.0,0.0,0.0,0.0,0.0,26
2018-11-29,IBM  IBM  Dips More Than Broader Markets  What You Should Know,0.0,0.0,0.0,0.0,0.0,0.0,0.0,0.0,0.0,0.0,0.0,11
2018-11-28,CLSNet Blockchain Payment Netting Service Launch Features Goldman Sachs  Morgan Stanley,0.0,0.0,0.0,0.0,0.0,0.0,0.0,0.0,0.0,0.0,0.0,11
