date,title,anger,fear,negative,positive,sadness,trust,anticipation,joy,disgust,surprise,anticip,word_count
2015-05-11,Top Retail Analyst: Starbucks' New 'Mini' Drinks Cuts Calories But Not Profits,0.0,0.0,0.0,0.0,0.0,0.0,0.0,0.0,0.0,0.0,0.0,15
2015-05-10,Starbucks moves Ethos water bottling out of drought hit California,0.03333333333333333,0.0,0.06666666666666667,0.0,0.0,0.0,0.0,0.0,0.0,0.0,0.0,10
2015-05-08,"Why RBC Sees 'Short-Term Disruption, Long-Term Opportunity' At Monster Beverage",0.0,0.0,0.0,0.0,0.0,0.0,0.0,0.0,0.0,0.0,0.0,12
2015-05-08,U S  stocks move broadly higher  as unemployment hits six year low,0.0,0.0,0.08333333333333333,0.0,0.0,0.0,0.0,0.0,0.0,0.0,0.0,12
2015-05-07,Major Food Companies Fail To Confront Drought Crisis  Report,0.0,0.0,0.0,0.0,0.0,0.0,0.0,0.0,0.0,0.0,0.0,9
2015-05-04,Buffett defends core holdings like IBM  Coca Cola  in interview,0.0,0.0,0.0,0.1,0.0,0.0,0.0,0.0,0.0,0.0,0.0,10
2015-05-04,Make The Most of Your 401(k) With Low-Cost Index Funds,0.0,0.0,0.0,0.0,0.0,0.0,0.0,0.0,0.0,0.0,0.0,13
2015-05-04,Warren Buffett on CNBC Says Coca-Cola has Strong Competitive Position,0.0,0.0,0.0,0.0,0.0,0.0,0.0,0.0,0.0,0.0,0.0,10
2015-05-04,Coca Cola Sees Resistance From Downtrend Line,0.0,0.0,0.0,0.0,0.0,0.0,0.0,0.0,0.0,0.0,0.0,7
2015-05-02,Berkshire profit up 10 percent as railroad rebounds,0.0,0.0,0.0,0.0,0.0,0.0,0.0,0.0,0.0,0.0,0.0,8
2015-05-01,Berkshire Hathaway reports 20  gain  ahead of Buffett s 50th anniversary,0.0,0.0,0.0,0.045454545454545456,0.0,0.0,0.022727272727272728,0.022727272727272728,0.0,0.0,0.0,11
2015-05-01,Cowen's Top Cigarette And Soda Stocks,0.0,0.0,0.0,0.0,0.0,0.0,0.0,0.0,0.0,0.0,0.0,7
2015-05-01,Is Warren Buffett 'Out Of Touch' On Coca-Cola?,0.0,0.0,0.0,0.0,0.0,0.0,0.0,0.0,0.0,0.0,0.0,10
2015-04-30,Appetite In EUR And GBP Diverges Post FOMC,0.0,0.0,0.0,0.0,0.0,0.0,0.0,0.0,0.0,0.0,0.0,8
2015-04-30,U S  stocks lower at close of trade  Dow Jones Industrial Average down 1 08 ,0.0,0.0,0.03333333333333333,0.0,0.016666666666666666,0.016666666666666666,0.0,0.0,0.0,0.0,0.0,15
2015-04-29,Here's Warren Buffett Singing The Coca-Cola Song,0.0,0.0,0.0,0.0,0.0,0.0,0.0,0.0,0.0,0.0,0.0,8
2015-04-29,Coke Shareholders Approve Pay for Top Execs With Only 80.4% Backing -Reuters,0.0,0.0,0.0,0.0,0.0,0.0,0.0,0.0,0.0,0.0,0.0,13
2015-04-28,Apple Tied With Oreo Cookie-Maker For Social Media 'Likes',0.0,0.0,0.0,0.0,0.0,0.0,0.0,0.0,0.0,0.0,0.0,10
2015-04-27,Coca-Cola CEO Talks Strategy,0.0,0.0,0.0,0.0,0.0,0.0,0.0,0.0,0.0,0.0,0.0,4
2015-04-26,Does Apple Hide More Cash Abroad Than Anyone?,0.0,0.0,0.0,0.0,0.0,0.0,0.0,0.0,0.0,0.0,0.0,9
2015-04-24,The Soda Industry Is Undergoing 'Big Changes',0.0,0.0,0.0,0.0,0.0,0.0,0.0,0.0,0.0,0.0,0.0,8
2015-04-24,Analyst Sees Turnaround Pressure Building At Coca-Cola,0.0,0.0,0.0,0.0,0.0,0.0,0.0,0.0,0.0,0.0,0.0,7
2015-04-23,"Excerpt From Tim Anderson's Morning Note: 'If You Want To Be Bearish, The Internals Of The Market Are Pathetic'",0.0,0.0,0.0,0.0,0.0,0.0,0.0,0.0,0.0,0.0,0.0,23
2015-04-22,Coke reports revenue growth for first time in nine quarters,0.0,0.0,0.0,0.05,0.0,0.0,0.05,0.0,0.0,0.0,0.0,10
2015-04-22,"Keep an Eye on These 10 Stocks for April 22, 2015",0.0,0.0,0.0,0.0,0.0,0.0,0.0,0.0,0.0,0.0,0.0,12
2015-04-22,Cramer: Coca-Cola Is The Conservative Way To Play 2 Huge Trends,0.0,0.0,0.0,0.0,0.0,0.0,0.0,0.0,0.0,0.0,0.0,12
2015-04-22,Coca-Cola Investors: Watch These Charts,0.0,0.0,0.0,0.0,0.0,0.0,0.0,0.0,0.0,0.0,0.0,6
2015-04-22,"Coca-Cola Tops Q1 Estimates, Shares Rise",0.0,0.0,0.0,0.0,0.0,0.0,0.0,0.0,0.0,0.0,0.0,7
2015-04-22,Coca-Cola Reports Q1 Operating Sales $10.711B vs $10.66B Est.,0.0,0.0,0.0,0.0,0.0,0.0,0.0,0.0,0.0,0.0,0.0,12
2015-04-22,Coca-Cola Reports Q1 Adj. EPS $0.48 vs $0.42 Est.,0.0,0.0,0.0,0.0,0.0,0.0,0.0,0.0,0.0,0.0,0.0,13
2015-04-22,"Earning & Economic Calendar for Wednesday April 22, 2015",0.0,0.0,0.0,0.0,0.0,0.0,0.0,0.0,0.0,0.0,0.0,10
2015-04-22,"Coca-Cola Offers Added Letter of Intent with US Bottling Partners, Terms Not Disclosed",0.0,0.0,0.0,0.0,0.0,0.0,0.0,0.0,0.0,0.0,0.0,14
2015-04-22,"Earnings Scheduled For April 22, 2015",0.0,0.0,0.0,0.0,0.0,0.0,0.0,0.0,0.0,0.0,0.0,7
2015-04-21,JJ Kinahan On Coca-Cola Options Ahead Of Earnings,0.0,0.0,0.0,0.0,0.0,0.0,0.0,0.0,0.0,0.0,0.0,8
2015-04-20,Stock Market On Edge As Tech Lights Up Earnings Marquee,0.0,0.0,0.0,0.0,0.0,0.0,0.0,0.0,0.0,0.0,0.0,10
2015-04-19,"Morgan Stanley, Facebook, Coke... Some Huge Names Report Earnings This Week",0.0,0.0,0.0,0.0,0.0,0.0,0.0,0.0,0.0,0.0,0.0,14
2015-04-19,Coca Cola  Downtrend Line Starting,0.0,0.0,0.0,0.0,0.0,0.0,0.0,0.0,0.0,0.0,0.0,5
2015-04-17,Coke to buy China multi grain drinks maker for  400 million,0.0,0.0,0.0,0.0,0.0,0.0,0.0,0.0,0.0,0.0,0.0,11
2015-04-15,Hearing Renewed Unconfirmed Takeover Chatter of Coca-Cola Buyout of Keurig Green Mountain,0.0,0.0,0.0,0.0,0.0,0.0,0.0,0.0,0.0,0.0,0.0,12
2015-04-14,The Susquehanna Note Moving Green Mountain Shares Up,0.0,0.0,0.0,0.0,0.0,0.0,0.0,0.0,0.0,0.0,0.0,8
2015-04-14,"Susquehanna 'Skeptical' On Monster, Initiates With Neutral Rating",0.0,0.0,0.0,0.0,0.0,0.0,0.0,0.0,0.0,0.0,0.0,10
2015-04-14,Why Susquehanna Thinks Sodastream Is Worth $24/Share,0.0,0.0,0.0,0.0,0.0,0.0,0.0,0.0,0.0,0.0,0.0,8
2015-04-13,Pepsico Expected to Announce NBA League Sponsorship Deal -Beverage-Digest,0.0,0.0,0.0,0.0,0.0,0.0,0.0,0.0,0.0,0.0,0.0,9
2015-04-13,Pepsi to replace Coke as the NBA s official beverage,0.0,0.0,0.0,0.05,0.0,0.05,0.0,0.0,0.0,0.0,0.0,10
2015-04-13,Wintergreen Advisers Plans Vote Vs. Coke Directors,0.0,0.0,0.0,0.0,0.0,0.0,0.0,0.0,0.0,0.0,0.0,7
2015-04-13,"Pepsico, NBA Announce Announced New Multiyear Marketing Partnership",0.0,0.0,0.0,0.0,0.0,0.0,0.0,0.0,0.0,0.0,0.0,9
2015-04-13,"Susquehanna Initiates Coverage on Coca-Cola at Negative, Announces $33.00 PT",0.0,0.0,0.0,0.0,0.0,0.0,0.0,0.0,0.0,0.0,0.0,12
2015-04-13,20 Little Known Facts About Warren Buffett,0.0,0.0,0.0,0.0,0.0,0.0,0.0,0.0,0.0,0.0,0.0,7
2015-04-09,These 10 Stocks Are Likely To Beat 'Rock-Bottom' Q1 Expectations,0.0,0.0,0.0,0.0,0.0,0.0,0.0,0.0,0.0,0.0,0.0,11
2015-04-07,Evercore Partners Initiates Coverage on Coca-Cola at Hold,0.0,0.0,0.0,0.0,0.0,0.0,0.0,0.0,0.0,0.0,0.0,8
2015-04-06,Coca-Cola Shares Correcting On Long-Term Chart: A Technical Breakdown,0.0,0.0,0.0,0.0,0.0,0.0,0.0,0.0,0.0,0.0,0.0,10
2015-04-02,Coca Cola  Short Term Bearish,0.0,0.0,0.0,0.0,0.0,0.0,0.0,0.0,0.0,0.0,0.0,5
2015-03-26,Pepsi-Cola Passed Diet Coke as No. 2 US Soda in 2014; Coke Remains No. 1 -Beverage Digest,0.0,0.0,0.0,0.0,0.0,0.0,0.0,0.0,0.0,0.0,0.0,20
2015-03-25,Citi Talks Obesity In Massive New Report,0.0,0.0,0.0,0.0,0.0,0.0,0.0,0.0,0.0,0.0,0.0,7
2015-03-25,This Map Of Every Food Brand Will Blow Your Mind,0.0,0.0,0.0,0.0,0.0,0.0,0.0,0.0,0.0,0.0,0.0,10
2015-03-18,Option Alert: Coca-Cola Apr $40 Call; 4357 Contract Trade at Ask @$0.81,0.0,0.0,0.0,0.0,0.0,0.0,0.0,0.0,0.0,0.0,0.0,17
2015-03-18,3 Implications Of a Fed Policy Shift,0.0,0.0,0.0,0.0,0.0,0.0,0.0,0.0,0.0,0.0,0.0,7
2015-03-17,Dan Nathan Sees Unusual Options Activity In Coca-Cola,0.0,0.0,0.0,0.0,0.0,0.0,0.0,0.0,0.0,0.0,0.0,8
2015-03-15,SPX Forward 4 Q Growth Barely Positive  Hasn t Been Negative Since 2009,0.0,0.0,0.0,0.0,0.0,0.0,0.0,0.0,0.0,0.0,0.0,13
2015-03-12,"Coca-Cola Has 'Accelerated Growth Potential,' Wells Fargo Says",0.0,0.0,0.0,0.0,0.0,0.0,0.0,0.0,0.0,0.0,0.0,10
2015-03-12,Coke CEO compensation rose 23 percent last year,0.0,0.0,0.0,0.0,0.0,0.0,0.0,0.0,0.0,0.0,0.0,8
2015-03-11,Prime Retailer Reports Coke Acquisition of GMCR in Progress,0.0,0.0,0.0,0.0,0.0,0.0,0.0,0.0,0.0,0.0,0.0,9
2015-03-09,Pro On Apple Watch Sell-Off: It's Only 'A Few Hours' Worth Of Trading,0.0,0.0,0.0,0.0,0.0,0.0,0.0,0.0,0.0,0.0,0.0,16
2015-03-08,Strong Jobs Report Unleashes Fears Of Lift Off,0.0,0.0,0.0,0.0,0.0,0.0,0.0,0.0,0.0,0.0,0.0,8
2015-03-06,U S  stocks lower at close of trade,0.0,0.0,0.0625,0.0,0.03125,0.03125,0.0,0.0,0.0,0.0,0.0,8
2015-03-06,Comparing NASDAQ Market Levels,0.0,0.0,0.0,0.0,0.0,0.0,0.0,0.0,0.0,0.0,0.0,4
2015-03-04,"Apple, 'Transformers' Lead 2015 Product Placement Award Winners",0.0,0.0,0.0,0.0,0.0,0.0,0.0,0.0,0.0,0.0,0.0,10
2015-03-03,Warren Buffett: Strong Dollar Makes For 'Tough Year' In 2015,0.0,0.0,0.0,0.0,0.0,0.0,0.0,0.0,0.0,0.0,0.0,12
2015-03-03,"Fast Money Picks For March 3: General Motors, Coca-Cola, Cisco, Bank Of America",0.0,0.0,0.0,0.0,0.0,0.0,0.0,0.0,0.0,0.0,0.0,17
2015-02-28,Berkshire Hathaway Expects to Partner With 3G in More Activities,0.0,0.0,0.0,0.0,0.0,0.0,0.0,0.0,0.0,0.0,0.0,10
2015-02-28,Stifel Analyst Sheds More Light On The Coke-Monster Relationship,0.0,0.0,0.0,0.0,0.0,0.0,0.0,0.0,0.0,0.0,0.0,9
2015-02-28,11 Key Quotes From Warren Buffett's New Shareholder Letter,0.0,0.0,0.0,0.0,0.0,0.0,0.0,0.0,0.0,0.0,0.0,10
2015-02-27,"Fast Money Picks For February 27: Coca Cola, Google, Facebook",0.0,0.0,0.0,0.0,0.0,0.0,0.0,0.0,0.0,0.0,0.0,13
2015-02-27,Morning Market Gainers,0.0,0.0,0.0,0.0,0.0,0.0,0.0,0.0,0.0,0.0,0.0,3
2015-02-27,Stocks Hitting 52-Week Highs,0.0,0.0,0.0,0.0,0.0,0.0,0.0,0.0,0.0,0.0,0.0,4
2015-02-27,U S  stocks post highest monthly gains in more than two years,0.0,0.011904761904761904,0.023809523809523808,0.011904761904761904,0.0,0.0,0.011904761904761904,0.011904761904761904,0.0,0.011904761904761904,0.0,12
2015-02-27,U S  stocks lower at close of trade,0.0,0.0,0.0625,0.0,0.03125,0.03125,0.0,0.0,0.0,0.0,0.0,8
2015-02-27,Benzinga's Top #PreMarket Gainers,0.0,0.0,0.0,0.0,0.0,0.0,0.0,0.0,0.0,0.0,0.0,6
2015-02-26,Monster Beverage Beats Q4 Views; Coke Deal To Close In Q2,0.0,0.0,0.0,0.0,0.0,0.0,0.0,0.0,0.0,0.0,0.0,12
2015-02-24,Option Alert: Coca-Cola May $42 Call; 3750 Contract Trade at Ask @$0.80,0.0,0.0,0.0,0.0,0.0,0.0,0.0,0.0,0.0,0.0,0.0,17
2015-02-23,"Tigress Financial Partners' Latest Ratings On WhiteWave Foods, Coca-Cola, PepsiCo",0.0,0.0,0.0,0.0,0.0,0.0,0.0,0.0,0.0,0.0,0.0,13
2015-02-23,Hearing Unconfirmed Market Chatter Brain Kelley to Replace Mutar Kent as Coke CEO,0.0,0.0,0.0,0.0,0.0,0.0,0.0,0.0,0.0,0.0,0.0,13
2015-02-22,Bull Markets Climb A Wall Of Worry   Should You Still Be In ,0.0,0.0,0.0,0.0,0.0,0.0,0.0,0.0,0.0,0.0,0.0,12
2015-02-22,Benzinga's Weekend M&A Chatter,0.0,0.0,0.0,0.0,0.0,0.0,0.0,0.0,0.0,0.0,0.0,7
2015-02-20,U S  stocks higher at close of trade,0.0,0.0,0.0625,0.0,0.0,0.0625,0.0,0.0,0.0,0.0,0.0,8
2015-02-20,"Coca-Cola CFO Speaking at CAGNY Conference Says Taking Steps to Revive Revenue, Profit Growth by Revising Incentive Metrics to Include Revenu",0.0,0.0,0.0,0.0,0.0,0.0,0.0,0.0,0.0,0.0,0.0,22
2015-02-20,"From Coca-Cola's Presentation at CAGNY Conference: Says Confident in Mid-Single Digit Long-Term Sales Growth, High Single Digit LT Earnings Growth",0.0,0.0,0.0,0.0,0.0,0.0,0.0,0.0,0.0,0.0,0.0,23
2015-02-20,Coca-Cola Presentation Begins At Cagny Conference,0.0,0.0,0.0,0.0,0.0,0.0,0.0,0.0,0.0,0.0,0.0,6
2015-02-20,Hearing Unconfirmed Market Chatter of Coke Buying Remainder of GMCR it Doesn't Own for $140-$150/Share,0.0,0.0,0.0,0.0,0.0,0.0,0.0,0.0,0.0,0.0,0.0,19
2015-02-20,Fast Money Halftime Report Final Trade From February 19,0.0,0.0,0.0,0.0,0.0,0.0,0.0,0.0,0.0,0.0,0.0,9
2015-02-19,Coca-Cola Company Increases Qtr. Dividend From $0.305 To $0.33/share,0.0,0.0,0.0,0.0,0.0,0.0,0.0,0.0,0.0,0.0,0.0,12
2015-02-19,Option Alert: Coca-Cola May $44 Call; 21458 Contract Trade Above Ask @$0.33; Now $41.68,0.0,0.0,0.0,0.0,0.0,0.0,0.0,0.0,0.0,0.0,0.0,21
2015-02-19,"James D. Robinson III, Peter Ueberroth To Retire From The Coca-Cola Company BOD",0.0,0.0,0.0,0.0,0.0,0.0,0.0,0.0,0.0,0.0,0.0,14
2015-02-19,U S  stocks mixed at close of trade,0.0,0.0,0.0625,0.0,0.0,0.0625,0.0,0.0,0.0,0.0,0.0,8
2015-02-17,Is Dr. Pepper Snapple 'Conservative'? This Analyst Thinks So,0.0,0.0,0.0,0.0,0.0,0.0,0.0,0.0,0.0,0.0,0.0,11
2015-02-17,"Soros Fund Management Sells American Express & Netflix, Buys FireEye In Q4",0.0,0.0,0.0,0.0,0.0,0.0,0.0,0.0,0.0,0.0,0.0,13
2015-02-17,Coca-Cola Bottling Co. Consolidated Announces Agreement with The Coca-Cola Company to Expand Franchise Territory,0.0,0.0,0.0,0.0,0.0,0.0,0.0,0.0,0.0,0.0,0.0,14
2015-02-17,Coffee: A Hot Commodity For The Next 5 Years,0.0,0.0,0.0,0.0,0.0,0.0,0.0,0.0,0.0,0.0,0.0,10
2015-02-13,Earnings Call Notes  2 13 15,0.0,0.0,0.0,0.0,0.0,0.0,0.0,0.0,0.0,0.0,0.0,6
2015-02-13,8-K: Monster Expects $280M in Costs From Transition of Distribution Agreement With Coca-Cola,0.0,0.0,0.0,0.0,0.0,0.0,0.0,0.0,0.0,0.0,0.0,15
2015-02-13,Coca-Cola Buys 6.38 Million Shares Of Keurig Green Mountain; Stock Briefly Spikes,0.0,0.0,0.0,0.0,0.0,0.0,0.0,0.0,0.0,0.0,0.0,13
2015-02-13,Keurig Green Mountain Amended S-13d Shows Atlantic Industries  Coca Cola Takes 16% Stake,0.0,0.0,0.0,0.0,0.0,0.0,0.0,0.0,0.0,0.0,0.0,14
2015-02-13,"Coca-Cola Co Buys 6,378,286 Shares Of Keurig Green Mountain Inc @$130.38/Share -Form 4",0.0,0.0,0.0,0.0,0.0,0.0,0.0,0.0,0.0,0.0,0.0,15
2015-02-13,UPDATE:  Keurig Green Mountain Shares Spiking On News Of Increased Stake By Coca Cola,0.0,0.0,0.0,0.0,0.0,0.0,0.0,0.0,0.0,0.0,0.0,15
2015-02-12,Coca Cola  PepsiCo Earnings Stir Up Consumer Staples ETFs,0.0,0.0,0.0,0.0,0.0,0.0,0.0,0.0,0.0,0.0,0.0,9
2015-02-12,"Notable Option Activity For February 12: ZIOP, VIPS, BA, KO, CSCO, CMCSA",0.0,0.0,0.0,0.0,0.0,0.0,0.0,0.0,0.0,0.0,0.0,18
2015-02-12,"Option Alert: KO April $47 Call; 2,000 Traded vs 32 OI; Currently $42.54",0.0,0.0,0.0,0.0,0.0,0.0,0.0,0.0,0.0,0.0,0.0,18
2015-02-12,Fast Money Picks For February 12,0.0,0.0,0.0,0.0,0.0,0.0,0.0,0.0,0.0,0.0,0.0,6
2015-02-10,Morning Market Gainers,0.0,0.0,0.0,0.0,0.0,0.0,0.0,0.0,0.0,0.0,0.0,3
2015-02-10,"Keep an Eye on These 10 Stocks for February 10, 2015",0.0,0.0,0.0,0.0,0.0,0.0,0.0,0.0,0.0,0.0,0.0,12
2015-02-10,"Earnings Scheduled For February 10, 2015",0.0,0.0,0.0,0.0,0.0,0.0,0.0,0.0,0.0,0.0,0.0,7
2015-02-10,"Earning & Economic Calendar for Tuesday February 10, 2015",0.0,0.0,0.0,0.0,0.0,0.0,0.0,0.0,0.0,0.0,0.0,10
2015-02-10,"Coca-Cola Reports Q4 Adj. EPS $0.44 vs $0.42, Operating Sales $10.87B vs $10.76B est.",0.0,0.0,0.0,0.0,0.0,0.0,0.0,0.0,0.0,0.0,0.0,21
2015-02-10,6 Things Coca-Cola Might Bring To A Store Near You,0.0,0.0,0.0,0.0,0.0,0.0,0.0,0.0,0.0,0.0,0.0,10
2015-02-10,UPDATE: Coca-Cola Shares Surge On Upbeat Earnings,0.0,0.0,0.0,0.0,0.0,0.0,0.0,0.0,0.0,0.0,0.0,8
2015-02-10,Coke s price increase encourages beverage company shareholders,0.0,0.0,0.0,0.125,0.0,0.0,0.0,0.0,0.0,0.0,0.0,8
2015-02-10,"Morning-Market Movers Led By Aeropostale, Coca-Cola & Coupons.Com",0.0,0.0,0.0,0.0,0.0,0.0,0.0,0.0,0.0,0.0,0.0,9
2015-02-10,From Conf Call: Coca-Cola Says China Food & Beverage Market Weakest in 10 Years,0.0,0.0,0.0,0.0,0.0,0.0,0.0,0.0,0.0,0.0,0.0,15
2015-02-10,Mid-Day Market Update: Markets Open Higher; Coca-Cola Profit Tops Views,0.0,0.0,0.0,0.0,0.0,0.0,0.0,0.0,0.0,0.0,0.0,12
2015-02-10,Mid-Afternoon Market Update: NASDAQ Gains Over 1%; Amkor Technology Shares Surge On Strong Earnings Report,0.0,0.0,0.0,0.0,0.0,0.0,0.0,0.0,0.0,0.0,0.0,18
2015-02-10,Coca Cola shares climb 2 4  after Q4 earnings beat estimates,0.0,0.0,0.0,0.0,0.0,0.0,0.0,0.0,0.0,0.0,0.0,11
2015-02-10,Coca Cola profit beats estimates  North American soda sales up,0.0,0.0,0.0,0.0,0.0,0.0,0.0,0.0,0.0,0.0,0.0,10
2015-02-10,Wall St  rises on Greek deal hopes  Apple hits record,0.0,0.0,0.0,0.02,0.0,0.02,0.02,0.02,0.0,0.02,0.0,10
2015-02-09,SodaStream looks to flavored waters as consumers shun sugary drinks,0.025,0.0,0.025,0.0,0.025,0.0,0.0,0.0,0.025,0.0,0.0,10
2015-02-09,Why Coca-Cola Shares Are Under Pressure,0.0,0.0,0.0,0.0,0.0,0.0,0.0,0.0,0.0,0.0,0.0,6
2015-02-09,"Wintergreen Urges Coca-Cola to Address Potential Approaches by Third Parties to Explore Buyout, Breakup",0.0,0.0,0.0,0.0,0.0,0.0,0.0,0.0,0.0,0.0,0.0,15
2015-02-08,Carter Worth And Mike Khouw's Coca-Cola Trade,0.0,0.0,0.0,0.0,0.0,0.0,0.0,0.0,0.0,0.0,0.0,8
2015-02-08,"From Coca-Cola To Tesla, Here Are The 68 Most Important Earnings Expectations For The Week",0.0,0.0,0.0,0.0,0.0,0.0,0.0,0.0,0.0,0.0,0.0,16
2015-02-05,Coke s Fuze and Gold Peak brands top  1 billion in sales,0.0,0.0,0.0,0.027777777777777776,0.0,0.027777777777777776,0.027777777777777776,0.0,0.0,0.0,0.0,12
2015-02-05,U S  stocks higher at close of trade,0.0,0.0,0.0625,0.0,0.0,0.0625,0.0,0.0,0.0,0.0,0.0,8
2015-02-05,"Warren Buffett Remarks On Moody's, Coca-Cola And The 'iWatch'",0.0,0.0,0.0,0.0,0.0,0.0,0.0,0.0,0.0,0.0,0.0,12
2015-02-04,"Warren Buffets Says Coke Sales Up Almost Every Year Since 1896, Doesn't Worry About Coca-Cola Investment",0.0,0.0,0.0,0.0,0.0,0.0,0.0,0.0,0.0,0.0,0.0,18
2015-02-04,"The Coca-Cola Company, The Kiwanis Club of Little Havana Sign Calle Ocho Festival Beverage Agreement Through 2017",0.0,0.0,0.0,0.0,0.0,0.0,0.0,0.0,0.0,0.0,0.0,18
2015-02-03,25 Stocks To Watch After Super Bowl Sunday,0.0,0.0,0.0,0.0,0.0,0.0,0.0,0.0,0.0,0.0,0.0,8
2015-02-03,Wintergreen Says Coca-Cola 2014 Proxy Statement Did Not Adequately Disclose Secret Bonus Shares,0.0,0.0,0.0,0.0,0.0,0.0,0.0,0.0,0.0,0.0,0.0,13
2015-02-02,Option Alert: Coca-Cola Feb $43 Call; 7155 Contract Trade at Ask @$0.28; Now $41.59,0.0,0.0,0.0,0.0,0.0,0.0,0.0,0.0,0.0,0.0,0.0,21
2015-01-28,Has Warren Buffett Lost His Touch? Not Even Close,0.0,0.0,0.0,0.0,0.0,0.0,0.0,0.0,0.0,0.0,0.0,10
2015-01-27,Coca-Cola New Initiatives,0.0,0.0,0.0,0.0,0.0,0.0,0.0,0.0,0.0,0.0,0.0,3
2015-01-23,Hearing Vague Market Chatter in Keurig Green Mountain Involving Coca-Cola,0.0,0.0,0.0,0.0,0.0,0.0,0.0,0.0,0.0,0.0,0.0,10
2015-01-22,Can You Name Warren Buffett's Top 5 Stock Holdings?,0.0,0.0,0.0,0.0,0.0,0.0,0.0,0.0,0.0,0.0,0.0,11
2015-01-16,Warren Buffett And Jim Cramer See Eye-To-Eye On This Big Bank,0.0,0.0,0.0,0.0,0.0,0.0,0.0,0.0,0.0,0.0,0.0,11
2015-01-15,An Interview With The CEO Of The World's Fastest-Growing Business Network,0.0,0.0,0.0,0.0,0.0,0.0,0.0,0.0,0.0,0.0,0.0,12
2015-01-13,"8-K from Monster Beverage Shows Co. Expecting Coca-Cola Deal to Close by End of Q1, Shows Co. to Receive $2.15B Cash Payment on Deal",0.0,0.0,0.0,0.0,0.0,0.0,0.0,0.0,0.0,0.0,0.0,27
2015-01-12,2015 Dogs Of The Dow,0.0,0.0,0.0,0.0,0.0,0.0,0.0,0.0,0.0,0.0,0.0,5
2015-01-12,Super Bowl Marketing Campaigns Heat Up,0.0,0.0,0.0,0.0,0.0,0.0,0.0,0.0,0.0,0.0,0.0,6
2015-01-09,Keurig Stock Heats Up As Its Single-Serve Machines Go Cold,0.0,0.0,0.0,0.0,0.0,0.0,0.0,0.0,0.0,0.0,0.0,10
2015-01-08,CNBC Now Tweets: 'BREAKING: Coca-Cola eliminating 1600 to 1800 jobs as part of already announced cost-cutting plan - DJ',0.0,0.0,0.0,0.0,0.0,0.0,0.045454545454545456,0.0,0.0,0.0,0.0,22
2015-01-08,"Report: Coca-Cola To Cut Up To 1,800 Jobs",0.0,0.0,0.0,0.0,0.0,0.0,0.0,0.0,0.0,0.0,0.0,9
2015-01-07,'Coca-Cola Selects PICS To Formalize Contractor Management Processes For Odwalla Brand',0.0,0.0,0.0,0.0,0.0,0.0,0.0,0.0,0.0,0.0,0.0,12
2015-01-06,"Option Alert: Coca-Cola Feb $44 Call; 2,500 Contract Trade at Ask @$0.68, Currently $42.73",0.0,0.0,0.0,0.0,0.0,0.0,0.0,0.0,0.0,0.0,0.0,21
2015-01-05,"Morgan Stanley Upgrades Coca-Cola, 'Strengths Can Be Seen In Multiple Areas'",0.0,0.0,0.0,0.0,0.0,0.0,0.0,0.0,0.0,0.0,0.0,13
2015-01-05,Hearing Unconfirmed Market Chatter of Possible 3G/Buffett Deal for Coca-Cola at $54+/Share,0.0,0.0,0.0,0.0,0.0,0.0,0.0,0.0,0.0,0.0,0.0,13
2015-01-05,Morgan Stanley Upgrades Coca-Cola to Overweight,0.0,0.0,0.0,0.0,0.0,0.0,0.0,0.0,0.0,0.0,0.0,6
2015-01-05,Did Berkshire Hathaway s Combs And Weschler Outperform S P 500 In 2014 ,0.0,0.0,0.0,0.0,0.0,0.0,0.0,0.0,0.0,0.0,0.0,13
2015-01-01,Mike Khouw Sees Unusual Options Activity In Coca-Cola,0.0,0.0,0.0,0.0,0.0,0.0,0.0,0.0,0.0,0.0,0.0,8
2014-12-29,"Sozzi Says Coca-Cola Should Imitate Pepsico, Build Snacks Division",0.0,0.0,0.0,0.0,0.0,0.0,0.0,0.0,0.0,0.0,0.0,10
2014-12-29,"Option Alert: Coca-Cola Jan $50 Call; 3,771 Contract Trade at Ask @$0.68, Currently $42.58",0.0,0.0,0.0,0.0,0.0,0.0,0.0,0.0,0.0,0.0,0.0,21
2014-12-23,WANdisco Increases Retail Customer Base ,0.0,0.0,0.0,0.0,0.0,0.0,0.0,0.0,0.0,0.0,0.0,5
2014-12-23,Notable Option Activity For December 23,0.0,0.0,0.0,0.0,0.0,0.0,0.0,0.0,0.0,0.0,0.0,6
2014-12-23,UPDATE: Coca-Cola To Cut Jobs,0.0,0.0,0.0,0.0,0.0,0.0,0.0,0.0,0.0,0.0,0.0,6
2014-12-23,"Coca-Cola To Cut 1,000 To  2,000 Jobs",0.0,0.0,0.0,0.0,0.0,0.0,0.0,0.0,0.0,0.0,0.0,7
2014-12-23,"Option Alert: Coca-Cola Jan $43.5 Call; 4,337 Contract Trade at Ask @$0.32; Currently $42.66",0.0,0.0,0.0,0.0,0.0,0.0,0.0,0.0,0.0,0.0,0.0,21
2014-12-23,Coke to cut up to 2 000 jobs in coming weeks  WSJ,0.0,0.0,0.0,0.0,0.0,0.0,0.08333333333333333,0.0,0.0,0.0,0.0,12
2014-12-22,"Morningstar Analyst Says Coca-Cola, WhiteWave Partnership Would Make Sense",0.0,0.0,0.0,0.0,0.0,0.0,0.0,0.0,0.0,0.0,0.0,10
2014-12-22,"Argus Research Analyst John Staszak Says Coca-Cola, WhiteWave Partnership Is A 'Good Idea'",0.0,0.0,0.0,0.0,0.0,0.0,0.0,0.0,0.0,0.0,0.0,15
2014-12-22,WhiteWave Trades Higher Amid Barron's Post On Coca-Cola Partnership,0.0,0.0,0.0,0.0,0.0,0.0,0.0,0.0,0.0,0.0,0.0,10
2014-12-22,Barron's Blog Mentions Potential Coca-Cola Deal for WhiteWave Foods,0.0,0.0,0.0,0.0,0.0,0.0,0.0,0.0,0.0,0.0,0.0,10
2014-12-22,UK's Competition And Markets Authority Says Relevant Merger Situation has Not Been Created in Proposed Transaction Between Coca-Cola Co and Monster Beverages,0.0,0.0,0.0,0.0,0.0,0.0,0.0,0.0,0.0,0.0,0.0,23
2014-12-21,Coca Cola Enterprises 2015 Profits To Be Hit by Fx Woes,0.0,0.0,0.0,0.0,0.0,0.0,0.0,0.0,0.0,0.0,0.0,11
2014-12-21,Time To Stock Up On Smart Water Users ,0.0,0.0,0.0,0.0,0.0,0.0,0.0,0.0,0.0,0.0,0.0,8
2014-12-18,"Coca-Cola Bottling Reports Deal with Coca-Cola for Expansion of Franchise Territory to Louisville, Evansville, IN",0.0,0.0,0.0,0.0,0.0,0.0,0.0,0.0,0.0,0.0,0.0,17
2014-12-17,Coca Cola Misses Estimates as Management is Scrutinized,0.0,0.0,0.0,0.0,0.0,0.0,0.0,0.0,0.0,0.0,0.0,8
2014-12-16,"The Coca-Cola Company Appoints Julie Hamilton As Chief Customer, Commercial Leadership Officer",0.0,0.0,0.0,0.0,0.0,0.0,0.0,0.0,0.0,0.0,0.0,13
2014-12-16,Strong Dollar Taking The Fizz Out Of Coca-Cola Profits,0.0,0.0,0.0,0.0,0.0,0.0,0.0,0.0,0.0,0.0,0.0,9
2014-12-16,Jefferies Lowers Coca-Cola Price Target,0.0,0.0,0.0,0.0,0.0,0.0,0.0,0.0,0.0,0.0,0.0,5
2014-12-16,"Fast Money Picks For December 16: Intersil, Toyota, Deckers Outdoor, Coca-Cola",0.0,0.0,0.0,0.0,0.0,0.0,0.0,0.0,0.0,0.0,0.0,15
2014-12-15,Wintergreen Advisers Issues Analysis of Coca-Cola,0.0,0.0,0.0,0.0,0.0,0.0,0.0,0.0,0.0,0.0,0.0,6
2014-12-15,UPDATE: Coca-Cola Sees A Currency Headwind On FX Of 7%,0.0,0.0,0.0,0.0,0.0,0.0,0.0,0.0,0.0,0.0,0.0,12
2014-12-15,Coca-Cola Expects Net Repurchases Of $2B to $3B In 2015,0.0,0.0,0.0,0.0,0.0,0.0,0.0,0.0,0.0,0.0,0.0,12
2014-12-15,Coca Cola shareholder says CEO Kent should be replaced,0.0,0.0,0.0,0.0,0.0,0.0,0.0,0.0,0.0,0.0,0.0,9
2014-12-14,Italy Downgraded  German Growth Slashed  Greek Stocks Collapse,0.0,0.0,0.0,0.0,0.0,0.0,0.0,0.0,0.0,0.0,0.0,8
2014-12-13,Bank Of America Upgrades Dr Pepper Snapple; Analysts Still Prefer Other Soft Drinks,0.0,0.0,0.0,0.0,0.0,0.0,0.0,0.0,0.0,0.0,0.0,14
2014-12-11,"Benzinga's M&A Chatter for Thursday December 11, 2014",0.0,0.0,0.0,0.0,0.0,0.0,0.0,0.0,0.0,0.0,0.0,12
2014-12-10,"Believe It Or Not, Morgan Stanley Says Buying Beer Is A Smart Investment",0.0,0.0,0.0,0.0,0.0,0.0,0.0,0.0,0.0,0.0,0.0,14
2014-12-03,U S  stocks gain on service sector data  Dow rises 0 18  ,0.0,0.0,0.020833333333333332,0.020833333333333332,0.0,0.0,0.020833333333333332,0.020833333333333332,0.0,0.0,0.0,12
2014-12-03,Exclusive  J J hires Goldman to explore sale of Splenda   sources,0.0,0.0,0.0,0.0,0.0,0.0,0.09090909090909091,0.0,0.0,0.0,0.0,11
2014-12-02,Tigress Financial Upgrades Coca-Cola Company (The) to Buy,0.0,0.0,0.0,0.0,0.0,0.0,0.0,0.0,0.0,0.0,0.0,10
2014-12-02,UPDATE: Tigress Financial Partners Upgrades Coca-Cola On Optimistic Growth Outlook,0.0,0.0,0.0,0.0,0.0,0.0,0.0,0.0,0.0,0.0,0.0,11
2014-12-01,3 Retail ETFs To Watch,0.0,0.0,0.0,0.0,0.0,0.0,0.0,0.0,0.0,0.0,0.0,5
2014-11-27,SABMiller  Coca Cola and local firm to create African bottler,0.0,0.0,0.0,0.05,0.0,0.0,0.0,0.05,0.0,0.0,0.0,10
2014-11-27,"The Coca-Cola Company, SABMiller, Coca-Cola Sabco to Form Coca-Cola Beverages Africa",0.0,0.0,0.0,0.0,0.0,0.0,0.0,0.0,0.0,0.0,0.0,13
2014-11-20,Hedge Fund Manager On Keurig Green Mountain: 'Coke Is Only Going To Buy More If The Price Falls',0.0,0.0,0.0,0.0,0.0,0.0,0.0,0.0,0.0,0.0,0.0,20
2014-11-20,Did Berkeley Just Start An Anti-Sugar Revolution?,0.0,0.0,0.0,0.0,0.0,0.0,0.0,0.0,0.0,0.0,0.0,8
2014-11-19,Fast Money Halftime Report Final Trade From November 19,0.0,0.0,0.0,0.0,0.0,0.0,0.0,0.0,0.0,0.0,0.0,9
2014-11-19,Notable Option Activity For November 19,0.0,0.0,0.0,0.0,0.0,0.0,0.0,0.0,0.0,0.0,0.0,6
2014-11-19,BTIG Analyst Says Coca-Cola Rumor is Not Legitimate,0.0,0.0,0.0,0.0,0.0,0.0,0.0,0.0,0.0,0.0,0.0,8
2014-11-19,"Great Lakes Coca-Cola Distribution Signs Deal with Coca-Cola, No Terms Disclosed",0.0,0.0,0.0,0.0,0.0,0.0,0.0,0.0,0.0,0.0,0.0,12
2014-11-19,"Option Alert: KO May 15 $49 Call; 10,182 Traded vs 192 OI; Currently $44.01",0.0,0.0,0.0,0.0,0.0,0.0,0.0,0.0,0.0,0.0,0.0,19
2014-11-19,"Top Performing Industries For November 19, 2014",0.0,0.0,0.0,0.0,0.0,0.0,0.0,0.0,0.0,0.0,0.0,8
2014-11-18,"Benzinga's M&A Chatter for Tuesday November 18, 2014",0.0,0.0,0.0,0.0,0.0,0.0,0.0,0.0,0.0,0.0,0.0,12
2014-11-18,"Dow, S&P 500 Add To Gains Following Encouraging International News",0.0,0.0,0.0,0.0,0.0,0.0,0.0,0.0,0.0,0.0,0.0,13
2014-11-18,UPDATE: Report of Potential 3G Capital Interest in Coca-Cola First Reported in June,0.0,0.0,0.0,0.0,0.0,0.0,0.0,0.0,0.0,0.0,0.0,14
2014-11-18,Shares of Coca Cola Move Higher on Forbes Report of Potential Bid by 3G Capital,0.0,0.0,0.0,0.0,0.0,0.0,0.0,0.0,0.0,0.0,0.0,15
2014-11-17,"Events for the Week of Nov. 17-21, 2014",0.0,0.0,0.0,0.0,0.0,0.0,0.0,0.0,0.0,0.0,0.0,9
2014-11-13,How Much Does Berkshire Hathaway Like Consumer Goods?,0.0,0.0,0.0,0.0,0.0,0.0,0.0,0.0,0.0,0.0,0.0,9
2014-11-13,"Hearing Unconfirmed Chatter Coke/Keurig Machine May Not be in Stores Until Late 2016, According to Sources",0.0,0.0,0.0,0.0,0.0,0.0,0.0,0.0,0.0,0.0,0.0,17
2014-11-07,Berkshire third quarter profit drops on investments  operating results gain,0.0,0.0,0.0,0.03333333333333333,0.0,0.0,0.03333333333333333,0.03333333333333333,0.0,0.0,0.0,10
