date,title,anger,fear,negative,positive,sadness,trust,anticipation,joy,disgust,surprise,anticip,word_count
2019-02-14,Put Traders Flock To Coca Cola Ahead Of Earnings,0.0,0.0,0.0,0.0,0.0,0.0,0.0,0.0,0.0,0.0,0.0,9
2019-02-14,Valentine s Card  Market Up 17  Since Christmas Eve  But Weak Data Could Weigh,0.0,0.0,0.0,0.0,0.0,0.0,0.0,0.0,0.0,0.0,0.0,14
2019-02-14,Stock Market News For Feb 15  2019,0.0,0.0,0.0,0.0,0.0,0.0,0.0,0.0,0.0,0.0,0.0,7
2019-02-14,PepsiCo  PEP  Q4 Earnings In Line  Sales Beat Estimates,0.0,0.0,0.0,0.0,0.0,0.0,0.0,0.0,0.0,0.0,0.0,9
2019-02-14,"A Peek Into The Markets: US Stock Futures Up Ahead Of Earnings, Economic Data",0.0,0.0,0.0,0.0,0.0,0.0,0.0,0.0,0.0,0.0,0.0,16
2019-02-14,Bottler Coca Cola HBC warns of higher finance costs  lower consumer spending,0.0,0.0,0.041666666666666664,0.0,0.041666666666666664,0.0,0.0,0.0,0.0,0.0,0.0,12
2019-02-14,Day Ahead  Top 3 Things to Watch,0.0,0.0,0.0,0.0,0.0,0.0,0.0,0.0,0.0,0.0,0.0,7
2019-02-14,52 Stocks Moving In Thursday's Mid-Day Session,0.0,0.0,0.0,0.0,0.0,0.0,0.0,0.0,0.0,0.0,0.0,8
2019-02-14,"Valentine's Card From The Market: Trade Optimism Continues, Cisco Posts Strong Quarter",0.0,0.0,0.0,0.0,0.0,0.0,0.0,0.0,0.0,0.0,0.0,15
2019-02-14,"Coca-Cola shares are trading lower despite a Q4 sales beat, after the company provided FY19 EPS guidance of $2.01-$2.10, below the $2.22 estimate.",0.0,0.0,0.008333333333333333,0.008333333333333333,0.008333333333333333,0.008333333333333333,0.0,0.0,0.0,0.0,0.0,30
2019-02-14,Coca-Cola Sees FY19 Operating Income Growth 10-11% Year Over Year,0.0,0.0,0.0,0.0,0.0,0.0,0.0,0.0,0.0,0.0,0.0,11
2019-02-14,Coca-Cola Sees FY19 Organic Sales Growth 4% Year Over Year,0.0,0.0,0.0,0.0,0.0,0.0,0.0,0.0,0.0,0.0,0.0,11
2019-02-14,"Coca-Cola Q4 EPS $0.43, Inline, Sales $7.1B Beat $7.03B Estimate",0.0,0.0,0.0,0.0,0.0,0.0,0.0,0.0,0.0,0.0,0.0,15
2019-02-14,"11 Stocks To Watch For February 14, 2019",0.0,0.0,0.0,0.0,0.0,0.0,0.0,0.0,0.0,0.0,0.0,9
2019-02-14,"Earnings Scheduled For February 14, 2019",0.0,0.0,0.0,0.0,0.0,0.0,0.0,0.0,0.0,0.0,0.0,7
2019-02-14,S P 500 slips as grim retail sales data overshadows trade hopes,0.011904761904761904,0.011904761904761904,0.011904761904761904,0.0,0.011904761904761904,0.011904761904761904,0.011904761904761904,0.0,0.011904761904761904,0.0,0.0,12
2019-02-14,Coca Cola Falls 7 ,0.0,0.0,0.0,0.0,0.0,0.0,0.0,0.0,0.0,0.0,0.0,4
2019-02-13,Coca Cola  KO  Meets Q4 Earnings Estimates,0.0,0.0,0.0,0.0,0.0,0.0,0.0,0.0,0.0,0.0,0.0,7
2019-02-13,Coca Cola  KO  Q4 Earnings In Line  Stock Slips On Soft View,0.0,0.0,0.0,0.0,0.0,0.0,0.0,0.0,0.0,0.0,0.0,12
2019-02-13,What Are The Trends In 13Fs Showing Us?,0.0,0.0,0.0,0.0,0.0,0.0,0.0,0.0,0.0,0.0,0.0,9
2019-02-13,Day Ahead  Top 3 Things to Watch,0.0,0.0,0.0,0.0,0.0,0.0,0.0,0.0,0.0,0.0,0.0,7
2019-02-13,Coca-Cola's Q4 Earnings Outlook,0.0,0.0,0.0,0.0,0.0,0.0,0.0,0.0,0.0,0.0,0.0,5
2019-02-13,CCEP Or CCHGY  Which Is The Better Value Stock Right Now ,0.0,0.0,0.0,0.0,0.0,0.0,0.0,0.0,0.0,0.0,0.0,11
2019-02-13,Coca Cola  Q4 Earnings Could Show Sales Growth  Proving Turnaround On Track,0.0,0.0,0.0,0.0,0.0,0.0,0.0,0.0,0.0,0.0,0.0,12
2019-02-13,Opening Bell  Global Stocks Climb On Trade  Is This Risk On Rally Premature ,0.0,0.0,0.0,0.0,0.0,0.0,0.0,0.0,0.0,0.0,0.0,13
2019-02-12,Stocks   Dow Surges on Government Shutdown Deal,0.0,0.0,0.0,0.0,0.0,0.0,0.0,0.0,0.0,0.0,0.0,7
2019-02-12,Forbes  LeBron still king of NBA earners,0.0,0.0,0.0,0.14285714285714285,0.0,0.0,0.0,0.0,0.0,0.0,0.0,7
2019-02-12,NBA notebook  Nuggets G Thomas nears season debut,0.0,0.0,0.0,0.0,0.0,0.0,0.0,0.0,0.0,0.0,0.0,8
2019-02-12,Boston Beer  SAM  To Post Q4 Earnings  What s In The Offing ,0.0,0.0,0.0,0.0,0.0,0.0,0.0,0.0,0.0,0.0,0.0,12
2019-02-12,Chart Of The Day  Buy Coca Cola s Drinks  Stay Away From Its Shares ,0.0,0.0,0.0,0.0,0.0,0.0,0.0,0.0,0.0,0.0,0.0,14
2019-02-12,Opening Bell  Futures Pop On U S  Government Budget Deal  Dollar Wavers,0.0,0.0,0.0,0.0,0.0,0.0,0.0,0.0,0.0,0.0,0.0,12
2019-02-11,Can Coke  KO  Keep The Earnings Surprise Streak Alive ,0.0,0.0,0.0,0.0,0.0,0.0,0.0,0.0,0.0,0.0,0.0,9
2019-02-11,Stocks   Wall Street Rises on Trade Hope,0.0,0.0,0.0,0.0,0.0,0.0,0.0,0.0,0.0,0.0,0.0,7
2019-02-11,Top 5 Things to Know in the Market on Monday,0.0,0.0,0.0,0.0,0.0,0.0,0.0,0.0,0.0,0.0,0.0,10
2019-02-11,"Earnings Potpourri: Coca-Cola, Deere, Cisco Report This Week, But Trade Talks Dominate",0.0,0.0,0.0,0.0,0.0,0.0,0.0,0.0,0.0,0.0,0.0,16
2019-02-11,Opening Bell  Global Stocks Rally But USD Strength Shows Trade Fears Persist,0.0,0.0,0.0,0.0,0.0,0.0,0.0,0.0,0.0,0.0,0.0,12
2019-02-11,World stocks edge higher ahead of trade talks  Brexit,0.0,0.0,0.037037037037037035,0.037037037037037035,0.0,0.037037037037037035,0.0,0.0,0.0,0.0,0.0,9
2019-02-11,Week Ahead   Dollar And Stocks At The Mercy Of Trade Talks,0.0,0.0,0.0,0.0,0.0,0.0,0.0,0.0,0.0,0.0,0.0,11
2019-02-11,What To Expect From These 5 Soft Drinks Stocks  Q4 Earnings ,0.0,0.0,0.0,0.0,0.0,0.0,0.0,0.0,0.0,0.0,0.0,11
2019-02-10,Dollar s Next Move Depends On Trump s Trade Progress And Border Concession,0.0,0.0,0.0,0.0,0.0,0.0,0.0,0.0,0.0,0.0,0.0,13
2019-02-10,3 Stocks To Watch In The Coming Week  Coca Cola  Nvidia  Cisco Systems,0.0,0.0,0.0,0.0,0.0,0.0,0.0,0.0,0.0,0.0,0.0,13
2019-02-10,Can PepsiCo  PEP  Retain Positive Earnings Trend In Q4 ,0.0,0.0,0.0,0.0,0.0,0.0,0.0,0.0,0.0,0.0,0.0,9
2019-02-10,Why Newell  NWL  Is Poised To Beat Earnings Estimates In Q4,0.0,0.0,0.0,0.0,0.0,0.0,0.0,0.0,0.0,0.0,0.0,11
2019-02-10,Looking Forward To An Eventful Week  Plus L  CNA  DO,0.0,0.0,0.0,0.0,0.0,0.0,0.0,0.0,0.0,0.0,0.0,10
2019-02-10,Companies From Several Industries To Report Q4 Earnings,0.0,0.0,0.0,0.0,0.0,0.0,0.0,0.0,0.0,0.0,0.0,8
2019-02-09,U S  fund managers brace for consumer slowdown,0.0,0.0,0.0,0.0,0.0,0.0,0.0,0.0,0.0,0.0,0.0,8
2019-02-08,Upcoming Earnings Reports To Watch  ATVI  KO  CSCO,0.0,0.0,0.0,0.0,0.0,0.0,0.0,0.0,0.0,0.0,0.0,8
2019-02-08,Earnings Growth Deceleration Details ,0.0,0.0,0.0,0.0,0.0,0.0,0.0,0.0,0.0,0.0,0.0,4
2019-02-07,Stock Exchange  Are The Momentum Bulls High  ,0.0,0.0,0.0,0.0,0.0,0.0,0.0,0.0,0.0,0.0,0.0,7
2019-02-06,Coca Cola  KO  Earnings Expected To Grow  Should You Buy ,0.0,0.0,0.0,0.0,0.0,0.0,0.0,0.0,0.0,0.0,0.0,10
2019-02-06,New Strong Buy Stocks For February 7th,0.0,0.0,0.0,0.0,0.0,0.0,0.0,0.0,0.0,0.0,0.0,7
2019-02-06,Can Coca Cola  KO  Keep Earnings Beat Trend Alive In Q4 ,0.0,0.0,0.0,0.0,0.0,0.0,0.0,0.0,0.0,0.0,0.0,11
2019-02-05,Coca-Cola Option Alert: Mar 15 $50 Calls Sweep (3) near the Ask: 606 @ $0.59 vs 17084 OI; Earnings 2/14 Before Open Ref=$49.335,0.0,0.0,0.0,0.0,0.0,0.0,0.0,0.0,0.0,0.0,0.0,32
2019-02-04,Can Molson Coors  TAP  Brave Industry Woes In Q4 Earnings ,0.0,0.0,0.0,0.0,0.0,0.0,0.0,0.0,0.0,0.0,0.0,10
2019-02-01,French food law will not squeeze household budgets  minister,0.0,0.0,0.0,0.044444444444444446,0.0,0.044444444444444446,0.0,0.022222222222222223,0.0,0.0,0.0,9
2019-01-31,Avon  AVP  Eyes Turnaround  Reduces Headcount And Inventory ,0.0,0.0,0.0,0.0,0.0,0.0,0.0,0.0,0.0,0.0,0.0,8
2019-01-31,Diageo  DEO  Posts Strong 1H19 Earnings  Ups FY19 Sales View,0.0,0.0,0.0,0.0,0.0,0.0,0.0,0.0,0.0,0.0,0.0,10
2019-01-31,How To Approach Q4 Earnings: The Analyst Perspective,0.0,0.0,0.0,0.0,0.0,0.0,0.0,0.0,0.0,0.0,0.0,9
2019-01-31,Top Ranked Value Stocks To Buy For February 1st,0.0,0.0,0.0,0.0,0.0,0.0,0.0,0.0,0.0,0.0,0.0,9
2019-01-31,"Earnings, Volatility, Brexit Are Key Topics Heading Into February",0.0,0.0,0.0,0.0,0.0,0.0,0.0,0.0,0.0,0.0,0.0,11
2019-01-30,Coca Cola Completes Buyout Of Nigeria s Dairy   Juice Maker,0.0,0.0,0.0,0.0,0.0,0.0,0.0,0.0,0.0,0.0,0.0,10
2019-01-29,3 Soft Drinks Stocks With Potential To Beat Earnings In Q4 ,0.0,0.0,0.0,0.0,0.0,0.0,0.0,0.0,0.0,0.0,0.0,11
2019-01-28,CCEP Vs  CCHGY  Which Stock Should Value Investors Buy Now ,0.0,0.0,0.0,0.0,0.0,0.0,0.0,0.0,0.0,0.0,0.0,10
2019-01-28,What Makes Marijuana ETF The Best Performer In January ,0.0,0.0,0.0,0.0,0.0,0.0,0.0,0.0,0.0,0.0,0.0,9
2019-01-25,The 'Amazon Effect' And How Bringg Helps Companies Gain More Customers,0.0,0.0,0.0,0.0,0.0,0.0,0.0,0.0,0.0,0.0,0.0,12
2019-01-23,Sink Into Staples ETFs,0.0,0.0,0.0,0.0,0.0,0.0,0.0,0.0,0.0,0.0,0.0,4
2019-01-23,Why Coca Cola European  CCEP  Could Beat Earnings Estimates Again,0.0,0.0,0.0,0.0,0.0,0.0,0.0,0.0,0.0,0.0,0.0,10
2019-01-22,Here s Why Investing In Monster Beverage  MNST  Makes Sense,0.0,0.0,0.0,0.0,0.0,0.0,0.0,0.0,0.0,0.0,0.0,10
2019-01-21,Sainsbury s Asda tie up not a done deal yet  experts warn,0.0,0.008333333333333333,0.008333333333333333,0.008333333333333333,0.0,0.016666666666666666,0.016666666666666666,0.008333333333333333,0.0,0.016666666666666666,0.0,12
2019-01-21,Brexit not to blame for shrinking UK chocolate bars   ONS,0.014285714285714285,0.0,0.014285714285714285,0.014285714285714285,0.0,0.014285714285714285,0.014285714285714285,0.014285714285714285,0.014285714285714285,0.0,0.0,10
2019-01-20,Tokyo s Top Stock Surges 305  in Year But CFO Sees It as Cheap,0.0,0.0,0.0,0.0,0.0,0.0,0.0,0.0,0.0,0.0,0.0,14
2019-01-17,Florida s Warm Weather Brings No Sunshine For Orange Juice Traders,0.0,0.0,0.0,0.0,0.0,0.0,0.0,0.0,0.0,0.0,0.0,11
2019-01-16,3 Weight Loss Stocks In Focus On Rising Obesity Fears ,0.0,0.0,0.0,0.0,0.0,0.0,0.0,0.0,0.0,0.0,0.0,10
2019-01-15,Wells Fargo cautious on Monster ahead of key meeting,0.0,0.022222222222222223,0.0,0.044444444444444446,0.0,0.022222222222222223,0.022222222222222223,0.0,0.0,0.0,0.0,9
2019-01-15,Why Marijuana ETF Is On A High In 2019 ,0.0,0.0,0.0,0.0,0.0,0.0,0.0,0.0,0.0,0.0,0.0,9
2019-01-09,Top Picks 2019  Sproutly SPR,0.0,0.0,0.0,0.0,0.0,0.0,0.0,0.0,0.0,0.0,0.0,5
2019-01-09,Buy Microsoft  MSFT  Stock On The Dip Amid Apple  AAPL  Uncertainty ,0.0,0.0,0.0,0.0,0.0,0.0,0.0,0.0,0.0,0.0,0.0,11
2019-01-09,Coca Cola  KO  Stock Sinks As Market Gains  What You Should Know,0.0,0.0,0.0,0.0,0.0,0.0,0.0,0.0,0.0,0.0,0.0,12
2019-01-09,CCEP Vs  CCHGY  Which Stock Is The Better Value Option ,0.0,0.0,0.0,0.0,0.0,0.0,0.0,0.0,0.0,0.0,0.0,10
2019-01-09,Constellation Brands Tops Q3 Earnings  View Cut Hurts Stock,0.0,0.0,0.0,0.0,0.0,0.0,0.0,0.0,0.0,0.0,0.0,9
2019-01-08,SunTrust Turns Bullish On Monster Beverage,0.0,0.0,0.0,0.0,0.0,0.0,0.0,0.0,0.0,0.0,0.0,6
2019-01-08,Top Analyst Reports For Visa  Coca Cola   AbbVie ,0.0,0.0,0.0,0.0,0.0,0.0,0.0,0.0,0.0,0.0,0.0,8
2019-01-07,The Top Cannabis Investing Storylines To Watch In 2019 ,0.0,0.0,0.0,0.0,0.0,0.0,0.0,0.0,0.0,0.0,0.0,9
2019-01-04,4 Dividend Stocks You ll Regret Holding In 2019,0.0,0.0,0.0,0.0,0.0,0.0,0.0,0.0,0.0,0.0,0.0,9
2019-01-04,Cleveland Fed President: No Reason To Believe Recession In Sight,0.0,0.0,0.0,0.0,0.0,0.0,0.0,0.0,0.0,0.0,0.0,11
2019-01-03,Coca Cola  KO  Stock Moves  0 62   What You Should Know,0.0,0.0,0.0,0.0,0.0,0.0,0.0,0.0,0.0,0.0,0.0,11
2019-01-03,EC Clears Coca Cola Acquisition of Cost Coffee,0.0,0.0,0.0,0.0,0.0,0.0,0.0,0.0,0.0,0.0,0.0,8
2019-01-03,Consumer Staples  Coke Or Pepsi ,0.0,0.0,0.0,0.0,0.0,0.0,0.0,0.0,0.0,0.0,0.0,5
2019-01-03,Stocks   Apple Plunges in Premarket  Celgene  IZEA Soar  Starbucks  Amgen Drop,0.0,0.0,0.0,0.0,0.0,0.0,0.0,0.0,0.0,0.0,0.0,11
2019-01-02,Will Monster Beverage s Strategies Cushion The Stock In 2019 ,0.0,0.0,0.0,0.0,0.0,0.0,0.0,0.0,0.0,0.0,0.0,10
2019-01-02,Macquarie: Coca-Cola European Partners Faces Downside Risk From UK Plastic Regulations,0.0,0.0,0.0,0.0,0.0,0.0,0.0,0.0,0.0,0.0,0.0,12
2018-12-29,"Barron's Picks And Pans: Coca-Cola, Disney, McDonald's, Verizon And More",0.0,0.0,0.0,0.0,0.0,0.0,0.0,0.0,0.0,0.0,0.0,16
2018-12-27,Bringing Some Sexy To Consumer Staples ETFs,0.0,0.0,0.0,0.0,0.0,0.0,0.0,0.0,0.0,0.0,0.0,7
2018-12-27,"In The December Bloodbath, These Hidden Factors Might Be Prompting Traders To Buy",0.0,0.0,0.0,0.0,0.0,0.0,0.0,0.0,0.0,0.0,0.0,14
2018-12-26,U S  stocks higher at close of trade  Dow Jones Industrial Average up 4 98 ,0.0,0.0,0.03333333333333333,0.0,0.0,0.03333333333333333,0.0,0.0,0.0,0.0,0.0,15
2018-12-24,Coca Cola Falls 3 ,0.0,0.0,0.0,0.0,0.0,0.0,0.0,0.0,0.0,0.0,0.0,4
2018-12-24,European shares falter as worst year since 2008 fades away,0.0,0.05,0.05,0.0,0.0,0.0,0.0,0.0,0.0,0.0,0.0,10
2018-12-24,Exclusive  U S  satellite service offers to sell minority stake to Russia,0.0,0.0,0.08333333333333333,0.0,0.0,0.0,0.0,0.0,0.0,0.0,0.0,12
2018-12-23,"Bulls & Bears Of The Week: Best Buy, Coca-Cola, Ford, Hilton, Netflix And More",0.0,0.0,0.0,0.0,0.0,0.0,0.0,0.0,0.0,0.0,0.0,19
2018-12-23,Losing Its FAANG: Market Struggles In 2018 As Tech Rally Slows,0.0,0.0,0.0,0.0,0.0,0.0,0.0,0.0,0.0,0.0,0.0,12
2018-12-21,U S  stocks lower at close of trade  Dow Jones Industrial Average down 1 81 ,0.0,0.0,0.03333333333333333,0.0,0.016666666666666666,0.016666666666666666,0.0,0.0,0.0,0.0,0.0,15
2018-12-19,Coca Cola  KO  Stock Moves  0 89   What You Should Know,0.0,0.0,0.0,0.0,0.0,0.0,0.0,0.0,0.0,0.0,0.0,11
2018-12-18,Which Beverages Stocks Will Pop? UBS Weigh In On The Sector,0.0,0.0,0.0,0.0,0.0,0.0,0.0,0.0,0.0,0.0,0.0,12
2018-12-18,Tilray Stock Up On Medical Cannabis Collaboration With Sandoz,0.0,0.0,0.0,0.0,0.0,0.0,0.0,0.0,0.0,0.0,0.0,9
2018-12-18,Macquarie: Coca-Cola A Winner With BodyArmor Investment As Pepsi's Gatorade Cedes Share,0.0,0.0,0.0,0.0,0.0,0.0,0.0,0.0,0.0,0.0,0.0,14
2018-12-17,The Sports Retailers Disrupting The Industry Heading Into 2019 ,0.0,0.0,0.0,0.0,0.0,0.0,0.0,0.0,0.0,0.0,0.0,9
2018-12-17,Why Soda's Decline Represents An Opportunity To Revolutionize The Beverage Sector,0.0,0.0,0.0,0.0,0.0,0.0,0.0,0.0,0.0,0.0,0.0,12
2018-12-14,Is Coca-Cola A Growth Company?,0.0,0.0,0.0,0.0,0.0,0.0,0.0,0.0,0.0,0.0,0.0,6
2018-12-13,"UBS Downgrades Coca-Cola to Neutral, Raises Price Target to $51",0.0,0.0,0.0,0.0,0.0,0.0,0.0,0.0,0.0,0.0,0.0,12
2018-12-13,Coca-Cola Option Alert: Fri $49.5 Calls Sweep (2) near the Ask: 1216 @ $0.24 vs 2705 OI; Ref=$49.49,0.0,0.0,0.0,0.0,0.0,0.0,0.0,0.0,0.0,0.0,0.0,27
2018-12-13,Stocks   Wall Street Moves Cautiously Higher at Open,0.0,0.0,0.0,0.0,0.0,0.0,0.0,0.0,0.0,0.0,0.0,8
2018-12-13,"Benzinga's Top Upgrades, Downgrades For December 13, 2018",0.0,0.0,0.0,0.0,0.0,0.0,0.0,0.0,0.0,0.0,0.0,11
2018-12-13,Instacart to close Whole Foods delivery operation next year,0.0,0.027777777777777776,0.0,0.027777777777777776,0.0,0.027777777777777776,0.027777777777777776,0.0,0.0,0.0,0.0,9
2018-12-13,"Coca-Cola Reports Loan Deal With Ioniqa Technologies For Transformation Of Hard-to-Recycle Plastic Waste into High-Quality, Food-Grade PET, No Terms Disclosed",0.0,0.0,0.0,0.0,0.0,0.0,0.0,0.0,0.0,0.0,0.0,22
2018-12-13,Stocks   U S  Futures Struggle for Direction as China Buys American Soybeans,0.0,0.0,0.0,0.0,0.0,0.0,0.0,0.0,0.0,0.0,0.0,12
2018-12-12,4 Reasons Why Pot Stocks   ETF Could Be On A High In 2019,0.0,0.0,0.0,0.0,0.0,0.0,0.0,0.0,0.0,0.0,0.0,13
2018-12-12,Dan Nathan Sees Unusual Options Activity In Coca-Cola,0.0,0.0,0.0,0.0,0.0,0.0,0.0,0.0,0.0,0.0,0.0,8
2018-12-12,Norfolk Southern moves headquarters to Atlanta,0.0,0.0,0.0,0.0,0.0,0.0,0.0,0.0,0.0,0.0,0.0,6
2018-12-12,"CME Group, Home Depot, Target: 'Fast Money' Picks For December 12",0.0,0.0,0.0,0.0,0.0,0.0,0.0,0.0,0.0,0.0,0.0,15
2018-12-11,Coca-Cola CEO Says Somewhat Uncertain Growth May Slow Compared To FY18,0.0,0.0,0.0,0.0,0.0,0.0,0.0,0.0,0.0,0.0,0.0,11
2018-12-11,The 2018 Farm Bill Vote: What You Need To Know,0.0,0.0,0.0,0.0,0.0,0.0,0.0,0.0,0.0,0.0,0.0,11
2018-12-11,An Upgrade For A Defensive Sector,0.0,0.0,0.0,0.0,0.0,0.0,0.0,0.0,0.0,0.0,0.0,6
2018-12-11,Here s Why Microsoft  MSFT  Stock Looks Like A Buy Right Now  ,0.0,0.0,0.0,0.0,0.0,0.0,0.0,0.0,0.0,0.0,0.0,12
2018-12-10,"Cushman & Wakefield Issues Release Highlighting Coca-Cola's Sale Of 711 Fifth Ave. In Manhattan, No Terms Disclosed",0.0,0.0,0.0,0.0,0.0,0.0,0.0,0.0,0.0,0.0,0.0,20
2018-12-07,Make Mine Vanilla: Dull Jobs Report Might Be Just What's Needed After Wild Week,0.0,0.0,0.0,0.0,0.0,0.0,0.0,0.0,0.0,0.0,0.0,16
2018-12-06,PepsiCo  PEP  Acquires SodaStream  Expands Beverage Portfolio,0.0,0.0,0.0,0.0,0.0,0.0,0.0,0.0,0.0,0.0,0.0,7
2018-12-06,Why Is Monster Beverage  MNST  Up 7 6  Since Last Earnings Report ,0.0,0.0,0.0,0.0,0.0,0.0,0.0,0.0,0.0,0.0,0.0,12
2018-12-06,Coca-Cola Reports Chair Muhtar Kent To Leave Co.; James Quincey Named Replacement,0.0,0.0,0.0,0.0,0.0,0.0,0.0,0.0,0.0,0.0,0.0,13
2018-12-06,Coca Cola CEO Quincey to take on chairman role in April,0.0,0.0,0.0,0.045454545454545456,0.0,0.045454545454545456,0.0,0.0,0.0,0.0,0.0,11
2018-12-04,Investors play defense with Coca Cola  McDonald s and PG,0.025,0.025,0.0,0.025,0.0,0.0,0.025,0.0,0.0,0.0,0.0,10
2018-12-04,Coca Cola  KO  Stock Moves  0 22   What You Should Know,0.0,0.0,0.0,0.0,0.0,0.0,0.0,0.0,0.0,0.0,0.0,11
2018-12-04,Glaxo To Sell India s Popular Horlicks Brand To Unilever ,0.0,0.0,0.0,0.0,0.0,0.0,0.0,0.0,0.0,0.0,0.0,10
2018-12-03,Stocks   Wall Street Surges on U S  China Trade War Truce,0.0,0.0,0.0,0.0,0.0,0.0,0.0,0.0,0.0,0.0,0.0,11
2018-12-03,Unilever swallows GSK s Indian Horlicks business for  3 8 billion,0.0,0.0,0.0,0.0,0.0,0.0,0.0,0.0,0.0,0.0,0.0,11
2018-12-03,Altria Likely To Venture Into Cannabis Space With Cronos Deal,0.0,0.0,0.0,0.0,0.0,0.0,0.0,0.0,0.0,0.0,0.0,10
2018-12-03,U S  stocks higher at close of trade  Dow Jones Industrial Average up 1 13 ,0.0,0.0,0.03333333333333333,0.0,0.0,0.03333333333333333,0.0,0.0,0.0,0.0,0.0,15
2018-11-30,Direxion Unveils Four Leveraged Consumer ETFs,0.0,0.0,0.0,0.0,0.0,0.0,0.0,0.0,0.0,0.0,0.0,6
2018-11-30,IKEA targets big cut in greenhouse gas emissions from production,0.0,0.0,0.0,0.05,0.0,0.0,0.05,0.0,0.0,0.0,0.0,10
2018-11-29,"Stocks Trading Ex Dividend For Thurs., Nov. 29, 2018",0.0,0.0,0.0,0.0,0.0,0.0,0.0,0.0,0.0,0.0,0.0,11
2018-11-29,Asian shares wobble before Trump Xi meeting,0.0,0.0,0.0,0.0,0.0,0.0,0.0,0.0,0.0,0.0,0.0,7
2018-11-29,Ad buyers skeptical as Snap looks beyond teens for growth,0.0,0.0,0.05,0.05,0.0,0.0,0.0,0.0,0.0,0.0,0.0,10
2018-11-28,Cannabis-Infused Beverage Stocks Rip Higher Amid Positive Farm Bill Development,0.0,0.0,0.0,0.0,0.0,0.0,0.0,0.0,0.0,0.0,0.0,10
2018-11-28,"Stocks That Will Be Trading Ex Dividend Thurs., Nov. 29, 2018",0.0,0.0,0.0,0.0,0.0,0.0,0.0,0.0,0.0,0.0,0.0,13
2018-11-28,Coca Cola  KO  Gains But Lags Market  What You Should Know,0.0,0.0,0.0,0.0,0.0,0.0,0.0,0.0,0.0,0.0,0.0,11
2018-11-28,Coke  KO  Up 3 8  Since Last Earnings Report  Can It Continue ,0.0,0.0,0.0,0.0,0.0,0.0,0.0,0.0,0.0,0.0,0.0,12
2018-11-27,UBS confident on Coca Cola HBC,0.0,0.0,0.0,0.05555555555555555,0.0,0.05555555555555555,0.0,0.05555555555555555,0.0,0.0,0.0,6
2018-11-23,"Pot Stocks, ETFs, Top News And Data From The Cannabis Industry This Week",0.0,0.0,0.0,0.0,0.0,0.0,0.0,0.0,0.0,0.0,0.0,15
2018-11-21,Pernod Ricard says needs time to assess impact of legal cannabis,0.0,0.0,0.0,0.0303030303030303,0.0,0.0303030303030303,0.0303030303030303,0.0,0.0,0.0,0.0,11
2018-11-21,"Stocks Which Set New 52-Week High Yesterday, Tues., Nov. 20, 2018",0.0,0.0,0.0,0.0,0.0,0.0,0.0,0.0,0.0,0.0,0.0,14
2018-11-21,"Stock, Oil Markets Bouncing Ahead of Thanksgiving Holiday",0.0,0.0,0.0,0.0,0.0,0.0,0.0,0.0,0.0,0.0,0.0,9
2018-11-21,October's Biggest Losers And Most Surprising Winners,0.0,0.0,0.0,0.0,0.0,0.0,0.0,0.0,0.0,0.0,0.0,8
2018-11-21,Market Seems To Make Partial Recovery Ahead Of Thanksgiving,0.0,0.0,0.0,0.0,0.0,0.0,0.0,0.0,0.0,0.0,0.0,9
2018-11-20,"Coca-Cola, PayPal, Valero: 'Fast Money' Picks For November 20",0.0,0.0,0.0,0.0,0.0,0.0,0.0,0.0,0.0,0.0,0.0,13
2018-11-20,"Stocks Which Set New 52-Week High Yesterday, Mon., Nov. 19, 2018",0.0,0.0,0.0,0.0,0.0,0.0,0.0,0.0,0.0,0.0,0.0,14
2018-11-19,"Coca-Cola CEO Talks Coffee, Cannabis With Cramer",0.0,0.0,0.0,0.0,0.0,0.0,0.0,0.0,0.0,0.0,0.0,8
2018-11-18,Stock Market News For Nov 19  2018,0.0,0.0,0.0,0.0,0.0,0.0,0.0,0.0,0.0,0.0,0.0,7
2018-11-18,Coca Cola  KO  Chalks Out Plan For Coffee Business  Cannabis,0.0,0.0,0.0,0.0,0.0,0.0,0.0,0.0,0.0,0.0,0.0,10
2018-11-15,Election Returns Likely To Usher In Hemp Amendment With Farm Bill,0.0,0.0,0.0,0.0,0.0,0.0,0.0,0.0,0.0,0.0,0.0,11
2018-11-15,Coca-Cola Option Alert: Jan 18 $48 Calls Sweep (2) above Ask!: 2100 @ $2.081 vs 9243 OI; Ref=$49.465,0.0,0.0,0.0,0.0,0.0,0.0,0.0,0.0,0.0,0.0,0.0,28
2018-11-15,With Growth Stocks Faltering  Coca Cola Makes Sense As A Defensive Play,0.0,0.0,0.0,0.0,0.0,0.0,0.0,0.0,0.0,0.0,0.0,12
2018-11-14,Stocks   Snap  PG E  Canopy Growth Plunge in Pre market  Pfizer Drops,0.0,0.0,0.0,0.0,0.0,0.0,0.0,0.0,0.0,0.0,0.0,12
2018-11-13,Nike hires former Coca Cola executive as Jordan Brand president,0.0,0.0,0.0,0.05,0.0,0.05,0.0,0.0,0.0,0.0,0.0,10
2018-11-13,Risk Off Redux  Volatility Storms Back Onto The Scene In Stock  Oil Rout,0.0,0.0,0.0,0.0,0.0,0.0,0.0,0.0,0.0,0.0,0.0,13
2018-11-12,U S  stocks lower at close of trade  Dow Jones Industrial Average down 2 32 ,0.0,0.0,0.03333333333333333,0.0,0.016666666666666666,0.016666666666666666,0.0,0.0,0.0,0.0,0.0,15
2018-11-12,Coca Cola  KO  Gains As Market Dips  What You Should Know,0.0,0.0,0.0,0.0,0.0,0.0,0.0,0.0,0.0,0.0,0.0,11
2018-11-12,October's biggest Losers And Most Surprising Winners,0.0,0.0,0.0,0.0,0.0,0.0,0.0,0.0,0.0,0.0,0.0,8
2018-11-09,"Stocks Which Set New 52-Week High Yesterday, Thurs., Nov. 8, 2018",0.0,0.0,0.0,0.0,0.0,0.0,0.0,0.0,0.0,0.0,0.0,14
2018-11-08,"Stocks Which Set New 52-Week High Yesterday, Wed., Nov. 7, 2018",0.0,0.0,0.0,0.0,0.0,0.0,0.0,0.0,0.0,0.0,0.0,14
2018-11-08,"As Coke Shakes Up Energy Drink Category, Monster Earns A Downgrade",0.0,0.0,0.0,0.0,0.0,0.0,0.0,0.0,0.0,0.0,0.0,12
2018-11-08,Coca Cola proposes energy drinks in clash with Monster Beverage,0.05,0.0,0.05,0.0,0.0,0.0,0.0,0.0,0.0,0.0,0.0,10
2018-11-08,Stocks   Roku  Qualcomm Plunge in Pre market  TripAdvisor Surges  Tesla Rises,0.0,0.0,0.0,0.0,0.0,0.0,0.0,0.0,0.0,0.0,0.0,11
2018-11-08,PreMarket Prep Opening NYSE Imbalance Update: Twilio 85k Shares To Sell; Square 157k To Sell; General Electric 267k To Sell; Coke 164k To Sell,0.0,0.0,0.0,0.0,0.0,0.0,0.0,0.0,0.0,0.0,0.0,28
2018-11-07,Michigan vote to legalize pot fires up investor momentum behind cannabis,0.009090909090909092,0.0,0.009090909090909092,0.018181818181818184,0.009090909090909092,0.009090909090909092,0.018181818181818184,0.009090909090909092,0.0,0.009090909090909092,0.0,11
2018-11-07,PreMarket Prep Opening NYSE Imbalance Update: Alibaba 62k Shares To Buy; GE 106k To Buy; Coke 85k To Sell; IBM 30k To Buy,0.0,0.0,0.0,0.0,0.0,0.0,0.0,0.0,0.0,0.0,0.0,27
2018-11-06,"Stocks Which Set New 52-Week High Yesterday, Mon., Nov. 5, 2018",0.0,0.0,0.0,0.0,0.0,0.0,0.0,0.0,0.0,0.0,0.0,14
2018-11-05,Coca Cola  KO  Outpaces Stock Market Gains  What You Should Know,0.0,0.0,0.0,0.0,0.0,0.0,0.0,0.0,0.0,0.0,0.0,11
2018-11-05,4 Trade Ideas For Coca Cola European Partners  Bonus Idea,0.0,0.0,0.0,0.0,0.0,0.0,0.0,0.0,0.0,0.0,0.0,10
2018-11-04,Will Monster Beverage  MNST  Beat Earnings Estimates In Q3 ,0.0,0.0,0.0,0.0,0.0,0.0,0.0,0.0,0.0,0.0,0.0,9
2018-11-02,Dow 30 Stock Roundup  Apple  Coca Cola  DowDuPont Earnings Impress,0.0,0.0,0.0,0.0,0.0,0.0,0.0,0.0,0.0,0.0,0.0,10
2018-11-01,Pfizer And Coca Cola Earnings Help Safer Income Stocks Shine ,0.0,0.0,0.0,0.0,0.0,0.0,0.0,0.0,0.0,0.0,0.0,10
2018-11-01,"High-Dividend, Wide Moat ETFs Debut",0.0,0.0,0.0,0.0,0.0,0.0,0.0,0.0,0.0,0.0,0.0,6
2018-11-01,Kraft Heinz Earnings miss  Revenue beats In Q3,0.0,0.0,0.0,0.0,0.0,0.0,0.0,0.0,0.0,0.0,0.0,8
2018-11-01,U S  voters to decide  76 billion of bonds  taxation limits,0.0,0.0,0.09090909090909091,0.0,0.0,0.0,0.0,0.0,0.0,0.0,0.0,11
2018-10-31,Estee Lauder Earnings  Revenue beat in Q1,0.0,0.0,0.0,0.0,0.0,0.0,0.0,0.0,0.0,0.0,0.0,7
2018-10-31,Molson Coors Expects To Launch Cannabis Beverage In 2019,0.0,0.0,0.0,0.0,0.0,0.0,0.0,0.0,0.0,0.0,0.0,9
2018-10-31,"Morgan Stanley Maintains Equal-Weight on Coca-Cola, Raises Price Target to $51",0.0,0.0,0.0,0.0,0.0,0.0,0.0,0.0,0.0,0.0,0.0,13
2018-10-31,"Jefferies Maintains Hold on Coca-Cola, Raises Price Target to $49",0.0,0.0,0.0,0.0,0.0,0.0,0.0,0.0,0.0,0.0,0.0,12
2018-10-31,From Molson Coors Q3 Earnings Conference Call: CEO Sees Canadian Cannabis Drink Market 'A Tremendous Opportunity',0.0,0.0,0.0,0.0,0.0,0.0,0.0,0.0,0.0,0.0,0.0,18
2018-10-30,Coca Cola Earnings  Revenue beat in Q3,0.0,0.0,0.0,0.0,0.0,0.0,0.0,0.0,0.0,0.0,0.0,7
2018-10-30,Ecolab Earnings inline  Revenue beats In Q3,0.0,0.0,0.0,0.0,0.0,0.0,0.0,0.0,0.0,0.0,0.0,7
2018-10-30,Stocks   Coca Cola  Apple Gain in Pre market  GE  Pfizer Sink,0.0,0.0,0.0,0.0,0.0,0.0,0.0,0.0,0.0,0.0,0.0,11
2018-10-30,Coke profits get health kick in third quarter,0.0625,0.0,0.0625,0.0,0.0,0.0,0.0,0.0,0.0,0.0,0.0,8
2018-10-30,"Coca-Cola Q3 EPS $0.58 Beats $0.55 Estimate, Sales $8.2B Beat $8.18B Estimate",0.0,0.0,0.0,0.0,0.0,0.0,0.0,0.0,0.0,0.0,0.0,17
2018-10-30,"'Coca-Cola CEO: ""we have no plans to get into the cannabis space."" $kO' - The Street's Brian Sozzi Tweets",0.0,0.0,0.0,0.0,0.0,0.0,0.0,0.0,0.0,0.0,0.0,26
2018-10-30,A Peek Into The Markets: US Stock Futures Gain Ahead Of Earnings,0.0,0.0,0.0,0.0,0.0,0.0,0.0,0.0,0.0,0.0,0.0,13
2018-10-30,Wild Times: Market Seems To Seek Solid Ground After Monday's Manic,0.0,0.0,0.0,0.0,0.0,0.0,0.0,0.0,0.0,0.0,0.0,13
2018-10-30,Top 5 Things to Know in the Market on Tuesday,0.0,0.0,0.0,0.0,0.0,0.0,0.0,0.0,0.0,0.0,0.0,10
2018-10-30,Jubilant FoodWorks Announces PepsiCo as New Beverage Partner for Domino's Pizza in India; Ends 20-Year Partnership with Coca-Cola,0.0,0.0,0.0,0.0,0.0,0.0,0.0,0.0,0.0,0.0,0.0,20
2018-10-30,"Earnings Scheduled For October 30, 2018",0.0,0.0,0.0,0.0,0.0,0.0,0.0,0.0,0.0,0.0,0.0,7
2018-10-30,"14 Stocks To Watch For October 30, 2018",0.0,0.0,0.0,0.0,0.0,0.0,0.0,0.0,0.0,0.0,0.0,9
2018-10-30,Monday Mania  Market Swings Violently  Crumbling After Early Gains,0.0,0.0,0.0,0.0,0.0,0.0,0.0,0.0,0.0,0.0,0.0,9
2018-10-29,Day Ahead  Top 3 Things to Watch,0.0,0.0,0.0,0.0,0.0,0.0,0.0,0.0,0.0,0.0,0.0,7
2018-10-29,"Benzinga's Week Ahead: Can Facebook, Apple Earnings Rescue The Stock Market?",0.0,0.0,0.0,0.0,0.0,0.0,0.0,0.0,0.0,0.0,0.0,15
2018-10-29,"Correction And Bounce: SPX Off 10% From Highs Intraday As Weak Earnings, Outlooks Crush Stocks",0.0,0.0,0.0,0.0,0.0,0.0,0.0,0.0,0.0,0.0,0.0,18
2018-10-29,Coca Cola s Q3 Report Could Put Some Fizz Into Its Dormant Shares,0.0,0.0,0.0,0.0,0.0,0.0,0.0,0.0,0.0,0.0,0.0,13
