date,title,anger,fear,negative,positive,sadness,trust,anticipation,joy,disgust,surprise,anticip,word_count
2017-04-26,How Ad Companies Have Responded To A Changing Media Landscape,0.0,0.0,0.0,0.0,0.0,0.0,0.0,0.0,0.0,0.0,0.0,10
2017-04-26,Zacks Earnings Trends Highlights  Caterpillar  DuPont  McDonald s  Coke And Procter   Gamble,0.0,0.0,0.0,0.0,0.0,0.0,0.0,0.0,0.0,0.0,0.0,12
2017-04-25,Nasdaq closes above 6000 for the first time ever,0.0,0.0,0.0,0.0,0.0,0.0,0.1111111111111111,0.0,0.0,0.0,0.0,9
2017-04-25,U S  stock index futures higher amid earnings spate ,0.0,0.0,0.0,0.0,0.0,0.0,0.0,0.0,0.0,0.0,0.0,9
2017-04-25,8 Technical Levels From Tuesday's PreMarket Prep,0.0,0.0,0.0,0.0,0.0,0.0,0.0,0.0,0.0,0.0,0.0,8
2017-04-25,Coca-Cola Sees FY 2017 EPS Down 1% to 3% YoY,0.0,0.0,0.0,0.0,0.0,0.0,0.0,0.0,0.0,0.0,0.0,12
2017-04-25,Coca Cola to cut 1 200 jobs  boosts savings target,0.0,0.0,0.0,0.1,0.0,0.0,0.0,0.0,0.0,0.0,0.0,10
2017-04-25,"Eying 6,000: Nasdaq Close To New Big Number As Relief Rally Seen Continuing",0.0,0.0,0.0,0.0,0.0,0.0,0.0,0.0,0.0,0.0,0.0,14
2017-04-25,Coca-Cola's Stock Unmoved After Mixed Q1 Report,0.0,0.0,0.0,0.0,0.0,0.0,0.0,0.0,0.0,0.0,0.0,8
2017-04-25,"Coca-Cola Incoming CEO On Sugar Tax, Says 'If governments need money, they should widen their tax bases'; Says Most of 1,200 Job Reductions Will Be In Atlanta",0.004032258064516129,0.0,0.004032258064516129,0.004032258064516129,0.004032258064516129,0.004032258064516129,0.004032258064516129,0.004032258064516129,0.0,0.004032258064516129,0.0,31
2017-04-25,Trading Coca Cola Ahead Of Earnings,0.0,0.0,0.0,0.0,0.0,0.0,0.0,0.0,0.0,0.0,0.0,6
2017-04-25,Coca-Cola Reaffirms 3% Organic Revenue Growth,0.0,0.0,0.0,0.0,0.0,0.0,0.0,0.0,0.0,0.0,0.0,7
2017-04-25,"Coca-Cola Q1 EPS $0.43 vs $0.44 Est, Sales $9.12B vs $8.89B Est",0.0,0.0,0.0,0.0,0.0,0.0,0.0,0.0,0.0,0.0,0.0,17
2017-04-25,Pepsi  PEP  Tops Q1 Earnings  Revenues On Price Gains,0.0,0.0,0.0,0.0,0.0,0.0,0.0,0.0,0.0,0.0,0.0,9
2017-04-25,"15 Stocks To Watch For April 25, 2017",0.0,0.0,0.0,0.0,0.0,0.0,0.0,0.0,0.0,0.0,0.0,9
2017-04-25,Coca Cola first quarter earnings miss as revenues fall ,0.0,0.0,0.05555555555555555,0.0,0.05555555555555555,0.0,0.0,0.0,0.0,0.0,0.0,9
2017-04-25,"Earnings Scheduled For April 25, 2017",0.0,0.0,0.0,0.0,0.0,0.0,0.0,0.0,0.0,0.0,0.0,7
2017-04-24,"Spell Out Relief: French Vote As Expected, So Attention Turns To Earnings, Tax Reform",0.0,0.0,0.0,0.0,0.0,0.0,0.0,0.0,0.0,0.0,0.0,17
2017-04-24,United Technologies  UTX  Q1 Earnings  What s In Store ,0.0,0.0,0.0,0.0,0.0,0.0,0.0,0.0,0.0,0.0,0.0,9
2017-04-24,TransUnion  TRU  Q1 Earnings  What s In Store This Time ,0.0,0.0,0.0,0.0,0.0,0.0,0.0,0.0,0.0,0.0,0.0,10
2017-04-24,S P Global  SPGI  To Post Q1 Earnings  A Beat In The Cards ,0.0,0.0,0.0,0.0,0.0,0.0,0.0,0.0,0.0,0.0,0.0,13
2017-04-24,3 Things To Watch When Coca Cola And Pepsi Report This Week,0.0,0.0,0.0,0.0,0.0,0.0,0.0,0.0,0.0,0.0,0.0,12
2017-04-24,"Earnings Preview: McDonald's, Coca-Cola, And Chipotle Report Q1",0.0,0.0,0.0,0.0,0.0,0.0,0.0,0.0,0.0,0.0,0.0,12
2017-04-24,Coca Cola  KO  Q1 Earnings Miss  Refranchising Costs Hurt,0.0,0.0,0.0,0.0,0.0,0.0,0.0,0.0,0.0,0.0,0.0,9
2017-04-24,Can Procter   Gamble  PG  Spring A Surprise In Q3 Earnings ,0.0,0.0,0.0,0.0,0.0,0.0,0.0,0.0,0.0,0.0,0.0,10
2017-04-24,Earnings To Watch,0.0,0.0,0.0,0.0,0.0,0.0,0.0,0.0,0.0,0.0,0.0,3
2017-04-24,"Earnings: Caterpillar, Lockheed Martin, and Eli Lilly Report Tomorrow",0.0,0.0,0.0,0.0,0.0,0.0,0.0,0.0,0.0,0.0,0.0,12
2017-04-23,The Zacks Analyst Blog Highlights  Verizon  Coca Cola  Starbucks  Danaher And Express Scripts,0.0,0.0,0.0,0.0,0.0,0.0,0.0,0.0,0.0,0.0,0.0,13
2017-04-23,Coca Cola  Caterpillar  DuPont  3M And Procter   Gamble Are Part Of Zacks Earnings Preview,0.0,0.0,0.0,0.0,0.0,0.0,0.0,0.0,0.0,0.0,0.0,14
2017-04-23,Will Beverage Stocks KO   AKO B Add Fizz To Q1 Earnings ,0.0,0.0,0.0,0.0,0.0,0.0,0.0,0.0,0.0,0.0,0.0,11
2017-04-23,Top Ranked Momentum Stocks To Buy For April 24th,0.0,0.0,0.0,0.0,0.0,0.0,0.0,0.0,0.0,0.0,0.0,9
2017-04-23,Dr Pepper Snapple  DPS  Q1 Earnings  A Beat In The Cards ,0.0,0.0,0.0,0.0,0.0,0.0,0.0,0.0,0.0,0.0,0.0,11
2017-04-21,Top Research Reports For Today  VZ  KO  SBUX,0.0,0.0,0.0,0.0,0.0,0.0,0.0,0.0,0.0,0.0,0.0,8
2017-04-21,"Pre-Market Imbalance Update (Note These Will Be More Volatile Because Of Options Expiration): Nike 211K Shares to Sell, Coca-Cola 205K Shares to Sell",0.0,0.0,0.0,0.0,0.0,0.0,0.0,0.0,0.0,0.0,0.0,27
2017-04-21,This Defensive Name Looks Technically Promising,0.0,0.0,0.0,0.0,0.0,0.0,0.0,0.0,0.0,0.0,0.0,6
2017-04-21,National Beverage Valuation Has Bubbled Too High,0.0,0.0,0.0,0.0,0.0,0.0,0.0,0.0,0.0,0.0,0.0,7
2017-04-21,Earnings Growth Accelerates In Q1 ,0.0,0.0,0.0,0.0,0.0,0.0,0.0,0.0,0.0,0.0,0.0,5
2017-04-20,Should You Expect A Beat From Coca Cola  KO  In Q1 Earnings,0.0,0.0,0.0,0.0,0.0,0.0,0.0,0.0,0.0,0.0,0.0,12
2017-04-20,U S  stocks higher at close of trade  Dow Jones Industrial Average up 0 85 ,0.0,0.0,0.03333333333333333,0.0,0.0,0.03333333333333333,0.0,0.0,0.0,0.0,0.0,15
2017-04-19,Coca Cola  KO  Brings Popular  Share A Coke  Program Back,0.0,0.0,0.0,0.0,0.0,0.0,0.0,0.0,0.0,0.0,0.0,10
2017-04-19,U S  soda sales drops for 12th straight year  trade publication,0.0,0.0,0.0,0.0,0.0,0.09090909090909091,0.0,0.0,0.0,0.0,0.0,11
2017-04-19,The Market In 5 Minutes,0.0,0.0,0.0,0.0,0.0,0.0,0.0,0.0,0.0,0.0,0.0,5
2017-04-19,Credit Suisse Upgrades Coca-Cola to Outperform,0.0,0.0,0.0,0.0,0.0,0.0,0.0,0.0,0.0,0.0,0.0,6
2017-04-19,"Benzinga's Top Upgrades, Downgrades For April 19, 2017",0.0,0.0,0.0,0.0,0.0,0.0,0.0,0.0,0.0,0.0,0.0,11
2017-04-12,Watch These 5 Huge Call Purchases In Wednesday Trade,0.0,0.0,0.0,0.0,0.0,0.0,0.0,0.0,0.0,0.0,0.0,9
2017-04-12,The Most Likely Targets For A Kraft Heinz Deal: Mondelez Or Pepsi,0.0,0.0,0.0,0.0,0.0,0.0,0.0,0.0,0.0,0.0,0.0,13
2017-04-12,"Pre-Market Imbalance Update: Berkshire Hathaway 55K Shares to Buy, GE 34K Shares to Sell, Coca-Cola 20K to Sell",0.0,0.0,0.0,0.0,0.0,0.0,0.0,0.0,0.0,0.0,0.0,21
2017-04-09,Jim Cramer Weighs In On Centurylink And Coca-Cola,0.0,0.0,0.0,0.0,0.0,0.0,0.0,0.0,0.0,0.0,0.0,8
2017-04-06,Watch These 8 Huge Call Purchases In Thursday Trade,0.0,0.0,0.0,0.0,0.0,0.0,0.0,0.0,0.0,0.0,0.0,9
2017-04-05,Option Alert: Coca-Cola Apr 28th 44.0 Calls Sweep: 651 @  ASK  $0.14: 651 traded vs 44 OI:  Earnings 4/25 Before Open  $42.83 Ref,0.0,0.0,0.0,0.0,0.0,0.0,0.0,0.0,0.0,0.0,0.0,29
2017-04-05,"World Retail Congress Continues Today; Presenters Include PVH, Estee Lauder's Jo Malone, Facebook, And Coca-Cola",0.0,0.0,0.0,0.0,0.0,0.0,0.0,0.0,0.0,0.0,0.0,20
2017-04-05,McDonald s U S  appoints three to senior roles,0.0,0.0,0.0,0.0,0.0,0.0,0.0,0.0,0.0,0.0,0.0,9
2017-04-05,Benzinga's Option Alert Recap From April 5,0.0,0.0,0.0,0.0,0.0,0.0,0.0,0.0,0.0,0.0,0.0,8
2017-04-04,Warren Buffett lands on Cherry Coke cans in China,0.0,0.0,0.0,0.0,0.0,0.0,0.0,0.0,0.0,0.0,0.0,9
2017-04-03,Here's What To Expect From This Year's World Retail Congress,0.0,0.0,0.0,0.0,0.0,0.0,0.0,0.0,0.0,0.0,0.0,12
2017-04-03,"Yahoo Finance Reporter Daniel Roberts Tweets: Coke is the new soft drink sponsor of Major League Baseball, replacing Pepsi. It had been Pepsi since 1997. $KO",0.0,0.0,0.0,0.016129032258064516,0.0,0.016129032258064516,0.0,0.0,0.0,0.0,0.0,31
2017-04-03,"Benzinga Premarket Prep Host Dennis Dick Tweets: Notable opening imbalances: $PFE -243K, $MRK -93K, $BABA +115K, $KO +104K, $T +111K, $CAT -55K, $IBM -42K",0.0,0.0,0.0,0.0,0.0,0.0,0.0,0.0,0.0,0.0,0.0,39
2017-04-01,Coca Cola  Weak Uptrend This Year,0.0,0.0,0.0,0.0,0.0,0.0,0.0,0.0,0.0,0.0,0.0,6
2017-04-01,"50 Advertisers Boycott YouTube Advertising, And It Won't Mean More Than A 1% Dip In Google's Top Line",0.0,0.0,0.0,0.0,0.0,0.0,0.0,0.0,0.0,0.0,0.0,22
2017-03-29,"CinemaCon Conference Continues Today; Presenters Include Regal Entertainment, Cinemark, Sony, Coca-Cola, Twentieth Century Fox, Time Warner, Imax, & Comcast",0.0,0.0,0.0,0.0,0.0,0.0,0.0,0.0,0.0,0.0,0.0,27
2017-03-27,Here's Every Major Corporation That's Pulled Ads From YouTube,0.0,0.0,0.0,0.0,0.0,0.0,0.0,0.0,0.0,0.0,0.0,11
2017-03-24,Household Names JPMorgan Initiated Ratings On This Week,0.0,0.0,0.0,0.0,0.0,0.0,0.0,0.0,0.0,0.0,0.0,8
2017-03-23,The Business Of Clean Water,0.0,0.0,0.0,0.0,0.0,0.0,0.0,0.0,0.0,0.0,0.0,5
2017-03-23,The Coca-Cola Company Names Francisco Crespo Chief Growth Officer,0.0,0.0,0.0,0.0,0.0,0.0,0.0,0.0,0.0,0.0,0.0,9
2017-03-23,The Pharmaceutical Stocks We re Buying Now,0.0,0.0,0.0,0.0,0.0,0.0,0.0,0.0,0.0,0.0,0.0,7
2017-03-22,Guy Adami And David Seaburg Share Their Thoughts On Altria And Coca-Cola,0.0,0.0,0.0,0.0,0.0,0.0,0.0,0.0,0.0,0.0,0.0,12
2017-03-21,National Beverage Could Be A Major Beneficiary Of The Sugar Tax,0.0,0.0,0.0,0.0,0.0,0.0,0.0,0.0,0.0,0.0,0.0,11
2017-03-21,"Benzinga's Top Upgrades, Downgrades For March 21, 2017",0.0,0.0,0.0,0.0,0.0,0.0,0.0,0.0,0.0,0.0,0.0,11
2017-03-21,"JP Morgan Initiates Coverage On Coca-Cola With Neutral, Announces $43 Price Target",0.0,0.0,0.0,0.0,0.0,0.0,0.0,0.0,0.0,0.0,0.0,14
2017-03-20,"Benzinga's Premarket Prep Host Dennis Dick Tweets: Notable opening imbalances: $BAC -984K, $JPM -86K, $PFE +115K, $BABA +54K, $GE -88K, $KO +72K, $NKE +64K",0.0,0.0,0.0,0.0,0.0,0.0,0.0,0.0,0.0,0.0,0.0,40
2017-03-19,Should Coke And Pepsi Move Into The Hard Soda Biz?,0.0,0.0,0.0,0.0,0.0,0.0,0.0,0.0,0.0,0.0,0.0,11
2017-03-16,Oil And Gas  Traders See More Downside,0.0,0.0,0.0,0.0,0.0,0.0,0.0,0.0,0.0,0.0,0.0,7
2017-03-15,How To Play The World s Most Overlooked Emerging Market,0.0,0.0,0.0,0.0,0.0,0.0,0.0,0.0,0.0,0.0,0.0,10
2017-03-13,Carter Worth And Mike Khouw's Coca-Cola Trade,0.0,0.0,0.0,0.0,0.0,0.0,0.0,0.0,0.0,0.0,0.0,8
2017-03-09,Border Tax  How To Navigate The New Reality Of U S  Mexico Trade,0.0,0.0,0.0,0.0,0.0,0.0,0.0,0.0,0.0,0.0,0.0,13
2017-03-09,"Competition Only Helps Apple Ripen, An Advantage Over The FANG Stocks",0.0,0.0,0.0,0.0,0.0,0.0,0.0,0.0,0.0,0.0,0.0,12
2017-03-08,Dan Nathan Sees Unusual Options Activity In The Coca-Cola Co,0.0,0.0,0.0,0.0,0.0,0.0,0.0,0.0,0.0,0.0,0.0,10
2017-03-08,"Hershey Shares Spike As Trader Chat Rooms Revive Speculation Buffett, Kraft Heinz Could Make Acquisition Bid",0.0,0.0,0.0,0.0,0.0,0.0,0.0,0.0,0.0,0.0,0.0,17
2017-03-06,How Berkshire Hathaway Evolved To A Conglomerate Of 80 Companies,0.0,0.0,0.0,0.0,0.0,0.0,0.0,0.0,0.0,0.0,0.0,10
2017-03-05,Do Sin Taxes Really Work?,0.0,0.0,0.0,0.0,0.0,0.0,0.0,0.0,0.0,0.0,0.0,6
2017-03-04,Could Trump Impede Michelle Obama's Health Initiatives?,0.0,0.0,0.0,0.0,0.0,0.0,0.0,0.0,0.0,0.0,0.0,9
2017-03-03,Nestle and Coke end Nestea iced tea venture,0.0,0.0,0.0,0.0,0.0,0.0,0.0,0.0,0.0,0.0,0.0,8
2017-03-03,Indian Dream Fizzling Out: Indian State Pulls U.S. Soft Drinks Over Water Scarcity,0.0,0.0,0.0,0.0,0.0,0.0,0.0,0.0,0.0,0.0,0.0,14
2017-03-02,Hot Stocks  What s Going On With Coca Cola And Is It Time to Buy ,0.0,0.0,0.0,0.0,0.0,0.0,0.0,0.0,0.0,0.0,0.0,15
2017-03-02,"Buffett's Soda Empire: If Kraft Heinz Acquired Pepsi, What Share Of The Soda Market Would 'The Oracle' Own?",0.0,0.0,0.0,0.0,0.0,0.0,0.0,0.0,0.0,0.0,0.0,23
2017-03-02,Casualties Of The Sugar Wars: Pepsi Announces Job Cuts As Philly Soda Tax Hits Sales,0.0,0.0,0.0,0.0,0.0,0.0,0.0,0.0,0.0,0.0,0.0,16
2017-03-01,iFOREX Daily Analysis   March 03 2017,0.0,0.0,0.0,0.0,0.0,0.0,0.0,0.0,0.0,0.0,0.0,6
2017-02-28,U S  stocks lower at close of trade  Dow Jones Industrial Average down 0 12 ,0.0,0.0,0.03333333333333333,0.0,0.016666666666666666,0.016666666666666666,0.0,0.0,0.0,0.0,0.0,15
2017-02-28,FEMSA  FMX  Earnings Miss  Revenues Beat Estimates In Q4,0.0,0.0,0.0,0.0,0.0,0.0,0.0,0.0,0.0,0.0,0.0,9
2017-02-27,Warren Buffett On Active Vs  Passive Investing  Outlines  The Bet  In Berkshire Shareholder Letter,0.0,0.0,0.0,0.0,0.0,0.0,0.0,0.0,0.0,0.0,0.0,14
2017-02-27,"Warren Buffett Doubles Apple Stake, Cheers iPhone Maker's Stickiness",0.0,0.0,0.0,0.0,0.0,0.0,0.0,0.0,0.0,0.0,0.0,11
2017-02-27,4 Lessons For Investors From Warren Buffett s Portfolio,0.0,0.0,0.0,0.0,0.0,0.0,0.0,0.0,0.0,0.0,0.0,9
2017-02-25,Warren Buffett rails against fee hungry Wall Street managers,0.027777777777777776,0.0,0.05555555555555555,0.0,0.0,0.0,0.027777777777777776,0.0,0.0,0.0,0.0,9
2017-02-25,Buffett upbeat on American business  Berkshire operating profit down,0.0,0.0,0.0,0.0,0.0,0.0,0.0,0.0,0.0,0.0,0.0,9
2017-02-23,Coca-Cola Exec. At CAGNY Conf. Says Co. Will Look At Downsizing Packaging In Some Areas,0.0,0.0,0.0,0.0,0.0,0.0,0.0,0.0,0.0,0.0,0.0,17
2017-02-22,These ETFs Could Help You Trade Short-Term Moves In Defensive Sectors,0.0,0.0,0.0,0.0,0.0,0.0,0.0,0.0,0.0,0.0,0.0,11
2017-02-17,Potential Cuts To Supplemental Nutrition Assistance Program Benefits Put These Top Lines At Risk,0.0,0.0,0.0,0.0,0.0,0.0,0.0,0.0,0.0,0.0,0.0,14
2017-02-17,"Markets Turn Lower As Long Weekend Approaches, But Optimism Seems Evident",0.0,0.0,0.0,0.0,0.0,0.0,0.0,0.0,0.0,0.0,0.0,12
2017-02-16,SodaStream Has Quietly Had A Really Nice Run,0.0,0.0,0.0,0.0,0.0,0.0,0.0,0.0,0.0,0.0,0.0,8
2017-02-16,Snap And Winning Streak Snapped,0.0,0.0,0.0,0.0,0.0,0.0,0.0,0.0,0.0,0.0,0.0,5
2017-02-16,Coca-Cola Increases Qtr Dividend From $0.35/Share To $0.37/Share,0.0,0.0,0.0,0.0,0.0,0.0,0.0,0.0,0.0,0.0,0.0,10
2017-02-15,How Sweet Were The Soda Pop Quarterly Prints?,0.0,0.0,0.0,0.0,0.0,0.0,0.0,0.0,0.0,0.0,0.0,9
2017-02-14,Berkshire takes huge bite of Apple  boosts airline stakes,0.0,0.0,0.1111111111111111,0.0,0.0,0.0,0.0,0.0,0.0,0.0,0.0,9
2017-02-14,"13F Roundup: Apple, Bank Of America And Other Stocks Hedge Funds Love/Hate",0.0,0.0,0.0,0.0,0.0,0.0,0.0,0.0,0.0,0.0,0.0,14
2017-02-14,What To Watch When Kraft Heinz And PepsiCo Report Earnings,0.0,0.0,0.0,0.0,0.0,0.0,0.0,0.0,0.0,0.0,0.0,10
2017-02-13,Investors Growing Impatient With Coca-Cola's Inability To Overcome Macro Challenges,0.0,0.0,0.0,0.0,0.0,0.0,0.0,0.0,0.0,0.0,0.0,11
2017-02-09,Market Points Toward Possible Test Of Record Highs Despite Twitter Results,0.0,0.0,0.0,0.0,0.0,0.0,0.0,0.0,0.0,0.0,0.0,11
2017-02-09,Opening Bell  Politics Weigh On FX  Directionless Equities,0.0,0.0,0.0,0.0,0.0,0.0,0.0,0.0,0.0,0.0,0.0,8
2017-02-09,Coca-Cola Smoked After Q4 Report,0.0,0.0,0.0,0.0,0.0,0.0,0.0,0.0,0.0,0.0,0.0,5
2017-02-09,Coca Cola forecasts drop in 2017 profit amid refranchising,0.0,0.0,0.0,0.0,0.0,0.0,0.0,0.0,0.0,0.0,0.0,9
2017-02-09,Dow up 100 points as U S  stocks buoyed by Trump tax talk,0.0,0.0,0.038461538461538464,0.019230769230769232,0.019230769230769232,0.0,0.0,0.0,0.0,0.0,0.0,13
2017-02-09,"Coca-Cola Reports Q4 Adj. EPS $0.37, Inline, Sales $9.4B vs $9.13B Est.",0.0,0.0,0.0,0.0,0.0,0.0,0.0,0.0,0.0,0.0,0.0,19
2017-02-09,Coca-Cola Sees FY17 Organic Sales Growth ~3%,0.0,0.0,0.0,0.0,0.0,0.0,0.0,0.0,0.0,0.0,0.0,8
2017-02-09,Coca Cola sees 3  growth in 2017 organic revenues  lower EPS ,0.0,0.0,0.022727272727272728,0.045454545454545456,0.022727272727272728,0.0,0.0,0.0,0.0,0.0,0.0,11
2017-02-09,"12 Stocks To Watch For February 9, 2017",0.0,0.0,0.0,0.0,0.0,0.0,0.0,0.0,0.0,0.0,0.0,9
2017-02-09,"Earnings Scheduled For February 9, 2017",0.0,0.0,0.0,0.0,0.0,0.0,0.0,0.0,0.0,0.0,0.0,7
2017-02-09,Coca-Cola Sees FY17 Adj. EPS Down 1-4% YoY,0.0,0.0,0.0,0.0,0.0,0.0,0.0,0.0,0.0,0.0,0.0,10
2017-02-09,A Peek Into The Markets: U.S. Stock Futures Rise; Twitter Sales Miss Views,0.0,0.0,0.0,0.0,0.0,0.0,0.0,0.0,0.0,0.0,0.0,15
2017-02-09,Q4 2016 Real-Time Call Brief,0.0,0.0,0.0,0.0,0.0,0.0,0.0,0.0,0.0,0.0,0.0,5
2017-02-09,"The Market In 5 Minutes: Twitter Tanks, Trump Tweets, Tesla Preps",0.0,0.0,0.0,0.0,0.0,0.0,0.0,0.0,0.0,0.0,0.0,14
2017-02-08,"The Most Popular Brand On Facebook Next To, Well, Facebook, Is...",0.0,0.0,0.0,0.0,0.0,0.0,0.0,0.0,0.0,0.0,0.0,15
2017-02-08,Watch These 8 Huge Call Purchases In Wednesday Trade,0.0,0.0,0.0,0.0,0.0,0.0,0.0,0.0,0.0,0.0,0.0,9
2017-02-07,"The Market In 5 Minutes: GM And Gap Earnings, Retail Sales Data",0.0,0.0,0.0,0.0,0.0,0.0,0.0,0.0,0.0,0.0,0.0,14
2017-02-07,Option Alert: Coca-Cola Feb 10th 43.0 Calls Sweep: 1575 @  ASK  $0.07: 2500 traded vs 524 OI:  Earnings 2/9 Before Open  $41.73 Ref,0.0,0.0,0.0,0.0,0.0,0.0,0.0,0.0,0.0,0.0,0.0,29
2017-02-07,"The Trump Diet: Fried Chicken, Diet Coke And Big Macs Served On A Silver Platter",0.0,0.0,0.0,0.0,0.0,0.0,0.0,0.0,0.0,0.0,0.0,17
2017-02-07,Benzinga's Option Alert Recap From February 7,0.0,0.0,0.0,0.0,0.0,0.0,0.0,0.0,0.0,0.0,0.0,8
2017-02-07,"20 Most Talked About Super Bowl LI Commercials, Ranked",0.0,0.0,0.0,0.0,0.0,0.0,0.0,0.0,0.0,0.0,0.0,10
2017-02-06,"Jobs Report, Fed Meeting Out of the Way, So Market Seeks New Catalyst",0.0,0.0,0.0,0.0,0.0,0.0,0.0,0.0,0.0,0.0,0.0,15
2017-02-06,Are Value Investors Bearish  ,0.0,0.0,0.0,0.0,0.0,0.0,0.0,0.0,0.0,0.0,0.0,4
2017-02-06,The Market In 5 Minutes: One For The Thumb,0.0,0.0,0.0,0.0,0.0,0.0,0.0,0.0,0.0,0.0,0.0,10
2017-02-06,"American Staples Earnings Preview: Low Expectations For Coca-Cola, Disney",0.0,0.0,0.0,0.0,0.0,0.0,0.0,0.0,0.0,0.0,0.0,11
2017-02-06,Watch These 8 Huge Put Purchases In Monday Trade,0.0,0.0,0.0,0.0,0.0,0.0,0.0,0.0,0.0,0.0,0.0,9
2017-02-06,Which Super Bowl LI Commercials Were Social Hits?,0.0,0.0,0.0,0.0,0.0,0.0,0.0,0.0,0.0,0.0,0.0,9
2017-02-03,Benzinga's Option Alert Recap From February 3,0.0,0.0,0.0,0.0,0.0,0.0,0.0,0.0,0.0,0.0,0.0,8
2017-02-03,Option Alert: Coca Cola Feb 10th 41.5 Puts Sweep: 3121 @  ASK  $0.37: 5751 traded vs 1134 OI:  Earnings 2/9 Before Open  $41.71 Ref,0.0,0.0,0.0,0.0,0.0,0.0,0.0,0.0,0.0,0.0,0.0,30
2017-01-30,"Who Is Jorge Paulo Lemann, And Why Might He Be Up To Something Big In 2017?",0.0,0.0,0.0,0.0,0.0,0.0,0.0,0.0,0.0,0.0,0.0,18
2017-01-30,"The Importance Of Immigrants On Wall Street, In Silicon Valley And For The United States",0.0,0.0,0.0,0.0,0.0,0.0,0.0,0.0,0.0,0.0,0.0,16
2017-01-27,Starbucks in crosshairs as Mexico boycott campaign simmers,0.0,0.0,0.125,0.0,0.0,0.0,0.0,0.0,0.0,0.0,0.0,8
2017-01-26,"Vita Coco Hires JP Morgan To Explore Sale, Could Value Co. At $1B; Coke Owns #2 Brand, Zico",0.0,0.0,0.0,0.0,0.0,0.0,0.0,0.0,0.0,0.0,0.0,23
2017-01-26,The Dow Industrials,0.0,0.0,0.0,0.0,0.0,0.0,0.0,0.0,0.0,0.0,0.0,3
2017-01-26,What Do Pepsi's Super Bowl Ads For Sugar-Free Products Mean For The Soda Market?,0.0,0.0,0.0,0.0,0.0,0.0,0.0,0.0,0.0,0.0,0.0,16
2017-01-26,"Following Sprint Stake, How Does Jay Z's Tidal Investment Rank Among Hip Hop's Biggest Deals?",0.0,0.0,0.0,0.0,0.0,0.0,0.0,0.0,0.0,0.0,0.0,19
2017-01-25,Wall Street's M&A Chatter From January 24,0.0,0.0,0.0,0.0,0.0,0.0,0.0,0.0,0.0,0.0,0.0,10
2017-01-25,The Market In 5 Minutes: Big Earnings And A Major IPO Acquisition,0.0,0.0,0.0,0.0,0.0,0.0,0.0,0.0,0.0,0.0,0.0,13
2017-01-24,Hearing Coca-Cola Mentioned in Takeover Chatter With Kellogg,0.0,0.0,0.0,0.0,0.0,0.0,0.0,0.0,0.0,0.0,0.0,8
2017-01-23,Watch These 7 Huge Put Purchases In Monday Trade,0.0,0.0,0.0,0.0,0.0,0.0,0.0,0.0,0.0,0.0,0.0,9
2017-01-20,Option Alert: Coca Cola Feb 39.0 Puts Sweep: 706 @  ASK  $0.13: 5844 traded vs 3582 OI:  Earnings 2/9 Before Open  $41.33 Ref,0.0,0.0,0.0,0.0,0.0,0.0,0.0,0.0,0.0,0.0,0.0,29
2017-01-19,"Benzinga's Top Upgrades, Downgrades For January 19, 2017",0.0,0.0,0.0,0.0,0.0,0.0,0.0,0.0,0.0,0.0,0.0,11
2017-01-19,Wells Fargo Downgrades Coca-Cola to Market Perform,0.0,0.0,0.0,0.0,0.0,0.0,0.0,0.0,0.0,0.0,0.0,7
2017-01-17,Quality Dividends On The Cheap With This ETF,0.0,0.0,0.0,0.0,0.0,0.0,0.0,0.0,0.0,0.0,0.0,8
2017-01-17,Winners And Losers From Trump's U.S. Dollar Comments,0.0,0.0,0.0,0.0,0.0,0.0,0.0,0.0,0.0,0.0,0.0,9
2017-01-17,Option Alert: Coca Cola Jun 47.0 Calls Sweep: 4359 @  ASK  $0.11: 4674 traded vs 7721 OI:  Earnings 2/9 Before Open  $41.17 Ref,0.0,0.0,0.0,0.0,0.0,0.0,0.0,0.0,0.0,0.0,0.0,29
2017-01-15,The Program For Trading Like A Hedge Fund,0.0,0.0,0.0,0.0,0.0,0.0,0.0,0.0,0.0,0.0,0.0,8
2017-01-13,Jim Cramer On JPMorgan: Best Quarter Ever,0.0,0.0,0.0,0.0,0.0,0.0,0.0,0.0,0.0,0.0,0.0,8
2017-01-13,Are Investor Concerns On Monster Beverages Misplaced?,0.0,0.0,0.0,0.0,0.0,0.0,0.0,0.0,0.0,0.0,0.0,8
2017-01-12,Wells Fargo: We Share Retailer's Concerns On Monster Beverage,0.0,0.0,0.0,0.0,0.0,0.0,0.0,0.0,0.0,0.0,0.0,11
2017-01-11,Trump rally makes stock options great again for some CEOs,0.0,0.0,0.0,0.0,0.0,0.0,0.0,0.0,0.0,0.0,0.0,10
2017-01-11,Dividend Stocks  Bursting Bubble Or A  Buy  ,0.0,0.0,0.0,0.0,0.0,0.0,0.0,0.0,0.0,0.0,0.0,7
2017-01-09,Viacom And Melco Crown Upgraded To Buy,0.0,0.0,0.0,0.0,0.0,0.0,0.0,0.0,0.0,0.0,0.0,7
2017-01-09,Barclays' Favorite In Big Beverage Group May Surprise You,0.0,0.0,0.0,0.0,0.0,0.0,0.0,0.0,0.0,0.0,0.0,10
2017-01-09,"Benzinga's Top Upgrades, Downgrades For January 9, 2017",0.0,0.0,0.0,0.0,0.0,0.0,0.0,0.0,0.0,0.0,0.0,11
2017-01-09,"The Market In 5 Minutes: Earnings Results, Conferences, Trump And More",0.0,0.0,0.0,0.0,0.0,0.0,0.0,0.0,0.0,0.0,0.0,14
2017-01-09,Goldman Sachs Downgrades Coca-Cola to Sell,0.0,0.0,0.0,0.0,0.0,0.0,0.0,0.0,0.0,0.0,0.0,6
2017-01-09,Barclays Initiates Coverage On Coca-Cola at Equal-Weight,0.0,0.0,0.0,0.0,0.0,0.0,0.0,0.0,0.0,0.0,0.0,7
2017-01-04,"Pre-Market Prep Host Dennis Dick Tweets: Notable opening imbalances:  $PG +93K, $KO +136K, $BAC +350K, $T -138K, $XRX +272K, $GM +60K, $CVX +73K, $BABA +49K, $F +441K",0.0,0.0,0.0,0.0,0.0,0.0,0.0,0.0,0.0,0.0,0.0,46
2017-01-02,Barron's Best Income Ideas For 2017,0.0,0.0,0.0,0.0,0.0,0.0,0.0,0.0,0.0,0.0,0.0,7
2016-12-31,"Dow Under 19,000 Or Dow At 20,000: What Happens First?",0.0,0.0,0.0,0.0,0.0,0.0,0.0,0.0,0.0,0.0,0.0,12
2016-12-30,Which Wall Street Firm Made The Best Stock Picks Of 2016?,0.0,0.0,0.0,0.0,0.0,0.0,0.0,0.0,0.0,0.0,0.0,12
2016-12-29,Opening Bell  Sell Offs Dominate Quiet Holiday Trade  USD Lower,0.0,0.0,0.0,0.0,0.0,0.0,0.0,0.0,0.0,0.0,0.0,10
2016-12-28,Meet This Year's Best Consumer Staples ETF,0.0,0.0,0.0,0.0,0.0,0.0,0.0,0.0,0.0,0.0,0.0,8
2016-12-22,"US Budget Deficit Increased By 6% In November, But The Deficit Could Widen Under Trump",0.0,0.0,0.0,0.0,0.0,0.0,0.0,0.0,0.0,0.0,0.0,17
2016-12-22,"Meet The New Dogs: 2017's Dogs Of The Dow Include Coca-Cola, Boeing",0.0,0.0,0.0,0.0,0.0,0.0,0.0,0.0,0.0,0.0,0.0,15
2016-12-21,"After A Poor Showing In 2016, Does Nike Qualify As A 'Dog Of The Dow'?",0.0,0.0,0.0,0.0,0.0,0.0,0.0,0.0,0.0,0.0,0.0,18
2016-12-21,Coke moves away from AB InBev with Africa bottling deal,0.0,0.0,0.0,0.02,0.0,0.02,0.02,0.02,0.0,0.02,0.0,10
2016-12-21,"Coca-Cola to Acquire AB Inbev's Interest In Bottling Operations in Zambia, Zimbabwe, Botswana, Swaziland, Lesotho, El Salvador, Honduras for Undisclosed Amount",0.0,0.0,0.0,0.0,0.0,0.0,0.0,0.0,0.0,0.0,0.0,28
2016-12-16,Morgan Stanley Downgrades Coca-Cola to Equal-Weight,0.0,0.0,0.0,0.0,0.0,0.0,0.0,0.0,0.0,0.0,0.0,6
2016-12-16,"The Market In 5 Minutes: Adobe, Oracle Take The Earnings Stage",0.0,0.0,0.0,0.0,0.0,0.0,0.0,0.0,0.0,0.0,0.0,13
2016-12-14,"Coca-Cola, UnitedHealth, Healthcare And Tech ETFs: Fast Money Picks For December 14",0.0,0.0,0.0,0.0,0.0,0.0,0.0,0.0,0.0,0.0,0.0,15
2016-12-13,"Jim Cramer Shares His Thoughts On Coca-Cola, Verizon, Twitter",0.0,0.0,0.0,0.0,0.0,0.0,0.0,0.0,0.0,0.0,0.0,11
2016-12-13,"Benzinga's Top Upgrades, Downgrades For December 13, 2016",0.0,0.0,0.0,0.0,0.0,0.0,0.0,0.0,0.0,0.0,0.0,11
2016-12-13,"Deutsche Makes A Resolution To Hold Coca-Cola, Procter & Gamble In The New Year",0.0,0.0,0.0,0.0,0.0,0.0,0.0,0.0,0.0,0.0,0.0,15
2016-12-13,Japan s Asahi expands in Europe with AB InBev beer deal,0.0,0.0,0.0,0.025974025974025972,0.0,0.012987012987012986,0.012987012987012986,0.025974025974025972,0.0,0.012987012987012986,0.0,11
2016-12-13,Deutsche Bank Downgrades Coca-Cola to Hold,0.0,0.0,0.0,0.0,0.0,0.0,0.0,0.0,0.0,0.0,0.0,6
2016-12-13,Long Island Iced Tea Stock  Brewing Success ,0.0,0.0,0.0,0.0,0.0,0.0,0.0,0.0,0.0,0.0,0.0,7
2016-12-12,Opening Bell  This Week It s All About The Fed  And Today  Oil ,0.0,0.0,0.0,0.0,0.0,0.0,0.0,0.0,0.0,0.0,0.0,13
2016-12-11,The Stock Market Is Officially In BUBBLE Territory  ,0.0,0.0,0.0,0.0,0.0,0.0,0.0,0.0,0.0,0.0,0.0,8
2016-12-11,Stocks Extending Weekly Rally,0.0,0.0,0.0,0.0,0.0,0.0,0.0,0.0,0.0,0.0,0.0,4
2016-12-09,U S  stocks higher at close of trade  Dow Jones Industrial Average up 0 72 ,0.0,0.0,0.03333333333333333,0.0,0.0,0.03333333333333333,0.0,0.0,0.0,0.0,0.0,15
2016-12-09,"James Quincy To Succeed Muhtar Kent As CEO in May 2017, Kent To Continue As Chairman",0.0,0.0,0.0,0.0,0.0,0.0,0.0,0.0,0.0,0.0,0.0,17
2016-12-09,"Coca-Cola Currently Hosting Call to Discuss Recent Mgmt Changes, Future of Business; Shares Largely Unaffected Amid Call",0.0,0.0,0.0,0.0,0.0,0.0,0.0,0.0,0.0,0.0,0.0,19
2016-12-09,"Coke CEO Steps Down, Here's What To Expect From The Stock",0.0,0.0,0.0,0.0,0.0,0.0,0.0,0.0,0.0,0.0,0.0,13
2016-12-09,Record setting rally pushes on as laggards get legs,0.0,0.0,0.0,0.0,0.0,0.0,0.0,0.0,0.0,0.0,0.0,9
2016-12-08,Trying Times For Staples ETFs,0.0,0.0,0.0,0.0,0.0,0.0,0.0,0.0,0.0,0.0,0.0,5
2016-12-08,Coca Cola  KO  Sees Leadership Shakeup,0.0,0.0,0.0,0.0,0.0,0.0,0.0,0.0,0.0,0.0,0.0,6
2016-12-05,"Beverage Stocks Trading Up Mid Day: National Beverage 7.5%, Craft Brew Alliance 2.5%, Boston Beer 2%, Coca Cola 2%, Anheuser Busch 1.5%",0.0,0.0,0.0,0.0,0.0,0.0,0.0,0.0,0.0,0.0,0.0,32
2016-12-05,Coca Cola opens new  100 million plant in Cambodia,0.0,0.0,0.0,0.0,0.0,0.0,0.0,0.0,0.0,0.0,0.0,9
2016-12-01,4 Biggest Losers For The Dow In November,0.0,0.0,0.0,0.0,0.0,0.0,0.0,0.0,0.0,0.0,0.0,8
2016-12-01,NASCAR  Monster Energy reach sponsorship agreement,0.0,0.0,0.0,0.08333333333333333,0.0,0.08333333333333333,0.0,0.0,0.0,0.0,0.0,6
2016-12-01,Stocks Hitting 52-Week Lows,0.0,0.0,0.0,0.0,0.0,0.0,0.0,0.0,0.0,0.0,0.0,4
2016-12-01,2 Sector ETFs Drawing Renewed Attention,0.0,0.0,0.0,0.0,0.0,0.0,0.0,0.0,0.0,0.0,0.0,6
2016-12-01,"Sports Business Reporter Scott Soshnick Tweets: 'BREAKING: Coca Cola's Monster Energy replacing Sprint as sponsor of Nascar's top racing tier, source says'",0.0,0.0,0.0,0.014285714285714287,0.0,0.014285714285714287,0.0071428571428571435,0.0,0.0,0.0,0.0,28
2016-11-30,U S  stocks mixed at close of trade  Dow Jones Industrial Average up 0 01 ,0.0,0.0,0.03333333333333333,0.0,0.0,0.03333333333333333,0.0,0.0,0.0,0.0,0.0,15
2016-11-29,The Difference Between Shareholders And Stakeholders,0.0,0.0,0.0,0.0,0.0,0.0,0.0,0.0,0.0,0.0,0.0,6
